qid	order	query	qld.recip_rank
2634143	wiki.topn3	direct borrowing phonological borrowing linguistic borrowing cultural borrowing intimate borrowing auxiliary verb dependent clause complement linguistics object grammar allophone accusativcase declension loanword morphology linguistics historical linguistics phoneme phonology genetic relationship linguistics applicativvoice apophony language contact xenocentrism youth subculture labelling cultural appropriation	0.3333
2643507	-1	why does milk cost more than gas per gallon?	1.0
2713171	-1	What does the sentence's mean?	0.3333
2713171	glove.topn3	sentence s mean jail s whose necessarily	1.0
2713171	stem.krovetz	what do the sentence s mean	0.5
2713171	termluster.topn5.3.bm25	sentence s mean	0.5
2713171	termluster.topn5.3.qld	sentence s mean	0.5
2713171	thesaurus.topn3	sentence s mean	0.5
2713171	thesaurus.topn3.replace	sentence s mean	0.5
2722241	-1	why do some animals hide in a dark place b4 they die?	0.5
2722241	bertqe.topn10.qld	revert back wild die alon	1.0
2722241	termluster.topn5.3.bm25	animals hide dark place b die	1.0
2722241	termluster.topn5.3.qld	animals hide dark place b die	1.0
2722241	thesaurus.topn3	animals hide dark place b die	1.0
2722241	thesaurus.topn3.replace	animals hide dark place b die	1.0
2783398	-1	What is a nucleus?	1.0
2785579	-1	If you could be an element of weather, which would you choose, and why?	0.0833
2785579	bt_bing_russian	If you could be a weather element what would you choose and why	0.2
2785579	bt_nllb_swahili	If you could be a weather creature what would you choose and why	0.1111
2795030	-1	Why do people drink Cuervo when it tastes the same going down as coming up?	1.0
2797224	-1	Muslims Are The Happiest People Ever, Why?	1.0
2799913	-1	What's the proper way to express sorrow at a funeral?	0.25
2799913	relevancefeedback.topn10.bm25	what s the proper way to express sorrow at a funeral burial conduct becaus feel do all object also where last	1.0
2799913	bt_bing_arabic	What is the correct way to express grief at a funeral	0.5
2799913	bt_bing_chinese_simplified	What is the right way to express grief at a funeral	0.5
2799913	bt_bing_french	What is the right way to express grief at a funeral	0.5
2799913	bt_bing_german	What is the right way to express grief at a funeral	0.5
2799913	bt_bing_korean	What is the proper way to express grief at a funeral	0.5
2799913	bt_bing_malay	What is the correct way to express grief at a funeral	0.5
2799913	bt_bing_persian	What is the right way to express grief at a funeral	0.5
2799913	bt_bing_russian	What is the right way to express grief at a funeral	0.5
2799913	bt_bing_swahili	What is the correct way to express grief at a funeral	0.5
2799913	bt_bing_tamil	What is the right way to express grief at a funeral	0.5
2799913	bt_nllb_arabic	What is the proper way to express grief at a funeral	0.5
2799913	bt_nllb_chinese_yue	How do you express your grief at a funeral	0.5
2799913	bt_nllb_french	What s the right way to express your grief at a funeral	0.5
2799913	bt_nllb_german	How can one express his grief at a funeral	0.5
2799913	bt_nllb_korean	What is the way to express grief at a funeral	0.5
2799913	bt_nllb_malay	What s the right way to express your grief at a funeral	0.5
2799913	bt_nllb_persian	What is the proper way to express grief at a funeral	0.5
2799913	bt_nllb_russian	What is the right way to express grief at a funeral	0.5
2799913	relevancefeedback.topn10.qld	what s the proper way to express sorrow at a funeral i we feel suffer burial film what do	0.5
2799913	stem.paicehusk	what s the prop way to express sorrow at a fun	0.5
2799913	stem.trunc5	what s the prope way to expre sorro at a funer	0.3333
2799913	word2vec.topn3	s proper way express sorrow funeral s of s s appropriate adequate necessary manner way sadness anguish grief burial	0.3333
2799913	wordnet.topn3	s proper way express sorrow funeral right right smart mode direction verbalise extract give tongue to grief sadness	0.3333
2814599	-1	what does the word remission mean when referring to cancer patients?	1.0
2814722	-1	why is the new jersey smoking ban not considered unconstitutional?	0.25
2814722	bertqe.topn10.bm25	around present raritan bai northern	1.0
2814722	wordnet.topn3.replace	unexampled island of Jersey New Jersey fume censor prohibition believe look at count unconstitutional	1.0
2814722	bt_nllb_persian	Why is the smoking ban in New Jersey not unfounded	0.5
2814722	relevancefeedback.topn10.qld	why is the new jersey smoking ban not considered unconstitutional caus labor oil peopl law smoke we you	0.5
2814722	bt_bing_french	Why isn t New Jersey s smoking ban considered unconstitutional	0.3333
2814722	bt_bing_persian	Why isn t New Jersey s smoking ban considered unconstitutional	0.3333
2814722	bt_bing_swahili	Why isn t New Jersey s smoking ban considered unconstitutional	0.3333
2814722	bt_nllb_french	Why isn t the New Jersey smoking ban considered unconstitutional	0.3333
2814722	bt_nllb_malay	Why isn t a smoking ban in New Jersey considered unconstitutional	0.3333
2814722	bt_nllb_tamil	Why is it not illegal to smoke in New Jersey	0.3333
2814722	conceptluster.topn5.3.bm25	new jersey smoking ban considered unconstitutional smoking ban constitutionality new jersey	0.3333
2814722	conceptluster.topn5.3.qld	new jersey smoking ban considered unconstitutional smoking ban constitutionality new jersey	0.3333
2814722	conceptnet.topn3	new jersey smoking ban considered unconstitutional city modern old lung cancer cancer bad for your health constitutional	0.3333
2814722	tagmee.topn3	new jersey smoking ban considered unconstitutional New Jersey Smoking ban Constitutionality	0.3333
2814722	tagmee.topn3.replace	New Jersey Smoking ban Constitutionality	0.3333
2815090	-1	how cloning will affects our community?	0.3333
2815090	bt_bing_arabic	How will cloning affect our society	0.5
2815090	bt_bing_swahili	How will cloning have an impact on our society	0.5
2815090	bt_bing_tamil	How will cloning affect our society	0.5
2815090	bt_nllb_malay	How will cloning affect our society	0.5
2815090	bt_nllb_persian	How does cloning affect our society	0.5
2815090	bt_nllb_tamil	How does cloning affect our society	0.5
2815090	conceptnet.topn3	cloning affects community	0.5
2815090	conceptnet.topn3.replace	cloning affects community	0.5
2815090	termluster.topn5.3.bm25	cloning affects community	0.5
2815090	termluster.topn5.3.qld	cloning affects community	0.5
2815090	thesaurus.topn3	cloning affects community	0.5
2815090	thesaurus.topn3.replace	cloning affects community	0.5
2838988	-1	How can I get a cork out of, not into, a wine bottle without a corkscrew?	1.0
2847807	-1	How can I get rid of the hicups?	1.0
2862887	-1	how to care for a spiked dragon and what to feed them?	1.0
2864267	-1	what exemplifies effective customer service?	1.0
2892478	-1	what factors cause the Earth to heat unevenly?	1.0
2956570	-1	What are the words to write the sound of raindrops, moving train & scribbling w/ pencil on paper figuratively?	1.0
2976644	-1	How amoeba catches its prey?	1.0
3040435	-1	USA have Snow, Hurricanes, Flood, Earthquakes and politicians, Brazil only have politicians, why?	1.0
3074429	-1	How can we understand Islam and Muslims better?	0.2
3074429	conceptluster.topn5.3.bm25	understand islam muslims better	0.25
3074429	conceptluster.topn5.3.qld	understand islam muslims better	0.25
3074429	termluster.topn5.3.bm25	understand islam muslims better	0.25
3074429	termluster.topn5.3.qld	understand islam muslims better	0.25
3074429	thesaurus.topn3	understand islam muslims better	0.25
3074429	thesaurus.topn3.replace	understand islam muslims better	0.25
3078448	-1	How do you prevent chicken from drying out when you cook it?	1.0
312215	-1	how good is apple pie when it is cold?	1.0
3155314	-1	we have pork chops, veal chops, lamb chops, why is there not any beef chops ?	0.5
3155314	anchor.topn3.replace	rafute okinawan siu chops sreey parmigiana eggpl sronoss chops lambo gerganiya play along chops kurog corned beef kipper chops	1.0
3155314	bt_bing_chinese_simplified	We have pork chops veal chops lamb chops why not steaks	1.0
3155314	bt_bing_malay	We have pork chopsticks beef chops lamb chops why are there no beef chopsticks	1.0
3155314	glove.topn3	pork chops veal chops lamb chops beef chops beef meat loin lamb chops loin mutton veal loin meat pork loin	1.0
3155314	glove.topn3.replace	beef meat loin lamb chops loin mutton veal loin meat pork loin	1.0
3155314	sensedisambiguation	we have pork pork barrel chops chop veal chops chop lamb chops chop why is there not any beef gripe chops chop	1.0
3155314	sensedisambiguation.replace	we have pork barrel chop veal chop lamb chop why is there not any gripe chop	1.0
3155314	tagmee.topn3.replace	Pork Pork chop Veal Meat chop	1.0
3155314	wiki.topn3	pork chops veal chops lamb chops beef chops egg food pork chicken food pork cubsteak list american foods burnt ends pork chop veal roasting mousse veal primal cut skilpadjies whitmeat meat chop	1.0
3155314	wiki.topn3.replace	egg food pork chicken food pork cubsteak list american foods burnt ends pork chop veal roasting mousse veal primal cut skilpadjies whitmeat meat chop	1.0
3155314	word2vec.topn3	pork chops veal chops lamb chops beef chops beef meat steaks prowess beef scaloppine sweetbreads steaks prowess mutton hogget steaks prowess meat pork steaks prowess	1.0
3155314	wordnet.topn3	pork chops veal chops lamb chops beef chops porc pork barrel chop shot hack veau chop shot hack Charles Lamb dear chop shot hack bitch beef cattle gripe chop shot hack	1.0
3206998	-1	how does disneyland make it snow?	1.0
3239329	-1	Why do we wee a lot in the cold weather especially at night?	0.5
3269759	-1	what is artificial intelligence?	1.0
3278654	-1	Why do Kamikaze pilots wear helmets?	1.0
3280768	-1	why is islam so hated in america?	0.3333
3280768	tagmee.topn3.replace	Islam	1.0
3280768	wiki.topn3.replace	islam muslims quraniwords phrases islam	0.5
3295055	-1	What causes skin discoloration, specifically, whitening of the skin between fingers?	0.0714
3295055	bt_bing_korean	What causes skin discoloration especially the white discoloration of the skin between the fingers	0.1667
3295055	bt_nllb_arabic	What causes the skin to change color specifically whitening the skin between the fingers	0.1667
3295055	bt_nllb_persian	What causes the skin to change color specifically the whitening of the skin between the fingers	0.1667
3295055	bt_nllb_russian	What causes the skin to turn colored namely the whitening of the skin between the fingers	0.1667
3295055	sensedisambiguation	What causes induce skin discoloration stain specifically whitening whiten of the skin between fingers finger	0.1667
3295055	bt_nllb_swahili	What causes the skin to turn white especially between the fingers	0.1429
3295055	bt_nllb_tamil	What causes the skin to turn white especially between the fingers	0.1429
3295055	relevancefeedback.topn10.bm25	what causes skin discoloration specifically whitening of the skin between fingers cancer ani it bleed your ink around area	0.1429
3295055	stem.lovins	what caus skin discolor specif whit of th skin between finger	0.1429
3295055	stem.porter	what caus skin discolor specif whiten of the skin between finger	0.1429
3295055	stem.porter2	what caus skin discolor specif whiten of the skin between finger	0.1429
3295055	bt_nllb_malay	What causes the skin to change color specifically the skin to become white between the fingers	0.1111
3295055	conceptnet.topn3	causes skin discoloration specifically whitening skin fingers covering the body mole bleach hand touch push buttons	0.1111
3295055	bt_bing_chinese_simplified	What causes skin discoloration especially whitening between the fingers	0.0833
3295055	bt_nllb_chinese_yue	What causes the skin to turn colored The skin between the fingers to become white	0.0833
3295055	termluster.topn5.3.bm25	causes skin discoloration specifically whitening skin fingers	0.0769
3295055	termluster.topn5.3.qld	causes skin discoloration specifically whitening skin fingers	0.0769
3295055	thesaurus.topn3	causes skin discoloration specifically whitening skin fingers	0.0769
3295055	thesaurus.topn3.replace	causes skin discoloration specifically whitening skin fingers	0.0769
3301173	-1	how to design road crust for national highways?	1.0
3313308	-1	how can I enjoy my time alone?	0.0909
3313308	glove.topn3	enjoy time alone when actually else	0.5
3313308	tagmee.topn3.replace	By Time Alone	0.5
3313308	word2vec.topn3	enjoy time alone moment time period alone alone	0.5
3313308	conceptluster.topn5.3.bm25	enjoy time alone time alone	0.25
3313308	conceptluster.topn5.3.qld	enjoy time alone time alone	0.25
3313308	tagmee.topn3	enjoy time alone By Time Alone	0.25
3313308	word2vec.topn3.replace	enjoy moment time period alone alone	0.25
3313308	termluster.topn5.3.bm25	enjoy time alone	0.2
3313308	termluster.topn5.3.qld	enjoy time alone	0.2
3313308	thesaurus.topn3	enjoy time alone	0.2
3313308	thesaurus.topn3.replace	enjoy time alone	0.2
3313308	anchor.topn3.replace	first and oxime longshot byo yomi дрене netherwar alone	0.1667
3313308	wordnet.topn3	enjoy time alone savour relish bask fourth dimension prison term meter unequalled unparalleled lonely	0.1667
3313308	anchor.topn3	enjoy time alone first and oxime longshot byo yomi дрене netherwar	0.125
3313308	bt_nllb_tamil	How can I enjoy solitude	0.1111
3363149	-1	Why do Arabs and Mexicans look alike?	1.0
3369088	-1	how can we stop the spread of islam?	1.0
3382736	-1	what is minimalist cubisium?	0.5
3382736	bt_bing_chinese_simplified	What is a Minimalist Cube	1.0
3382736	bt_nllb_german	What is a minimalist cubism	1.0
3382736	bt_nllb_russian	What is minimalist cubism	1.0
3382736	bt_nllb_swahili	What is a minimalist cubism	1.0
3382736	conceptnet.topn3	minimalist cubisium government	1.0
3382736	relevancefeedback.topn10.bm25	what is minimalist cubisium i complic actual govern galleri object direct blood	1.0
3382736	relevancefeedback.topn10.qld	what is minimalist cubisium i galleri complic actual govern window basic direct ey	1.0
3385681	-1	if red bull is soo bad for people ,then why is it soo popular?	0.5
3385681	bertqe.topn10.qld	mani danger soo peac same	1.0
3389038	-1	why the media in US and Europe is always attacking the Arabs and Islam without finding the truth about them?	0.5
3389038	bt_bing_korean	Why do the American and European media always attack Arabs and Islam without finding the truth about them	1.0
3389038	bt_bing_persian	Why do the media in America and Europe always attack Arabs and Islam without finding out the truth about them	1.0
3389038	bt_bing_tamil	Why does the media in America and Europe always attack Arabs and Islam without finding out the truth about them	1.0
3389038	bt_nllb_french	Why do the American and European media still attack Arabs and Islam without finding the truth about them	1.0
3389038	bt_nllb_persian	Why do the American and European media always attack Arabs and Islam without finding the truth about them	1.0
3389038	bt_nllb_swahili	Why do the American and European media always attack Arabs and Islam without finding the truth about them	1.0
3396066	-1	Why do airplanes fly so high?	1.0
34041	-1	what are the symptoms of strep throat?	1.0
3411123	-1	Why does'nt America regard foriegn credentials?	0.5
3411123	bertqe.topn10.bm25	south whole unintellig most reason	1.0
3411123	bt_bing_swahili	Why does the U S look at foreign credentials	1.0
3496147	-1	Why was I punished for being christlike?	1.0
3499881	-1	Why is Gordon Ramsey so popular?	1.0
3507491	-1	Why is religious freedom more important today?	1.0
354733	-1	What are the names of some famous photographers and why do their work stand up?	0.5
354733	bertqe.topn10.bm25	mani famou art piec we	1.0
354733	conceptluster.topn5.3.bm25	names famous photographers work stand photography	1.0
354733	conceptluster.topn5.3.qld	names famous photographers work stand photography	1.0
354733	relevancefeedback.topn10.bm25	what are the names of some famous photographers and why do their work stand up she adam photograph ask comfort ani even fly	1.0
354733	stem.trunc5	what are the names of some famou photo and why do their work stand up	1.0
354733	tagmee.topn3	names famous photographers work stand Photography	1.0
3552010	-1	Why do parent put kids on restriction?	0.5
3552010	anchor.topn3.replace	non parent kadeg kadege posut ružama srbima kids restriction	1.0
3554263	-1	why some people behave so rude without reason,is it due to their own problem?	0.25
3554263	relevancefeedback.topn10.bm25	why some people behave so rude without reason is it due to their own problem reason eat complain wai make arrog peopl anyth	1.0
3554263	bt_bing_chinese_simplified	Why do some people behave so rudely for no reason is it because of their own problems	0.5
3554263	bt_bing_german	Why do some people behave so rudely for no reason is it because of their own problem	0.5
3554263	bt_bing_korean	Why do some people behave so rudely for no reason is it because of their own problems	0.5
3554263	bt_bing_persian	Why do some people behave so rudely for no reason is it because of their own problems	0.5
3554263	bt_bing_russian	Why do some people behave so rudely for no reason is it because of their own problem	0.5
3554263	bt_bing_tamil	Why do some people behave so rudely without reason and is it their own problem	0.5
3554263	bt_nllb_french	Why do some people behave so rude for no reason because of their own problems	0.5
3554263	bt_nllb_german	Why do some people behave so rude is because of their own problem	0.5
3554263	bt_nllb_persian	Why do some people act so rude for no reason	0.5
3554263	conceptluster.topn5.3.bm25	people behave rude without reason due problem people magazine reason hoobastank song rude song	0.5
3554263	conceptluster.topn5.3.qld	people behave rude without reason due problem people magazine reason hoobastank song rude song	0.5
3554263	tagmee.topn3	people behave rude without reason due problem People magazine Rude song The Reason Hoobastank song	0.5
3554263	bt_nllb_chinese_yue	Why are some people so rude without any reason Is it because they have problems	0.3333
3554263	glove.topn3	people behave rude without reason due problem others those disrespectful obnoxious even no fact why owing result solve	0.3333
3559048	-1	How do you sell a junk car without a title?	1.0
3577501	-1	what are some signs that puberty is beginning?	1.0
3639660	-1	Why do most cigarettes have the yellow filter?	1.0
3640705	-1	what is the punishment for child molestors?	1.0
3698636	-1	why do cats headbutt?	1.0
3714728	-1	Why is the world so shallow?	1.0
3723508	-1	What is the difference between an ox and a bull?	1.0
3778229	-1	how were the witches tested in the salem witch trials?	1.0
3825386	-1	How can I develop leanbody and muscles?	0.0909
3825386	bt_bing_german	How can I develop leaner body and muscles	0.25
3825386	bt_bing_korean	How can I get leaner and have more muscles	0.25
3825386	sensedisambiguation	How can I develop train leanbody and muscles muscleman	0.1667
3825386	termluster.topn5.3.bm25	develop leanbody muscles	0.125
3825386	termluster.topn5.3.qld	develop leanbody muscles	0.125
3825386	thesaurus.topn3	develop leanbody muscles	0.125
3825386	thesaurus.topn3.replace	develop leanbody muscles	0.125
3872395	-1	what are some easy ways to get a toddler to go to sleep without being mean?	0.25
3872395	relevancefeedback.topn10.qld	what are some easy ways to get a toddler to go to sleep without being mean problem child christma dog stroller alldai puppi bite we	1.0
3872395	conceptluster.topn5.3.bm25	easy ways get toddler go sleep without mean	0.5
3872395	conceptluster.topn5.3.qld	easy ways get toddler go sleep without mean	0.5
3872395	tagmee.topn3	easy ways get toddler go sleep without mean	0.5
3872395	termluster.topn5.3.bm25	easy ways get toddler go sleep without mean	0.5
3872395	termluster.topn5.3.qld	easy ways get toddler go sleep without mean	0.5
3872395	thesaurus.topn3	easy ways get toddler go sleep without mean	0.5
3872395	thesaurus.topn3.replace	easy ways get toddler go sleep without mean	0.5
3872395	wiki.topn3	easy ways get toddler go sleep without mean	0.5
3872395	stem.porter2	what are some easi way to get a toddler to go to sleep without be mean	0.3333
3874326	-1	How come Compton is only designated for black people?	0.5
3874326	anchor.topn3	come compton designated black people uniplicatu pandaemonium a lov compton mill br compton lyvett kvinnen triplewart black cockatoo	1.0
3874326	anchor.topn3.replace	uniplicatu pandaemonium a lov compton mill br compton lyvett designated kvinnen triplewart black cockatoo people	1.0
3874326	bt_bing_swahili	How is Compton designated solely for black people	1.0
3874326	bt_nllb_chinese_yue	Why is Compton designed for black people	1.0
3874326	bt_nllb_french	How come Compton is reserved for blacks	1.0
3874326	bt_nllb_korean	Why is Compton for black people	1.0
3874326	conceptluster.topn5.3.bm25	come compton designated black people compton california	1.0
3874326	conceptluster.topn5.3.qld	come compton designated black people compton california	1.0
3874326	relevancefeedback.topn10.bm25	how come compton is only designated for black people can design you i peopl angel	1.0
3874326	sensedisambiguation	How come total Compton is only designated intend for black people	1.0
3874326	sensedisambiguation.replace	How total compton is only intend for black people	1.0
3874326	stem.paicehusk	how com compton is on design for black peopl	1.0
3874326	tagmee.topn3	come compton designated black people Compton California	1.0
3874326	tagmee.topn3.replace	Compton California	1.0
3874326	termluster.topn5.3.bm25	come compton designated black people	1.0
3874326	termluster.topn5.3.qld	come compton designated black people	1.0
3874326	thesaurus.topn3	come compton designated black people	1.0
3874326	thesaurus.topn3.replace	come compton designated black people	1.0
3874326	wiki.topn3	come compton designated black people gardena california hawthorne california pomona california compton california	1.0
3874326	wiki.topn3.replace	gardena california hawthorne california pomona california compton california	1.0
3874326	wordnet.topn3	come compton designated black people arrive cum come up Arthur Holly Compton Arthur Compton indicate destine show Negroid Shirley Temple Black Black person hoi polloi multitude	1.0
3874326	wordnet.topn3.replace	arrive cum come up Arthur Holly Compton Arthur Compton indicate destine show Negroid Shirley Temple Black Black person hoi polloi multitude	1.0
387874	-1	Why does asparugus make your pee stink?	1.0
3910925	-1	Why is yawning contagious?	1.0
3960080	-1	Why don't commercial planes fly over the North Pole?	1.0
3971195	-1	How do i get my pitbull more agressive?	1.0
3990512	-1	how can we get concentration onsomething?	0.0833
3990512	anchor.topn3.replace	drive differences chak chak concentration onsomething	0.1667
3990512	anchor.topn3	get concentration onsomething drive differences chak chak	0.1429
3990512	conceptluster.topn5.3.bm25	get concentration onsomething	0.1429
3990512	conceptluster.topn5.3.qld	get concentration onsomething	0.1429
3990512	tagmee.topn3	get concentration onsomething	0.1429
3990512	termluster.topn5.3.bm25	get concentration onsomething	0.1429
3990512	termluster.topn5.3.qld	get concentration onsomething	0.1429
3990512	thesaurus.topn3	get concentration onsomething	0.1429
3990512	thesaurus.topn3.replace	get concentration onsomething	0.1429
3990512	wiki.topn3	get concentration onsomething	0.1429
4003223	-1	What are the marketing gimmicks that will attract males?	0.3333
4003223	bertqe.topn10.bm25	market market gimmick corona i m	1.0
4003223	relevancefeedback.topn10.bm25	what are the marketing gimmicks that will attract males gimmick corona you crab male panten	1.0
4003223	relevancefeedback.topn10.qld	what are the marketing gimmicks that will attract males you gimmick corona crab panten	1.0
4003223	bt_bing_tamil	Marketing gimmicks that attract men	0.5
4003223	termluster.topn5.3.bm25	marketing gimmicks attract males	0.5
4003223	termluster.topn5.3.qld	marketing gimmicks attract males	0.5
4003223	thesaurus.topn3	marketing gimmicks attract males	0.5
4003223	thesaurus.topn3.replace	marketing gimmicks attract males	0.5
4012558	-1	what is the term milky way?	1.0
4018891	-1	How do I know if a particular term or phrase is copyrighted?	1.0
402514	-1	why do my baked potatos never taste near as good as when I get them in a nice restaurant?	0.5
4126337	-1	Why does my friend buy...?	0.1667
4126337	relevancefeedback.topn10.bm25	why does my friend buy bui bulldog doe she you all anyon	1.0
4126337	conceptluster.topn5.3.bm25	friend buy	0.5
4126337	conceptluster.topn5.3.qld	friend buy	0.5
4126337	tagmee.topn3	friend buy	0.5
4126337	termluster.topn5.3.bm25	friend buy	0.5
4126337	termluster.topn5.3.qld	friend buy	0.5
4126337	thesaurus.topn3	friend buy	0.5
4126337	thesaurus.topn3.replace	friend buy	0.5
4126337	wiki.topn3	friend buy	0.5
4126337	bt_bing_french	Why is my friend buying	0.25
4126337	bt_bing_german	Why is my friend buying	0.25
4126337	bt_bing_russian	Why is my friend buying	0.25
4126337	bt_bing_tamil	Why is my friend buying	0.25
4126337	bt_nllb_french	Why is my friend buying	0.25
4126337	bt_nllb_german	Why is my friend buying	0.25
4126337	bt_nllb_russian	Why is my friend buying	0.25
4126337	bt_bing_chinese_simplified	Why would my friend buy	0.2
4126337	bt_nllb_arabic	Why would my friend buy	0.2
4126337	bt_nllb_tamil	Why would my friend buy	0.2
4126337	stem.krovetz	why do my friend buy	0.2
4153592	-1	what can make someones ear's stink?	0.1667
4153592	bertqe.topn10.qld	might allow appreci it stinki	1.0
4153592	conceptnet.topn3	make someones ear s stink create manufacture offer hearing organ listening farting	1.0
4153592	wordnet.topn3	make someones ear s stink shuffling stool seduce mortal soul capitulum auricle stench fetor mephitis	0.5
4153592	rm3.topn10.10.0.5.bm25	what can make someones ears stink?	0.25
4153592	rm3.topn10.10.0.5.qld	what can make someones ears stink?	0.25
4153592	termluster.topn5.3.bm25	make someones ear s stink	0.25
