qid	order	query	qld.recip_rank
4153592	termluster.topn5.3.qld	make someones ear s stink	0.25
4153592	thesaurus.topn3	make someones ear s stink	0.25
4153592	thesaurus.topn3.replace	make someones ear s stink	0.25
4153592	bt_bing_swahili	What would make someone s ear stink	0.2
4153592	bt_bing_tamil	What makes someone s ear stink	0.2
4165406	-1	Why did the founder of Daewoo get a 10-year jail sentence?	1.0
4185395	-1	how can i cure the std or the sexually transmitted disease?	1.0
4185501	-1	why does the sun shine?	1.0
4190287	-1	Why is switching schools so depressing?	0.5
4190287	relevancefeedback.topn10.bm25	why is switching schools so depressing you good pass larg limit u between i	1.0
4196421	-1	how can you be more brilliant?	0.25
4196421	conceptnet.topn3	brilliant	0.5
4196421	conceptnet.topn3.replace	brilliant	0.5
4196421	termluster.topn5.3.bm25	brilliant	0.5
4196421	termluster.topn5.3.qld	brilliant	0.5
4196421	thesaurus.topn3	brilliant	0.5
4196421	thesaurus.topn3.replace	brilliant	0.5
4196421	bertqe.topn10.bm25	femal read everyth twice studi	0.3333
4197214	-1	Why my GF feel like pissing during sexual intercourse?	0.3333
4197214	bertqe.topn10.bm25	becaus preserv womanhood pride themselv	1.0
4197214	conceptluster.topn5.3.bm25	gf feel like pissing sexual intercourse sexual intercourse	1.0
4197214	conceptluster.topn5.3.qld	gf feel like pissing sexual intercourse sexual intercourse	1.0
4197214	conceptnet.topn3.replace	bf touch sense love servant peeing remembering something sexual intercourse	1.0
4197214	sensedisambiguation	Why my GF feel like pissing make during sexual intercourse sexual intercourse	1.0
4197214	tagmee.topn3	gf feel like pissing sexual intercourse Sexual intercourse	1.0
4197214	tagmee.topn3.replace	Sexual intercourse	1.0
4197214	termluster.topn5.3.bm25	gf feel like pissing sexual intercourse	1.0
4197214	termluster.topn5.3.qld	gf feel like pissing sexual intercourse	1.0
4197214	thesaurus.topn3	gf feel like pissing sexual intercourse	1.0
4197214	thesaurus.topn3.replace	gf feel like pissing sexual intercourse	1.0
4197214	glove.topn3	gf feel like pissing sexual intercourse pts ga felt such even aou oly cycling sex abuse unprotected sexual	0.5
421753	-1	how to get rid of a skunk?	1.0
4250296	-1	What do doctors do when a patient has a Do Nor Resuscitate Order?	1.0
4256593	-1	How do I remove the SIMM card on a LG VX8300 Cell Phone?	1.0
4278201	-1	how does Ultraviolet Light Affects Seed Germination and plant growth?	1.0
4283542	-1	i have had loose stools for a week...how do i make it stop?	0.3333
4283542	relevancefeedback.topn10.bm25	i have had loose stools for a week how do i make it stop applesauc u area loos you effect	1.0
4283542	termluster.topn5.3.bm25	loose stools week make stop	0.5
4283542	termluster.topn5.3.qld	loose stools week make stop	0.5
4283542	thesaurus.topn3	loose stools week make stop	0.5
4283542	thesaurus.topn3.replace	loose stools week make stop	0.5
4288761	-1	How can i stop my husband from exhuming my baby's body for compensation?	1.0
4311093	-1	Why hot air rises up?	0.5
4311093	bertqe.topn10.bm25	rise someth hast replac hot	1.0
4311093	bt_bing_arabic	Why does hot air rise	1.0
4311093	bt_bing_chinese_simplified	Why does hot air rise	1.0
4311093	bt_bing_french	Why does hot air rise	1.0
4311093	bt_bing_german	Why does hot air rise	1.0
4311093	bt_bing_korean	Why does hot air rise	1.0
4311093	bt_bing_malay	Why does hot air rise	1.0
4311093	bt_bing_russian	Why does hot air rise up	1.0
4311093	bt_nllb_arabic	Why is the hot air rising	1.0
4311093	bt_nllb_french	Why is the hot air rising	1.0
4311093	bt_nllb_german	Why is the hot air rising	1.0
4311093	bt_nllb_korean	Why is the hot air rising	1.0
4311093	bt_nllb_malay	Why is the hot air rising	1.0
4311093	bt_nllb_russian	Why is the hot air rising	1.0
4311093	bt_nllb_swahili	Why does the hot air increase	1.0
4311093	bt_nllb_tamil	Why is the hot air rising	1.0
4311093	conceptluster.topn5.3.bm25	hot air rises	1.0
4311093	conceptluster.topn5.3.qld	hot air rises	1.0
4311093	tagmee.topn3	hot air rises	1.0
4311093	termluster.topn5.3.bm25	hot air rises	1.0
4311093	termluster.topn5.3.qld	hot air rises	1.0
4311093	thesaurus.topn3	hot air rises	1.0
4311093	thesaurus.topn3.replace	hot air rises	1.0
4311093	wiki.topn3	hot air rises	1.0
4311093	word2vec.topn3	hot air rises cold cool air water soars increases	1.0
4311093	word2vec.topn3.replace	cold cool air water soars increases	1.0
4357460	-1	how to make my car faster?	1.0
4365565	-1	How Does Water Pressure Change?	0.125
4365565	stem.krovetz	how do water pressure change	0.1429
4365565	stem.lovins	how do water pressur chang	0.1429
4365565	termluster.topn5.3.bm25	water pressure change	0.1429
4365565	termluster.topn5.3.qld	water pressure change	0.1429
4365565	thesaurus.topn3	water pressure change	0.1429
4365565	thesaurus.topn3.replace	water pressure change	0.1429
4367654	-1	Why is April 19th important?	0.2
4367654	rm3.topn10.10.0.5.bm25	Why is April 19th important?	0.5
4367654	rm3.topn10.10.0.5.qld	Why is April 19th important?	0.5
4367654	bt_bing_arabic	Why is April important	0.3333
4367654	bt_bing_chinese_simplified	Why is April important	0.3333
4367654	bt_bing_french	Why is April important	0.3333
4367654	bt_bing_german	Why is April important	0.3333
4367654	bt_bing_korean	Why is April important	0.3333
4367654	bt_bing_malay	Why is April important	0.3333
4367654	bt_bing_persian	Why is April important	0.3333
4367654	bt_bing_russian	Why is April so important	0.3333
4367654	bt_bing_tamil	Why is April important	0.3333
4367654	bt_nllb_arabic	Why is April important	0.3333
4367654	bt_nllb_chinese_yue	Why is April so important	0.3333
4367654	bt_nllb_french	Why is April important	0.3333
4367654	bt_nllb_german	Why is April important	0.3333
4367654	bt_nllb_korean	Why is April so important	0.3333
4367654	bt_nllb_malay	Why is April so important	0.3333
4367654	bt_nllb_persian	Why is April important	0.3333
4367654	bt_nllb_russian	Why is April important	0.3333
4367654	bt_nllb_swahili	Why is April special	0.3333
4367654	bt_nllb_tamil	Why April is Important	0.3333
4372730	-1	Why doesn't the bible make any sense?	0.0111
4372730	bt_bing_french	Why does the Bible make no sense	1.0
4372730	bt_bing_malay	Why does the Bible not make sense	1.0
4372730	bt_nllb_malay	Why does the Bible make sense	1.0
4372730	bt_bing_swahili	Why does the Bible not matter	0.5
4372730	rm3.topn10.10.0.5.bm25	Why doesnt the bible make any sense?	0.5
4372730	rm3.topn10.10.0.5.qld	Why doesnt the bible make any sense?	0.5
4372730	conceptluster.topn5.3.bm25	n t bible make sense bible	0.25
4372730	conceptluster.topn5.3.qld	n t bible make sense bible	0.25
4372730	tagmee.topn3	n t bible make sense Bible	0.25
4372730	tagmee.topn3.replace	Bible	0.2
4372730	relevancefeedback.topn10.qld	why doesn t the bible make any sense self you so bibl etern question sound written he	0.0909
4372730	word2vec.topn3	n t bible make sense scripture create sense sence sense	0.0714
4372730	sensedisambiguation	Why does n t the bible make any sense common sense	0.0667
4372730	bt_nllb_arabic	Why is the Bible not reasonable	0.0476
4372730	sensedisambiguation.replace	Why does n t the bible make any common sense	0.0435
4372730	termluster.topn5.3.bm25	n t bible make sense	0.0333
4372730	termluster.topn5.3.qld	n t bible make sense	0.0333
4372730	thesaurus.topn3	n t bible make sense	0.0333
4372730	thesaurus.topn3.replace	n t bible make sense	0.0333
4372730	glove.topn3	n t bible make sense do not scripture testament made kind sort	0.0263
4372730	glove.topn3.replace	do not scripture testament made kind sort	0.025
4372730	wiki.topn3	n t bible make sense judeo christian topics bible old testament bible	0.0238
4372730	conceptnet.topn3.replace	not No you bible create manufacture offer taste touch smell	0.0204
4372730	stem.trunc4	why does t the bibl make any sens	0.0185
4372730	wordnet.topn3	n t bible make sense Holy Writ Word of God piddle crap get to sensation sentiency sensory faculty	0.0147
4372730	bertqe.topn10.bm25	your apolog sincer why do	0.0133
4372730	wiki.topn3.replace	judeo christian topics bible old testament bible	0.0128
4372730	bt_bing_german	Why doesn t the Bible make sense	0.0118
4372730	bt_bing_korean	Why doesn t the Bible make sense	0.0118
4372730	bt_bing_persian	Why doesn t the Bible make sense	0.0118
4377861	-1	how to handsew sequins?	1.0
4385316	-1	How do I keep black birds out of my bar-b-que grill?	1.0
4406669	-1	What do you order at Taco Bell?	1.0
443848	-1	Does anybody know where i could get a free guide on how to train a siberian husky?	1.0
4448097	-1	what is innate immunity?	1.0
4462511	-1	How do i know if my gold fish is pregnant?	1.0
4467100	-1	What does sholomister mean?	0.0
4473137	-1	Causes and effects of the rise of Christanity?	0.3333
4473137	conceptnet.topn3.replace	causes personal property up sun christanity	1.0
4473137	relevancefeedback.topn10.qld	causes and effects of the rise of christanity religion planet book mari born be i christ christan	1.0
4473137	bt_nllb_persian	The causes and effects of Christianity	0.5
4473137	word2vec.topn3.replace	causes impacts soar christanity	0.5
4473331	-1	How can I keep my rabit indoors?	1.0
456214	-1	What is the importance of absolute zero temperature?	1.0
474417	-1	what does the prefix "cyclo" mean in greek mythology?	1.0
481173	-1	why live, when your in misery?	1.0
484496	-1	Why a man float on water when he dies?	0.2
484496	anchor.topn3	man float water dies man controversi man releas a class donggong parascombrop dialys softer fürchte wissenschften freue	1.0
484496	anchor.topn3.replace	man controversi man releas a class donggong parascombrop dialys softer fürchte wissenschften freue	1.0
484496	bt_bing_german	Why does a person float on water when he dies	0.3333
484496	bt_bing_korean	Why does a person float on water when he dies	0.3333
484496	bt_nllb_swahili	Why does a person float on water when he dies	0.3333
484496	bt_bing_persian	Why does a man float when he dies	0.25
484496	termluster.topn5.3.bm25	man float water dies	0.25
484496	termluster.topn5.3.qld	man float water dies	0.25
484496	thesaurus.topn3	man float water dies	0.25
484496	thesaurus.topn3.replace	man float water dies	0.25
551239	-1	how do i find out if someone left me a life insurance policy?	0.5
551239	anchor.topn3	find someone left life insurance policy finnfechtnach dance br you r railroader nadutu right kudonji apicomplexan kdblife nánjīng small	1.0
551239	anchor.topn3.replace	finnfechtnach dance br you r railroader someone nadutu right kudonji apicomplexan kdblife nánjīng small insurance policy	1.0
551239	bertqe.topn10.bm25	need cancel polici you still	1.0
551239	bertqe.topn10.qld	you have own polici ten	1.0
551239	bt_bing_korean	How do I know if someone left me a life insurance policy	1.0
551239	bt_bing_malay	How can I tell if someone left me a life insurance policy	1.0
551239	bt_bing_swahili	How can I tell if someone left me a life insurance policy	1.0
551239	bt_nllb_arabic	How do I know if someone left me a life insurance policy	1.0
551239	bt_nllb_french	How do I know if someone left me a life insurance policy	1.0
551239	bt_nllb_german	How do I know if someone left me a life insurance policy	1.0
551239	bt_nllb_malay	How do I know if someone left my life insurance policy	1.0
551239	bt_nllb_swahili	How do I know if someone left me a life insurance policy	1.0
551239	bt_nllb_tamil	How do I know if someone left me a life insurance policy	1.0
551239	conceptluster.topn5.3.bm25	find someone left life insurance policy life insurance insurance policy medical examiner	1.0
551239	conceptluster.topn5.3.qld	find someone left life insurance policy life insurance insurance policy medical examiner	1.0
551239	conceptnet.topn3	find someone left life insurance policy discover search call turn side remain death water expensive health insurance	1.0
551239	conceptnet.topn3.replace	discover search call turn side remain death water expensive health insurance policy	1.0
551239	sensedisambiguation.replace	how do i rule out if person entrust me a life policy policy	1.0
551239	stem.paicehusk	how do i find out if someon left me a lif ins policy	1.0
551239	tagmee.topn3	find someone left life insurance policy Medical examiner Life insurance Insurance policy	1.0
558570	-1	My city just put a ban on pit bulls, how do we reverse the decision?	1.0
654124	-1	Why am I not able to concentrate on my studies?	0.5
654124	anchor.topn3	able concentrate studies	1.0
654124	anchor.topn3.replace	able concentrate studies	1.0
654124	bertqe.topn10.bm25	dont mix studi other stuff	1.0
654124	bt_bing_chinese_simplified	Why can t I concentrate on my studies	1.0
654124	bt_bing_french	Why can t I concentrate on my studies	1.0
654124	bt_bing_german	Why can t I concentrate on my studies	1.0
654124	bt_bing_korean	Why can t I concentrate on my studies	1.0
654124	bt_bing_malay	Why can t I concentrate on my studies	1.0
654124	bt_bing_russian	Why can t I concentrate on my studies	1.0
654124	bt_bing_tamil	Why can t I concentrate on my studies	1.0
654124	conceptluster.topn5.3.bm25	able concentrate studies	1.0
654124	conceptluster.topn5.3.qld	able concentrate studies	1.0
654124	conceptnet.topn3	able concentrate studies ability can study commit to memory centre	1.0
654124	glove.topn3	able concentrate studies unable could focus	1.0
654124	relevancefeedback.topn10.bm25	why am i not able to concentrate on my studies you answer u	1.0
654124	tagmee.topn3	able concentrate studies	1.0
654124	termluster.topn5.3.bm25	able concentrate studies	1.0
654124	termluster.topn5.3.qld	able concentrate studies	1.0
654124	thesaurus.topn3	able concentrate studies	1.0
654124	thesaurus.topn3.replace	able concentrate studies	1.0
654124	wiki.topn3	able concentrate studies	1.0
667488	-1	how soon can you drive on a newly paved driveway?	0.5
667488	bertqe.topn10.bm25	you longer drive your drivewai	1.0
667488	stem.paicehusk	how soon can you driv on a new pav driveway	1.0
676028	-1	Why do our elected federal senators and congressmen not have to live on regular S.S. like the rest of us?	1.0
707303	-1	How do people get hiccups, what are they, and what exactly is the best way to cure them?	1.0
714612	-1	Why doesn't the water fall off  earth if it's round?	0.0357
714612	bertqe.topn10.bm25	pull earth larg object haha	1.0
714612	bt_nllb_tamil	If it is round why does water not fall from the earth	1.0
714612	conceptluster.topn5.3.bm25	n t water fall earth s round earth	0.5
714612	conceptluster.topn5.3.qld	n t water fall earth s round earth	0.5
714612	rm3.topn10.10.0.5.bm25	Why doesnt the water fall off  earth if its round?	0.5
714612	rm3.topn10.10.0.5.qld	Why doesnt the water fall off  earth if its round?	0.5
714612	tagmee.topn3	n t water fall earth s round Earth	0.5
714612	termluster.topn5.3.bm25	n t water fall earth s round	0.25
714612	termluster.topn5.3.qld	n t water fall earth s round	0.25
714612	thesaurus.topn3	n t water fall earth s round	0.25
714612	thesaurus.topn3.replace	n t water fall earth s round	0.25
714612	relevancefeedback.topn10.qld	why doesn t the water fall off earth if it s round moon univers mass pb object larg parallax shape	0.1667
714612	sensedisambiguation	Why does n t the water body of water fall off earth worldly concern if it s round turn	0.1667
714612	bertqe.topn10.qld	earth just pull water toward	0.1429
714612	bt_bing_swahili	Why shouldn t water fall to earth if it is round	0.1
714612	word2vec.topn3	n t water fall earth s round water The liquid spring planet heaven s of s s round	0.1
714612	tagmee.topn3.replace	Earth	0.0909
714612	glove.topn3	n t water fall earth s round do not drinking seawater beginning coming planet mars s whose final	0.0588
714612	wiki.topn3	n t water fall earth s round habitable zone planets terrestrial planets earth earth	0.0526
714612	anchor.topn3	n t water fall earth s round sør jan anthraconit radujevac parascombrop dialys softer thangaiah kambwili această village th spy fi earth sequel b v v s nebergal diwlith overall	0.05
714612	bt_bing_french	Why doesn t water fall out of the earth if it s round	0.04
714612	bt_bing_malay	Why doesn t water fall from the earth if it s round	0.037
714612	bt_bing_tamil	Why doesn t water fall from the earth if it s round	0.037
714612	bt_nllb_malay	Why doesn t water fall from the earth if it s round	0.037
746920	-1	How do you get rid of wart on your hand a using home method?	0.5
746920	bt_bing_french	How to get rid of wart on your hand using the homemade method	1.0
746920	sensedisambiguation	How do you get scram rid of wart on your hand a using use home home plate method method acting	1.0
746920	wiki.topn3	get rid wart hand using home method dandruff digitalis urethritis wart hand thumb finger hand	1.0
761742	-1	How can I become a playa?	1.0
765138	-1	Why does loving someone hurts like hell?	0.2
765138	conceptluster.topn5.3.bm25	loving someone hurts like hell	0.3333
765138	conceptluster.topn5.3.qld	loving someone hurts like hell	0.3333
765138	stem.krovetz	why do loving someone hurt like hell	0.3333
765138	tagmee.topn3	loving someone hurts like hell	0.3333
765138	termluster.topn5.3.bm25	loving someone hurts like hell	0.3333
765138	termluster.topn5.3.qld	loving someone hurts like hell	0.3333
765138	thesaurus.topn3	loving someone hurts like hell	0.3333
765138	thesaurus.topn3.replace	loving someone hurts like hell	0.3333
765138	wiki.topn3	loving someone hurts like hell	0.3333
785823	-1	how is the library consider as a heart of university?	0.3333
785823	bertqe.topn10.bm25	you might have go librari	1.0
785823	bertqe.topn10.qld	access you mai have some	1.0
785823	wiki.topn3	library consider heart university libraries book promotion public library library universities colleges college types university college university	1.0
785823	wiki.topn3.replace	libraries book promotion public library library universities colleges college types university college university	1.0
785823	bt_bing_chinese_simplified	How can libraries be seen as the heart of a university	0.5
785823	bt_nllb_chinese_yue	Library is the heart of the university	0.5
785823	bt_nllb_german	How does the library feel about the university	0.5
785823	conceptnet.topn3	library consider heart university think home college	0.5
785823	glove.topn3	library consider heart university archive should mind indeed professor graduate	0.5
785823	tagmee.topn3.replace	Library University	0.5
78762	-1	why do i have pterofobia?	0.0
788976	-1	Why did the Bush Admin cover up 9/11?	0.02
788976	bt_bing_persian	Why did the Bush administration cover	1.0
788976	bt_nllb_arabic	Why did the Bush administration cover	1.0
788976	bt_nllb_persian	Why did the Bush Administration cover	1.0
788976	rm3.topn10.10.0.5.bm25	Why did the Bush Admin cover up 9/11?	1.0
788976	rm3.topn10.10.0.5.qld	Why did the Bush Admin cover up 9/11?	1.0
788976	bertqe.topn10.bm25	why did iraqi brutal murder	0.5
788976	bt_bing_arabic	Why did Bush administrative cover up	0.5
788976	bt_bing_chinese_simplified	Why did the Bush administration cover up	0.5
788976	bt_bing_french	Why did the Bush administration cover up	0.5
788976	bt_bing_german	Why did the Bush administration cover up	0.5
788976	bt_bing_korean	Why did the Bush administration cover up	0.5
788976	bt_bing_tamil	Why did the Bush administration cover up	0.5
788976	bt_nllb_chinese_yue	Why did the Bush administration cover up	0.5
788976	bt_nllb_french	Why did the Bush administration cover up	0.5
788976	bt_nllb_german	Why did the Bush administration cover up	0.5
788976	bt_nllb_korean	Why did the Bush administration cover up	0.5
788976	bt_nllb_russian	Why did the Bush administration cover up	0.5
788976	bt_nllb_tamil	Why did the Bush administration cover up	0.5
788976	bt_bing_malay	Why did the Bush Administrators close	0.3333
788976	bt_bing_russian	Why did the Bush administration cover up the events of	0.25
788976	conceptluster.topn5.3.bm25	bush admin cover internet forum george w bush cover up	0.1667
788976	conceptluster.topn5.3.qld	bush admin cover internet forum george w bush cover up	0.1667
788976	tagmee.topn3	bush admin cover George W Bush Internet forum Cover up	0.1667
788976	bt_nllb_malay	Why did the Bush administration hide	0.1
788976	relevancefeedback.topn10.qld	why did the bush admin cover up attack i too we new	0.0714
788976	wiki.topn3	bush admin cover texas rangers owners texas rangers executives aviators connecticut george w bush email instant messaging domain name internet forum disinformation wanted list shill cover up	0.0625
788976	tagmee.topn3.replace	George W Bush Internet forum Cover up	0.0588
788976	relevancefeedback.topn10.bm25	why did the bush admin cover up he	0.0526
788976	wordnet.topn3	bush admin cover shrub President George W Bush Dubyuh overcompensate compensate screening Sept	0.0526
788976	stem.trunc4	why did the bush admi cove up	0.0476
788976	glove.topn3	bush admin cover clinton obama kd localweather aftermath sept	0.0455
788976	bt_bing_swahili	Why did Bush s moderator cover	0.0435
788976	conceptnet.topn3	bush admin cover president bush league book blanket lid	0.0417
788976	bt_nllb_swahili	Why did President Bush hide	0.0385
788976	wordnet.topn3.replace	shrub President George W Bush Dubyuh admin overcompensate compensate screening Sept	0.0222
788976	termluster.topn5.3.bm25	bush admin cover	0.0204
788976	termluster.topn5.3.qld	bush admin cover	0.0204
788976	thesaurus.topn3	bush admin cover	0.0204
788976	thesaurus.topn3.replace	bush admin cover	0.0204
821387	-1	I have mice.How do I get rid of them humanely?	1.0
823384	-1	why did the army have personal cuts in the mid 1990's?	0.0667
823384	relevancefeedback.topn10.bm25	why did the army have personal cuts in the mid s bush i arab s cut food	1.0
823384	bt_bing_german	Why were there personnel cuts in the army in the mid s	0.5
823384	bt_nllb_korean	Why did the military cut personnel in the mid s	0.5
823384	bt_nllb_persian	Why did the military cut personnel in the mid s	0.5
823384	rm3.topn10.10.0.5.bm25	why did the army have personal cuts in the mid 1990s?	0.5
823384	rm3.topn10.10.0.5.qld	why did the army have personal cuts in the mid 1990s?	0.5
823384	tagmee.topn3	army personal cuts mid s Cutting in Cutting in	0.3333
823384	conceptluster.topn5.3.bm25	army personal cuts mid s cutting	0.25
823384	conceptluster.topn5.3.qld	army personal cuts mid s cutting	0.25
823384	glove.topn3.replace	forces military own fact cuts late early s whose	0.1667
823384	relevancefeedback.topn10.qld	why did the army have personal cuts in the mid s bush game suv ad cocain i can peopl	0.1667
823384	glove.topn3	army personal cuts mid s forces military own fact late early s whose	0.1429
823384	bt_bing_russian	Why were there personal cuts in the army in the mid s	0.1111
823384	word2vec.topn3	army personal cuts mid s troops pesonal personnal reductions mid mid late mid to late s of s s	0.1111
823384	word2vec.topn3.replace	troops pesonal personnal reductions mid mid late mid to late s of s s	0.1111
823384	termluster.topn5.3.bm25	army personal cuts mid s	0.0833
823384	termluster.topn5.3.qld	army personal cuts mid s	0.0833
823384	thesaurus.topn3	army personal cuts mid s	0.0833
823384	thesaurus.topn3.replace	army personal cuts mid s	0.0833
8293	-1	Why do men fantasized about raping women?	1.0
849221	-1	when it comes to religion why dont people realize history repeats itself?	0.1667
849221	bertqe.topn10.bm25	repeat itself christ return why	1.0
849221	bt_nllb_swahili	Why do unknown people repeat history	1.0
849221	relevancefeedback.topn10.bm25	when it comes to religion why dont people realize history repeats itself histori anymor tsk bibl chang repeat doe	1.0
849221	sensedisambiguation	when it comes come to religion why dont people realize understand history repeats repeat itself	0.5
849221	relevancefeedback.topn10.qld	when it comes to religion why dont people realize history repeats itself all i you histori repeat happen chang peopl	0.3333
849221	sensedisambiguation.replace	when it come to religion why dont people understand history repeat itself	0.2
851124	-1	How is ego a part of our survival instincts?	1.0
896725	-1	what are some good exercises to get rid of those love handles?	1.0
922849	-1	why do some people take life so seriously?	1.0
949154	-1	can anybody tell me what is a butler?	1.0
953489	-1	Why do I have to dumb myself down all the time though I am highly undereducated?	0.0
953489	termluster.topn5.3.bm25	dumb time though highly undereducated	0.0556
953489	termluster.topn5.3.qld	dumb time though highly undereducated	0.0556
953489	thesaurus.topn3	dumb time though highly undereducated	0.0556
953489	thesaurus.topn3.replace	dumb time though highly undereducated	0.0556
953489	conceptluster.topn5.3.bm25	dumb time though highly undereducated time magazine	0.0213
953489	conceptluster.topn5.3.qld	dumb time though highly undereducated time magazine	0.0213
953489	tagmee.topn3	dumb time though highly undereducated Time magazine	0.0213
953489	stem.trunc5	why do i have to dumb mysel down all the time thoug i am highl under	0.0175
