SemSearch_LS-8	-1	continents in the world	0.328
SemSearch_LS-9	-1	degrees of Eastern Orthodox monasticism	0.57
TREC_Entity-1	-1	Carriers that Blackberry makes phones for.	0.1284
TREC_Entity-10	-1	Campuses of Indiana University.	0.1249
TREC_Entity-11	-1	Donors to the Home Depot Foundation.	0.2578
TREC_Entity-12	-1	Airlines that Air Canada has code share flights with.	0.2287
TREC_Entity-14	-1	Authors awarded an Anthony Award at Bouchercon in 2007.	0.5698
TREC_Entity-15	-1	Universities that are members of the SEC conference for football.	0.0796
TREC_Entity-16	-1	Sponsors of the Mancuso quilt festivals.	0.0
TREC_Entity-17	-1	Chefs with a show on the Food Network.	0.5395
TREC_Entity-18	-1	Members of the band Jefferson Airplane.	0.7044
TREC_Entity-19	-1	Companies that John Hennessey serves on the board of.	0.148
TREC_Entity-2	-1	Winners of the ACM Athena award.	0.4074
TREC_Entity-20	-1	Scotch whisky distilleries on the island of Islay.	0.7576
TREC_Entity-4	-1	Professional sports teams in Philadelphia.	0.5034
TREC_Entity-5	-1	Products of Medimmune, Inc.	0.6131
TREC_Entity-6	-1	Organizations that award Nobel prizes.	0.3008
TREC_Entity-7	-1	Airlines that currently use Boeing 747 planes.	0.0078
TREC_Entity-9	-1	Members of The Beaux Arts Trio.	0.621
