qid	order	query	qld.recip_rank
795	-1	notable cocker spaniels	0.0278
795	bt_nllb_korean	A remarkable Coker Spaniel	0.3333
795	bt_nllb_arabic	Cockroaches are remarkable Spaniels	0.125
795	bt_nllb_persian	Notable spaniels	0.0588
795	bt_nllb_malay	The famous spaniel cocker	0.04
795	bt_nllb_swahili	The famous cocker Spaniels	0.04
795	bt_nllb_french	the remarkable cocker Spaniels	0.0294
795	bt_nllb_german	Notable Cocker Spaniels	0.0278
795	bt_nllb_tamil	The notable Coker Spaniel	0.0256
795	bt_nllb_chinese_yue	Fish	0.0
795	bt_nllb_russian	The most remarkable cock singer	0.0
796	-1	Blue Grass Music Festival history	0.5
796	bt_nllb_arabic	The history of the Blue Grass Music Festival	0.5
796	bt_nllb_french	The history of the Blue Grass Music Festival	0.5
796	bt_nllb_german	History of the Blue Grass music festival	0.5
796	bt_nllb_korean	The history of the Blue Grass Music Festival	0.5
796	bt_nllb_malay	The history of the Blue Grass Music Festival	0.5
796	bt_nllb_persian	The history of the Blue Grass Music Festival	0.5
796	bt_nllb_russian	The history of the Blue Grass music festival	0.5
796	bt_nllb_swahili	The history of the Blue Grass Music Festival	0.5
796	bt_nllb_tamil	The history of the Blue Cross Music Festival	0.5
796	bt_nllb_chinese_yue	The history of the Blue Grass Festival	0.3333
797	-1	reintroduction of gray wolves	1.0
797	bt_nllb_french	reintroduction of grey wolves	1.0
797	bt_nllb_persian	The gray wolves	1.0
797	bt_nllb_russian	Restarting the use of gray wolves	1.0
797	bt_nllb_arabic	Re introducing the gray wolves	0.5
797	bt_nllb_chinese_yue	Grey wolves are reintroduced	0.5
797	bt_nllb_german	Restoration of gray wolves	0.5
797	bt_nllb_swahili	reintroduction of the black wolf	0.2
797	bt_nllb_korean	The Grey Wolf breeding	0.1667
797	bt_nllb_tamil	The Red Wolf Resettlement	0.0476
797	bt_nllb_malay	re introduction of the grey wolf	0.0417
798	-1	Massachusetts textile mills	0.5
798	bt_nllb_chinese_yue	The Massachusetts textile mill	0.5
798	bt_nllb_malay	Massachusetts textile mill	0.5
798	bt_nllb_tamil	Massachusetts textile mills	0.5
798	bt_nllb_arabic	Textile factories in Massachusetts	0.3333
798	bt_nllb_german	Textile factories in Massachusetts	0.3333
798	bt_nllb_korean	Massachusetts textile factory	0.3333
798	bt_nllb_persian	The textile factories of Massachusetts	0.3333
798	bt_nllb_russian	Textile factories in Massachusetts	0.3333
798	bt_nllb_swahili	Textile machines in Massachusetts	0.1429
798	bt_nllb_french	Textile manufacturing in Massachusetts	0.0263
799	-1	Animals in Alzheimer's research	1.0
799	bt_nllb_arabic	Animals in Alzheimer s research	1.0
799	bt_nllb_chinese_yue	Animals in the Alzheimer s study	1.0
799	bt_nllb_french	Animals in research on Alzheimer s	1.0
799	bt_nllb_german	Animals in Alzheimer s research	1.0
799	bt_nllb_korean	The animals in the Alzheimer s study	1.0
799	bt_nllb_malay	Animals in Alzheimer s research	1.0
799	bt_nllb_persian	Animals in Alzheimer s research	1.0
799	bt_nllb_swahili	Animals in Alzheimer s research	1.0
799	bt_nllb_tamil	The animals involved in Alzheimer s disease research	1.0
799	bt_nllb_russian	Animals in the Alzheimer s disease studies	0.5
800	-1	Ovarian Cancer Treatment	0.0909
800	bt_nllb_arabic	Treatment for ovarian cancer	0.0909
800	bt_nllb_chinese_yue	Treatment for ovarian cancer	0.0909
800	bt_nllb_french	Treatment of ovarian cancer	0.0909
800	bt_nllb_german	Treatment of ovarian cancer	0.0909
800	bt_nllb_korean	Treatment for ovarian cancer	0.0909
800	bt_nllb_malay	Treatment for Ovarian Cancer	0.0909
800	bt_nllb_persian	Treatment for ovarian cancer	0.0909
800	bt_nllb_russian	Treatment of ovarian cancer	0.0909
800	bt_nllb_tamil	The treatment of cervical cancer	0.0714
800	bt_nllb_swahili	Treatment of Eye Cancer	0.0167
801	-1	Kudzu Pueraria lobata	1.0
801	bt_nllb_chinese_yue	Kudzu Pueraria lobata is a species of lobata	1.0
801	bt_nllb_french	The wings of the pueraria lobata	1.0
801	bt_nllb_malay	Kudzu Pueraria lobata	1.0
801	bt_nllb_russian	The Kudo Pueraria of the Lobot	1.0
801	bt_nllb_swahili	The Pueraria lobata	1.0
801	bt_nllb_tamil	The first is the Kutsu Puearia Lopata	1.0
801	bt_nllb_arabic	I m not going to lie	0.0
801	bt_nllb_german	Other articles of heading No	0.0
801	bt_nllb_korean	The Kuz Poeria Robata is the first	0.0
801	bt_nllb_persian	I m not going to tell you	0.0
802	-1	Volcano eruptions global temperature	1.0
802	bt_nllb_arabic	Volcanic eruptions Global warming	1.0
802	bt_nllb_chinese_yue	The volcano erupted and global warming began	1.0
802	bt_nllb_french	Volcanic eruptions and global warming	1.0
802	bt_nllb_german	Volcanic eruptions global temperature	1.0
802	bt_nllb_korean	Volcanic eruptions are global warming	1.0
802	bt_nllb_malay	Global temperature volcanic eruption	1.0
802	bt_nllb_persian	The eruption of a global warming volcano	1.0
802	bt_nllb_russian	Volcanic eruptions global temperature	1.0
802	bt_nllb_swahili	Volcanic violence global warming	1.0
802	bt_nllb_tamil	Volcanic eruptions global warming	1.0
803	-1	May Day	0.0
803	bt_nllb_arabic	May st	0.0
803	bt_nllb_chinese_yue	May st	0.0
803	bt_nllb_french	May	0.0
803	bt_nllb_german	May	0.0
803	bt_nllb_korean	May st	0.0
803	bt_nllb_malay	First day of May	0.0
803	bt_nllb_persian	A little bit	0.0
803	bt_nllb_russian	May st	0.0
803	bt_nllb_swahili	May	0.0
803	bt_nllb_tamil	May	0.0
804	-1	ban on human cloning	0.3333
804	bt_nllb_arabic	Prohibit human cloning	1.0
804	bt_nllb_french	prohibition on cloning humans	1.0
804	bt_nllb_german	Prohibition of cloning of humans	1.0
804	bt_nllb_korean	Prohibition of human reproduction	1.0
804	bt_nllb_malay	Prohibition of human cloning	1.0
804	bt_nllb_chinese_yue	The ban on human cloning	0.3333
804	bt_nllb_persian	The ban on human cloning	0.3333
804	bt_nllb_tamil	The ban on human cloning	0.3333
804	bt_nllb_russian	The ban on cloning	0.2
804	bt_nllb_swahili	The ban on human design	0.1667
805	-1	Identity Theft Passport	0.0909
805	bt_nllb_arabic	Passport for identity theft	0.0909
805	bt_nllb_french	Passport for identity theft	0.0909
805	bt_nllb_korean	A passport to steal an ID	0.0909
805	bt_nllb_malay	Passport for identity theft	0.0909
805	bt_nllb_persian	Identity theft passport	0.0909
805	bt_nllb_russian	Passport of identity theft	0.0909
805	bt_nllb_swahili	A Passport for Identity Theft	0.0909
805	bt_nllb_tamil	Identity theft passport	0.0909
805	bt_nllb_german	Pass for identity theft	0.0189
805	bt_nllb_chinese_yue	I m a passenger and I m a passenger	0.0
806	-1	Doctors Without Borders	1.0
806	bt_nllb_arabic	Doctors without borders	1.0
806	bt_nllb_chinese_yue	Doctors without borders	1.0
806	bt_nllb_french	Doctors without Borders	1.0
806	bt_nllb_german	Doctors without Borders	1.0
806	bt_nllb_korean	Doctors without borders	1.0
806	bt_nllb_malay	Doctor Without Borders	1.0
806	bt_nllb_persian	Doctors without borders	1.0
806	bt_nllb_russian	Doctors without borders	1.0
806	bt_nllb_swahili	Doctors Without Borders	1.0
806	bt_nllb_tamil	Doctors without Borders	1.0
807	-1	Sugar tariff-rate quotas	1.0
807	bt_nllb_arabic	Sugar tariffs	1.0
807	bt_nllb_french	Tariff quota for sugar	1.0
807	bt_nllb_korean	Sugar tariffs	1.0
807	bt_nllb_malay	Sugar tariff boxes	1.0
807	bt_nllb_russian	Quotas on sugar tariff rates	1.0
807	bt_nllb_tamil	Tax quotas for sugar	1.0
807	bt_nllb_persian	Cutting tariffs on sugar	0.5
807	bt_nllb_swahili	Sugar tax rates	0.1
807	bt_nllb_chinese_yue	The sugar tax rate is positioned	0.0909
807	bt_nllb_german	Farmers tariff quotas	0.0909
808	-1	North Korean Counterfeiting	1.0
808	bt_nllb_arabic	North Korea is fake	1.0
808	bt_nllb_chinese_yue	North Korea is fake	1.0
808	bt_nllb_french	The North Korean counterfeit	1.0
808	bt_nllb_german	North Korean counterfeits	1.0
808	bt_nllb_korean	The North Korean counterfeit	1.0
808	bt_nllb_russian	North Korea is a fake	1.0
808	bt_nllb_tamil	The North Korean counterfeit	1.0
808	bt_nllb_persian	North Korean fraud	0.1111
808	bt_nllb_swahili	North Korean Fraud	0.1111
808	bt_nllb_malay	North Korea Abuses	0.037
809	-1	wetlands wastewater treatment	1.0
809	bt_nllb_chinese_yue	Wetland wastewater treatment	1.0
809	bt_nllb_french	treatment of wetland wastewater	1.0
809	bt_nllb_german	Wastewater treatment of wetlands	1.0
809	bt_nllb_malay	Wastewater treatment in wetlands	1.0
809	bt_nllb_persian	Treatment of wastewater in wetlands	1.0
809	bt_nllb_russian	cleaning of wastewater in wetlands	1.0
809	bt_nllb_tamil	Wetland wastewater treatment	1.0
809	bt_nllb_korean	The wetlands are being treated	0.5
809	bt_nllb_arabic	Wastewater treatment in swampy areas	0.1111
809	bt_nllb_swahili	rainwater treatment	0.0
810	-1	timeshare resales	1.0
810	bt_nllb_arabic	Re selling the stake in time	0.0
810	bt_nllb_chinese_yue	Share the time of reselling	0.0
810	bt_nllb_french	Recurring sales of time shared	0.0
810	bt_nllb_german	The Commission shall take into account the following information	0.0
810	bt_nllb_korean	Shared time reselling	0.0
810	bt_nllb_malay	Selling back time together	0.0
810	bt_nllb_persian	Selling back the time sharing	0.0
810	bt_nllb_russian	Re selling of parts	0.0
810	bt_nllb_swahili	time sales share	0.0
810	bt_nllb_tamil	Time sharing reselling	0.0
811	-1	handwriting recognition	0.5
811	bt_nllb_malay	handwriting recognition	0.5
811	bt_nllb_russian	recognition of handwriting	0.5
811	bt_nllb_chinese_yue	Handwritten identification	0.3333
811	bt_nllb_arabic	Identify the handwriting	0.2
811	bt_nllb_french	recognition of writing	0.0909
811	bt_nllb_german	Handwriting identification	0.0312
811	bt_nllb_korean	Signature of the hand	0.0
811	bt_nllb_persian	Handline detection	0.0
811	bt_nllb_swahili	Recognizing the Scriptures	0.0
811	bt_nllb_tamil	Signature approval	0.0
812	-1	total knee replacement surgery	1.0
812	bt_nllb_arabic	Full knee replacement surgery	1.0
812	bt_nllb_french	total knee replacement surgery	1.0
812	bt_nllb_korean	Full knee replacement surgery	1.0
812	bt_nllb_malay	total knee replacement surgery	1.0
812	bt_nllb_persian	Knee replacement surgery	1.0
812	bt_nllb_russian	General operation for knee replacement	1.0
812	bt_nllb_swahili	knee surgery	1.0
812	bt_nllb_chinese_yue	A complete knee replacement	0.3333
812	bt_nllb_german	Total knee replacement operation	0.3333
812	bt_nllb_tamil	A complete knee replacement	0.3333
813	-1	Atlantic Intracoastal Waterway	1.0
813	bt_nllb_arabic	The inland waterway in the Atlantic Ocean	1.0
813	bt_nllb_chinese_yue	Inland waterways in the Atlantic Ocean	1.0
813	bt_nllb_french	The Atlantic Intracoastal Waterway	1.0
813	bt_nllb_german	The Atlantic Intracoastal Waterway	1.0
813	bt_nllb_malay	Inland waterway of the Atlantic	1.0
813	bt_nllb_persian	The waterway into the Atlantic coast	1.0
813	bt_nllb_russian	Inland waterways of the Atlantic	1.0
813	bt_nllb_swahili	The Atlantic Waterway	1.0
813	bt_nllb_tamil	The Atlantic coast waterway	1.0
813	bt_nllb_korean	I m on my way to the Atlantic coast	0.0
814	-1	Johnstown flood	1.0
814	bt_nllb_arabic	Johnstown floods	1.0
814	bt_nllb_chinese_yue	Johnstown flood	1.0
814	bt_nllb_french	Johnstown Flood	1.0
814	bt_nllb_german	Johnstown Flood	1.0
814	bt_nllb_korean	The Johnstown flood	1.0
814	bt_nllb_malay	Flooding in Johnstown	1.0
814	bt_nllb_persian	The Johnstown Flood	1.0
814	bt_nllb_russian	Flooding in Johnstown	1.0
814	bt_nllb_swahili	Floods in Johnstown	1.0
814	bt_nllb_tamil	Johnstown Flood	1.0
815	-1	Coast Guard rescues	0.125
815	bt_nllb_korean	Coast Guard rescued him	1.0
815	bt_nllb_arabic	Saving the Coast Guard	0.3333
815	bt_nllb_russian	Coast Guard is saving	0.3333
815	bt_nllb_chinese_yue	Coast Guard rescue	0.125
815	bt_nllb_german	Rescue of the Coast Guard	0.125
815	bt_nllb_malay	The Coast Guard is rescuing	0.125
815	bt_nllb_persian	Rescue of the Coast Guard	0.125
815	bt_nllb_tamil	Coast Guard rescue	0.125
815	bt_nllb_french	The Coast Guard Rescuers	0.0909
815	bt_nllb_swahili	Coastguards Cleaning	0.0
816	-1	USAID assistance to Galapagos	1.0
816	bt_nllb_arabic	Assistance provided by the U S Agency for International Development to the Galapagos Islands	1.0
816	bt_nllb_chinese_yue	USAID is helping Galapagos	1.0
816	bt_nllb_french	Aid from USAID to the Galapagos	1.0
816	bt_nllb_german	USAID aid to the Galapagos	1.0
816	bt_nllb_korean	USAID support for the Galapagos region	1.0
816	bt_nllb_malay	USAID aid to the Galapagos	1.0
816	bt_nllb_persian	USAID aid to the Galapagos	1.0
816	bt_nllb_russian	USAID s assistance to the Galapagos	1.0
816	bt_nllb_swahili	USAID aid to the Galapagos	1.0
816	bt_nllb_tamil	USAID assistance to the Galapagos area	1.0
817	-1	sports stadium naming rights	1.0
817	bt_nllb_chinese_yue	The naming rights of the stadium	1.0
817	bt_nllb_french	Name rights of the sports stadium	1.0
817	bt_nllb_german	Sports stadium rights	1.0
817	bt_nllb_malay	right to name sports stadiums	1.0
817	bt_nllb_persian	Sports stadium naming rights	1.0
817	bt_nllb_russian	right to name the sports stadium	1.0
817	bt_nllb_swahili	right to the name of the stadium	1.0
817	bt_nllb_tamil	Naming rights of the stadium	1.0
817	bt_nllb_korean	Sports stadium names	0.2
817	bt_nllb_arabic	Sports fields naming rights	0.05
818	-1	Chaco Culture National Park	1.0
818	bt_nllb_arabic	The national park of culture of the Chaco	1.0
818	bt_nllb_french	The Chaco National Park of Culture	1.0
818	bt_nllb_german	The Chaco culture national park	1.0
818	bt_nllb_malay	The Chaco Cultural Park	1.0
818	bt_nllb_persian	The national park of the Chaco culture	1.0
818	bt_nllb_russian	The Chaco National Park of Culture	1.0
818	bt_nllb_swahili	The Chaco National Park	1.0
818	bt_nllb_chinese_yue	The Chako Culture National Park	0.0
818	bt_nllb_korean	The Chako Cultural National Park	0.0
818	bt_nllb_tamil	Sago Cultural National Park	0.0
819	-1	1890 Census	0.0175
819	bt_nllb_chinese_yue	The census	0.0175
819	bt_nllb_french	Census of	0.0175
819	bt_nllb_german	census	0.0175
819	bt_nllb_korean	The census	0.0175
819	bt_nllb_malay	census	0.0175
819	bt_nllb_persian	The census	0.0175
819	bt_nllb_russian	The census	0.0175
819	bt_nllb_tamil	Census	0.0175
819	bt_nllb_arabic	population	0.0
819	bt_nllb_swahili	Population in	0.0
820	-1	imported fire ants	0.5
820	bt_nllb_persian	Fire ants are in	1.0
820	bt_nllb_arabic	Imported fire ants	0.5
820	bt_nllb_chinese_yue	Importing fire	0.5
820	bt_nllb_french	imported fire ants	0.5
820	bt_nllb_german	imported fire ants	0.5
820	bt_nllb_malay	imported fire ants	0.5
820	bt_nllb_russian	imported fire ants	0.5
820	bt_nllb_tamil	Imported fire ants	0.5
820	bt_nllb_korean	Imported fireworks	0.0
820	bt_nllb_swahili	outdoor fireflies	0.0
821	-1	Internet work-at-home scams	0.3333
821	bt_nllb_german	Internet work to home fraud	1.0
821	bt_nllb_malay	Internet fraud works at home	1.0
821	bt_nllb_persian	Internet scams at work	1.0
821	bt_nllb_french	Internet scams at work from home	0.5
821	bt_nllb_arabic	Internet scams at work at home	0.3333
821	bt_nllb_russian	Internet fraud at work	0.1429
821	bt_nllb_tamil	The Internet is a home for online work	0.05
821	bt_nllb_chinese_yue	The Internet is the kitchen	0.0
821	bt_nllb_korean	You re cheating on the Internet	0.0
821	bt_nllb_swahili	Cheating on homework on the Internet	0.0
822	-1	Custer's Last Stand	0.3333
822	bt_nllb_malay	Custer s last defense	0.5
822	bt_nllb_russian	Custer s last shot	0.5
822	bt_nllb_french	Custer s last stand	0.3333
822	bt_nllb_arabic	Last stop for Custer	0.0909
822	bt_nllb_korean	The Last Book of Custer	0.0909
822	bt_nllb_persian	The last stop of Custer	0.0909
822	bt_nllb_swahili	Custer s Final Victory	0.0714
822	bt_nllb_german	Custer s final point of view	0.0294
822	bt_nllb_chinese_yue	Castor s final step	0.0
822	bt_nllb_tamil	The final stage of Castro	0.0
823	-1	Continuing care retirement communities	1.0
823	bt_nllb_arabic	Continuing care retirement communities	1.0
823	bt_nllb_chinese_yue	Continuing to care for the retirement community	1.0
823	bt_nllb_malay	The community of retired people continues to care	1.0
823	bt_nllb_persian	Continuing care retirement communities	1.0
823	bt_nllb_korean	Continuous management retirement community	0.5
823	bt_nllb_french	Continuing care pension communities	0.0769
823	bt_nllb_german	Development pension communities	0.0
823	bt_nllb_russian	Communities of pensioners in constant care	0.0
823	bt_nllb_swahili	Adult communities to thrive	0.0
823	bt_nllb_tamil	Continuous Care Pension Societies	0.0
824	-1	Civil Air Patrol	1.0
824	bt_nllb_arabic	Civil air patrol	1.0
824	bt_nllb_chinese_yue	Civil air patrol	1.0
824	bt_nllb_french	Civil air patrol	1.0
824	bt_nllb_german	Civil air patrol	1.0
824	bt_nllb_persian	Civil air patrol	1.0
824	bt_nllb_russian	Civil air patrol	1.0
824	bt_nllb_tamil	The Civil Air Force	1.0
824	bt_nllb_korean	Civil air police	0.0357
824	bt_nllb_swahili	Civil Air Police	0.0357
824	bt_nllb_malay	Public air services	0.0115
825	-1	National Guard Involvement in Iraq	0.1429
825	bt_nllb_swahili	The National Guard s Co operation in Iraq	0.2
825	bt_nllb_arabic	National Guard involvement in Iraq	0.1429
825	bt_nllb_french	National Guard involvement in Iraq	0.1429
825	bt_nllb_malay	National Guard involvement in Iraq	0.1429
825	bt_nllb_persian	National Guard involvement in Iraq	0.1429
825	bt_nllb_chinese_yue	The Iraqi National Guard is involved	0.1111
825	bt_nllb_german	The National Guard s involvement in Iraq	0.1
825	bt_nllb_korean	The National Guard s involvement in Iraq	0.1
825	bt_nllb_russian	The National Guard s involvement in Iraq	0.1
825	bt_nllb_tamil	National Police participation in Iraq	0.0
826	-1	Florida Seminole Indians	0.25
826	bt_nllb_arabic	Seminole Indian in Florida	0.25
826	bt_nllb_chinese_yue	The Seminole Indians of Florida	0.25
826	bt_nllb_french	Seminole Indians of Florida	0.25
826	bt_nllb_german	Florida Seminole Indians	0.25
826	bt_nllb_korean	The Florida Seminole Indians	0.25
826	bt_nllb_malay	The Seminole Indians of Florida	0.25
826	bt_nllb_persian	The Seminole Indians of Florida	0.25
826	bt_nllb_russian	The Seminole Indians of Florida	0.25
826	bt_nllb_swahili	Seminole Indians of Florida	0.25
826	bt_nllb_tamil	The Florida Seminole Indians	0.25
827	-1	Hidden Markov Modeling HMM	1.0
827	bt_nllb_chinese_yue	The hidden Malkov simulates HMM	1.0
827	bt_nllb_french	Hidden modeling of Markov HMM	1.0
827	bt_nllb_german	HMM hidden Markov modeling	1.0
827	bt_nllb_korean	HMM hidden maquette modeling	1.0
827	bt_nllb_malay	HMM model of Markov hidden	1.0
827	bt_nllb_persian	The secret modeling of Markov HMM	1.0
827	bt_nllb_russian	The hidden Markov model of HMM	1.0
827	bt_nllb_swahili	Secret Markov Modeling HMM	1.0
827	bt_nllb_tamil	HMM with hidden Markov modeling	1.0
827	bt_nllb_arabic	Markov is hiding a model hymn	0.1
828	-1	secret shoppers	1.0
828	bt_nllb_arabic	The secret shoppers	1.0
828	bt_nllb_chinese_yue	Secret shoppers	1.0
828	bt_nllb_korean	Secret shoppers	1.0
828	bt_nllb_malay	Secret shoppers	1.0
828	bt_nllb_swahili	secret shoppers	1.0
828	bt_nllb_french	secret buyers	0.0
828	bt_nllb_german	Secret Buyers	0.0
828	bt_nllb_persian	The hidden buyers	0.0
828	bt_nllb_russian	The secret buyers	0.0
828	bt_nllb_tamil	Secret buyers	0.0
829	-1	Spanish Civil War support	0.3333
829	bt_nllb_arabic	Supporting the Spanish Civil War	0.3333
829	bt_nllb_chinese_yue	Spanish Civil War support	0.3333
829	bt_nllb_french	Support for the Spanish Civil War	0.3333
829	bt_nllb_german	Support for the Spanish Civil War	0.3333
829	bt_nllb_korean	Spanish Civil War Support	0.3333
829	bt_nllb_malay	Support for the Spanish Civil War	0.3333
829	bt_nllb_persian	Support for the Spanish Civil War	0.3333
829	bt_nllb_russian	Support during the Spanish Civil War	0.3333
829	bt_nllb_swahili	Aid for the Spanish Civil War	0.25
829	bt_nllb_tamil	The Spanish Civil War was a turbulent period	0.1667
830	-1	model railroads	0.5
830	bt_nllb_arabic	The railroad model	0.5
830	bt_nllb_chinese_yue	The model of railroads	0.5
830	bt_nllb_french	railway model	0.0303
830	bt_nllb_german	Model railway	0.0303
830	bt_nllb_korean	Model railway	0.0303
830	bt_nllb_malay	model railway	0.0303
830	bt_nllb_persian	Model railways	0.0303
830	bt_nllb_russian	model of railways	0.0303
830	bt_nllb_swahili	model railways	0.0303
830	bt_nllb_tamil	Model railway	0.0303
831	-1	Dulles Airport security	1.0
831	bt_nllb_french	Security at Dulles Airport	1.0
831	bt_nllb_german	Security at Dulles Airport	1.0
831	bt_nllb_malay	Dulles Airport Security	1.0
831	bt_nllb_swahili	Security at Dulles Airport	1.0
831	bt_nllb_tamil	Airport security of Dulles	1.0
831	bt_nllb_korean	Dallas airport security	0.3333
831	bt_nllb_persian	Security at Dallas Airport	0.3333
831	bt_nllb_russian	The security of the Dallas airport	0.3333
831	bt_nllb_arabic	Dalyes airport security	0.1667
831	bt_nllb_chinese_yue	Dulles Airport is safe	0.1429
832	-1	labor union activity	1.0
832	bt_nllb_chinese_yue	The trade union movement	0.1
832	bt_nllb_arabic	Trade union activity	0.0208
832	bt_nllb_french	trade union activity	0.0208
832	bt_nllb_german	Trade union activity	0.0208
832	bt_nllb_korean	Trade union activities	0.0208
832	bt_nllb_malay	trade union activities	0.0208
832	bt_nllb_persian	Activities of trade unions	0.0208
832	bt_nllb_russian	Trade union activities	0.0208
832	bt_nllb_swahili	the activities of trade unions	0.0208
832	bt_nllb_tamil	Trade union activity	0.0208
833	-1	Iceland government	1.0
833	bt_nllb_arabic	The Icelandic government	1.0
833	bt_nllb_chinese_yue	The Icelandic government	1.0
833	bt_nllb_french	The Icelandic Government	1.0
833	bt_nllb_german	Government of Iceland	1.0
833	bt_nllb_korean	The Icelandic government	1.0
833	bt_nllb_malay	The Icelandic government	1.0
833	bt_nllb_persian	The Icelandic government	1.0
833	bt_nllb_russian	The Government of Iceland	1.0
833	bt_nllb_swahili	The Icelandic government	1.0
833	bt_nllb_tamil	The Icelandic government	1.0
834	-1	Global positioning system earthquakes	0.2
834	bt_nllb_malay	Earthquake global placement system	1.0
834	bt_nllb_arabic	Earthquakes in the global positioning system	0.2
834	bt_nllb_chinese_yue	Global positioning system earthquake	0.2
834	bt_nllb_french	Earthquake in the global positioning system	0.2
834	bt_nllb_german	Earthquakes in the global positioning system	0.2
834	bt_nllb_persian	Earthquakes in the global positioning system	0.2
834	bt_nllb_russian	Global positioning system of earthquakes	0.2
834	bt_nllb_tamil	The global positioning system earthquakes	0.2
834	bt_nllb_swahili	Earthquake of the international system of installation	0.1667
834	bt_nllb_korean	Earthquake location system	0.0152
835	-1	Big Dig pork	1.0
835	bt_nllb_german	Big Dig pork	1.0
835	bt_nllb_malay	Big Dig pork	1.0
835	bt_nllb_swahili	Big Dig pork	1.0
835	bt_nllb_korean	Big digging pigs	0.2
835	bt_nllb_tamil	Big digging pig	0.2
835	bt_nllb_french	Big Dig s pig	0.125
835	bt_nllb_arabic	Big pork	0.037
835	bt_nllb_persian	Big pork	0.037
835	bt_nllb_chinese_yue	Dig a hole in the pork	0.0
835	bt_nllb_russian	Big lead	0.0
836	-1	illegal immigrant wages	0.1429
836	bt_nllb_arabic	The wages of illegal immigrants	0.1429
836	bt_nllb_chinese_yue	The wages of illegal immigrants	0.1429
836	bt_nllb_french	wages of illegal immigrants	0.1429
836	bt_nllb_german	Wages for illegal immigrants	0.1429
836	bt_nllb_korean	The wages of illegal immigrants	0.1429
836	bt_nllb_malay	The wages of illegal immigrants	0.1429
836	bt_nllb_persian	The rights of illegal immigrants	0.1429
836	bt_nllb_russian	wages of illegal immigrants	0.1429
836	bt_nllb_tamil	The wages of illegal immigrants	0.1429
836	bt_nllb_swahili	wages of legal immigrants	0.0588
837	-1	Eskimo History	0.0714
837	bt_nllb_arabic	The history of the Eskimos	0.0714
837	bt_nllb_french	The history of the Eskimos	0.0714
837	bt_nllb_german	The history of the Eskimos	0.0714
837	bt_nllb_korean	The history of the Eskimos	0.0714
837	bt_nllb_malay	The history of the Eskimos	0.0714
837	bt_nllb_persian	The history of the Eskimos	0.0714
837	bt_nllb_tamil	The history of Eskimo	0.0714
837	bt_nllb_russian	The story of the Eskimos	0.05
837	bt_nllb_chinese_yue	The Smithsonian	0.0
837	bt_nllb_swahili	The History of the Waeskim	0.0
838	-1	urban suburban coyotes	1.0
838	bt_nllb_french	urban coyotes of the suburbs	1.0
838	bt_nllb_russian	urban coyotes	1.0
838	bt_nllb_swahili	urban coyotes	1.0
838	bt_nllb_tamil	Coyotes an urban suburb	1.0
838	bt_nllb_malay	suburb coyotes	0.5
838	bt_nllb_korean	Coyote outside the city	0.25
838	bt_nllb_arabic	Urban cows	0.0
838	bt_nllb_chinese_yue	Suburbs	0.0
838	bt_nllb_german	Urban suburb cohouses	0.0
838	bt_nllb_persian	Urban Quotes	0.0
839	-1	textile dyeing techniques	1.0
839	bt_nllb_arabic	Techniques for dyeing fabrics	1.0
839	bt_nllb_french	textile dyeing techniques	1.0
839	bt_nllb_german	Textile colouring processes	1.0
839	bt_nllb_korean	Fiber dyeing techniques	1.0
839	bt_nllb_malay	textile dyeing techniques	1.0
839	bt_nllb_persian	Textile dyeing techniques	1.0
839	bt_nllb_swahili	techniques for dyeing clothes	1.0
839	bt_nllb_tamil	Textile dyeing techniques	1.0
839	bt_nllb_russian	textile painting techniques	0.1111
839	bt_nllb_chinese_yue	Weaving technology	0.0204
840	-1	Geysers	1.0
840	bt_nllb_french	The geysers	1.0
840	bt_nllb_malay	Geysers	1.0
840	bt_nllb_persian	The Geyser	1.0
840	bt_nllb_russian	Geysers	1.0
840	bt_nllb_swahili	Geysers	1.0
840	bt_nllb_german	Other geysers	0.3333
840	bt_nllb_arabic	The waves	0.0
840	bt_nllb_chinese_yue	Gas	0.0
840	bt_nllb_korean	The basement	0.0
840	bt_nllb_tamil	Kaiser	0.0
841	-1	camel North America	1.0
841	bt_nllb_chinese_yue	North American camel	1.0
841	bt_nllb_german	Camel of North America	1.0
841	bt_nllb_korean	Camel North America	1.0
841	bt_nllb_malay	North American camel	1.0
841	bt_nllb_russian	Camel North America	1.0
841	bt_nllb_swahili	camels in North America	1.0
841	bt_nllb_arabic	North America	0.0
841	bt_nllb_french	North America	0.0
841	bt_nllb_persian	North America	0.0
841	bt_nllb_tamil	North America	0.0
842	-1	David McCullough	0.0769
842	bt_nllb_persian	I m going to see David McCullough	1.0
842	bt_nllb_chinese_yue	David McCullough is the author of this book	0.2
842	bt_nllb_arabic	David McCullough	0.0769
842	bt_nllb_french	David McCullough	0.0769
842	bt_nllb_malay	David McCullough is	0.0769
842	bt_nllb_russian	David McCullough	0.0769
