1265,3640705,bt_bing_tamil,What is the punishment for child molesters,0.288
1266,3640705,bt_nllb_persian,What is the punishment for child molestation,0.288
1267,3640705,bt_nllb_swahili,What is the punishment for child molestation,0.288
1268,3640705,stem.krovetz,what is the punishment for child molest,0.288
1269,3640705,stem.paicehusk,what is the pun for child molest,0.2403
1270,3698636,-1,why do cats headbutt?,0.0376
1271,3698636,termluster.topn5.3.bm25,cats headbutt,0.3239
1272,3698636,termluster.topn5.3.qld,cats headbutt,0.3239
1273,3698636,thesaurus.topn3,cats headbutt,0.3239
1274,3698636,thesaurus.topn3.replace,cats headbutt,0.3239
1275,3698636,conceptluster.topn5.3.bm25,cats headbutt headbutt,0.283
1276,3698636,conceptluster.topn5.3.qld,cats headbutt headbutt,0.283
1277,3698636,tagmee.topn3,cats headbutt Headbutt,0.283
1278,3698636,stem.porter2,whi do cat headbutt,0.0567
1279,3698636,bt_bing_malay,Why Headbutt Cats,0.051
1280,3698636,tagmee.topn3.replace,Headbutt,0.05
1281,3698636,anchor.topn3,cats headbutt head but bodypress hanging short,0.0479
1282,3698636,word2vec.topn3,cats headbutt felines dogs head butt headbutting,0.0448
1283,3698636,wiki.topn3,cats headbutt strikes martial arts flip acrobatic elbow strike headbutt,0.0417
1284,3714728,-1,Why is the world so shallow?,0.2136
1285,3714728,termluster.topn5.3.bm25,world shallow,0.6603
1286,3714728,termluster.topn5.3.qld,world shallow,0.6603
1287,3714728,thesaurus.topn3,world shallow,0.6603
1288,3714728,thesaurus.topn3.replace,world shallow,0.6603
1289,3714728,stem.porter2,whi is the world so shallow,0.3993
1290,3714728,conceptnet.topn3,world shallow deep fordable neritic,0.339
1291,3723508,-1,What is the difference between an ox and a bull?,0.5896
1292,3723508,conceptluster.topn5.3.bm25,difference ox bull heraldry bull ox,0.7863
1293,3723508,conceptluster.topn5.3.qld,difference ox bull heraldry bull ox,0.7863
1294,3723508,tagmee.topn3,difference ox bull Heraldry Ox Bull,0.7863
1295,3723508,termluster.topn5.3.bm25,difference ox bull,0.7799
1296,3723508,termluster.topn5.3.qld,difference ox bull,0.7799
1297,3723508,thesaurus.topn3,difference ox bull,0.7799
1298,3723508,thesaurus.topn3.replace,difference ox bull,0.7799
1299,3723508,tagmee.topn3.replace,Heraldry Ox Bull,0.7686
1300,3723508,glove.topn3,difference ox bull fact instance oxen ooooooooooooooooooooooooooooooooooooooo srivalo piyanart,0.7662
1301,3723508,wiki.topn3,difference ox bull heraldry escutcheon heraldry gules heraldry horsharness scythe chisel ox rooster ox hoof bull,0.7401
1302,3723508,stem.trunc4,what is the diff betw an ox and a bull,0.6814
1303,3723508,stem.trunc5,what is the diffe betwe an ox and a bull,0.6814
1304,3723508,sensedisambiguation.replace,What is the remainder between an ox and a bull,0.6719
1305,3723508,wordnet.topn3,difference ox bull dispute conflict difference of opinion wild ox dogshit Irish bull bull through,0.6441
1306,3723508,conceptnet.topn3,difference ox bull distinction animal cow,0.6184
1307,3723508,wordnet.topn3.replace,dispute conflict difference of opinion wild ox dogshit Irish bull bull through,0.6142
1308,3723508,word2vec.topn3,difference ox bull diference differnce oxen donkey s eyes,0.5928
1309,3778229,-1,how were the witches tested in the salem witch trials?,0.7907
1310,3778229,sensedisambiguation,how were the witches witch tested test in the salem witch trials trial,0.8252
1311,3778229,bt_bing_chinese_simplified,How were witches put to the test in the Salem Witch Trial,0.7926
1312,3778229,bt_bing_german,How were the witches put to the test in the Salem Witch Trials,0.7926
1313,3825386,-1,How can I develop leanbody and muscles?,0.1963
1314,3825386,termluster.topn5.3.bm25,develop leanbody muscles,0.497
1315,3825386,termluster.topn5.3.qld,develop leanbody muscles,0.497
1316,3825386,thesaurus.topn3,develop leanbody muscles,0.497
1317,3825386,thesaurus.topn3.replace,develop leanbody muscles,0.497
1318,3825386,conceptluster.topn5.3.bm25,develop leanbody muscles developmental biology muscle,0.3507
1319,3825386,conceptluster.topn5.3.qld,develop leanbody muscles developmental biology muscle,0.3507
1320,3825386,tagmee.topn3,develop leanbody muscles Developmental biology Muscle,0.3507
1321,3872395,-1,what are some easy ways to get a toddler to go to sleep without being mean?,0.0299
1322,3872395,bt_bing_tamil,What are some simple ways to put toddler to sleep without average,0.1225
1323,3872395,bt_bing_french,What are some easy ways to put a toddler to sleep without being naughty,0.0922
1324,3872395,stem.porter2,what are some easi way to get a toddler to go to sleep without be mean,0.0596
1325,3872395,stem.porter,what ar some easi wai to get a toddler to go to sleep without be mean,0.0578
1326,3872395,conceptluster.topn5.3.bm25,easy ways get toddler go sleep without mean,0.0571
1327,3872395,conceptluster.topn5.3.qld,easy ways get toddler go sleep without mean,0.0571
1328,3872395,tagmee.topn3,easy ways get toddler go sleep without mean,0.0571
1329,3872395,termluster.topn5.3.bm25,easy ways get toddler go sleep without mean,0.0571
1330,3872395,termluster.topn5.3.qld,easy ways get toddler go sleep without mean,0.0571
1331,3872395,thesaurus.topn3,easy ways get toddler go sleep without mean,0.0571
1332,3872395,thesaurus.topn3.replace,easy ways get toddler go sleep without mean,0.0571
1333,3872395,wiki.topn3,easy ways get toddler go sleep without mean,0.0571
1334,3872395,word2vec.topn3,easy ways get toddler go sleep without mean straightforward quick easier things methods obtain give go infant baby come goes proceed dreamless wihtout wihout imply say,0.0448
1335,3872395,stem.lovins,what ar som eas way to ges a toddler to go to sleep without being mean,0.0447
1336,3872395,bt_bing_korean,What are some easy ways to get a toddler to sleep without being grumpy,0.0444
1337,3872395,bt_bing_chinese_simplified,What are some easy ways to get a toddler to sleep without being mean,0.0429
1338,3872395,bt_bing_german,What are some easy ways to get a toddler to sleep without being mean,0.0429
1339,3872395,relevancefeedback.topn10.qld,what are some easy ways to get a toddler to go to sleep without being mean problem child christma dog stroller alldai puppi bite we,0.0419
1340,3874326,-1,How come Compton is only designated for black people?,0.1337
1341,3874326,termluster.topn5.3.bm25,come compton designated black people,0.3025
1342,3874326,termluster.topn5.3.qld,come compton designated black people,0.3025
1343,3874326,thesaurus.topn3,come compton designated black people,0.3025
1344,3874326,thesaurus.topn3.replace,come compton designated black people,0.3025
1345,3874326,anchor.topn3,come compton designated black people uniplicatu pandaemonium a lov compton mill br compton lyvett kvinnen triplewart black cockatoo,0.2849
1346,3874326,conceptluster.topn5.3.bm25,come compton designated black people compton california,0.2113
1347,3874326,conceptluster.topn5.3.qld,come compton designated black people compton california,0.2113
1348,3874326,tagmee.topn3,come compton designated black people Compton California,0.2113
1349,3874326,wordnet.topn3,come compton designated black people arrive cum come up Arthur Holly Compton Arthur Compton indicate destine show Negroid Shirley Temple Black Black person hoi polloi multitude,0.2067
1350,3874326,bt_bing_french,How come Compton is only for black people,0.1812
1351,3874326,bt_bing_german,How come Compton is only for black people,0.1812
1352,3874326,bt_nllb_arabic,How come Compton was only for black people,0.1812
1353,3874326,stem.porter,how come compton is onli designat for black peopl,0.1812
1354,3874326,anchor.topn3.replace,uniplicatu pandaemonium a lov compton mill br compton lyvett designated kvinnen triplewart black cockatoo people,0.1589
1355,3874326,bt_bing_tamil,How was Compton assigned only to black people,0.1426
1356,387874,-1,Why does asparugus make your pee stink?,0.5775
1357,387874,termluster.topn5.3.bm25,asparugus make pee stink,0.6316
1358,387874,termluster.topn5.3.qld,asparugus make pee stink,0.6316
1359,387874,thesaurus.topn3,asparugus make pee stink,0.6316
1360,387874,thesaurus.topn3.replace,asparugus make pee stink,0.6316
1361,387874,stem.porter2,whi doe asparugus make your pee stink,0.6208
1362,387874,stem.krovetz,why do asparugu make your pee stink,0.6187
1363,3910925,-1,Why is yawning contagious?,0.5871
1364,3910925,conceptluster.topn5.3.bm25,yawning contagious infection yawn,0.6615
1365,3910925,conceptluster.topn5.3.qld,yawning contagious infection yawn,0.6615
1366,3910925,tagmee.topn3,yawning contagious Yawn Infection,0.6615
1367,3910925,wordnet.topn3,yawning contagious yaw oscitant contractable transmissible,0.6381
1368,3910925,anchor.topn3,yawning contagious,0.636
1369,3910925,anchor.topn3.replace,yawning contagious,0.636
1370,3910925,termluster.topn5.3.bm25,yawning contagious,0.636
1371,3910925,termluster.topn5.3.qld,yawning contagious,0.636
1372,3910925,thesaurus.topn3,yawning contagious,0.636
1373,3910925,thesaurus.topn3.replace,yawning contagious,0.636
1374,3910925,stem.porter2,whi is yawn contagi,0.6325
1375,3910925,relevancefeedback.topn10.bm25,why is yawning contagious contagi yawn,0.6265
1376,3910925,relevancefeedback.topn10.qld,why is yawning contagious yawn contagi,0.6265
1377,3910925,sensedisambiguation,Why is yawning yawn contagious,0.6076
1378,3910925,wiki.topn3,yawning contagious rapid eymovement behavior disorder sinus anatomy torticollis yawn antibiotics urinary bladder pancreas infection,0.5918
1379,3960080,-1,Why don't commercial planes fly over the North Pole?,0.5165
1380,3960080,termluster.topn5.3.bm25,n t commercial planes fly north pole,0.62
1381,3960080,termluster.topn5.3.qld,n t commercial planes fly north pole,0.62
1382,3960080,thesaurus.topn3,n t commercial planes fly north pole,0.62
1383,3960080,thesaurus.topn3.replace,n t commercial planes fly north pole,0.62
1384,3960080,rm3.topn10.10.0.5.bm25,Why dont commercial planes fly over the North Pole?,0.5734
1385,3960080,rm3.topn10.10.0.5.qld,Why dont commercial planes fly over the North Pole?,0.5734
1386,3960080,conceptluster.topn5.3.bm25,n t commercial planes fly north pole anatomical terms location,0.5605
1387,3960080,conceptluster.topn5.3.qld,n t commercial planes fly north pole anatomical terms location,0.5605
1388,3960080,bt_nllb_tamil,Why do commercial planes not fly over the North Pole,0.5268
1389,3960080,bt_nllb_french,Why aren t commercial planes flying over the North Pole,0.5259
1390,3960080,bt_nllb_german,Why aren t commercial planes flying over the North Pole,0.5259
1391,3960080,bt_nllb_malay,Why aren t commercial planes flying over the North Pole,0.5259
1392,3960080,bt_nllb_russian,Why aren t commercial planes flying over the North Pole,0.5259
1393,3971195,-1,How do i get my pitbull more agressive?,0.2462
1394,3971195,conceptluster.topn5.3.bm25,get pitbull agressive aggression pitbull rapper,0.3852
1395,3971195,conceptluster.topn5.3.qld,get pitbull agressive aggression pitbull rapper,0.3852
1396,3971195,tagmee.topn3,get pitbull agressive Pitbull rapper Aggression,0.3852
1397,3971195,termluster.topn5.3.bm25,get pitbull agressive,0.3839
1398,3971195,termluster.topn5.3.qld,get pitbull agressive,0.3839
1399,3971195,thesaurus.topn3,get pitbull agressive,0.3839
1400,3971195,thesaurus.topn3.replace,get pitbull agressive,0.3839
1401,3971195,relevancefeedback.topn10.qld,how do i get my pitbull more agressive dog your pitbul,0.3198
1402,3971195,anchor.topn3,get pitbull agressive drive differences chak chak syryaki prodiacoryph hasratan,0.3051
1403,3971195,relevancefeedback.topn10.bm25,how do i get my pitbull more agressive dog pitbul ask ass terror,0.2925
1404,3971195,bt_bing_arabic,How do I make a pitbull more aggressive,0.273
1405,3971195,bt_bing_tamil,How do I get my pitbull aggressive,0.2613
1406,3971195,wiki.topn3,get pitbull agressive lil jon nayer mr inc pitbull rapper problem behavior observational learning behavior aggression,0.2579
1407,3990512,-1,how can we get concentration onsomething?,0.006
1408,3990512,conceptluster.topn5.3.bm25,get concentration onsomething,0.21
1409,3990512,conceptluster.topn5.3.qld,get concentration onsomething,0.21
1410,3990512,tagmee.topn3,get concentration onsomething,0.21
1411,3990512,termluster.topn5.3.bm25,get concentration onsomething,0.21
1412,3990512,termluster.topn5.3.qld,get concentration onsomething,0.21
1413,3990512,thesaurus.topn3,get concentration onsomething,0.21
1414,3990512,thesaurus.topn3.replace,get concentration onsomething,0.21
1415,3990512,wiki.topn3,get concentration onsomething,0.21
1416,3990512,glove.topn3,get concentration onsomething got furthermore,0.0788
1417,3990512,anchor.topn3.replace,drive differences chak chak concentration onsomething,0.0379
1418,3990512,anchor.topn3,get concentration onsomething drive differences chak chak,0.023
1419,3990512,word2vec.topn3,get concentration onsomething obtain give go concetration,0.0207
1420,4003223,-1,What are the marketing gimmicks that will attract males?,0.5479
1421,4003223,termluster.topn5.3.bm25,marketing gimmicks attract males,0.5885
1422,4003223,termluster.topn5.3.qld,marketing gimmicks attract males,0.5885
1423,4003223,thesaurus.topn3,marketing gimmicks attract males,0.5885
1424,4003223,thesaurus.topn3.replace,marketing gimmicks attract males,0.5885
1425,4003223,relevancefeedback.topn10.bm25,what are the marketing gimmicks that will attract males gimmick corona you crab male panten,0.5858
1426,4012558,-1,what is the term milky way?,0.7187
1427,4012558,conceptluster.topn5.3.bm25,term milky way time milky way,0.7541
1428,4012558,conceptluster.topn5.3.qld,term milky way time milky way,0.7541
1429,4012558,tagmee.topn3,term milky way Time Milky Way,0.7541
1430,4012558,bt_nllb_french,What is the end of the Milky Way,0.7487
1431,4012558,tagmee.topn3.replace,Time Milky Way,0.7421
1432,4012558,termluster.topn5.3.bm25,term milky way,0.7393
1433,4012558,termluster.topn5.3.qld,term milky way,0.7393
1434,4012558,thesaurus.topn3,term milky way,0.7393
1435,4012558,thesaurus.topn3.replace,term milky way,0.7393
1436,4012558,bt_bing_chinese_simplified,What is the Milky Way,0.7387
1437,4012558,bt_bing_swahili,What is the Milky Way,0.7387
1438,4012558,bt_nllb_russian,What is the Milky Way,0.7387
1439,4012558,bt_nllb_swahili,What is the Milky Way,0.7387
1440,4018891,-1,How do I know if a particular term or phrase is copyrighted?,0.1708
1441,4018891,sensedisambiguation,How do I know sleep together if a particular term or phrase is copyrighted copyright,0.3213
1442,4018891,relevancefeedback.topn10.bm25,how do i know if a particular term or phrase is copyrighted help come protect you languag black need copyright,0.2521
1443,4018891,termluster.topn5.3.bm25,know particular term phrase copyrighted,0.2399
1444,4018891,termluster.topn5.3.qld,know particular term phrase copyrighted,0.2399
1445,4018891,thesaurus.topn3,know particular term phrase copyrighted,0.2399
1446,4018891,thesaurus.topn3.replace,know particular term phrase copyrighted,0.2399
1447,4018891,word2vec.topn3,know particular term phrase copyrighted know knwo tell specific certain these phrase word words copywritten copyright protected uncopyrighted,0.2326
1448,4018891,bt_nllb_french,How do you know if a particular term or phrase is copyrighted,0.1919
1449,4018891,bt_bing_swahili,How do I know if a particular word or phrase is copyrighted,0.1885
1450,4018891,bt_bing_tamil,How do I know if a particular word or phrase is copyrighted,0.1885
1451,4018891,bt_nllb_tamil,How do I know if a particular word or phrase is copyrighted,0.1885
1452,4018891,bt_bing_korean,How do I know if a term or phrase is copyrighted,0.182
1453,4018891,stem.paicehusk,how do i know if a particul term or phras is copyright,0.182
1454,4018891,bt_nllb_german,How do I know if a particular term or phrase is protected by copyright,0.1761
1455,4018891,stem.lovins,how do i know if a particl term or phras is copyright,0.1755
1456,402514,-1,why do my baked potatos never taste near as good as when I get them in a nice restaurant?,0.4149
1457,402514,termluster.topn5.3.bm25,baked potatos never taste near good get nice restaurant,0.5715
1458,402514,termluster.topn5.3.qld,baked potatos never taste near good get nice restaurant,0.5715
1459,402514,thesaurus.topn3,baked potatos never taste near good get nice restaurant,0.5715
1460,402514,thesaurus.topn3.replace,baked potatos never taste near good get nice restaurant,0.5715
1461,402514,conceptluster.topn5.3.bm25,baked potatos never taste near good get nice restaurant national institute health care excellence baking taste restaurant potato mary j blige song,0.4931
1462,402514,conceptluster.topn5.3.qld,baked potatos never taste near good get nice restaurant national institute health care excellence baking taste restaurant potato mary j blige song,0.4931
1463,402514,tagmee.topn3,baked potatos never taste near good get nice restaurant Why Mary J Blige song Baking Potato Taste National Institute for Health and Care Excellence Restaurant,0.4839
1464,402514,stem.porter2,whi do my bake potato never tast near as good as when i get them in a nice restaur,0.4487
1465,402514,sensedisambiguation.replace,why do my baked potato never taste near as good as when I receive them in a nice restaurant,0.4454
1466,402514,relevancefeedback.topn10.qld,why do my baked potatos never taste near as good as when i get them in a nice restaurant potato bake you food,0.436
1467,402514,sensedisambiguation,why do my baked potatos potato never taste near as good as when I get receive them in a nice restaurant,0.432
1468,402514,relevancefeedback.topn10.bm25,why do my baked potatos never taste near as good as when i get them in a nice restaurant potato food you bake eat,0.4262
1469,402514,bt_bing_arabic,Why doesn t baked potatoes taste as good as when I get them in a nice restaurant,0.4204
1470,402514,bt_bing_german,Why do my baked potatoes never taste nearly as good as when I get them at a nice restaurant,0.4189
1471,4126337,-1,Why does my friend buy...?,0.1932
1472,4126337,conceptluster.topn5.3.bm25,friend buy,0.3194
1473,4126337,conceptluster.topn5.3.qld,friend buy,0.3194
1474,4126337,tagmee.topn3,friend buy,0.3194
1475,4126337,termluster.topn5.3.bm25,friend buy,0.3194
1476,4126337,termluster.topn5.3.qld,friend buy,0.3194
1477,4126337,thesaurus.topn3,friend buy,0.3194
1478,4126337,thesaurus.topn3.replace,friend buy,0.3194
1479,4126337,wiki.topn3,friend buy,0.3194
1480,4126337,bt_bing_french,Why is my friend buying,0.2555
1481,4126337,bt_bing_german,Why is my friend buying,0.2555
1482,4126337,bt_bing_russian,Why is my friend buying,0.2555
1483,4126337,bt_bing_tamil,Why is my friend buying,0.2555
1484,4126337,bt_nllb_french,Why is my friend buying,0.2555
1485,4126337,bt_nllb_german,Why is my friend buying,0.2555
1486,4126337,bt_nllb_russian,Why is my friend buying,0.2555
1487,4126337,stem.krovetz,why do my friend buy,0.204
1488,4153592,-1,what can make someones ear's stink?,0.1527
1489,4153592,termluster.topn5.3.bm25,make someones ear s stink,0.3036
1490,4153592,termluster.topn5.3.qld,make someones ear s stink,0.3036
1491,4153592,thesaurus.topn3,make someones ear s stink,0.3036
1492,4153592,thesaurus.topn3.replace,make someones ear s stink,0.3036
1493,4153592,bt_bing_tamil,What makes someone s ear stink,0.2343
1494,4153592,rm3.topn10.10.0.5.bm25,what can make someones ears stink?,0.183
1495,4153592,rm3.topn10.10.0.5.qld,what can make someones ears stink?,0.183
1496,4153592,bt_bing_swahili,What would make someone s ear stink,0.1825
1497,4153592,conceptluster.topn5.3.bm25,make someones ear s stink odor,0.1592
1498,4153592,conceptluster.topn5.3.qld,make someones ear s stink odor,0.1592
1499,4153592,tagmee.topn3,make someones ear s stink Odor,0.1592
1500,4165406,-1,Why did the founder of Daewoo get a 10-year jail sentence?,0.4724
1501,4165406,termluster.topn5.3.bm25,founder daewoo get year jail sentence,0.6204
1502,4165406,termluster.topn5.3.qld,founder daewoo get year jail sentence,0.6204
1503,4165406,thesaurus.topn3,founder daewoo get year jail sentence,0.6204
1504,4165406,thesaurus.topn3.replace,founder daewoo get year jail sentence,0.6204
1505,4165406,bt_bing_tamil,Why was Daewoo founder sentenced to years in jail,0.5868
1506,4165406,stem.porter2,whi did the founder of daewoo get a year jail sentenc,0.5174
1507,4185395,-1,how can i cure the std or the sexually transmitted disease?,0.7035
1508,4185501,-1,why does the sun shine?,0.354
1509,4185501,stem.porter2,whi doe the sun shine,0.4216
1510,4185501,termluster.topn5.3.bm25,sun shine,0.4165
1511,4185501,termluster.topn5.3.qld,sun shine,0.4165
1512,4185501,thesaurus.topn3,sun shine,0.4165
1513,4185501,thesaurus.topn3.replace,sun shine,0.4165
1514,4185501,wiki.topn3,sun shine best thearly years might bgiants album danny weinkauf back skull sun shine sun mass incandescent gas,0.4108
1515,4185501,conceptluster.topn5.3.bm25,sun shine sun shine sun mass incandescent gas,0.4067
1516,4185501,conceptluster.topn5.3.qld,sun shine sun shine sun mass incandescent gas,0.4067
1517,4185501,tagmee.topn3,sun shine Why Does the Sun Shine The Sun Is a Mass of Incandescent Gas,0.3813
1518,4185501,tagmee.topn3.replace,Why Does the Sun Shine The Sun Is a Mass of Incandescent Gas,0.3697
1519,4185501,bt_bing_german,Why is the sun shining,0.3554
1520,4185501,bt_bing_persian,Why is the sun shining,0.3554
1521,4185501,bt_bing_russian,Why is the sun shining,0.3554
1522,4185501,bt_bing_swahili,Why is the sun shining,0.3554
1523,4185501,bt_nllb_french,Why is the sun shining,0.3554
1524,4185501,bt_nllb_german,Why is the sun shining,0.3554
1525,4185501,bt_nllb_korean,Why is the sun shining,0.3554
1526,4185501,bt_nllb_malay,Why is the sun shining,0.3554
1527,4185501,bt_nllb_russian,Why is the sun shining,0.3554
1528,4185501,bt_nllb_tamil,Why is the sun shining,0.3554
1529,4190287,-1,Why is switching schools so depressing?,0.2237
1530,4190287,anchor.topn3,switching schools depressing,0.283
1531,4190287,anchor.topn3.replace,switching schools depressing,0.283
1532,4190287,termluster.topn5.3.bm25,switching schools depressing,0.283
1533,4190287,termluster.topn5.3.qld,switching schools depressing,0.283
1534,4190287,thesaurus.topn3,switching schools depressing,0.283
1535,4190287,thesaurus.topn3.replace,switching schools depressing,0.283
1536,4190287,stem.porter2,whi is switch school so depress,0.2411
1537,4196421,-1,how can you be more brilliant?,0.3265
1538,4196421,conceptnet.topn3,brilliant,0.6416
1539,4196421,conceptnet.topn3.replace,brilliant,0.6416
1540,4196421,termluster.topn5.3.bm25,brilliant,0.6416
1541,4196421,termluster.topn5.3.qld,brilliant,0.6416
1542,4196421,thesaurus.topn3,brilliant,0.6416
1543,4196421,thesaurus.topn3.replace,brilliant,0.6416
1544,4196421,relevancefeedback.topn10.qld,how can you be more brilliant quasar lsd galileo your art custom brilliant,0.5388
1545,4197214,-1,Why my GF feel like pissing during sexual intercourse?,0.3492
1546,4197214,conceptluster.topn5.3.bm25,gf feel like pissing sexual intercourse sexual intercourse,0.4106
1547,4197214,conceptluster.topn5.3.qld,gf feel like pissing sexual intercourse sexual intercourse,0.4106
1548,4197214,tagmee.topn3,gf feel like pissing sexual intercourse Sexual intercourse,0.4106
1549,4197214,termluster.topn5.3.bm25,gf feel like pissing sexual intercourse,0.4085
1550,4197214,termluster.topn5.3.qld,gf feel like pissing sexual intercourse,0.4085
1551,4197214,thesaurus.topn3,gf feel like pissing sexual intercourse,0.4085
1552,4197214,thesaurus.topn3.replace,gf feel like pissing sexual intercourse,0.4085
1553,4197214,sensedisambiguation.replace,Why my GF feel like make during sexual sexual intercourse,0.4047
1554,4197214,tagmee.topn3.replace,Sexual intercourse,0.3928
1555,4197214,sensedisambiguation,Why my GF feel like pissing make during sexual intercourse sexual intercourse,0.3927
1556,421753,-1,how to get rid of a skunk?,0.2016
1557,421753,conceptluster.topn5.3.bm25,get rid skunk skunk,0.4092
1558,421753,conceptluster.topn5.3.qld,get rid skunk skunk,0.4092
1559,421753,tagmee.topn3,get rid skunk Skunk,0.4092
1560,421753,wiki.topn3,get rid skunk chipmunk opossum prairidog skunk,0.405
1561,421753,word2vec.topn3,get rid skunk obtain give go eradicate banish eliminate skunk like,0.3989
1562,421753,termluster.topn5.3.bm25,get rid skunk,0.3538
1563,421753,termluster.topn5.3.qld,get rid skunk,0.3538
1564,421753,thesaurus.topn3,get rid skunk,0.3538
1565,421753,thesaurus.topn3.replace,get rid skunk,0.3538
1566,421753,anchor.topn3,get rid skunk drive differences chak chak stojkovićevo okruglica stojkovićeva mephitis mephiti mephitis,0.3165
1567,421753,tagmee.topn3.replace,Skunk,0.3101
1568,421753,stem.lovins,how to ges rid of a skunk,0.2857
1569,421753,sensedisambiguation.replace,how to suffer rid of a skunk,0.2729
1570,421753,bt_nllb_swahili,how to remove skunk,0.2521
1571,421753,conceptnet.topn3,get rid skunk receive animal,0.2437
1572,4250296,-1,What do doctors do when a patient has a Do Nor Resuscitate Order?,0.0562
1573,4250296,termluster.topn5.3.bm25,doctors patient resuscitate order,0.5558
1574,4250296,termluster.topn5.3.qld,doctors patient resuscitate order,0.5558
1575,4250296,thesaurus.topn3,doctors patient resuscitate order,0.5558
1576,4250296,thesaurus.topn3.replace,doctors patient resuscitate order,0.5558
1577,4250296,anchor.topn3,doctors patient resuscitate order alunga patient deriv in a row order column major maydoni tukmit,0.454
1578,4250296,glove.topn3,doctors patient resuscitate order physicians patients doctors resurrect revive,0.3012
1579,4250296,conceptluster.topn5.3.bm25,doctors patient resuscitate order religious order physician resuscitation,0.265
1580,4250296,conceptluster.topn5.3.qld,doctors patient resuscitate order religious order physician resuscitation,0.265
1581,4250296,tagmee.topn3,doctors patient resuscitate order Physician Resuscitation Religious order,0.265
1582,4250296,wordnet.topn3,doctors patient resuscitate order MD medico Doctor of the Church affected role patient role come to revive gild ordination society,0.2441
