,qid,order,query,bm25.map
0,100653,-1,how do I go about getting copies of letters of commendation prsented to me from city of san diego?,0.491
1,100653,termluster.topn5.3.bm25,go getting copies letters commendation prsented city san diego,0.5367
2,100653,termluster.topn5.3.qld,go getting copies letters commendation prsented city san diego,0.5367
3,100653,thesaurus.topn3,go getting copies letters commendation prsented city san diego,0.5367
4,100653,thesaurus.topn3.replace,go getting copies letters commendation prsented city san diego,0.5367
5,100653,bt_bing_german,How do I get copies of letters of recommendation provided to me by the City of San Diego,0.5223
6,100653,bt_bing_russian,How do I get copies of thank you letters from the City of San Diego,0.5217
7,100653,bt_nllb_french,How do I get copies of congratulatory letters sent by the city of San Diego,0.5194
8,100653,bt_bing_korean,How do I get a copy of a letter of commendation from the City of San Diego to me,0.5056
9,100653,bt_bing_swahili,How do i get copies of congratulatory letters given to me from the city of san diego,0.5017
10,100653,bt_nllb_korean,How do we get compliments from the city of San Diego,0.4978
11,100653,bt_bing_french,How do I get copies of the letters of recommendation sent to me by the City of San Diego,0.4955
12,100653,stem.trunc5,how do i go about getti copie of lette of comme prsen to me from city of san diego,0.4916
13,1015624,-1,What's the Definition of a bloody mary?,0.7116
14,1015624,bt_bing_arabic,What is the definition of Bloody Mary,0.7319
15,1015624,bt_bing_chinese_simplified,What is the definition of a Bloody Mary,0.7319
16,1015624,bt_bing_french,What is the definition of a bloody mary,0.7319
17,1015624,bt_bing_german,What is the definition of a Bloody Mary,0.7319
18,1015624,bt_bing_korean,What is the definition of a Bloody Mary,0.7319
19,1015624,bt_bing_malay,What is the definition of bloody mary,0.7319
20,1015624,bt_bing_persian,What is the definition of the Bloody Mary,0.7319
21,1015624,bt_bing_russian,What is the definition of a Bloody Mary,0.7319
22,1015624,bt_bing_tamil,What is the definition of Bloody Mary,0.7319
23,1015624,bt_nllb_arabic,What is the definition of Bloody Mary,0.7319
24,1015624,bt_nllb_korean,What is the definition of a bloody Mary,0.7319
25,1015624,bt_nllb_persian,What is the definition of bloody Mary,0.7319
26,1015624,bt_nllb_swahili,What is the definition of bloody Mary,0.7319
27,1015624,bt_nllb_tamil,What is the definition of a bloody Mary,0.7319
28,1015624,rm3.topn10.10.0.5.bm25,Whats the Definition of a bloody mary?,0.7319
29,1015624,rm3.topn10.10.0.5.qld,Whats the Definition of a bloody mary?,0.7319
30,1017690,-1,what is the history of indian music?,0.5752
31,1017690,conceptluster.topn5.3.bm25,history indian music,0.6199
32,1017690,conceptluster.topn5.3.qld,history indian music,0.6199
33,1017690,tagmee.topn3,history indian music,0.6199
34,1017690,termluster.topn5.3.bm25,history indian music,0.6199
35,1017690,termluster.topn5.3.qld,history indian music,0.6199
36,1017690,thesaurus.topn3,history indian music,0.6199
37,1017690,thesaurus.topn3.replace,history indian music,0.6199
38,1017690,wiki.topn3,history indian music,0.6199
39,1035857,-1,Why are liberals so quick to defend Saddam?,0.3804
40,1035857,termluster.topn5.3.bm25,liberals quick defend saddam,0.4898
41,1035857,termluster.topn5.3.qld,liberals quick defend saddam,0.4898
42,1035857,thesaurus.topn3,liberals quick defend saddam,0.4898
43,1035857,thesaurus.topn3.replace,liberals quick defend saddam,0.4898
44,1035857,stem.porter2,whi are liber so quick to defend saddam,0.3897
45,103830,-1,Why do man Arabs hate the west ?,0.496
46,103830,termluster.topn5.3.bm25,man arabs hate west,0.674
47,103830,termluster.topn5.3.qld,man arabs hate west,0.674
48,103830,thesaurus.topn3,man arabs hate west,0.674
49,103830,thesaurus.topn3.replace,man arabs hate west,0.674
50,103830,stem.porter2,whi do man arab hate the west,0.5678
51,1063812,-1,How do I grow taller?,0.4152
52,1063812,bt_bing_russian,How do you grow taller,0.461
53,1063812,bt_nllb_korean,How can you grow taller,0.4528
54,1063812,conceptluster.topn5.3.bm25,grow taller,0.436
55,1063812,conceptluster.topn5.3.qld,grow taller,0.436
56,1063812,tagmee.topn3,grow taller,0.436
57,1063812,termluster.topn5.3.bm25,grow taller,0.436
58,1063812,termluster.topn5.3.qld,grow taller,0.436
59,1063812,thesaurus.topn3,grow taller,0.436
60,1063812,thesaurus.topn3.replace,grow taller,0.436
61,1063812,wiki.topn3,grow taller,0.436
62,1063812,relevancefeedback.topn10.qld,how do i grow taller bright you my taller u,0.4191
63,1063812,anchor.topn3,grow taller critically gross herbland escalada remedio serigrafia,0.4179
64,1077370,-1,Why do only Humans have Finger prints?,0.5316
65,1077370,termluster.topn5.3.bm25,humans finger prints,0.6935
66,1077370,termluster.topn5.3.qld,humans finger prints,0.6935
67,1077370,thesaurus.topn3,humans finger prints,0.6935
68,1077370,thesaurus.topn3.replace,humans finger prints,0.6935
69,1077370,sensedisambiguation,Why do only Humans homo have Finger prints print,0.5919
70,1077370,anchor.topn3,humans finger prints nightbug zfi death small,0.5437
71,1082595,-1,what is meant by mobile technology?,0.4871
72,1082595,conceptnet.topn3,meant mobile technology ploughland meaned cell Mobile River automotive technology,0.5889
73,1082595,conceptluster.topn5.3.bm25,meant mobile technology,0.5779
74,1082595,conceptluster.topn5.3.qld,meant mobile technology,0.5779
75,1082595,tagmee.topn3,meant mobile technology,0.5779
76,1082595,termluster.topn5.3.bm25,meant mobile technology,0.5779
77,1082595,termluster.topn5.3.qld,meant mobile technology,0.5779
78,1082595,thesaurus.topn3,meant mobile technology,0.5779
79,1082595,thesaurus.topn3.replace,meant mobile technology,0.5779
80,1082595,wiki.topn3,meant mobile technology,0.5779
81,1082595,bt_bing_arabic,What is mobile technology,0.5777
82,1082595,bt_bing_french,What is mobile technology,0.5777
83,1082595,bt_bing_german,What is mobile technology,0.5777
84,1082595,bt_bing_tamil,What is mobile technology,0.5777
85,1082595,bt_nllb_korean,What is mobile technology,0.5777
86,1082595,bt_nllb_swahili,what is mobile technology,0.5777
87,1082595,bt_nllb_tamil,What is mobile technology,0.5777
88,1082595,sensedisambiguation.replace,what is think of by mobile technology,0.5635
89,1082595,bt_bing_swahili,What is the point of mobile technology,0.5406
90,1082595,bt_bing_chinese_simplified,What does mobile technology mean,0.5297
91,1082595,bt_bing_malay,What does mobile technology mean,0.5297
92,1082595,bt_bing_persian,What does mobile technology mean,0.5297
93,1082595,bt_nllb_arabic,What does mobile technology mean,0.5297
94,1082595,bt_nllb_chinese_yue,What does mobile technology mean,0.5297
95,1082595,bt_nllb_french,What does mobile technology mean,0.5297
96,1082595,bt_nllb_german,What does mobile technology mean,0.5297
97,1082595,bt_nllb_malay,What does mobile technology mean,0.5297
98,1082595,bt_nllb_persian,What does mobile technology mean,0.5297
99,1082595,bt_nllb_russian,What does mobile technology mean,0.5297
100,1119420,-1,"Well the black light is UV light.So if it is ""black"" how can it be ""light"" ?",0.5912
101,1119420,termluster.topn5.3.bm25,well black light uv light so black light,0.629
102,1119420,termluster.topn5.3.qld,well black light uv light so black light,0.629
103,1119420,thesaurus.topn3,well black light uv light so black light,0.629
104,1119420,thesaurus.topn3.replace,well black light uv light so black light,0.629
105,1152934,-1,Why don't fat people have to pay more for air travel?,0.2979
106,1152934,bt_nllb_german,Why don t fat people pay for air travel anymore,0.3925
107,1152934,bt_nllb_malay,Why don t fat people pay more for air travel,0.3668
108,1152934,bt_nllb_russian,Why don t fat people pay more for air travel,0.3668
109,1152934,bt_bing_swahili,Why don t oil people pay more for air travel,0.3265
110,1152934,stem.lovins,why don t fat peopl hav to pay mor for air travel,0.3243
111,1152934,stem.paicehusk,why don t fat peopl hav to pay mor for air travel,0.3243
112,1152934,stem.trunc5,why don t fat peopl have to pay more for air trave,0.3151
113,1152934,stem.porter2,whi don t fat peopl have to pay more for air travel,0.3071
114,1167882,-1,What are the different types of sins and how are they caused?,0.1912
115,1167882,termluster.topn5.3.bm25,different types sins caused,0.5376
116,1167882,termluster.topn5.3.qld,different types sins caused,0.5376
117,1167882,thesaurus.topn3,different types sins caused,0.5376
118,1167882,thesaurus.topn3.replace,different types sins caused,0.5376
119,1167882,conceptluster.topn5.3.bm25,different types sins caused typology theology sin,0.291
120,1167882,conceptluster.topn5.3.qld,different types sins caused typology theology sin,0.291
121,1167882,tagmee.topn3,different types sins caused Typology theology Sin,0.291
122,1199639,-1,"How to ""LOSE""all body fat ?",0.4968
123,1199639,conceptluster.topn5.3.bm25,lose body fat,0.5451
124,1199639,conceptluster.topn5.3.qld,lose body fat,0.5451
125,1199639,tagmee.topn3,lose body fat,0.5451
126,1199639,termluster.topn5.3.bm25,lose body fat,0.5451
127,1199639,termluster.topn5.3.qld,lose body fat,0.5451
128,1199639,thesaurus.topn3,lose body fat,0.5451
129,1199639,thesaurus.topn3.replace,lose body fat,0.5451
130,1199639,wiki.topn3,lose body fat,0.5451
131,1199639,bt_bing_chinese_simplified,How to lose body fat,0.4984
132,1254390,-1,how do i deap fry chicken?,0.2462
133,1254390,bt_nllb_swahili,How do I deap fried chicken,0.3631
134,1254390,stem.porter2,how do i deap fri chicken,0.3631
135,1254390,bt_bing_german,How can I defish fried chicken,0.3343
136,1254390,bt_bing_swahili,How can I raise fried chicken,0.3339
137,1254390,bt_bing_korean,How do you harvest fried chicken,0.316
138,1254390,bt_nllb_arabic,How do I feed fried chicken,0.3083
139,1254390,wiki.topn3,deap fry chicken canadian penning trap mass spectrometer myron l good fermilab e seaquest deap staling deep frying batter cooking frying junglefowls poultry pig chicken,0.2987
140,1254390,conceptluster.topn5.3.bm25,deap fry chicken chicken deap frying,0.2872
141,1254390,conceptluster.topn5.3.qld,deap fry chicken deap frying chicken,0.2872
142,1254390,tagmee.topn3,deap fry chicken DEAP Frying Chicken,0.2872
143,1254390,tagmee.topn3.replace,DEAP Frying Chicken,0.2872
144,1254390,termluster.topn5.3.bm25,deap fry chicken,0.2872
145,1254390,termluster.topn5.3.qld,deap fry chicken,0.2872
146,1254390,thesaurus.topn3,deap fry chicken,0.2872
147,1254390,thesaurus.topn3.replace,deap fry chicken,0.2872
148,1254390,relevancefeedback.topn10.qld,how do i deap fry chicken buncha you chicken breath danger oil,0.2582
149,1254390,bt_bing_arabic,How can I fry chicken,0.2561
150,1254390,bt_nllb_malay,How can I fry chicken,0.2561
151,1254390,bt_nllb_tamil,How do I get the yellow fried chicken,0.2491
152,1262692,-1,How can I get rid of pimples on my back?,0.2915
153,1262692,termluster.topn5.3.bm25,get rid pimples back,0.4609
154,1262692,termluster.topn5.3.qld,get rid pimples back,0.4609
155,1262692,thesaurus.topn3,get rid pimples back,0.4609
156,1262692,thesaurus.topn3.replace,get rid pimples back,0.4609
157,1262692,relevancefeedback.topn10.bm25,how can i get rid of pimples on my back dont pimpl benzyl back,0.4341
158,1262692,sensedisambiguation,How can I get rid of pimples pimple on my back spinal column,0.4297
159,1262692,conceptluster.topn5.3.bm25,get rid pimples back get,0.4282
160,1262692,conceptluster.topn5.3.qld,get rid pimples back get,0.4282
161,1262692,relevancefeedback.topn10.qld,how can i get rid of pimples on my back your you pimpl dont make,0.3988
162,1262692,tagmee.topn3,get rid pimples back Can I Get A,0.3952
163,1262692,bt_bing_chinese_simplified,How do you get rid of pimples on your back,0.3732
164,1262692,anchor.topn3,get rid pimples back drive differences chak chak stojkovićevo okruglica stojkovićeva kristma ever clos morefar,0.3661
165,1262692,conceptnet.topn3,get rid pimples back receive a person return reply front,0.3549
166,1282199,-1,how can I hide the cuts on my wrists?,0.2111
167,1282199,conceptluster.topn5.3.bm25,hide cuts wrists,0.4278
168,1282199,conceptluster.topn5.3.qld,hide cuts wrists,0.4278
169,1282199,tagmee.topn3,hide cuts wrists,0.4278
170,1282199,termluster.topn5.3.bm25,hide cuts wrists,0.4278
171,1282199,termluster.topn5.3.qld,hide cuts wrists,0.4278
172,1282199,thesaurus.topn3,hide cuts wrists,0.4278
173,1282199,thesaurus.topn3.replace,hide cuts wrists,0.4278
174,1282199,wiki.topn3,hide cuts wrists,0.4278
175,1282199,wordnet.topn3,hide cuts wrists obliterate skin veil swing swerve veer articulatio radiocarpea wrist joint,0.3551
176,1282199,sensedisambiguation,how can I hide shroud the cuts stinger on my wrists wrist,0.2791
177,1282199,bt_bing_russian,How do I hide cuts on my wrists,0.2366
178,1282199,bt_nllb_french,How do I hide the cuts on my wrists,0.2366
179,1287437,-1,how can i lose 30 pounds by june3?,0.118
180,1287437,rm3.topn10.10.0.5.bm25,how can i lose 30 pounds by june3?,0.3836
181,1287437,rm3.topn10.10.0.5.qld,how can i lose 30 pounds by june3?,0.3836
182,1287437,relevancefeedback.topn10.bm25,how can i lose pounds by june control you good your,0.1694
183,1287437,termluster.topn5.3.bm25,lose pounds june,0.1681
184,1287437,termluster.topn5.3.qld,lose pounds june,0.1681
185,1287437,thesaurus.topn3,lose pounds june,0.1681
186,1287437,thesaurus.topn3.replace,lose pounds june,0.1681
187,1287437,conceptnet.topn3,lose pounds june weight plural of pound,0.1364
188,1287437,sensedisambiguation,how can i lose suffer thirty pounds syrian pound by june,0.129
189,1287437,glove.topn3,lose pounds june lost kilos kilograms,0.1263
190,1287437,conceptluster.topn5.3.bm25,lose pounds june pound mass canadian dollar,0.1262
191,1287437,conceptluster.topn5.3.qld,lose pounds june canadian dollar pound mass,0.1262
192,1287437,tagmee.topn3,lose pounds june Canadian dollar Pound mass,0.1262
193,1287437,relevancefeedback.topn10.qld,how can i lose pounds by june you ur turkei,0.123
194,1290612,-1,why do anxiety and depression seem to coexist?,0.5591
195,1290612,termluster.topn5.3.bm25,anxiety depression seem coexist,0.606
196,1290612,termluster.topn5.3.qld,anxiety depression seem coexist,0.606
197,1290612,thesaurus.topn3,anxiety depression seem coexist,0.606
198,1290612,thesaurus.topn3.replace,anxiety depression seem coexist,0.606
199,1292734,-1,what color you like the most and why?,0.062
200,1292734,bt_nllb_malay,What color do you like and why,0.1069
201,1292734,bt_nllb_persian,What color do you like and why,0.1069
202,1292734,bt_bing_arabic,What color do you like the most and why,0.0915
203,1292734,bt_bing_malay,What color do you like the most and why,0.0915
204,1292734,bt_bing_persian,What color do you like most and why,0.0915
205,1292734,bt_bing_french,Which color do you like the most and why,0.0792
206,1292734,bt_bing_korean,Which color do you like the most and why,0.0792
207,1292734,bt_bing_russian,Which color do you like the most and why,0.0792
208,1292734,bt_bing_tamil,Which color do you like the most and why,0.0792
209,1292734,bt_bing_german,Which color do you like best and why,0.078
210,1292734,bt_nllb_arabic,What color do you like best and why,0.0688
211,1292734,bt_nllb_chinese_yue,What color do you like best Why,0.0688
212,1292734,bt_nllb_german,What color do you like best and why,0.0688
213,1292734,bt_nllb_korean,What color do you like best Why,0.0688
214,1292734,bt_nllb_russian,What color do you like best and why,0.0688
215,1292734,bt_nllb_swahili,What color do you like best and why,0.0688
216,1340574,-1,Why do some people only go to church on Easter Sunday and never go again until Christmas ?,0.4791
217,1340574,termluster.topn5.3.bm25,people go church easter sunday never go christmas,0.5305
218,1340574,termluster.topn5.3.qld,people go church easter sunday never go christmas,0.5305
219,1340574,thesaurus.topn3,people go church easter sunday never go christmas,0.5305
220,1340574,thesaurus.topn3.replace,people go church easter sunday never go christmas,0.5305
221,1340574,stem.porter2,whi do some peopl onli go to church on easter sunday and never go again until christma,0.5005
222,1340574,bt_bing_swahili,Why do some people go to church on Easter Sunday and never go again until Christmas,0.4829
223,1340574,bt_bing_persian,Why do some people just go to church on Easter Sunday and never go again until Christmas,0.481
224,1340574,bt_nllb_malay,Why do some people just go to church on Easter Sunday and not go again until Christmas,0.4809
225,1351675,-1,Why must I have an uncracked winshield in order to for my car to pass a safety inspeciton?,0.2246
226,1351675,conceptluster.topn5.3.bm25,must uncracked winshield order car pass safety inspeciton forward pass safety gridiron football position,0.4114
227,1351675,conceptluster.topn5.3.qld,must uncracked winshield order car pass safety inspeciton forward pass safety gridiron football position,0.4114
228,1351675,tagmee.topn3,must uncracked winshield order car pass safety inspeciton Forward pass Safety gridiron football position,0.4114
229,1351675,termluster.topn5.3.bm25,must uncracked winshield order car pass safety inspeciton,0.4026
230,1351675,termluster.topn5.3.qld,must uncracked winshield order car pass safety inspeciton,0.4026
231,1351675,thesaurus.topn3,must uncracked winshield order car pass safety inspeciton,0.4026
232,1351675,thesaurus.topn3.replace,must uncracked winshield order car pass safety inspeciton,0.4026
233,1351675,relevancefeedback.topn10.bm25,why must i have an uncracked winshield in order to for my car to pass a safety inspeciton or safeti can you dirt radiat,0.3282
234,1351675,sensedisambiguation.replace,Why mustiness I have an uncracked winshield in order to for my car to pass a safety inspeciton,0.2782
235,1351675,stem.porter2,whi must i have an uncrack winshield in order to for my car to pass a safeti inspeciton,0.2766
236,1351675,bt_bing_swahili,Why should I have an uncracked winshield so that my car passes the safety inspeciton,0.2299
237,1364894,-1,Why do we need to tell customer service/operator about our sickness in order to make appointment w/ a doctor?,0.2647
238,1364894,relevancefeedback.topn10.bm25,why do we need to tell customer service operator about our sickness in order to make appointment w a doctor circumcis doctor i you appoint out custom,0.4752
239,1364894,termluster.topn5.3.bm25,need tell customer service operator sickness order make appointment w doctor,0.3966
240,1364894,termluster.topn5.3.qld,need tell customer service operator sickness order make appointment w doctor,0.3966
241,1364894,thesaurus.topn3,need tell customer service operator sickness order make appointment w doctor,0.3966
242,1364894,thesaurus.topn3.replace,need tell customer service operator sickness order make appointment w doctor,0.3966
243,1364894,bt_nllb_german,Why do we have to tell the customer service operator about our illness to make an appointment with a doctor,0.3075
244,1364894,stem.porter2,whi do we need to tell custom servic oper about our sick in order to make appoint w a doctor,0.2947
245,1364894,bt_bing_russian,Why do we have to inform customer service operator about our illness in order to make an appointment with a doctor,0.2872
246,1364894,bt_nllb_korean,Why should we tell a customer service businessman about the disease to make an appointment with a doctor,0.2852
247,1364894,bt_bing_korean,Why do I need to tell the customer service operator about my illness in order to make an appointment with my doctor,0.2747
248,1364894,bt_bing_arabic,Why do we need to tell the customer service operator about our illness in order to make an appointment with a doctor,0.272
249,1364894,bt_bing_malay,Why do we need to tell the customer operator service about our illness to make an appointment with a doctor,0.2719
250,1364894,bt_nllb_malay,Why do we have to tell the customer service about our illness to make an appointment with a doctor,0.2717
251,1364894,bt_bing_persian,Why do we need customer service operator regarding our illness in order to make a w doctor appointment,0.2712
252,1364894,bt_bing_swahili,Why do we need to tell customer service operator about our illness in order to make an appointment w a doctor,0.2677
253,1373069,-1,Freedom of Speech - why don't people understand how to use it?,0.1981
254,1373069,termluster.topn5.3.bm25,freedom speech n t people understand use,0.2839
255,1373069,termluster.topn5.3.qld,freedom speech n t people understand use,0.2839
256,1373069,thesaurus.topn3,freedom speech n t people understand use,0.2839
257,1373069,thesaurus.topn3.replace,freedom speech n t people understand use,0.2839
258,1373069,stem.porter2,freedom of speech whi don t peopl understand how to use it,0.2469
259,1373069,conceptluster.topn5.3.bm25,freedom speech n t people understand use freedom speech,0.2412
260,1373069,conceptluster.topn5.3.qld,freedom speech n t people understand use freedom speech,0.2412
261,1373069,tagmee.topn3,freedom speech n t people understand use Freedom of speech,0.2412
262,1373069,bt_nllb_french,Freedom of speech Why do people not understand how to use it,0.2249
263,1373069,bt_nllb_swahili,Freedom of Speech why do people not understand how to use it,0.2249
264,1373069,bt_nllb_tamil,Freedom of speech Why do people not understand how to use it,0.2249
265,1373069,rm3.topn10.10.0.5.bm25,Freedom of Speech - why dont people understand how to use it?,0.2171
266,1373069,rm3.topn10.10.0.5.qld,Freedom of Speech - why dont people understand how to use it?,0.2171
267,1373069,anchor.topn3,freedom speech n t people understand use il helsien martin ss misspeak cross speech bucc sør jan anthraconit radujevac judaism empiricism prophylacti d ignam nbsp mhz autonomatron,0.2074
268,1373069,sensedisambiguation,Freedom of Speech why do n t people understand how to use it,0.2003
269,1373069,sensedisambiguation.replace,freedom of speech why do n t people understand how to use it,0.2003
270,143833,-1,What is the difference between coolant and anti-freeze?,0.6399
271,143833,termluster.topn5.3.bm25,difference coolant anti freeze,0.7813
272,143833,termluster.topn5.3.qld,difference coolant anti freeze,0.7813
273,143833,thesaurus.topn3,difference coolant anti freeze,0.7813
274,143833,thesaurus.topn3.replace,difference coolant anti freeze,0.7813
275,143833,conceptnet.topn3,difference coolant anti freeze distinction,0.7706
276,143833,wordnet.topn3,difference coolant anti freeze divergence conflict,0.7344
277,143833,conceptnet.topn3.replace,distinction coolant anti freeze,0.734
278,143833,wordnet.topn3.replace,divergence conflict coolant anti freeze,0.7273
279,143833,sensedisambiguation.replace,What is the remainder between coolant and anti freeze,0.6874
280,1459749,-1,Why don't I have an asthma attack during sex?,0.3869
281,1459749,stem.porter2,whi don t i have an asthma attack dure sex,0.4625
282,1477322,-1,Why do people say Germans are racists?,0.193
283,1477322,anchor.topn3,people say germans racists axay 笑說 sadrnezhaad,0.51
284,1477322,termluster.topn5.3.bm25,people say germans racists,0.51
285,1477322,termluster.topn5.3.qld,people say germans racists,0.51
286,1477322,thesaurus.topn3,people say germans racists,0.51
287,1477322,thesaurus.topn3.replace,people say germans racists,0.51
288,1477322,stem.porter2,whi do peopl say german are racist,0.3484
289,1477322,anchor.topn3.replace,people axay 笑說 sadrnezhaad germans racists,0.2825
290,1477322,sensedisambiguation,Why do people say suppose Germans german are racists racist,0.2683
291,1502604,-1,how do crooks  make  fake   passports  ?,0.4065
292,1502604,termluster.topn5.3.bm25,crooks make fake passports,0.6116
293,1502604,termluster.topn5.3.qld,crooks make fake passports,0.6116
294,1502604,thesaurus.topn3,crooks make fake passports,0.6116
295,1502604,thesaurus.topn3.replace,crooks make fake passports,0.6116
296,1509982,-1,How is th Chemistry is a basic of Science?,0.8358
297,1509982,termluster.topn5.3.bm25,th chemistry basic science,0.8574
298,1509982,termluster.topn5.3.qld,th chemistry basic science,0.8574
299,1509982,thesaurus.topn3,th chemistry basic science,0.8574
300,1509982,thesaurus.topn3.replace,th chemistry basic science,0.8574
301,1582877,-1,why do we go to school if in the real world we dont use most of it?,0.0882
302,1582877,termluster.topn5.3.bm25,go school real world dont use,0.1796
303,1582877,termluster.topn5.3.qld,go school real world dont use,0.1796
304,1582877,thesaurus.topn3,go school real world dont use,0.1796
305,1582877,thesaurus.topn3.replace,go school real world dont use,0.1796
306,1582877,stem.porter2,whi do we go to school if in the real world we dont use most of it,0.0921
307,159716,-1,"How do I find an Inmate at Southwest Detention Center 30755 Auld Rd., Murrieta, CA 92563?",0.3735
308,159716,termluster.topn5.3.bm25,find inmate southwest detention center auld rd murrieta ca,0.5809
309,159716,termluster.topn5.3.qld,find inmate southwest detention center auld rd murrieta ca,0.5809
310,159716,thesaurus.topn3,find inmate southwest detention center auld rd murrieta ca,0.5809
311,159716,thesaurus.topn3.replace,find inmate southwest detention center auld rd murrieta ca,0.5809
312,159716,relevancefeedback.topn10.bm25,how do i find an inmate at southwest detention center auld rd murrieta ca anyon her art court counti you detent,0.3833
313,1607728,-1,what causes gray facial hair in men?,0.5956
314,1607728,stem.porter,what caus grai facial hair in men,0.6125
315,1607728,stem.porter2,what caus gray facial hair in men,0.6125
316,1607728,relevancefeedback.topn10.bm25,what causes gray facial hair in men grai american i men caus our,0.6084
317,1607728,termluster.topn5.3.bm25,causes gray facial hair men,0.6025
318,1607728,termluster.topn5.3.qld,causes gray facial hair men,0.6025
319,1607728,thesaurus.topn3,causes gray facial hair men,0.6025
320,1607728,thesaurus.topn3.replace,causes gray facial hair men,0.6025
321,1623623,-1,"How do you improve fuel efficiency of a 2004, Ford Ikon?",0.3144
