957,3040435,termluster.topn5.3.qld,usa snow hurricanes flood earthquakes politicians brazil politicians,0.3976
958,3040435,thesaurus.topn3,usa snow hurricanes flood earthquakes politicians brazil politicians,0.3976
959,3040435,thesaurus.topn3.replace,usa snow hurricanes flood earthquakes politicians brazil politicians,0.3976
960,3040435,bt_bing_french,The U S has snow hurricanes floods earthquakes and politicians Brazil has only politicians why,0.3636
961,3040435,bt_bing_russian,The U S has snow hurricanes floods earthquakes and politicians Brazil has only politicians why,0.3636
962,3040435,bt_nllb_german,The U S has snow hurricanes floods earthquakes and politicians Brazil has only politicians why,0.3636
963,3040435,bt_bing_german,In the U S there is snow hurricanes floods earthquakes and politicians in Brazil there are only politicians why,0.3257
964,3074429,-1,How can we understand Islam and Muslims better?,0.431
965,3074429,conceptluster.topn5.3.bm25,understand islam muslims better,0.5638
966,3074429,conceptluster.topn5.3.qld,understand islam muslims better,0.5638
967,3074429,termluster.topn5.3.bm25,understand islam muslims better,0.5638
968,3074429,termluster.topn5.3.qld,understand islam muslims better,0.5638
969,3074429,thesaurus.topn3,understand islam muslims better,0.5638
970,3074429,thesaurus.topn3.replace,understand islam muslims better,0.5638
971,3074429,sensedisambiguation,How can we understand Islam and Muslims muslim better good,0.5094
972,3078448,-1,How do you prevent chicken from drying out when you cook it?,0.1918
973,3078448,conceptluster.topn5.3.bm25,prevent chicken drying cook food drying chicken cooking desiccation,0.4501
974,3078448,conceptluster.topn5.3.qld,prevent chicken drying cook food drying chicken cooking desiccation,0.4501
975,3078448,tagmee.topn3,prevent chicken drying cook Chicken Food drying Desiccation Cooking,0.4501
976,3078448,termluster.topn5.3.bm25,prevent chicken drying cook,0.4475
977,3078448,termluster.topn5.3.qld,prevent chicken drying cook,0.4475
978,3078448,thesaurus.topn3,prevent chicken drying cook,0.4475
979,3078448,thesaurus.topn3.replace,prevent chicken drying cook,0.4475
980,3078448,wiki.topn3,prevent chicken drying cook junglefowls poultry pig chicken food drying desiccation dunaliella salina heterotroph desiccation recipe cooking baking cooking,0.369
981,3078448,bt_bing_persian,How to prevent chicken from drying while cooking,0.299
982,3078448,tagmee.topn3.replace,Chicken Food drying Desiccation Cooking,0.2703
983,3078448,wordnet.topn3,prevent chicken drying cook foreclose forestall crybaby wimp dry out make manipulate Captain Cook,0.2596
984,3078448,bt_nllb_chinese_yue,How do you prevent chicken drying when you cook,0.2376
985,3078448,bt_nllb_arabic,How do you avoid drying chicken when you re cooking it,0.2239
986,3078448,stem.porter2,how do you prevent chicken from dri out when you cook it,0.2174
987,3078448,bt_bing_arabic,How do you prevent chicken from drying out when cooked,0.1999
988,3078448,bt_bing_russian,How do you prevent chicken from drying out when cooking it,0.1999
989,3078448,bt_nllb_russian,How can you prevent chicken from drying up when it s cooked,0.1994
990,3078448,anchor.topn3,prevent chicken drying cook alcohol drug abus um santandereana masala hồ naktamna sornjai swalv,0.1977
991,312215,-1,how good is apple pie when it is cold?,0.549
992,312215,relevancefeedback.topn10.bm25,how good is apple pie when it is cold cold appl,0.5563
993,312215,termluster.topn5.3.bm25,good apple pie cold,0.5517
994,312215,termluster.topn5.3.qld,good apple pie cold,0.5517
995,312215,thesaurus.topn3,good apple pie cold,0.5517
996,312215,thesaurus.topn3.replace,good apple pie cold,0.5517
997,3155314,-1,"we have pork chops, veal chops, lamb chops, why is there not any beef chops ?",0.2726
998,3155314,bt_bing_malay,We have pork chopsticks beef chops lamb chops why are there no beef chopsticks,0.4798
999,3155314,glove.topn3,pork chops veal chops lamb chops beef chops beef meat loin lamb chops loin mutton veal loin meat pork loin,0.4341
1000,3155314,anchor.topn3,pork chops veal chops lamb chops beef chops rafute okinawan siu sreey parmigiana eggpl sronoss lambo gerganiya play along kurog corned beef kipper,0.3722
1001,3155314,bt_nllb_german,We have pork veal lamb why is there no beef,0.2824
1002,3155314,bt_nllb_swahili,We have pork veal lamb why not beef,0.2824
1003,3155314,bt_bing_korean,I have pork chops veal chops and lamb chops so why don t I have beef chops,0.2775
1004,3155314,stem.lovins,we hav pork chop veal chop lamb chop why is ther not any beef chop,0.2755
1005,3155314,stem.paicehusk,we hav pork chop veal chop lamb chop why is ther not any beef chop,0.2755
1006,3206998,-1,how does disneyland make it snow?,0.323
1007,3206998,conceptluster.topn5.3.bm25,disneyland make snow disneyland snow,0.5388
1008,3206998,conceptluster.topn5.3.qld,disneyland make snow disneyland snow,0.5388
1009,3206998,tagmee.topn3,disneyland make snow Disneyland Snow,0.5388
1010,3206998,termluster.topn5.3.bm25,disneyland make snow,0.5158
1011,3206998,termluster.topn5.3.qld,disneyland make snow,0.5158
1012,3206998,thesaurus.topn3,disneyland make snow,0.5158
1013,3206998,thesaurus.topn3.replace,disneyland make snow,0.5158
1014,3206998,tagmee.topn3.replace,Disneyland Snow,0.4647
1015,3206998,stem.krovetz,how do disneyland make it snow,0.4228
1016,3206998,bt_bing_swahili,How did Disneyland make it snow,0.4006
1017,3206998,wiki.topn3,disneyland make snow disneyland resort visitor attractions orange county california amusement parks california disneyland hail ice winter snow,0.3385
1018,3239329,-1,Why do we wee a lot in the cold weather especially at night?,0.2408
1019,3239329,termluster.topn5.3.bm25,wee lot cold weather especially night,0.3845
1020,3239329,termluster.topn5.3.qld,wee lot cold weather especially night,0.3845
1021,3239329,thesaurus.topn3,wee lot cold weather especially night,0.3845
1022,3239329,thesaurus.topn3.replace,wee lot cold weather especially night,0.3845
1023,3239329,stem.porter2,whi do we wee a lot in the cold weather especi at night,0.2659
1024,3269759,-1,what is artificial intelligence?,0.3545
1025,3269759,word2vec.topn3,artificial intelligence artifical synthetic intellegence intelligence,0.6508
1026,3269759,wordnet.topn3,artificial intelligence contrived unreal intelligence activity word,0.562
1027,3269759,anchor.topn3.replace,percettiva intelligenza condenan intelligence,0.4976
1028,3269759,conceptnet.topn3,artificial intelligence learning United States intelligence agency,0.3815
1029,3269759,anchor.topn3,artificial intelligence percettiva intelligenza condenan,0.3575
1030,3269759,conceptluster.topn5.3.bm25,artificial intelligence artificial intelligence,0.3575
1031,3269759,conceptluster.topn5.3.qld,artificial intelligence artificial intelligence,0.3575
1032,3269759,tagmee.topn3,artificial intelligence Artificial intelligence,0.3575
1033,3269759,tagmee.topn3.replace,Artificial intelligence,0.3575
1034,3269759,termluster.topn5.3.bm25,artificial intelligence,0.3575
1035,3269759,termluster.topn5.3.qld,artificial intelligence,0.3575
1036,3269759,thesaurus.topn3,artificial intelligence,0.3575
1037,3269759,thesaurus.topn3.replace,artificial intelligence,0.3575
1038,3278654,-1,Why do Kamikaze pilots wear helmets?,0.5068
1039,3278654,word2vec.topn3,kamikaze pilots wear helmets aviators wore visors,0.5647
1040,3278654,bt_nllb_malay,Why is a Kamikaze pilot wearing a helmet,0.5262
1041,3278654,bt_nllb_russian,Why are the Kamikaze pilots wearing helmets,0.5262
1042,3278654,termluster.topn5.3.bm25,kamikaze pilots wear helmets,0.523
1043,3278654,termluster.topn5.3.qld,kamikaze pilots wear helmets,0.523
1044,3278654,thesaurus.topn3,kamikaze pilots wear helmets,0.523
1045,3278654,thesaurus.topn3.replace,kamikaze pilots wear helmets,0.523
1046,3278654,anchor.topn3,kamikaze pilots wear helmets fvk malacoda cockersdal garments prohibit chochma,0.5182
1047,3278654,sensedisambiguation,Why do Kamikaze pilots pilot wear helmets helmet,0.514
1048,3278654,stem.porter2,whi do kamikaz pilot wear helmet,0.507
1049,3280768,-1,why is islam so hated in america?,0.2491
1050,3280768,termluster.topn5.3.bm25,islam hated america,0.3868
1051,3280768,termluster.topn5.3.qld,islam hated america,0.3868
1052,3280768,thesaurus.topn3,islam hated america,0.3868
1053,3280768,thesaurus.topn3.replace,islam hated america,0.3868
1054,3280768,anchor.topn3,islam hated america khazbulat azraqi fakhriddinov schurlau firetip mimic whit,0.3707
1055,3280768,conceptluster.topn5.3.bm25,islam hated america islam,0.3313
1056,3280768,conceptluster.topn5.3.qld,islam hated america islam,0.3313
1057,3280768,tagmee.topn3,islam hated america Islam,0.3313
1058,3280768,stem.porter2,whi is islam so hate in america,0.3076
1059,3295055,-1,"What causes skin discoloration, specifically, whitening of the skin between fingers?",0.2945
1060,3295055,termluster.topn5.3.bm25,causes skin discoloration specifically whitening skin fingers,0.3713
1061,3295055,termluster.topn5.3.qld,causes skin discoloration specifically whitening skin fingers,0.3713
1062,3295055,thesaurus.topn3,causes skin discoloration specifically whitening skin fingers,0.3713
1063,3295055,thesaurus.topn3.replace,causes skin discoloration specifically whitening skin fingers,0.3713
1064,3295055,anchor.topn3,causes skin discoloration specifically whitening skin fingers sofamo commandeering ablepharon sofamo commandeering ablepharon,0.3178
1065,3295055,stem.porter,what caus skin discolor specif whiten of the skin between finger,0.3005
1066,3295055,stem.porter2,what caus skin discolor specif whiten of the skin between finger,0.3005
1067,3301173,-1,how to design road crust for national highways?,0.4962
1068,3301173,conceptluster.topn5.3.bm25,design road crust national highways continental crust road national highway india,0.6139
1069,3301173,conceptluster.topn5.3.qld,design road crust national highways continental crust road national highway india,0.6139
1070,3301173,tagmee.topn3,design road crust national highways Road Continental crust National Highway India,0.6139
1071,3301173,termluster.topn5.3.bm25,design road crust national highways,0.5583
1072,3301173,termluster.topn5.3.qld,design road crust national highways,0.5583
1073,3301173,thesaurus.topn3,design road crust national highways,0.5583
1074,3301173,thesaurus.topn3.replace,design road crust national highways,0.5583
1075,3313308,-1,how can I enjoy my time alone?,0.0581
1076,3313308,conceptluster.topn5.3.bm25,enjoy time alone time alone,0.4628
1077,3313308,conceptluster.topn5.3.qld,enjoy time alone time alone,0.4628
1078,3313308,tagmee.topn3,enjoy time alone By Time Alone,0.4628
1079,3313308,termluster.topn5.3.bm25,enjoy time alone,0.4582
1080,3313308,termluster.topn5.3.qld,enjoy time alone,0.4582
1081,3313308,thesaurus.topn3,enjoy time alone,0.4582
1082,3313308,thesaurus.topn3.replace,enjoy time alone,0.4582
1083,3313308,wiki.topn3,enjoy time alone oblivion orphanagalbum driven orphanagalbum bart smits time alone,0.4
1084,3313308,word2vec.topn3,enjoy time alone moment time period alone alone,0.3447
1085,3313308,tagmee.topn3.replace,By Time Alone,0.3287
1086,3313308,word2vec.topn3.replace,enjoy moment time period alone alone,0.3052
1087,3313308,anchor.topn3,enjoy time alone first and oxime longshot byo yomi дрене netherwar,0.1893
1088,3313308,glove.topn3,enjoy time alone when actually else,0.1847
1089,3363149,-1,Why do Arabs and Mexicans look alike?,0.5147
1090,3363149,termluster.topn5.3.bm25,arabs mexicans look alike,0.6271
1091,3363149,termluster.topn5.3.qld,arabs mexicans look alike,0.6271
1092,3363149,thesaurus.topn3,arabs mexicans look alike,0.6271
1093,3363149,thesaurus.topn3.replace,arabs mexicans look alike,0.6271
1094,3363149,anchor.topn3,arabs mexicans look alike backward,0.5673
1095,3363149,stem.porter2,whi do arab and mexican look alik,0.5472
1096,3369088,-1,how can we stop the spread of islam?,0.3561
1097,3369088,termluster.topn5.3.bm25,stop spread islam,0.4276
1098,3369088,termluster.topn5.3.qld,stop spread islam,0.4276
1099,3369088,thesaurus.topn3,stop spread islam,0.4276
1100,3369088,thesaurus.topn3.replace,stop spread islam,0.4276
1101,3369088,bt_bing_russian,How to stop the spread of Islam,0.4152
1102,3369088,bt_bing_tamil,How to stop the spread of Islam,0.4152
1103,3369088,conceptluster.topn5.3.bm25,stop spread islam spread islam islam,0.4058
1104,3369088,conceptluster.topn5.3.qld,stop spread islam spread islam islam,0.4058
1105,3369088,tagmee.topn3,stop spread islam Spread of Islam Islam,0.4058
1106,3369088,wordnet.topn3,stop spread islam give up contain turn back spread out outspread feast Muslimism,0.373
1107,3369088,tagmee.topn3.replace,Spread of Islam Islam,0.3684
1108,3382736,-1,what is minimalist cubisium?,0.5704
1109,3382736,bt_nllb_german,What is a minimalist cubism,0.6657
1110,3382736,bt_nllb_russian,What is minimalist cubism,0.6657
1111,3382736,bt_nllb_swahili,What is a minimalist cubism,0.6657
1112,3385681,-1,"if red bull is soo bad for people ,then why is it soo popular?",0.1206
1113,3385681,bt_nllb_chinese_yue,If red bulls are bad for people why is it so popular,0.2663
1114,3385681,bt_nllb_korean,If red bulls are bad for people why are they so popular,0.2663
1115,3385681,tagmee.topn3,red bull soo bad people soo popular Red Bull People magazine Why T song Pop music,0.245
1116,3385681,conceptluster.topn5.3.bm25,red bull soo bad people soo popular pop music t song people magazine red bull,0.2325
1117,3385681,conceptluster.topn5.3.qld,red bull soo bad people soo popular pop music t song people magazine red bull,0.2325
1118,3385681,bt_bing_arabic,If Red Bull is so bad for people why is it so popular,0.2017
1119,3385681,bt_bing_chinese_simplified,If Red Bull is so bad for people then why is it so popular,0.2017
1120,3385681,bt_bing_french,If Red Bull is so bad for people then why is it so popular,0.2017
1121,3385681,bt_bing_german,If Red Bull is so bad for people why is it so popular,0.2017
1122,3385681,bt_bing_korean,If Red Bull is so bad for people why is it so popular,0.2017
1123,3385681,bt_bing_malay,If Red Bull is so bad for people then why is it so popular,0.2017
1124,3385681,bt_bing_persian,If Red Bull is so bad for people then why is it so popular,0.2017
1125,3385681,bt_bing_russian,If Red Bull is so bad for people then why is it so popular,0.2017
1126,3385681,bt_bing_swahili,If Red Bull is so bad for people then why is it so popular,0.2017
1127,3385681,bt_bing_tamil,If Red Bull is so bad for people why is it so popular,0.2017
1128,3385681,bt_nllb_french,If Red Bull is so bad for people why is it so popular,0.2017
1129,3385681,bt_nllb_malay,If Red Bull is so bad for people why is it so popular,0.2017
1130,3385681,bt_nllb_persian,If Red Bull is so bad for people why is it so popular,0.2017
1131,3385681,bt_nllb_russian,If Red Bull is so bad for people why is it so popular,0.2017
1132,3385681,bt_nllb_swahili,If Red Bull is so bad for people then why is it so popular,0.2017
1133,3385681,bt_nllb_tamil,If Red Bull is so bad for humans why is it so popular,0.1908
1134,3385681,bt_nllb_arabic,If Red Bull is so bad for people why is he so popular,0.1815
1135,3385681,bt_nllb_german,If Red Bull is so bad for people why is he so popular,0.1815
1136,3385681,wordnet.topn3,red bull soo bad people soo popular cherry red faced reddened dogshit Irish bull bull through forged unfit tough hoi polloi multitude democratic pop,0.169
1137,3385681,termluster.topn5.3.bm25,red bull soo bad people soo popular,0.1255
1138,3385681,termluster.topn5.3.qld,red bull soo bad people soo popular,0.1255
1139,3385681,thesaurus.topn3,red bull soo bad people soo popular,0.1255
1140,3385681,thesaurus.topn3.replace,red bull soo bad people soo popular,0.1255
1141,3385681,stem.porter2,if red bull is soo bad for peopl then whi is it soo popular,0.1254
1142,3385681,conceptnet.topn3,red bull soo bad people soo popular apple color cow sow dialect Stealing trouble Killing crowd stupid talk to each other nonclassical favourite,0.1238
1143,3389038,-1,why the media in US and Europe is always attacking the Arabs and Islam without finding the truth about them?,0.2886
1144,3389038,termluster.topn5.3.bm25,media us europe always attacking arabs islam without finding truth,0.3727
1145,3389038,termluster.topn5.3.qld,media us europe always attacking arabs islam without finding truth,0.3727
1146,3389038,thesaurus.topn3,media us europe always attacking arabs islam without finding truth,0.3727
1147,3389038,thesaurus.topn3.replace,media us europe always attacking arabs islam without finding truth,0.3727
1148,3389038,stem.porter2,whi the media in us and europ is alway attack the arab and islam without find the truth about them,0.3186
1149,3396066,-1,Why do airplanes fly so high?,0.3748
1150,3396066,termluster.topn5.3.bm25,airplanes fly high,0.4809
1151,3396066,termluster.topn5.3.qld,airplanes fly high,0.4809
1152,3396066,thesaurus.topn3,airplanes fly high,0.4809
1153,3396066,thesaurus.topn3.replace,airplanes fly high,0.4809
1154,34041,-1,what are the symptoms of strep throat?,0.7152
1155,3411123,-1,Why does'nt America regard foriegn credentials?,0.2719
1156,3411123,stem.krovetz,why do nt america regard foriegn credentials,0.297
1157,3411123,termluster.topn5.3.bm25,does nt america regard foriegn credentials,0.2942
1158,3411123,termluster.topn5.3.qld,does nt america regard foriegn credentials,0.2942
1159,3411123,thesaurus.topn3,does nt america regard foriegn credentials,0.2942
1160,3411123,thesaurus.topn3.replace,does nt america regard foriegn credentials,0.2942
1161,3496147,-1,Why was I punished for being christlike?,0.1554
1162,3496147,sensedisambiguation,Why was I punished punish for being christlike,0.2583
1163,3496147,relevancefeedback.topn10.bm25,why was i punished for being christlike punish allow he you move,0.1993
1164,3496147,anchor.topn3,punished christlike,0.1714
1165,3496147,anchor.topn3.replace,punished christlike,0.1714
1166,3496147,conceptluster.topn5.3.bm25,punished christlike,0.1714
1167,3496147,conceptluster.topn5.3.qld,punished christlike,0.1714
1168,3496147,tagmee.topn3,punished christlike,0.1714
1169,3496147,termluster.topn5.3.bm25,punished christlike,0.1714
1170,3496147,termluster.topn5.3.qld,punished christlike,0.1714
1171,3496147,thesaurus.topn3,punished christlike,0.1714
1172,3496147,thesaurus.topn3.replace,punished christlike,0.1714
1173,3496147,wiki.topn3,punished christlike,0.1714
1174,3499881,-1,Why is Gordon Ramsey so popular?,0.2488
1175,3499881,tagmee.topn3,gordon ramsey popular Gordon Ramsey,0.4585
1176,3499881,conceptluster.topn5.3.bm25,gordon ramsey popular,0.4573
1177,3499881,conceptluster.topn5.3.qld,gordon ramsey popular,0.4573
1178,3499881,termluster.topn5.3.bm25,gordon ramsey popular,0.4573
1179,3499881,termluster.topn5.3.qld,gordon ramsey popular,0.4573
1180,3499881,thesaurus.topn3,gordon ramsey popular,0.4573
1181,3499881,thesaurus.topn3.replace,gordon ramsey popular,0.4573
1182,3499881,tagmee.topn3.replace,Gordon Ramsey,0.436
1183,3499881,wiki.topn3,gordon ramsey popular bob weiskopf paul alter bill persky gordon ramsey,0.4318
1184,3499881,wordnet.topn3.replace,gordon ramsey pop democratic,0.4224
1185,3499881,stem.porter2,whi is gordon ramsey so popular,0.3274
1186,3499881,stem.paicehusk,why is gordon ramsey so popul,0.3131
1187,3499881,wordnet.topn3,gordon ramsey popular democratic pop,0.2636
1188,3507491,-1,Why is religious freedom more important today?,0.4721
1189,3507491,termluster.topn5.3.bm25,religious freedom important today,0.587
1190,3507491,termluster.topn5.3.qld,religious freedom important today,0.587
1191,3507491,thesaurus.topn3,religious freedom important today,0.587
1192,3507491,thesaurus.topn3.replace,religious freedom important today,0.587
1193,3507491,stem.porter2,whi is religi freedom more import today,0.55
1194,354733,-1,What are the names of some famous photographers and why do their work stand up?,0.1527
1195,354733,termluster.topn5.3.bm25,names famous photographers work stand,0.311
1196,354733,termluster.topn5.3.qld,names famous photographers work stand,0.311
1197,354733,thesaurus.topn3,names famous photographers work stand,0.311
1198,354733,thesaurus.topn3.replace,names famous photographers work stand,0.311
1199,354733,conceptluster.topn5.3.bm25,names famous photographers work stand photography,0.2251
1200,354733,conceptluster.topn5.3.qld,names famous photographers work stand photography,0.2251
1201,354733,tagmee.topn3,names famous photographers work stand Photography,0.2251
1202,354733,bt_nllb_korean,What are the names of famous photographers and why is their work remarkable,0.192
1203,354733,relevancefeedback.topn10.bm25,what are the names of some famous photographers and why do their work stand up she adam photograph ask comfort ani even fly,0.1841
1204,354733,sensedisambiguation,What are the names name of some famous celebrated photographers photographer and why do their work workplace stand up,0.1749
1205,354733,bt_nllb_tamil,What are the names of famous photographers and why is their work so high,0.1741
1206,354733,glove.topn3,names famous photographers work stand well known famed cameramen paparazzi,0.1704
1207,354733,stem.porter2,what are the name of some famous photograph and whi do their work stand up,0.1682
1208,354733,bt_nllb_french,What are the names of some famous photographers and why is their work so important,0.1587
1209,354733,bt_nllb_russian,What are the names of some famous photographers and why are their works so prominent,0.1551
1210,354733,bt_nllb_arabic,What are the names of some famous photographers and why is their work so powerful,0.1549
1211,354733,bt_nllb_german,What are the names of some famous photographers and why are their works noted,0.1547
1212,3552010,-1,Why do parent put kids on restriction?,0.2344
1213,3552010,termluster.topn5.3.bm25,parent put kids restriction,0.474
1214,3552010,termluster.topn5.3.qld,parent put kids restriction,0.474
1215,3552010,thesaurus.topn3,parent put kids restriction,0.474
1216,3552010,thesaurus.topn3.replace,parent put kids restriction,0.474
1217,3552010,anchor.topn3.replace,non parent kadeg kadege posut ružama srbima kids restriction,0.4254
1218,3552010,anchor.topn3,parent put kids restriction non parent kadeg kadege posut ružama srbima,0.4087
1219,3554263,-1,"why some people behave so rude without reason,is it due to their own problem?",0.1529
1220,3554263,termluster.topn5.3.bm25,people behave rude without reason due problem,0.5831
1221,3554263,termluster.topn5.3.qld,people behave rude without reason due problem,0.5831
1222,3554263,thesaurus.topn3,people behave rude without reason due problem,0.5831
1223,3554263,thesaurus.topn3.replace,people behave rude without reason due problem,0.5831
1224,3554263,conceptluster.topn5.3.bm25,people behave rude without reason due problem people magazine reason hoobastank song rude song,0.3329
1225,3554263,conceptluster.topn5.3.qld,people behave rude without reason due problem people magazine reason hoobastank song rude song,0.3329
1226,3554263,tagmee.topn3,people behave rude without reason due problem People magazine Rude song The Reason Hoobastank song,0.3329
1227,3554263,stem.porter2,whi some peopl behav so rude without reason is it due to their own problem,0.2073
1228,3559048,-1,How do you sell a junk car without a title?,0.6106
1229,3559048,bt_bing_persian,How to sell a junk car without a title,0.6187
1230,3559048,stem.trunc4,how do you sell a junk car with a titl,0.6183
1231,3559048,stem.trunc5,how do you sell a junk car witho a title,0.6183
1232,3559048,conceptluster.topn5.3.bm25,sell junk car without title,0.6149
1233,3559048,conceptluster.topn5.3.qld,sell junk car without title,0.6149
1234,3559048,tagmee.topn3,sell junk car without title,0.6149
1235,3559048,termluster.topn5.3.bm25,sell junk car without title,0.6149
1236,3559048,termluster.topn5.3.qld,sell junk car without title,0.6149
1237,3559048,thesaurus.topn3,sell junk car without title,0.6149
1238,3559048,thesaurus.topn3.replace,sell junk car without title,0.6149
1239,3559048,wiki.topn3,sell junk car without title,0.6149
1240,3577501,-1,what are some signs that puberty is beginning?,0.4717
1241,3577501,conceptluster.topn5.3.bm25,signs puberty beginning puberty death,0.6119
1242,3577501,conceptluster.topn5.3.qld,signs puberty beginning puberty death,0.6119
1243,3577501,tagmee.topn3,signs puberty beginning Death Puberty,0.6119
1244,3577501,wiki.topn3,signs puberty beginning life senescence disease death puberty ejaculation sexual dysfunction puberty,0.5421
1245,3577501,anchor.topn3,signs puberty beginning,0.5375
1246,3577501,anchor.topn3.replace,signs puberty beginning,0.5375
1247,3577501,termluster.topn5.3.bm25,signs puberty beginning,0.5375
1248,3577501,termluster.topn5.3.qld,signs puberty beginning,0.5375
1249,3577501,thesaurus.topn3,signs puberty beginning,0.5375
1250,3577501,thesaurus.topn3.replace,signs puberty beginning,0.5375
1251,3577501,bt_nllb_french,What are the signs that puberty is beginning,0.4783
1252,3639660,-1,Why do most cigarettes have the yellow filter?,0.5496
1253,3639660,termluster.topn5.3.bm25,cigarettes yellow filter,0.7561
1254,3639660,termluster.topn5.3.qld,cigarettes yellow filter,0.7561
1255,3639660,thesaurus.topn3,cigarettes yellow filter,0.7561
1256,3639660,thesaurus.topn3.replace,cigarettes yellow filter,0.7561
1257,3639660,stem.porter2,whi do most cigarett have the yellow filter,0.5776
1258,3640705,-1,what is the punishment for child molestors?,0.2341
1259,3640705,word2vec.topn3,punishment child molestors retribution children mother infant child molesters peadophiles pedofiles,0.3676
1260,3640705,bt_bing_arabic,What is the punishment for child molesters,0.288
1261,3640705,bt_bing_french,What is the punishment for child molesters,0.288
1262,3640705,bt_bing_german,What is the punishment for child molesters,0.288
1263,3640705,bt_bing_malay,What is the punishment for child molestation,0.288
1264,3640705,bt_bing_russian,What is the punishment for child molesters,0.288
