qid	order	query	bm25.recip_rank
100653	-1	how do I go about getting copies of letters of commendation prsented to me from city of san diego?	1.0
100653	bt_nllb_arabic	How do I get copies of the letters of encouragement I sent her from the city of San Diego	1.0
100653	bt_nllb_chinese_yue	How do I get letters from San Diego	1.0
100653	bt_nllb_french	How do I get copies of congratulatory letters sent by the city of San Diego	1.0
100653	bt_nllb_german	How do I get copies of the San Diego letter of credit	1.0
100653	bt_nllb_korean	How do we get compliments from the city of San Diego	1.0
100653	bt_nllb_persian	How do I get the mail from San Diego City that s been sent to me	1.0
100653	bt_nllb_malay	How do I get a copy of the letter of credit sent from the city of San Diego	0.5
100653	bt_nllb_russian	How can I get copies of the complimentary letters sent to me from the city of San Diego	0.5
100653	bt_nllb_swahili	How can I get copies of congratulatory letters from San Diego	0.5
100653	bt_nllb_tamil	How can I get copies of congratulatory letters sent to me from San Diego	0.5
1015624	-1	What's the Definition of a bloody mary?	1.0
1015624	bt_nllb_arabic	What is the definition of Bloody Mary	1.0
1015624	bt_nllb_korean	What is the definition of a bloody Mary	1.0
1015624	bt_nllb_malay	What s the definition of bloody Mary	1.0
1015624	bt_nllb_persian	What is the definition of bloody Mary	1.0
1015624	bt_nllb_russian	What s the definition of Bloody Mary	1.0
1015624	bt_nllb_swahili	What is the definition of bloody Mary	1.0
1015624	bt_nllb_tamil	What is the definition of a bloody Mary	1.0
1015624	bt_nllb_german	What s the definition of a fucking Mary	0.0278
1015624	bt_nllb_french	What s the definition of a holy Mary	0.0233
1015624	bt_nllb_chinese_yue	What is the definition of a virgin	0.0
1017690	-1	what is the history of indian music?	1.0
1017690	bt_nllb_arabic	What is the history of Indian music	1.0
1017690	bt_nllb_chinese_yue	What is the history of Indian music	1.0
1017690	bt_nllb_french	What is the history of Indian music	1.0
1017690	bt_nllb_german	What is the history of Indian music	1.0
1017690	bt_nllb_korean	What is the history of Indian music	1.0
1017690	bt_nllb_malay	What is the history of Indian music	1.0
1017690	bt_nllb_persian	What is the history of Indian music	1.0
1017690	bt_nllb_russian	What is the history of Indian music	1.0
1017690	bt_nllb_swahili	What is the history of Indian music	1.0
1017690	bt_nllb_tamil	What is the history of Indian music	1.0
1035857	-1	Why are liberals so quick to defend Saddam?	1.0
1035857	bt_nllb_arabic	Why are liberals so quick to defend Saddam	1.0
1035857	bt_nllb_chinese_yue	Why did liberals defend Saddam so quickly	1.0
1035857	bt_nllb_french	Why are the Liberals defending Saddam so fast	1.0
1035857	bt_nllb_german	Why are the liberals so quick to defend Saddam	1.0
1035857	bt_nllb_korean	Why are liberals so quick to defend Saddam	1.0
1035857	bt_nllb_malay	Why are liberals so quick to defend Saddam	1.0
1035857	bt_nllb_russian	Why are the liberals protecting Saddam so quickly	1.0
1035857	bt_nllb_swahili	Why are liberals so quick to defend Saddam	1.0
1035857	bt_nllb_tamil	Why are liberals so quick to defend Saddam	1.0
1035857	bt_nllb_persian	Why are the liberals defending my voice so quickly	0.5
103830	-1	Why do man Arabs hate the west ?	1.0
103830	bt_nllb_arabic	Why are Arabs turning to the West	1.0
103830	bt_nllb_chinese_yue	Why do Arabs hate the West	1.0
103830	bt_nllb_french	Why do the Arabs hate the West	1.0
103830	bt_nllb_german	Why do the Arabs hate the West	1.0
103830	bt_nllb_korean	Why do Arabs hate the West	1.0
103830	bt_nllb_malay	Why do Arabs hate the West	1.0
103830	bt_nllb_persian	Why do Arabs hate the West	1.0
103830	bt_nllb_russian	Why do the Arabs hate the West	1.0
103830	bt_nllb_swahili	Why do the Arabs hate the West	1.0
103830	bt_nllb_tamil	Why do the Arabs hate the West	1.0
1063812	-1	How do I grow taller?	1.0
1063812	bt_nllb_chinese_yue	How do I grow taller	1.0
1063812	bt_nllb_korean	How can you grow taller	1.0
1063812	bt_nllb_persian	How can I get taller	1.0
1063812	bt_nllb_malay	How can I be taller	0.5
1063812	bt_nllb_swahili	How can I be taller	0.5
1063812	bt_nllb_arabic	How do I get to the height	0.1111
1063812	bt_nllb_french	How can I get bigger	0.0
1063812	bt_nllb_german	How do I get bigger	0.0
1063812	bt_nllb_russian	How can I grow up	0.0
1063812	bt_nllb_tamil	How can I get high	0.0
1077370	-1	Why do only Humans have Finger prints?	1.0
1077370	bt_nllb_arabic	Why do only humans have fingerprints	1.0
1077370	bt_nllb_chinese_yue	Why are only humans fingerprinted	1.0
1077370	bt_nllb_french	Why are only humans fingerprinted	1.0
1077370	bt_nllb_malay	Why are only humans fingerprinted	1.0
1077370	bt_nllb_swahili	Why are only humans fingerprinted	1.0
1077370	bt_nllb_tamil	Why do only humans have fingerprints	1.0
1077370	bt_nllb_korean	Why is it that only humans have fingerprints	0.5
1077370	bt_nllb_russian	Why are only people having fingerprints	0.2
1077370	bt_nllb_german	Why are only people fingerprinted	0.1
1077370	bt_nllb_persian	Why do only humans have fingers	0.0169
1082595	-1	what is meant by mobile technology?	0.5
1082595	bt_nllb_arabic	What does mobile technology mean	1.0
1082595	bt_nllb_chinese_yue	What does mobile technology mean	1.0
1082595	bt_nllb_french	What does mobile technology mean	1.0
1082595	bt_nllb_german	What does mobile technology mean	1.0
1082595	bt_nllb_korean	What is mobile technology	1.0
1082595	bt_nllb_malay	What does mobile technology mean	1.0
1082595	bt_nllb_persian	What does mobile technology mean	1.0
1082595	bt_nllb_russian	What does mobile technology mean	1.0
1082595	bt_nllb_swahili	what is mobile technology	1.0
1082595	bt_nllb_tamil	What is mobile technology	1.0
1119420	-1	Well the black light is UV light.So if it is "black" how can it be "light" ?	1.0
1119420	bt_nllb_arabic	Well black light is UV light so if black is how can it be light	1.0
1119420	bt_nllb_chinese_yue	Black light is ultraviolet light so if it s black why is it light	1.0
1119420	bt_nllb_french	Black light is UV If it s black how can it be light	1.0
1119420	bt_nllb_german	The black light is UV light so if it s black how can it be light	1.0
1119420	bt_nllb_persian	So black light is UV light so if it s black how can it be light	1.0
1119420	bt_nllb_russian	Well black light is ultraviolet light so if it s black how can it be light	1.0
1119420	bt_nllb_swahili	Well black light is UV light So if it s black how can it be light	1.0
1119420	bt_nllb_korean	So black light is ultraviolet so if it s black how can it be light	0.5
1119420	bt_nllb_malay	So if it s black how can it be light	0.25
1119420	bt_nllb_tamil	So if it s black how can it be light	0.25
1152934	-1	Why don't fat people have to pay more for air travel?	1.0
1152934	bt_nllb_chinese_yue	Why don t obese people spend more on planes	1.0
1152934	bt_nllb_german	Why don t fat people pay for air travel anymore	1.0
1152934	bt_nllb_korean	Why don t obese people pay more for airplanes	1.0
1152934	bt_nllb_malay	Why don t fat people pay more for air travel	1.0
1152934	bt_nllb_persian	Why don t fat people have to pay so much for air travel	1.0
1152934	bt_nllb_russian	Why don t fat people pay more for air travel	1.0
1152934	bt_nllb_swahili	Why should older people not pay more for air travel	1.0
1152934	bt_nllb_tamil	Why do fat people not have to pay more for air travel	1.0
1152934	bt_nllb_french	Why don t the big guys pay more for the thefts	0.5
1152934	bt_nllb_arabic	Why shouldn t fat people be allowed to pay more to fly	0.125
1167882	-1	What are the different types of sins and how are they caused?	1.0
1167882	bt_nllb_korean	What kind of sin is it and how does it occur	1.0
1167882	bt_nllb_malay	What are the different types of sin and how are they caused	1.0
1167882	bt_nllb_arabic	What are the different types of sins and how do they cause them	0.5
1167882	bt_nllb_german	What are the different kinds of sins and how are they caused	0.25
1167882	bt_nllb_french	What are the different types of sins and how do they result	0.2
1167882	bt_nllb_persian	What are the different types of sins and how do they result	0.2
1167882	bt_nllb_chinese_yue	What kind of sin what causes it	0.0833
1167882	bt_nllb_tamil	What is sin and how does it occur	0.0417
1167882	bt_nllb_russian	What are the different sins and how do they occur	0.025
1167882	bt_nllb_swahili	What are the kinds of sins and how do they result	0.0118
1199639	-1	How to "LOSE"all body fat ?	1.0
1199639	bt_nllb_chinese_yue	How do you lose body fat	1.0
1199639	bt_nllb_french	How do you lose all the body fat	1.0
1199639	bt_nllb_german	How can you lose all the body fat	1.0
1199639	bt_nllb_korean	How do you lose all the fat in your body	1.0
1199639	bt_nllb_persian	How do I lose all my body fat	1.0
1199639	bt_nllb_russian	How do you lose all the body fat	1.0
1199639	bt_nllb_swahili	How can you lose all body fat	1.0
1199639	bt_nllb_malay	How do you MEDIATE all the body fat	0.5
1199639	bt_nllb_tamil	How can you lose body fat	0.5
1199639	bt_nllb_arabic	How do you check all the fat in your body	0.25
1254390	-1	how do i deap fry chicken?	0.5
1254390	bt_nllb_french	How do you fry chicken	1.0
1254390	bt_nllb_korean	How do you fry chicken	1.0
1254390	bt_nllb_malay	How can I fry chicken	1.0
1254390	bt_nllb_swahili	How do I deap fried chicken	1.0
1254390	bt_nllb_arabic	How do I feed fried chicken	0.5
1254390	bt_nllb_persian	How do I fry chicken	0.5
1254390	bt_nllb_tamil	How do I get the yellow fried chicken	0.5
1254390	bt_nllb_russian	How do I bake chicken	0.25
1254390	bt_nllb_german	How do I make the chicken	0.0333
1254390	bt_nllb_chinese_yue	How do I eat chicken	0.0
1262692	-1	How can I get rid of pimples on my back?	1.0
1262692	bt_nllb_german	How can I get rid of pimples on my back	1.0
1262692	bt_nllb_arabic	How can I get rid of bugs on my back	0.0
1262692	bt_nllb_chinese_yue	How can I get rid of my back	0.0
1262692	bt_nllb_french	How do I get rid of buttons on my back	0.0
1262692	bt_nllb_korean	How do you get rid of this thing on your back	0.0
1262692	bt_nllb_malay	How can I get rid of the acne in my back	0.0
1262692	bt_nllb_persian	How do I get rid of my back pain	0.0
1262692	bt_nllb_russian	How do you get rid of the spleen	0.0
1262692	bt_nllb_swahili	How can I remove the sores on my back	0.0
1262692	bt_nllb_tamil	How can I get rid of the worms in my back	0.0
1282199	-1	how can I hide the cuts on my wrists?	1.0
1282199	bt_nllb_german	How can I hide the cuts on my wrists	1.0
1282199	bt_nllb_russian	How can I hide the cuts on my wrists	1.0
1282199	bt_nllb_tamil	How can I hide the cuts on my wrists	1.0
1282199	bt_nllb_arabic	How do I hide my wrists	0.5
1282199	bt_nllb_french	How do I hide the cuts on my wrists	0.5
1282199	bt_nllb_malay	How can I hide the wound in my wrist	0.5
1282199	bt_nllb_chinese_yue	How can I hide the scar on my wrist	0.3333
1282199	bt_nllb_persian	How can I hide my hand cuts	0.2
1282199	bt_nllb_korean	How can we hide the torn wounds in the wrist	0.0769
1282199	bt_nllb_swahili	How can I hide my hand wounds	0.0
1287437	-1	how can i lose 30 pounds by june3?	0.5
1287437	bt_nllb_arabic	How can I lose pounds on June	0.5
1287437	bt_nllb_german	How can I lose pounds by June	0.5
1287437	bt_nllb_malay	How can I lose pounds on June	0.5
1287437	bt_nllb_persian	How can I lose pounds by June	0.5
1287437	bt_nllb_russian	How can I lose pounds by June	0.5
1287437	bt_nllb_swahili	How can I lose pounds by June	0.5
1287437	bt_nllb_tamil	How can I lose pounds by June	0.5
1287437	bt_nllb_chinese_yue	How can I lose pounds by June rd	0.3333
1287437	bt_nllb_french	How can I lose pounds before June rd	0.3333
1287437	bt_nllb_korean	How can we cut pounds by June	0.1111
1290612	-1	why do anxiety and depression seem to coexist?	1.0
1290612	bt_nllb_arabic	Why do anxiety and depression seem to go hand in hand	1.0
1290612	bt_nllb_french	Why do anxiety and depression seem to coexist	1.0
1290612	bt_nllb_korean	Why do you think anxiety and depression exist together	1.0
1290612	bt_nllb_malay	Why do anxiety and depression seem to migrate	1.0
1290612	bt_nllb_russian	Why do anxiety and depression go hand in hand	1.0
1290612	bt_nllb_swahili	why anxiety and depression seem to be linked	1.0
1290612	bt_nllb_tamil	Why do anxiety and depression go hand in hand	1.0
1290612	bt_nllb_chinese_yue	Why does anxiety and depression seem to be the same thing	0.5
1290612	bt_nllb_persian	Why do thinking and depression interact	0.0526
1290612	bt_nllb_german	Why do fear and depression seem to be linked	0.0175
1292734	-1	what color you like the most and why?	1.0
1292734	bt_nllb_arabic	What color do you like best and why	1.0
1292734	bt_nllb_chinese_yue	What color do you like best Why	1.0
1292734	bt_nllb_german	What color do you like best and why	1.0
1292734	bt_nllb_korean	What color do you like best Why	1.0
1292734	bt_nllb_malay	What color do you like and why	1.0
1292734	bt_nllb_persian	What color do you like and why	1.0
1292734	bt_nllb_russian	What color do you like best and why	1.0
1292734	bt_nllb_swahili	What color do you like best and why	1.0
1292734	bt_nllb_french	What color do you prefer and why	0.5
1292734	bt_nllb_tamil	What do you like and why	0.0244
1340574	-1	Why do some people only go to church on Easter Sunday and never go again until Christmas ?	1.0
1340574	bt_nllb_arabic	Why do some people go to church only on Sunday and not go back until Christmas	1.0
1340574	bt_nllb_chinese_yue	Why do some people go to church only on Easter and not before Christmas	1.0
1340574	bt_nllb_french	Why do some people only go to church on Easter Sunday and never go back before Christmas	1.0
1340574	bt_nllb_german	Why do some people only go to church on Easter Sunday and not until Christmas	1.0
1340574	bt_nllb_korean	Why do some people go to church on Easter Sunday and not go back until Christmas	1.0
1340574	bt_nllb_malay	Why do some people just go to church on Easter Sunday and not go again until Christmas	1.0
1340574	bt_nllb_persian	Why do some people only go to church on Easter Sunday and not until Christmas	1.0
1340574	bt_nllb_russian	Why do some people go to church only on Easter Sunday and never go back to church before Christmas	1.0
1340574	bt_nllb_swahili	Why do some people go to church only on Easter and not until Christmas	1.0
1340574	bt_nllb_tamil	Why do some people not return to church until Christmas to go to church only on Easter Sundays	1.0
1351675	-1	Why must I have an uncracked winshield in order to for my car to pass a safety inspeciton?	1.0
1351675	bt_nllb_korean	Why should I not break the wingsclad to pass the safety check	1.0
1351675	bt_nllb_swahili	Why do I need a safety shield to pass a safety check	1.0
1351675	bt_nllb_malay	Why do I need a horn shield that doesn t break so my car can pass a security check	0.1
1351675	bt_nllb_arabic	Why would I have to have a window shield if my car hasn t been tested	0.0
1351675	bt_nllb_chinese_yue	Why would I need a window that s not damaged to pass through the security check	0.0
1351675	bt_nllb_french	Why do I have to have a shield without cracks to get my car through a security check	0.0
1351675	bt_nllb_german	Why do I have to have an unbroken windshield to get my car through a security check	0.0
1351675	bt_nllb_persian	Why would I have to have a hole in the door to get my car through security	0.0
1351675	bt_nllb_russian	Why do I need a shield to keep my car safe	0.0
1351675	bt_nllb_tamil	Why should I wear a wing shield in order to go to my car security check	0.0
1364894	-1	Why do we need to tell customer service/operator about our sickness in order to make appointment w/ a doctor?	1.0
1364894	bt_nllb_arabic	Why do we need to tell customer service about our illness for a doctor appointment	1.0
1364894	bt_nllb_chinese_yue	Why would we tell a customer service operator about our condition before we could meet a doctor	1.0
1364894	bt_nllb_french	Why should we inform the customer service operator of our illness before making an appointment with a doctor	1.0
1364894	bt_nllb_german	Why do we have to tell the customer service operator about our illness to make an appointment with a doctor	1.0
1364894	bt_nllb_korean	Why should we tell a customer service businessman about the disease to make an appointment with a doctor	1.0
1364894	bt_nllb_malay	Why do we have to tell the customer service about our illness to make an appointment with a doctor	1.0
1364894	bt_nllb_persian	Why should we inform the customer service operator about our illness before we see a doctor	1.0
1364894	bt_nllb_swahili	Why do we need to tell a client care professional about our condition before we can make an appointment with a doctor	1.0
1364894	bt_nllb_tamil	Why should we inform the customer service operator about our illness to arrange an appointment with the doctor	1.0
1364894	bt_nllb_russian	Why should we report our illness to the customer service provider operator to make an appointment	0.3333
1373069	-1	Freedom of Speech - why don't people understand how to use it?	0.5
1373069	bt_nllb_chinese_yue	Freedom of speech Why can t people use it	1.0
1373069	bt_nllb_french	Freedom of speech Why do people not understand how to use it	1.0
1373069	bt_nllb_swahili	Freedom of Speech why do people not understand how to use it	1.0
1373069	bt_nllb_tamil	Freedom of speech Why do people not understand how to use it	1.0
1373069	bt_nllb_arabic	Freedom of expression Why don t people understand how to use it	0.5
1373069	bt_nllb_german	Freedom of speech why don t people understand how to use it	0.5
1373069	bt_nllb_korean	Freedom of expression Why don t people understand how to use it	0.5
1373069	bt_nllb_malay	Freedom of Speech why don t people understand how to use it	0.5
1373069	bt_nllb_russian	Freedom of speech why don t people understand how to use it	0.5
1373069	bt_nllb_persian	Freedom of expression Why don t people know how to use it	0.2
143833	-1	What is the difference between coolant and anti-freeze?	1.0
143833	bt_nllb_chinese_yue	What s the difference between coolant and anti coolant	1.0
143833	bt_nllb_french	What s the difference between the coolant and the anti freeze	1.0
143833	bt_nllb_malay	What s the difference between a coolant and antifreeze	1.0
143833	bt_nllb_arabic	What s the difference between a refrigerant and an anti freeze	0.5
143833	bt_nllb_german	What s the difference between refrigerants and anti freeze	0.5
143833	bt_nllb_russian	What s the difference between a coolant and an anti inflammatory	0.1111
143833	bt_nllb_persian	What is the difference between refrigerant and antifreeze	0.0385
143833	bt_nllb_swahili	What is the difference between cold water and freezing water	0.0152
143833	bt_nllb_korean	What s the difference between refrigerants and anti caking agents	0.0
143833	bt_nllb_tamil	What is the difference between a refrigerant and an anti cold liquid	0.0
1459749	-1	Why don't I have an asthma attack during sex?	1.0
1459749	bt_nllb_arabic	Why didn t I get an asthma attack while I was having sex	1.0
1459749	bt_nllb_chinese_yue	Why can t I have asthma during sex	1.0
1459749	bt_nllb_french	Why don t I have an asthma attack during sex	1.0
1459749	bt_nllb_german	Why don t I get an asthma attack during sex	1.0
1459749	bt_nllb_korean	Why don t you have an asthma attack during sex	1.0
1459749	bt_nllb_malay	Why didn t I have an asthma attack while I was having sex	1.0
1459749	bt_nllb_persian	Why don t I have an asthma attack during sex	1.0
1459749	bt_nllb_russian	Why don t I start having asthma during sex	1.0
1459749	bt_nllb_tamil	Why don t I have an asthma attack while having sex	1.0
1459749	bt_nllb_swahili	Why do I not have a seizure during sex	0.0159
1477322	-1	Why do people say Germans are racists?	1.0
1477322	bt_nllb_arabic	Why do people say Germans are racist	1.0
1477322	bt_nllb_german	Why do people say the Germans are racist	1.0
1477322	bt_nllb_korean	Why do Germans call themselves racists	1.0
1477322	bt_nllb_malay	Why do people say Germans are racist	1.0
1477322	bt_nllb_russian	Why do people say Germans are racist	1.0
1477322	bt_nllb_tamil	Why do people say that Germans are racist	1.0
1477322	bt_nllb_french	Why are Germans racist	0.5
1477322	bt_nllb_persian	Why do people call Germans racist	0.1667
1477322	bt_nllb_chinese_yue	Why would anyone call Germans racists	0.125
1477322	bt_nllb_swahili	Why do people call Germans colorful	0.0435
1502604	-1	how do crooks  make  fake   passports  ?	1.0
1502604	bt_nllb_chinese_yue	How do you make a fake passport	1.0
1502604	bt_nllb_french	How do crooks make fake passports	1.0
1502604	bt_nllb_malay	How do criminals make fake passports	1.0
1502604	bt_nllb_persian	How do passport thieves make it	1.0
1502604	bt_nllb_swahili	How do criminals make fake passports	1.0
1502604	bt_nllb_arabic	How do scammers make fake passports	0.5
1502604	bt_nllb_german	How do scammers get fake passports	0.5
1502604	bt_nllb_russian	How do scammers make fake passports	0.5
1502604	bt_nllb_tamil	How do fraudsters do fake passports	0.3333
1502604	bt_nllb_korean	How do fraudsters create fake passports	0.25
1509982	-1	How is th Chemistry is a basic of Science?	1.0
1509982	bt_nllb_arabic	How is chemistry fundamental to science	1.0
1509982	bt_nllb_chinese_yue	How did chemistry become the basis of science	1.0
1509982	bt_nllb_french	How is chemistry a science foundation	1.0
1509982	bt_nllb_korean	Why is chemistry the basis of science	1.0
1509982	bt_nllb_malay	How is chemistry the basis of science	1.0
1509982	bt_nllb_persian	How about chemistry is a science	1.0
1509982	bt_nllb_russian	How is chemistry the basis of science	1.0
1509982	bt_nllb_swahili	How is Chemistry the basis of Science	1.0
1509982	bt_nllb_tamil	How is the basic science of chemistry based	1.0
1509982	bt_nllb_german	How is chemistry a principle of science	0.5
1582877	-1	why do we go to school if in the real world we dont use most of it?	1.0
1582877	bt_nllb_arabic	Why go to school if in the real world we don t use most of it	0.1667
1582877	bt_nllb_korean	Why don t you go to school and use most of it in the real world	0.1667
1582877	bt_nllb_french	Why do we go to school if in the real world we don t use most of it	0.1429
1582877	bt_nllb_malay	Why do we go to school if in the real world we don t use most of it	0.1429
1582877	bt_nllb_russian	Why do we go to school if in the real world we don t use most of it	0.1429
1582877	bt_nllb_swahili	why do we go to school like in the real world we don t spend more of it	0.0833
1582877	bt_nllb_german	Why do we go to school when we don t use most of it	0.0667
1582877	bt_nllb_tamil	Why do we go to school when we don t use it in the real world	0.0667
1582877	bt_nllb_chinese_yue	If in the real world we don t spend most of our time in school why go	0.0588
1582877	bt_nllb_persian	Why go to school if we don t use it in the real world	0.0476
159716	-1	How do I find an Inmate at Southwest Detention Center 30755 Auld Rd., Murrieta, CA 92563?	1.0
159716	bt_nllb_arabic	How do I find a prisoner at the Southwest detention center at Old Street Morita CA	1.0
159716	bt_nllb_chinese_yue	How do I find a prisoner in the Southwest detention center at Auld Rd Murrieta CA	1.0
159716	bt_nllb_german	How do I find a prisoner at the Southwest Detention Center Auld Rd Murrieta CA	1.0
159716	bt_nllb_korean	How do we find the inmates at Murrieta CA in Southwest Prison Wood	1.0
159716	bt_nllb_malay	How do I find the inmate at Southwest detention center Auld Rd Murrieta CA	1.0
159716	bt_nllb_russian	How can I find a prisoner in Southwest Center Old Red Murrieta CA	1.0
159716	bt_nllb_swahili	How can I find a prisoner at the Southwest Correctional Center Auld Rd Murrieta CA	1.0
159716	bt_nllb_french	How do you find a prisoner at the Southwest detention center Auld Rd Murrieta CA	0.5
159716	bt_nllb_persian	How do I find a prisoner at the Southwest detention center Old Rodeo Morretta CA	0.5
159716	bt_nllb_tamil	How do you find a prisoner at the Southwest detention center Old Reddy Murrieta CA	0.5
1607728	-1	what causes gray facial hair in men?	1.0
1607728	bt_nllb_arabic	What causes gray hair on men s faces	1.0
1607728	bt_nllb_chinese_yue	What causes gray hair on men s faces	1.0
1607728	bt_nllb_french	What causes gray facial hair in men	1.0
1607728	bt_nllb_german	What causes gray facial hair in men	1.0
1607728	bt_nllb_korean	What causes gray hair on men s faces	1.0
1607728	bt_nllb_malay	What causes gray facial hair in men	1.0
1607728	bt_nllb_persian	What causes gray hair in men	1.0
1607728	bt_nllb_russian	What causes gray hair on men s faces	1.0
1607728	bt_nllb_swahili	What causes black facial hair in men	1.0
1607728	bt_nllb_tamil	What causes red hair on the face of men	1.0
1623623	-1	How do you improve fuel efficiency of a 2004, Ford Ikon?	1.0
1623623	bt_nllb_arabic	How do you improve fuel efficiency from the Ford Icon	1.0
1623623	bt_nllb_chinese_yue	How do you improve the fuel efficiency of the Ford Icon	1.0
1623623	bt_nllb_german	How do you improve the fuel efficiency of a Ford icon	1.0
1623623	bt_nllb_korean	How can we improve the fuel efficiency of the Ford icon	1.0
1623623	bt_nllb_malay	How do you improve fuel efficiency from a Ford Icon	1.0
1623623	bt_nllb_persian	How do you improve fuel efficiency from the Ford icon	1.0
1623623	bt_nllb_russian	How do you improve the fuel efficiency of a Ford icon	1.0
1623623	bt_nllb_swahili	How can you improve the fuel efficiency of the Ford Ikon	1.0
1623623	bt_nllb_tamil	How do you improve the fuel efficiency of a Ford icon	1.0
1623623	bt_nllb_french	How can we improve the energy efficiency of a Ford Ikon	0.25
1663853	-1	what is a wet dream?	1.0
1663853	bt_nllb_arabic	What is a wet dream	1.0
1663853	bt_nllb_chinese_yue	What is the dream	1.0
1663853	bt_nllb_french	What s a wet dream	1.0
1663853	bt_nllb_german	What s a wet dream	1.0
1663853	bt_nllb_korean	What is a wet dream	1.0
1663853	bt_nllb_malay	What is a wet dream	1.0
1663853	bt_nllb_persian	What are wet dreams	1.0
1663853	bt_nllb_russian	What is a wet dream	1.0
1663853	bt_nllb_tamil	What is a wet dream	1.0
1663853	bt_nllb_swahili	What is a rain dream	0.5
