23464	bt_nllb_tamil	Why are women so beautiful	0.0769
23464	bt_nllb_swahili	why are girls so good	0.037
2380990	-1	Why am I alive?	1.0
2380990	bt_nllb_arabic	Why am I alive	1.0
2380990	bt_nllb_chinese_yue	Why am I alive	1.0
2380990	bt_nllb_french	Why am I still alive	1.0
2380990	bt_nllb_german	Why am I alive	1.0
2380990	bt_nllb_korean	Why are you alive	1.0
2380990	bt_nllb_malay	Why am I still alive	1.0
2380990	bt_nllb_persian	Why am I alive	1.0
2380990	bt_nllb_russian	Why am I alive	1.0
2380990	bt_nllb_tamil	Why am I alive	1.0
2380990	bt_nllb_swahili	Why am I here	0.0
2382487	-1	what do i do if i have not started my period in like almost 6 months?	0.5
2382487	bt_nllb_arabic	What do I do if I haven t started my period in about six months	0.5
2382487	bt_nllb_german	What should I do if I haven t started my period in almost six months	0.2
2382487	bt_nllb_chinese_yue	What if I haven t had my period in six months	0.1667
2382487	bt_nllb_tamil	What if I haven t had my period in six months	0.1667
2382487	bt_nllb_malay	What would I do if I didn t start my period in almost six months	0.1429
2382487	bt_nllb_swahili	What if I haven t had my period in almost six months	0.1111
2382487	bt_nllb_french	What if I haven t started my period in almost six months	0.1
2382487	bt_nllb_russian	What if I haven t started my period in almost six months	0.1
2382487	bt_nllb_persian	What if I haven t started my period in about six months	0.0833
2382487	bt_nllb_korean	What if you haven t started menstruating in about six months	0.0175
2418598	-1	why do wisdom varies from person to person?	1.0
2418598	bt_nllb_arabic	Why does wisdom differ from person to person	1.0
2418598	bt_nllb_french	Why is wisdom different from person to person	1.0
2418598	bt_nllb_german	Why does wisdom differ from person to person	1.0
2418598	bt_nllb_korean	Why is wisdom different from person to person	1.0
2418598	bt_nllb_persian	Why does wisdom differ from person to person	1.0
2418598	bt_nllb_tamil	Why does wisdom differ from person to person	1.0
2418598	bt_nllb_malay	Why does wisdom vary from person to person	0.5
2418598	bt_nllb_swahili	why does wisdom vary from person to person	0.5
2418598	bt_nllb_chinese_yue	Why is it that people s intelligence is different	0.0
2418598	bt_nllb_russian	Why is wisdom different from man to man	0.0
2443586	-1	What is a Bro?	1.0
2443586	bt_nllb_german	What s a bro	1.0
2443586	bt_nllb_malay	What is it bro	1.0
2443586	bt_nllb_arabic	What is brother	0.1111
2443586	bt_nllb_chinese_yue	What is brother	0.1111
2443586	bt_nllb_swahili	What is a brother	0.1111
2443586	bt_nllb_tamil	What a brother	0.1111
2443586	bt_nllb_french	What s a brother	0.0714
2443586	bt_nllb_korean	What s a brother	0.0714
2443586	bt_nllb_persian	What s your brother	0.0196
2443586	bt_nllb_russian	What is Braw	0.0
2446614	-1	how could u get success?	0.3333
2446614	bt_nllb_german	How could you succeed	0.0208
2446614	bt_nllb_russian	How could you succeed	0.0208
2446614	bt_nllb_arabic	How can you succeed	0.0159
2446614	bt_nllb_persian	How can you succeed	0.0159
2446614	bt_nllb_swahili	How can you succeed	0.0159
2446614	bt_nllb_tamil	How can you succeed	0.0159
2446614	bt_nllb_chinese_yue	How did you succeed	0.0108
2446614	bt_nllb_korean	How did you succeed	0.0108
2446614	bt_nllb_french	How did you do that	0.0
2446614	bt_nllb_malay	How can you do that	0.0
2452795	-1	How can I heat the water within a 150 gal tank that's open to the atmosphere in Feb.?	1.0
2452795	bt_nllb_german	How do I heat the water in a gal tank that s open to the atmosphere in February	1.0
2452795	bt_nllb_korean	How can we heat gallons of water that s open to the atmosphere in February	1.0
2452795	bt_nllb_russian	How can I heat gallon water that s open to the atmosphere in February	1.0
2452795	bt_nllb_arabic	How can I heat the water inside a dollar open air tank in February	0.25
2452795	bt_nllb_french	How can I heat water in a gallon tank that s open to the atmosphere in February	0.2
2452795	bt_nllb_persian	How do I heat the blue in the gallery tank that opened to the atmosphere in February	0.2
2452795	bt_nllb_tamil	How can I heat a gallon tank of water that is open to the atmosphere in February	0.2
2452795	bt_nllb_chinese_yue	How do I heat water in a gallon tank that opened in February	0.1667
2452795	bt_nllb_malay	How do I heat water in a gallon tank that s open to the atmosphere in February	0.1667
2452795	bt_nllb_swahili	How can I boil water in a gallon tank that is open to the sky in February	0.1429
2479423	-1	Why is there brail on the keypads at drive up ATM's?	1.0
2479423	bt_nllb_french	Why is there braille on the ATM keyboards	1.0
2479423	bt_nllb_german	Why is it in Braille on the keyboards of the ATMs	1.0
2479423	bt_nllb_korean	Why is there a braille on the keyboard in the ATM	1.0
2479423	bt_nllb_malay	Why is there a braille on the keypad at the ATM	1.0
2479423	bt_nllb_russian	Why is there a braille on the ATM keyboards	1.0
2479423	bt_nllb_swahili	Why is there braille on the dashboards on the car to the ATM	1.0
2479423	bt_nllb_tamil	Why is there a brake on the clutch when driving at an ATM	0.5
2479423	bt_nllb_arabic	Why is there a brill on the keyboard in the ATM	0.2
2479423	bt_nllb_chinese_yue	Why is there a print on the keyboard of the power supply	0.0
2479423	bt_nllb_persian	Why is there a brilliant key on the bank keyboards	0.0
2484180	-1	why do people judge a dog by what he looks like?	1.0
2484180	bt_nllb_arabic	Why do people judge a dog by how it looks	1.0
2484180	bt_nllb_chinese_yue	Why would people judge dogs by their looks	1.0
2484180	bt_nllb_french	Why do people judge a dog by how it looks	1.0
2484180	bt_nllb_german	Why do people judge a dog by how he looks	1.0
2484180	bt_nllb_malay	Why do people judge dogs by their looks	1.0
2484180	bt_nllb_russian	Why do people judge a dog by how it looks	1.0
2484180	bt_nllb_persian	Why do people judge by dogs	0.5
2484180	bt_nllb_korean	Why do people judge dogs appearances	0.3333
2484180	bt_nllb_swahili	why do people judge a dog by its appearance	0.25
2484180	bt_nllb_tamil	Why do people judge a dog based on his appearance	0.2
2528767	-1	How do I determine the charge of the iron ion in FeCl3?	0.5
2528767	bt_nllb_arabic	How do I find the iron ion charge in Fickle	1.0
2528767	bt_nllb_chinese_yue	How do I determine the charge of iron ions in FeCl	0.5
2528767	bt_nllb_french	How do we determine the charge of the iron ion in FeCl	0.5
2528767	bt_nllb_german	How do we determine the charge of the ion in FeCl	0.5
2528767	bt_nllb_korean	How do we determine the charge of the iron ion of FeCl	0.5
2528767	bt_nllb_malay	How do I determine the charge of iron ions in FeCl	0.5
2528767	bt_nllb_russian	How do you determine the iron ion charge in FeCl	0.5
2528767	bt_nllb_tamil	How do I determine the charge of iron ions in FeCl	0.5
2528767	bt_nllb_persian	How do I determine the iron ion content in FeCl	0.2
2528767	bt_nllb_swahili	How do I determine the load of iron ions in FeCl	0.2
2529114	-1	since i have premature ejaculation problem, how to satisfy my girl?	1.0
2529114	bt_nllb_german	Since I m having premature ejaculation how can I satisfy my girl	1.0
2529114	bt_nllb_malay	Since I have a problem with premature ejaculation how can I please my girl	1.0
2529114	bt_nllb_russian	I have problems with premature ejaculation how do I satisfy my girlfriend	1.0
2529114	bt_nllb_french	Since I have an early ejaculation problem how can I please my daughter	0.0435
2529114	bt_nllb_swahili	Since I have a problem with premature delivery how can I please my girlfriend	0.0312
2529114	bt_nllb_persian	Since I have an early ejaculation problem how do I please my daughter	0.013
2529114	bt_nllb_arabic	Since I have a problem with early spread how do I please my girl	0.0
2529114	bt_nllb_chinese_yue	I have a problem with preterm birth how can I please my daughter	0.0
2529114	bt_nllb_korean	I have a problem with early abortion so how can I please my daughter	0.0
2529114	bt_nllb_tamil	How can I please my wife since I have a pre eclampsia problem	0.0
2539741	-1	what cause the car to have white smoke coming from the muffler and making a kicking or knocking sounds?	1.0
2539741	bt_nllb_arabic	What causes a car to have white smoke coming from the pressurizer and making a kick or a gunshot	1.0
2539741	bt_nllb_chinese_yue	Why is there white smoke in cars and sound	1.0
2539741	bt_nllb_korean	Why would a car want white smoke coming out of a maverick	1.0
2539741	bt_nllb_persian	What causes white smoke to enter the car s shutter and cause the sound of kicking or punching	1.0
2539741	bt_nllb_swahili	what causes the car to have white smoke from the cover and make knocking or knocking sounds	1.0
2539741	bt_nllb_malay	What causes a car to have white smoke coming out of the packaging and making a kick or a knocking noise	0.5
2539741	bt_nllb_tamil	What causes the white smoke of a car to come out of the fog and make a knocking or knocking noise	0.25
2539741	bt_nllb_russian	What makes the machine get white smoke from the silencer and knock or knock	0.2
2539741	bt_nllb_french	What makes the car have white smoke coming from the plug and making a kick or a knock	0.1
2539741	bt_nllb_german	What causes white smoke to come out of the jewellery and make a knock or a knock	0.0435
2551845	-1	Why is GW dogged for not getting OBL yet killing Zarkawi is a non-event?	1.0
2551845	bt_nllb_chinese_yue	Why is it that GW was accused of not getting OBL and killing Zarkawi was not an accident	1.0
2551845	bt_nllb_french	Why is GW being sued for not getting the OBL when killing Zarkawi is a no go	1.0
2551845	bt_nllb_german	Why is GW being prosecuted for non OBL success while killing Zarkawi is a non event	1.0
2551845	bt_nllb_korean	Why is it that GW was not charged with OBL and then killed Zarkawi	1.0
2551845	bt_nllb_malay	Why is GW sued for not getting OBL but killing Zarkawi is not an event	1.0
2551845	bt_nllb_persian	Why is GW not using her Bill and still not having a child killed a coincidence	1.0
2551845	bt_nllb_swahili	Why does GW keep bothering about not getting OBL when killing Zarkawi is not an accident	1.0
2551845	bt_nllb_russian	Why is GW being prosecuted for not getting an O B L And Zarqawi s murder is not an event	0.0286
2551845	bt_nllb_arabic	Why is G H being sentenced to not getting Opel when Zarqawi s murder is not an event	0.0103
2551845	bt_nllb_tamil	Why is it accused that G V did not get the OPL but that Sarghai s killing was not an accident	0.0
2582920	-1	What is the difference in a dried plum and a dried prune?	1.0
2582920	bt_nllb_french	What is the difference between a dry prune and a dry prune	1.0
2582920	bt_nllb_german	What s the difference between a dried plum and a dried plum	1.0
2582920	bt_nllb_malay	What s the difference between a dried plum and a dried prune	1.0
2582920	bt_nllb_persian	What s the difference between a dry plum and a dry plum	1.0
2582920	bt_nllb_swahili	What is the difference between a dried plum and a dried plum	1.0
2582920	bt_nllb_arabic	What s the difference between a dry and dry and dry and dry and dry and dry and dry and dry and dry and dry and dry and dry and dry and dry and dry and dry and dry and dry and dry and dry and dry and dry and dry and dry and dry and dry and dry and dry and dry and dry and dry and dry and dry and dry and dry and dry and dry and dry and dry and dry and dry and dry and dry and dry and dry and dry and dry and dry and dry and dry and and dry and and dry and and dry and and and and and and and and and and and and and and and and and and and and and and and and and and and and and and and and and and and and and and and and and between the like that is all about	0.0
2582920	bt_nllb_chinese_yue	What s the difference between dry and dry	0.0
2582920	bt_nllb_korean	What s the difference between dry grass and dry grass	0.0
2582920	bt_nllb_russian	What s the difference between dry cream and dry cream	0.0
2582920	bt_nllb_tamil	What is the difference between a dry bloom and a dry bloom	0.0
2592121	-1	how to rollover 401k into real estate?	0.25
2592121	bt_nllb_chinese_yue	How do you turn your k into real estate	1.0
2592121	bt_nllb_malay	How do you turn your k into real estate	1.0
2592121	bt_nllb_russian	How do you transfer your k to real estate	1.0
2592121	bt_nllb_arabic	How do you get your k back to real estate	0.5
2592121	bt_nllb_german	How can I turn k into real estate	0.5
2592121	bt_nllb_korean	How do you convert into real estate	0.3333
2592121	bt_nllb_persian	How do I turn k into real estate	0.3333
2592121	bt_nllb_french	How do you get k into real estate	0.25
2592121	bt_nllb_swahili	How to turn k into real estate	0.25
2592121	bt_nllb_tamil	How to turn k into real estate	0.25
2619912	-1	How were you saved from sin-and born again as Jesus says "Except you repent, and be born again..." How didYou?	1.0
2619912	bt_nllb_arabic	How could you be saved from sin and born again as Jesus says unless you were born again and how could you	1.0
2619912	bt_nllb_chinese_yue	How have you been delivered from sin and born again	1.0
2619912	bt_nllb_french	How did you get saved from sin and be born again as Jesus said unless you repent and be born again How did you do it	1.0
2619912	bt_nllb_german	How did you get saved from sin and be born again as Jesus says unless you repent and be born again How did you do that	1.0
2619912	bt_nllb_korean	And then after being born again Jesus said Unless you repent and be born again	1.0
2619912	bt_nllb_malay	How can you be saved from sin and born again as Jesus said unless you repent and be born again How are you	1.0
2619912	bt_nllb_russian	How were you saved from sin and born again as Jesus says Unless you repent and be born again How did you do that	1.0
2619912	bt_nllb_swahili	How are you saved from sin and born again as Jesus says unless you repent and be born again How are you	1.0
2619912	bt_nllb_tamil	How were you saved from sin and born again as Jesus says Unless you repent you must be born again How are you	1.0
2619912	bt_nllb_persian	How did you get rid of sin and be born again	0.5
2634143	-1	what is direct borrowing, phonological borrowing, linguistic borrowing, cultural borrowing,intimate borrowing?	1.0
2634143	bt_nllb_arabic	What is direct borrowing voice borrowing linguistic borrowing cultural borrowing intimate borrowing	1.0
2634143	bt_nllb_chinese_yue	What are direct loans audio loans language loans cultural loans intimate loans	0.0
2634143	bt_nllb_french	What is direct lending phonological lending linguistic lending cultural lending intimate lending	0.0
2634143	bt_nllb_german	What is direct credit phonological credit linguistic credit cultural credit intimate credit	0.0
2634143	bt_nllb_korean	What are direct loans phonological loans linguistic loans cultural loans intimate loans	0.0
2634143	bt_nllb_malay	What are direct loans phonology loans language loans cultural loans intimate loans	0.0
2634143	bt_nllb_persian	What are direct loans voice loans language loans cultural loans direct loans	0.0
2634143	bt_nllb_russian	What are direct loans phonological loans language loans cultural loans personal loans	0.0
2634143	bt_nllb_swahili	What is direct credit phonological credit language credit cultural credit neighborhood credit	0.0
2634143	bt_nllb_tamil	What is direct credit audio credit language credit cultural credit close credit	0.0
2643507	-1	why does milk cost more than gas per gallon?	1.0
2643507	bt_nllb_arabic	Why is milk more expensive than gas per liter	1.0
2643507	bt_nllb_french	Why is milk more expensive than gas per gallon	1.0
2643507	bt_nllb_german	Why does milk cost more than gas per gallon	1.0
2643507	bt_nllb_korean	Why is milk more expensive than gasoline per gallon	1.0
2643507	bt_nllb_persian	Why does milk cost more per gallon than gas	1.0
2643507	bt_nllb_russian	Why is milk more expensive than gas per gallon	1.0
2643507	bt_nllb_swahili	why is milk more expensive than gas per litre	1.0
2643507	bt_nllb_malay	Why is milk more expensive than gas	0.5
2643507	bt_nllb_tamil	Why is milk more expensive than fuel per litre	0.25
2643507	bt_nllb_chinese_yue	Why is milk more expensive than oil	0.0909
2713171	-1	What does the sentence's mean?	1.0
2713171	bt_nllb_arabic	What does that phrase mean	0.0
2713171	bt_nllb_chinese_yue	What does this mean	0.0
2713171	bt_nllb_french	What does that phrase mean	0.0
2713171	bt_nllb_german	What does that phrase mean	0.0
2713171	bt_nllb_korean	What does this phrase mean	0.0
2713171	bt_nllb_malay	What does that say	0.0
2713171	bt_nllb_persian	What does that mean	0.0
2713171	bt_nllb_russian	What does that offer mean	0.0
2713171	bt_nllb_swahili	What does that mean	0.0
2713171	bt_nllb_tamil	What does this phrase mean	0.0
2722241	-1	why do some animals hide in a dark place b4 they die?	0.25
2722241	bt_nllb_malay	Why are some animals hiding in the dark	1.0
2722241	bt_nllb_arabic	Why are some animals hiding in a dark place	0.3333
2722241	bt_nllb_german	Why are animals hiding in a dark place	0.3333
2722241	bt_nllb_korean	Why do some animals hide in the dark	0.3333
2722241	bt_nllb_persian	Why do some animals hide in the dark	0.3333
2722241	bt_nllb_russian	Why do some animals hide in the dark	0.3333
2722241	bt_nllb_tamil	Why do some animals hide in the dark	0.3333
2722241	bt_nllb_chinese_yue	Why do some animals hide in dark places	0.2
2722241	bt_nllb_french	Why do some animals hide in a dark place	0.2
2722241	bt_nllb_swahili	Why do some animals hide in the dark place B when they die	0.2
2783398	-1	What is a nucleus?	1.0
2783398	bt_nllb_french	What is a nucleus	1.0
2783398	bt_nllb_russian	What is a nucleus	1.0
2783398	bt_nllb_chinese_yue	What is nuclear	0.0143
2783398	bt_nllb_korean	What is nuclear	0.0143
2783398	bt_nllb_arabic	What s the core	0.0
2783398	bt_nllb_german	What is a core	0.0
2783398	bt_nllb_malay	What s the core	0.0
2783398	bt_nllb_persian	What is the core	0.0
2783398	bt_nllb_swahili	What is the clue	0.0
2783398	bt_nllb_tamil	What is a nuclear weapon	0.0
2785579	-1	If you could be an element of weather, which would you choose, and why?	1.0
2785579	bt_nllb_arabic	If you could be a weather element which would you choose and why	1.0
2785579	bt_nllb_malay	If you could be the element of the weather which would you choose and why	1.0
2785579	bt_nllb_russian	If you could be the weather element which would you choose and why	1.0
2785579	bt_nllb_german	If you could be an element of the weather which one would you choose and why	0.5
2785579	bt_nllb_persian	If you could be the element of the air who would you choose and why	0.1667
2785579	bt_nllb_swahili	If you could be a weather creature what would you choose and why	0.1
2785579	bt_nllb_tamil	If you were an element of weather what would you choose and why	0.0435
2785579	bt_nllb_chinese_yue	If you could be a weather factor what would you choose	0.04
2785579	bt_nllb_french	If you could be a weather forecaster which one would you choose and why	0.0137
2785579	bt_nllb_korean	If it could be a weather factor which would you choose	0.0
2795030	-1	Why do people drink Cuervo when it tastes the same going down as coming up?	1.0
2795030	bt_nllb_arabic	Why do people drink kerfu when it tastes the same as going down as going up	1.0
2795030	bt_nllb_german	Why do people drink cuervo when it tastes the same when you go down as when you go up	1.0
2795030	bt_nllb_korean	Why do people drink curbo when it tastes like going up and down	1.0
2795030	bt_nllb_malay	Why do people drink Cuervo when it feels like going up	1.0
2795030	bt_nllb_russian	Why do people drink a Cuervo when the taste drops as it rises	1.0
2795030	bt_nllb_swahili	Why do people drink Cuervo when its taste is the same as going down like a climb	1.0
2795030	bt_nllb_chinese_yue	Why would anyone drink Cuervo when it tastes the same going up and down	0.5
2795030	bt_nllb_french	Why do people drink Cuervo when it tastes the same downwards as upwards	0.5
2795030	bt_nllb_tamil	Why does it rise as the taste goes down as well when people drink Cuervo	0.5
2795030	bt_nllb_persian	Why do people eat the quirou when I like to go up and down	0.0556
2797224	-1	Muslims Are The Happiest People Ever, Why?	1.0
2797224	bt_nllb_arabic	Muslims are the happiest people ever why	1.0
2797224	bt_nllb_chinese_yue	Muslims are the happiest people ever why	1.0
2797224	bt_nllb_french	Muslims are the happiest people of all time why	1.0
2797224	bt_nllb_german	Muslims are the happiest people of all time why	1.0
2797224	bt_nllb_korean	Are Muslims the happiest people in history and why	1.0
2797224	bt_nllb_malay	Muslims are the happiest people of all time why	1.0
2797224	bt_nllb_persian	Muslims are the happiest people in the world why	1.0
2797224	bt_nllb_russian	Muslims are the happiest people why	1.0
2797224	bt_nllb_swahili	Muslims Are the Happiest People Why	1.0
2797224	bt_nllb_tamil	Muslims are the happiest people in the world why	1.0
2799913	-1	What's the proper way to express sorrow at a funeral?	1.0
2799913	bt_nllb_chinese_yue	How do you express your grief at a funeral	1.0
2799913	bt_nllb_french	What s the right way to express your grief at a funeral	1.0
2799913	bt_nllb_german	How can one express his grief at a funeral	1.0
2799913	bt_nllb_malay	What s the right way to express your grief at a funeral	1.0
2799913	bt_nllb_arabic	What is the proper way to express grief at a funeral	0.5
2799913	bt_nllb_korean	What is the way to express grief at a funeral	0.5
2799913	bt_nllb_persian	What is the proper way to express grief at a funeral	0.5
2799913	bt_nllb_russian	What is the right way to express grief at a funeral	0.5
2799913	bt_nllb_swahili	What is the proper way to express mourning at a funeral	0.5
2799913	bt_nllb_tamil	What is the proper way to express mourning at a funeral	0.5
2814599	-1	what does the word remission mean when referring to cancer patients?	1.0
2814599	bt_nllb_french	What does the word remission mean when we talk about cancer patients	1.0
2814599	bt_nllb_german	What does the word remission mean in cancer patients	1.0
2814599	bt_nllb_malay	What does the word remission mean when you refer to a cancer patient	1.0
2814599	bt_nllb_russian	What does the word remission mean for cancer patients	1.0
2814599	bt_nllb_swahili	What does the word remission mean when used for cancer patients	1.0
2814599	bt_nllb_tamil	What does the word remediation mean for cancer patients	1.0
2814599	bt_nllb_arabic	What does the word disappear mean when you refer to cancer patients	0.5
2814599	bt_nllb_chinese_yue	What does the word release mean when you talk about cancer patients	0.5
2814599	bt_nllb_korean	What does the word forgiveness mean when you refer to a cancer patient	0.5
2814599	bt_nllb_persian	When we refer to cancer patients what does the word background mean	0.5
2814722	-1	why is the new jersey smoking ban not considered unconstitutional?	1.0
2814722	bt_nllb_german	Why is the New Jersey smoking ban not considered unconstitutional	1.0
2814722	bt_nllb_korean	Why is the New Jersey smoking ban not unconstitutional	1.0
2814722	bt_nllb_persian	Why is the smoking ban in New Jersey not unfounded	1.0
2814722	bt_nllb_russian	Why is a smoking ban in New Jersey not considered unconstitutional	1.0
2814722	bt_nllb_swahili	why does a New Jersey smoking ban violate the constitution	1.0
2814722	bt_nllb_tamil	Why is it not illegal to smoke in New Jersey	0.5
2814722	bt_nllb_french	Why isn t the New Jersey smoking ban considered unconstitutional	0.3333
2814722	bt_nllb_malay	Why isn t a smoking ban in New Jersey considered unconstitutional	0.3333
2814722	bt_nllb_arabic	Why isn t a smoking ban in New Jersey unconstitutional	0.1111
2814722	bt_nllb_chinese_yue	Why is it not unconstitutional to stop smoking in New York	0.05
2815090	-1	how cloning will affects our community?	0.5
2815090	bt_nllb_chinese_yue	How will cloning affect our communities	0.5
2815090	bt_nllb_french	How will cloning affect our community	0.5
2815090	bt_nllb_german	How will cloning affect our community	0.5
2815090	bt_nllb_malay	How will cloning affect our society	0.5
2815090	bt_nllb_persian	How does cloning affect our society	0.5
2815090	bt_nllb_russian	How will cloning affect our community	0.5
2815090	bt_nllb_tamil	How does cloning affect our society	0.5
2815090	bt_nllb_arabic	How will the copying process affect our society	0.0
2815090	bt_nllb_korean	How will reproduction affect our society	0.0
2815090	bt_nllb_swahili	how our culture will affect our culture	0.0
2838988	-1	How can I get a cork out of, not into, a wine bottle without a corkscrew?	1.0
2838988	bt_nllb_german	How can I get a fork out of a wine bottle without a cork screw	1.0
2838988	bt_nllb_malay	How can I get the pattern out of not in a bottle of wine without a corkscrew	1.0
2838988	bt_nllb_russian	How can I get cork out of a bottle of wine without cork screw	1.0
2838988	bt_nllb_tamil	How can I get out of a cork from a bottle of wine without a cork no	1.0
2838988	bt_nllb_chinese_yue	How can I get out of a bottle of wine without a spiral	0.3333
2838988	bt_nllb_arabic	How can I get the top of a bottle of wine without a gun	0.25
2838988	bt_nllb_french	How can I get a bottle of wine out without the winch	0.25
2838988	bt_nllb_persian	How can I get out of a bottle of wine without a crutch and not look inside	0.125
2838988	bt_nllb_korean	How do you get a cup out without a coke screw	0.0286
2838988	bt_nllb_swahili	How can I get a spoon out not in a bottle of wine without a spoon screen	0.0125
2847807	-1	How can I get rid of the hicups?	1.0
2847807	bt_nllb_french	How do I get rid of hiccups	0.25
2847807	bt_nllb_malay	How can I get rid of hiccups	0.25
2847807	bt_nllb_swahili	How can I get rid of hiccups	0.25
2847807	bt_nllb_chinese_yue	How can I get rid of it	0.04
2847807	bt_nllb_arabic	How can I get rid of Jacob	0.0385
2847807	bt_nllb_german	How can I get rid of the slurry	0.0357
2847807	bt_nllb_russian	How can I get rid of the hip	0.0303
2847807	bt_nllb_persian	How can I get rid of this hook	0.0263
2847807	bt_nllb_tamil	How can I get rid of the hit ups	0.025
2847807	bt_nllb_korean	How do we get rid of this hip	0.0
