3552010	bt_nllb_tamil	Why do parents control their children	0.0312
3554263	-1	why some people behave so rude without reason,is it due to their own problem?	1.0
3554263	bt_nllb_german	Why do some people behave so rude is because of their own problem	0.5
3554263	bt_nllb_chinese_yue	Why are some people so rude without any reason Is it because they have problems	0.25
3554263	bt_nllb_french	Why do some people behave so rude for no reason because of their own problems	0.25
3554263	bt_nllb_russian	Why do some people act so rude for no reason it s because of their own problems	0.1
3554263	bt_nllb_persian	Why do some people act so rude for no reason	0.0625
3554263	bt_nllb_arabic	Why do some people act inappropriately for no reason	0.0
3554263	bt_nllb_korean	Why do some people act disrespectfully	0.0
3554263	bt_nllb_malay	Why do some people act so cruel for no reason because of their own problems	0.0
3554263	bt_nllb_swahili	Why do some people act cruelly for no reason and is it because of their own problem	0.0
3554263	bt_nllb_tamil	Why do some people act so badly for no reason and is it their own fault	0.0
3559048	-1	How do you sell a junk car without a title?	1.0
3559048	bt_nllb_chinese_yue	How do you sell trash cars without a title	1.0
3559048	bt_nllb_french	How do you sell a regular car without a title	1.0
3559048	bt_nllb_german	How do you sell a junk car without a title	1.0
3559048	bt_nllb_korean	How can you sell a garbage truck without a title	1.0
3559048	bt_nllb_malay	How do you sell trash cans without a title	1.0
3559048	bt_nllb_persian	How about selling a trash car without a title	1.0
3559048	bt_nllb_swahili	How to sell junk car without a name	1.0
3559048	bt_nllb_tamil	How do you sell a garbage car without a title	1.0
3559048	bt_nllb_russian	How do you sell a garbage machine without a title	0.3333
3559048	bt_nllb_arabic	How do you sell a bad car without a address	0.0244
3577501	-1	what are some signs that puberty is beginning?	1.0
3577501	bt_nllb_arabic	What are some signs that puberty has begun	1.0
3577501	bt_nllb_chinese_yue	What are the signs of puberty	1.0
3577501	bt_nllb_french	What are the signs that puberty is beginning	1.0
3577501	bt_nllb_german	What are some signs of puberty	1.0
3577501	bt_nllb_persian	What are the signs of puberty	1.0
3577501	bt_nllb_korean	What are some signs that the coming of age is about to begin	0.3333
3577501	bt_nllb_russian	What are the signs that sexual maturation is beginning	0.1667
3577501	bt_nllb_malay	What are some signs that adolescence is about to begin	0.1111
3577501	bt_nllb_swahili	what are the signs that a pregnancy is beginning	0.0
3577501	bt_nllb_tamil	What is the beginning of youth	0.0
3639660	-1	Why do most cigarettes have the yellow filter?	1.0
3639660	bt_nllb_arabic	Why do most cigarettes have a yellow filter	1.0
3639660	bt_nllb_chinese_yue	Why do most cigarettes have yellow filters	1.0
3639660	bt_nllb_french	Why do most cigarettes have the yellow filter	1.0
3639660	bt_nllb_german	Why do most cigarettes have the yellow filter	1.0
3639660	bt_nllb_korean	Why do most cigarettes have yellow filters	1.0
3639660	bt_nllb_malay	Why do most cigarettes have yellow filters	1.0
3639660	bt_nllb_persian	Why do most cigarettes have yellow filters	1.0
3639660	bt_nllb_russian	Why do most cigarettes have a yellow filter	1.0
3639660	bt_nllb_swahili	Why do many cigarettes have a yellow filter	1.0
3639660	bt_nllb_tamil	Why do most cigarettes have yellow filters	1.0
3640705	-1	what is the punishment for child molestors?	1.0
3640705	bt_nllb_french	What s the point of child molesters	1.0
3640705	bt_nllb_persian	What is the punishment for child molestation	1.0
3640705	bt_nllb_swahili	What is the punishment for child molestation	1.0
3640705	bt_nllb_arabic	What is the punishment for child rapists	0.2
3640705	bt_nllb_chinese_yue	What is the punishment for child abuse	0.0145
3640705	bt_nllb_malay	What is the punishment for child abuse	0.0145
3640705	bt_nllb_russian	What is the punishment for child abuse	0.0145
3640705	bt_nllb_german	What is the penalty for minors	0.0
3640705	bt_nllb_korean	What is the punishment for child sexual abuse	0.0
3640705	bt_nllb_tamil	What is the punishment for child sexual abuse	0.0
3698636	-1	why do cats headbutt?	1.0
3698636	bt_nllb_chinese_yue	Why is a cat so stupid	0.3333
3698636	bt_nllb_swahili	why the cat s head	0.2
3698636	bt_nllb_persian	Why do cats keep their heads	0.1667
3698636	bt_nllb_korean	Why does a cat have a head	0.1
3698636	bt_nllb_arabic	Why are cats moving	0.0
3698636	bt_nllb_french	Why are cats shoveling	0.0
3698636	bt_nllb_german	Why are cats shaking	0.0
3698636	bt_nllb_malay	Why is the cat sweating	0.0
3698636	bt_nllb_russian	Why are the cats dizzy	0.0
3698636	bt_nllb_tamil	Why do cats have headaches	0.0
3714728	-1	Why is the world so shallow?	1.0
3714728	bt_nllb_chinese_yue	Why is the world so shallow	1.0
3714728	bt_nllb_malay	Why is the world so shallow	1.0
3714728	bt_nllb_french	Why is the world so superficial	0.0345
3714728	bt_nllb_german	Why is the world so superficial	0.0345
3714728	bt_nllb_russian	Why is the world so superficial	0.0345
3714728	bt_nllb_arabic	Why is the world so tight	0.0263
3714728	bt_nllb_tamil	Why is the world so dim	0.0256
3714728	bt_nllb_persian	Why is the world so flat	0.0196
3714728	bt_nllb_korean	Why is the world like this	0.0
3714728	bt_nllb_swahili	Why is the universe so low	0.0
3723508	-1	What is the difference between an ox and a bull?	1.0
3723508	bt_nllb_chinese_yue	What s the difference between cows and bulls	1.0
3723508	bt_nllb_korean	What s the difference between cows and bulls	1.0
3723508	bt_nllb_swahili	What is the difference between a bull and a calf	1.0
3723508	bt_nllb_arabic	What s the difference between a bull and a bull	0.5
3723508	bt_nllb_french	What s the difference between a bull and a bull	0.5
3723508	bt_nllb_german	What s the difference between a bull and a bull	0.5
3723508	bt_nllb_malay	What s the difference between a bull and a bull	0.5
3723508	bt_nllb_russian	What s the difference between a bull and a bull	0.5
3723508	bt_nllb_tamil	What is the difference between a cow and a cow	0.0179
3723508	bt_nllb_persian	What s the difference between a cow and a cow	0.0169
3778229	-1	how were the witches tested in the salem witch trials?	1.0
3778229	bt_nllb_arabic	How did you test witches at Salem witch trials	1.0
3778229	bt_nllb_chinese_yue	How did the Salem Witch Trials test witches	1.0
3778229	bt_nllb_french	How were witches tested at the Salem Witch Trials	1.0
3778229	bt_nllb_german	How were witches tested in the Salem witch trials	1.0
3778229	bt_nllb_korean	How were witches tested at the Salem Witch Trials	1.0
3778229	bt_nllb_malay	How were witches tested in the Salem witch trials	1.0
3778229	bt_nllb_persian	How were witches tested in the courts of the healthy witches	1.0
3778229	bt_nllb_russian	How were the witches in Salem	1.0
3778229	bt_nllb_swahili	How were witches tried in the Salem witch trials	1.0
3778229	bt_nllb_tamil	How were witches tested in Salem witch trials	1.0
3825386	-1	How can I develop leanbody and muscles?	1.0
3825386	bt_nllb_chinese_yue	How can I develop muscle and lean	0.125
3825386	bt_nllb_arabic	How can I develop a lean body and muscles	0.0625
3825386	bt_nllb_french	How can I develop lean body and muscle	0.0625
3825386	bt_nllb_german	How can I develop a lean body and muscles	0.0625
3825386	bt_nllb_persian	How can I develop a lean body and muscle	0.0625
3825386	bt_nllb_russian	How can I develop a lean body and muscles	0.0625
3825386	bt_nllb_swahili	How can I develop a lean body and muscles	0.0625
3825386	bt_nllb_malay	How can I build lean bodies and muscles	0.01
3825386	bt_nllb_korean	How can I build my own body and muscles	0.0
3825386	bt_nllb_tamil	How can I cultivate a lean body	0.0
3872395	-1	what are some easy ways to get a toddler to go to sleep without being mean?	0.3333
3872395	bt_nllb_arabic	What are some easy ways to get a little child to sleep without being violent	0.0345
3872395	bt_nllb_french	What are some easy ways to get a child to sleep without being mean	0.0333
3872395	bt_nllb_korean	What are some easy ways to get your kids to sleep without harm	0.0278
3872395	bt_nllb_swahili	what are some simple ways to get a baby to sleep without being dirty	0.0152
3872395	bt_nllb_german	How can you let a little child sleep without being mean	0.0143
3872395	bt_nllb_persian	What are some simple ways to get a child to sleep without abuse	0.012
3872395	bt_nllb_chinese_yue	How can you keep a child from speaking badly in their sleep	0.0
3872395	bt_nllb_malay	What s the easiest way to get a child to sleep without being mean	0.0
3872395	bt_nllb_russian	What are the simple ways to get a baby to sleep without being angry	0.0
3872395	bt_nllb_tamil	What are some simple ways to keep a boy asleep without being betrayed	0.0
3874326	-1	How come Compton is only designated for black people?	0.5
3874326	bt_nllb_arabic	How come Compton was only for black people	1.0
3874326	bt_nllb_chinese_yue	Why is Compton designed for black people	1.0
3874326	bt_nllb_french	How come Compton is reserved for blacks	1.0
3874326	bt_nllb_german	Why is Compton only for blacks	1.0
3874326	bt_nllb_korean	Why is Compton for black people	1.0
3874326	bt_nllb_malay	Why is Compton only for blacks	1.0
3874326	bt_nllb_persian	Why is Compton only for blacks	1.0
3874326	bt_nllb_russian	Why is Compton only for blacks	1.0
3874326	bt_nllb_tamil	How is Compton only designated by black people	1.0
3874326	bt_nllb_swahili	Why is Compton reserved for black people only	0.2
387874	-1	Why does asparugus make your pee stink?	1.0
387874	bt_nllb_arabic	Why does asparagus make you pee	1.0
387874	bt_nllb_french	Why does your pee smell like asparagus	1.0
387874	bt_nllb_german	Why does your pee smell like asparagus	1.0
387874	bt_nllb_malay	Why does asparagus make your urine smell	0.1111
387874	bt_nllb_swahili	Why does asparagus make your candy smell	0.1111
387874	bt_nllb_tamil	Why does Asparagus smell your urine	0.1
387874	bt_nllb_chinese_yue	Why does Asparagus make you smell like a piss	0.0909
387874	bt_nllb_persian	Why does sprigos make your urine smell	0.0526
387874	bt_nllb_russian	Why does asparagus make you drink so bad	0.05
387874	bt_nllb_korean	Why does the weather smell like asparagus	0.0323
3910925	-1	Why is yawning contagious?	1.0
3910925	bt_nllb_arabic	Why is vibration contagious	1.0
3910925	bt_nllb_chinese_yue	Why is it contagious	1.0
3910925	bt_nllb_french	Why is it contagious to vomit	1.0
3910925	bt_nllb_german	Why is it contagious	1.0
3910925	bt_nllb_malay	Why is it that the spider can be contagious	1.0
3910925	bt_nllb_russian	Why is burning contagious	1.0
3910925	bt_nllb_swahili	Why is bathing contagious	1.0
3910925	bt_nllb_korean	Why is sleep a contagious disease	0.5
3910925	bt_nllb_persian	Why are the gnomes so boring	0.0
3910925	bt_nllb_tamil	Why the blindness	0.0
3960080	-1	Why don't commercial planes fly over the North Pole?	1.0
3960080	bt_nllb_arabic	Why don t commercial planes fly over the Arctic	1.0
3960080	bt_nllb_chinese_yue	Why can t commercial planes fly over the Arctic	1.0
3960080	bt_nllb_french	Why aren t commercial planes flying over the North Pole	1.0
3960080	bt_nllb_german	Why aren t commercial planes flying over the North Pole	1.0
3960080	bt_nllb_malay	Why aren t commercial planes flying over the North Pole	1.0
3960080	bt_nllb_persian	Why aren t commercial planes flying from the North Pole	1.0
3960080	bt_nllb_russian	Why aren t commercial planes flying over the North Pole	1.0
3960080	bt_nllb_swahili	Why do commercial aircraft not fly over the North Pole	1.0
3960080	bt_nllb_tamil	Why do commercial planes not fly over the North Pole	1.0
3960080	bt_nllb_korean	Why don t commercial planes cross the Arctic	0.1429
3971195	-1	How do i get my pitbull more agressive?	1.0
3971195	bt_nllb_french	How can I make my pit bull more aggressive	1.0
3971195	bt_nllb_german	How can I make my pit bull more aggressive	1.0
3971195	bt_nllb_malay	How can I make my pitbull more aggressive	1.0
3971195	bt_nllb_russian	How can I make my pit bull more aggressive	1.0
3971195	bt_nllb_tamil	How can I make my pitbull more aggressive	1.0
3971195	bt_nllb_arabic	How can I make him more aggressive	0.5
3971195	bt_nllb_swahili	How can I make my pitbull sharper	0.5
3971195	bt_nllb_korean	How can we make Pittleburr more aggressive	0.1
3971195	bt_nllb_chinese_yue	How can I make my son more positive	0.0
3971195	bt_nllb_persian	How can I scare my dick so bad	0.0
3990512	-1	how can we get concentration onsomething?	0.0769
3990512	bt_nllb_arabic	How can we focus on something	0.0
3990512	bt_nllb_chinese_yue	How do we focus on work	0.0
3990512	bt_nllb_french	How can we focus our attention on something	0.0
3990512	bt_nllb_german	How can we focus on something	0.0
3990512	bt_nllb_korean	How can we focus	0.0
3990512	bt_nllb_malay	How can we focus on something	0.0
3990512	bt_nllb_persian	How do we get focused on something	0.0
3990512	bt_nllb_russian	How can we focus on something	0.0
3990512	bt_nllb_swahili	How can we focus on something	0.0
3990512	bt_nllb_tamil	How can we focus on something	0.0
4003223	-1	What are the marketing gimmicks that will attract males?	1.0
4003223	bt_nllb_arabic	What marketing scratches will attract males	1.0
4003223	bt_nllb_persian	What marketing tricks are attracting men	0.3333
4003223	bt_nllb_russian	What marketing tricks will attract men	0.3333
4003223	bt_nllb_tamil	What are the marketing tricks that attract men	0.3333
4003223	bt_nllb_french	What kind of marketing tricks will attract men	0.25
4003223	bt_nllb_korean	What marketing techniques attract men	0.25
4003223	bt_nllb_malay	What s the marketing trick that ll attract men	0.2
4003223	bt_nllb_chinese_yue	What are the marketing techniques that attract men s attention	0.1
4003223	bt_nllb_german	What are the marketing tricks men wear	0.0
4003223	bt_nllb_swahili	What marketing techniques will appeal to men	0.0
4012558	-1	what is the term milky way?	1.0
4012558	bt_nllb_chinese_yue	What is the name of the galaxy	1.0
4012558	bt_nllb_french	What is the end of the Milky Way	1.0
4012558	bt_nllb_german	What is the term Milky Way	1.0
4012558	bt_nllb_korean	What is the term for a galaxy	1.0
4012558	bt_nllb_malay	What s the term Milky Way	1.0
4012558	bt_nllb_russian	What is the Milky Way	1.0
4012558	bt_nllb_swahili	What is the Milky Way	1.0
4012558	bt_nllb_arabic	What s the term our trade route	0.0
4012558	bt_nllb_persian	What is the term Milk Road	0.0
4012558	bt_nllb_tamil	What is the word milk road	0.0
4018891	-1	How do I know if a particular term or phrase is copyrighted?	1.0
4018891	bt_nllb_arabic	How do I know if a particular term or phrase is copyrighted	1.0
4018891	bt_nllb_chinese_yue	How do I know if a word or phrase has copyright	1.0
4018891	bt_nllb_french	How do you know if a particular term or phrase is copyrighted	1.0
4018891	bt_nllb_german	How do I know if a particular term or phrase is protected by copyright	1.0
4018891	bt_nllb_korean	How do we know if a particular term or phrase has copyright	1.0
4018891	bt_nllb_malay	How do I know if a particular term or phrase is copyrighted	1.0
4018891	bt_nllb_russian	How do I know that a particular term or phrase is copyrighted	1.0
4018891	bt_nllb_swahili	How do I know if a word or a statement has copyright	1.0
4018891	bt_nllb_tamil	How do I know if a particular word or phrase is copyrighted	1.0
4018891	bt_nllb_persian	How do I know if a particular term or phrase is occupied	0.5
402514	-1	why do my baked potatos never taste near as good as when I get them in a nice restaurant?	1.0
402514	bt_nllb_chinese_yue	Why can t my potatoes be as good as the ones I bought in a good restaurant	1.0
402514	bt_nllb_french	Why don t my baked potatoes taste as good as when I have them in a good restaurant	1.0
402514	bt_nllb_korean	Why is my potato not as tasty as a delicious restaurant	0.5
402514	bt_nllb_tamil	Why isn t my bag of potatoes almost as tasty as when I get to a good restaurant	0.3333
402514	bt_nllb_swahili	why aren t my boiled potatoes as good as I see them in a good restaurant	0.2
402514	bt_nllb_malay	Why didn t my fries ever taste like when I got them at a good restaurant	0.0323
402514	bt_nllb_russian	Why don t my fries ever taste as good as when I get them at a good restaurant	0.0222
402514	bt_nllb_arabic	Why don t breadcrumbs taste like when I get them at a nice restaurant	0.0
402514	bt_nllb_german	Why don t my fries taste as good as they do in a nice restaurant	0.0
402514	bt_nllb_persian	Why don t I like my cooked guards as much as I do when I eat them in a good restaurant	0.0
4126337	-1	Why does my friend buy...?	1.0
4126337	bt_nllb_arabic	Why would my friend buy	1.0
4126337	bt_nllb_chinese_yue	Why did my friend buy	1.0
4126337	bt_nllb_french	Why is my friend buying	1.0
4126337	bt_nllb_german	Why is my friend buying	1.0
4126337	bt_nllb_malay	Why did my friend buy	1.0
4126337	bt_nllb_russian	Why is my friend buying	1.0
4126337	bt_nllb_swahili	Why does my friend buy	1.0
4126337	bt_nllb_tamil	Why would my friend buy	1.0
4126337	bt_nllb_korean	Why is my friend staying	0.125
4126337	bt_nllb_persian	Why does my friend eat	0.0667
4153592	-1	what can make someones ear's stink?	0.5
4153592	bt_nllb_german	What can make someone s ear smell	0.25
4153592	bt_nllb_korean	What makes someone smell like a man s ear	0.25
4153592	bt_nllb_persian	What could make a person s ear smell bad	0.25
4153592	bt_nllb_tamil	What can someone do with their ears smelling	0.25
4153592	bt_nllb_arabic	What makes him smell like someone s ears	0.2
4153592	bt_nllb_malay	What makes a person s ears smell	0.2
4153592	bt_nllb_russian	What could make someone smell	0.0208
4153592	bt_nllb_swahili	What could cause anyone to break his ear	0.0159
4153592	bt_nllb_chinese_yue	Why does anyone smell bad	0.0
4153592	bt_nllb_french	What can make someone smell like a cat	0.0
4165406	-1	Why did the founder of Daewoo get a 10-year jail sentence?	1.0
4165406	bt_nllb_chinese_yue	Why was the founder of Daewoo sentenced to years in prison	0.5
4165406	bt_nllb_french	Why was the founder of Daewoo sentenced to years in prison	0.5
4165406	bt_nllb_german	Why was the founder of Daewoo sentenced to years in prison	0.5
4165406	bt_nllb_korean	Why was the founder of Daewoo sentenced to years in prison	0.5
4165406	bt_nllb_malay	Why was Daewoo s founder sentenced to years in prison	0.5
4165406	bt_nllb_swahili	Why was the founder of Daewoo sentenced to years in prison	0.5
4165406	bt_nllb_russian	Why did the founder of Daewoo get a year prison sentence	0.25
4165406	bt_nllb_arabic	Why did the founder of Daio get a year prison sentence	0.1667
4165406	bt_nllb_persian	Why was the founder of Davao sentenced to years in prison	0.1429
4165406	bt_nllb_tamil	Why was Davo s founder sentenced to years in prison	0.125
4185395	-1	how can i cure the std or the sexually transmitted disease?	1.0
4185395	bt_nllb_arabic	How can I treat chronic or sexually transmitted diseases	1.0
4185395	bt_nllb_chinese_yue	How do I cure sexually transmitted diseases	1.0
4185395	bt_nllb_french	How can you cure a sexually transmitted disease	1.0
4185395	bt_nllb_german	How can I cure an STD or sexually transmitted disease	1.0
4185395	bt_nllb_korean	How can we treat STDs or sexually transmitted diseases	1.0
4185395	bt_nllb_malay	How can I cure an STD or sexually transmitted disease	1.0
4185395	bt_nllb_russian	How can you treat STDs or STDs	1.0
4185395	bt_nllb_swahili	How can I cure a sexually transmitted disease	1.0
4185395	bt_nllb_tamil	How can I cure an STD or sexually transmitted disease	1.0
4185395	bt_nllb_persian	How can I treat sexual and sexual illness	0.0435
4185501	-1	why does the sun shine?	0.5
4185501	bt_nllb_french	Why is the sun shining	1.0
4185501	bt_nllb_german	Why is the sun shining	1.0
4185501	bt_nllb_korean	Why is the sun shining	1.0
4185501	bt_nllb_malay	Why is the sun shining	1.0
4185501	bt_nllb_russian	Why is the sun shining	1.0
4185501	bt_nllb_tamil	Why is the sun shining	1.0
4185501	bt_nllb_chinese_yue	Why does the sun shine	0.5
4185501	bt_nllb_persian	Why does the sun shine	0.5
4185501	bt_nllb_swahili	why does the sun shine	0.5
4185501	bt_nllb_arabic	Why is the sun rising	0.0
4190287	-1	Why is switching schools so depressing?	1.0
4190287	bt_nllb_french	Why is changing schools so depressing	0.5
4190287	bt_nllb_german	Why is it so depressing to change schools	0.5
4190287	bt_nllb_korean	Why is it so depressing to change schools	0.5
4190287	bt_nllb_persian	Why is changing schools so depressing	0.5
4190287	bt_nllb_russian	Why is going to school so depressing	0.5
4190287	bt_nllb_tamil	Why is changing schools so depressing	0.5
4190287	bt_nllb_arabic	Why is changing school so troubling	0.0
4190287	bt_nllb_chinese_yue	Why is it so sad to be transferred	0.0
4190287	bt_nllb_malay	Why is changing schools so frustrating	0.0
4190287	bt_nllb_swahili	Why is changing schools so frustrating	0.0
4196421	-1	how can you be more brilliant?	0.5
4196421	bt_nllb_french	How can you be more brilliant	0.5
4196421	bt_nllb_german	How can you be more brilliant	0.5
4196421	bt_nllb_malay	How can you be more brilliant	0.5
4196421	bt_nllb_russian	How can you be more brilliant	0.5
4196421	bt_nllb_arabic	How can you be smarter	0.0
4196421	bt_nllb_chinese_yue	How can you be smarter	0.0
4196421	bt_nllb_korean	How can we be smarter	0.0
4196421	bt_nllb_persian	How can you be smarter	0.0
4196421	bt_nllb_swahili	how can you be more cunning	0.0
4196421	bt_nllb_tamil	How can you be brighter	0.0
4197214	-1	Why my GF feel like pissing during sexual intercourse?	1.0
4197214	bt_nllb_chinese_yue	Why should I pee during sex	0.5
4197214	bt_nllb_swahili	Why does my GF feel like candying during sex	0.3333
4197214	bt_nllb_malay	Why does my GF feel like I m peeing during sex	0.1667
4197214	bt_nllb_tamil	Why do I feel like my GF needs urine when having sex	0.0556
4197214	bt_nllb_korean	Why do you want to pee during sex	0.037
4197214	bt_nllb_french	Why does my FG want to pee during sex	0.0256
4197214	bt_nllb_german	Why do I want to pee during sex	0.0204
4197214	bt_nllb_arabic	Why do I feel like my moving wife wants to pee while having sex	0.0
4197214	bt_nllb_persian	Why do I feel like I want to predict during sex	0.0
4197214	bt_nllb_russian	Why does my female sex drive want to write during sex	0.0
421753	-1	how to get rid of a skunk?	1.0
421753	bt_nllb_malay	How do you get rid of the skunk	1.0
421753	bt_nllb_swahili	how to remove skunk	1.0
421753	bt_nllb_tamil	How do you get rid of a skunk	1.0
421753	bt_nllb_arabic	How do you get rid of the dirt	0.0
421753	bt_nllb_chinese_yue	How do you get rid of one	0.0
421753	bt_nllb_french	How do you get rid of a scunk	0.0
421753	bt_nllb_german	How do you get rid of a piece of junk	0.0
421753	bt_nllb_korean	How do you get rid of shit	0.0
421753	bt_nllb_persian	How do we get rid of a mess	0.0
421753	bt_nllb_russian	How do you get rid of the scan	0.0
4250296	-1	What do doctors do when a patient has a Do Nor Resuscitate Order?	0.5
4250296	bt_nllb_chinese_yue	What happens when the patient is unable to do or restore order to life	1.0
4250296	bt_nllb_french	What do doctors do when a patient is ordered not to be resuscitated	0.5
4250296	bt_nllb_malay	What do doctors do when patients have no or Resuscitate orders	0.5
4250296	bt_nllb_persian	What do doctors do when a patient has a no live order	0.5
4250296	bt_nllb_swahili	What do doctors do when a patient has an order to Do or Resuscitate	0.5
4250296	bt_nllb_tamil	What would doctors do if a patient was ordered not to be re admitted	0.5
4250296	bt_nllb_german	What do doctors do when a patient has a Do N Resuscitate order	0.25
4250296	bt_nllb_korean	What if doctors order patients to live or not to live	0.2
4250296	bt_nllb_russian	What do doctors do when a patient has a Don t wake up order	0.0909
4250296	bt_nllb_arabic	What do doctors do when a patient has a don t do it or resuscitate it	0.0185
4256593	-1	How do I remove the SIMM card on a LG VX8300 Cell Phone?	1.0
4256593	bt_nllb_arabic	How do I remove the SIMM card on a LG VX	1.0
4256593	bt_nllb_chinese_yue	How do I get rid of the SIMM card on my LG VX	1.0
4256593	bt_nllb_french	How do you get the SIM card out of an LG VX cell phone	1.0
4256593	bt_nllb_german	How do I remove the SIM card from an LG VX phone	1.0
4256593	bt_nllb_korean	How do you remove SIMM cards from your LG VX phone	1.0
4256593	bt_nllb_malay	How do I get the SIM card out of my LG VX cell phone	1.0
4256593	bt_nllb_persian	How do I delete the SIMM card from the LG VX	1.0
4256593	bt_nllb_russian	How to delete a SIMM card on an LG VX mobile phone	1.0
4256593	bt_nllb_swahili	How can I remove SIMM from my LG VX mobile phone	1.0
4256593	bt_nllb_tamil	How to remove SIMM card from LG VX mobile phone	1.0
4278201	-1	how does Ultraviolet Light Affects Seed Germination and plant growth?	1.0
4278201	bt_nllb_arabic	How does ultraviolet light affect seed cultivation and plant growth	1.0
4278201	bt_nllb_chinese_yue	What effect does ultraviolet light have on the growth and growth of seeds	1.0
4278201	bt_nllb_french	How does ultraviolet light affect seed germination and plant growth	1.0
4278201	bt_nllb_german	How does ultraviolet light affect seed germination and plant growth	1.0
4278201	bt_nllb_korean	How does UV light affect seed sprouts and plant growth	1.0
4278201	bt_nllb_malay	How does ultraviolet light affect the growth of seeds and plants	1.0
4278201	bt_nllb_persian	How does ultraviolet light affect the growth of seeds and plants	1.0
4278201	bt_nllb_russian	How does ultraviolet light affect seed germination and plant growth	1.0
4278201	bt_nllb_swahili	How Does Green Light Affect Seed Sowing and Plant Growth	1.0
4278201	bt_nllb_tamil	How does UV light affect seed germination and plant growth	1.0
4283542	-1	i have had loose stools for a week...how do i make it stop?	1.0
4283542	bt_nllb_french	I ve had a loose stool for a week How can I stop it	1.0
4283542	bt_nllb_arabic	I ve been weakening my stool for a week How can I stop it	0.0118
