2862887	-1	how to care for a spiked dragon and what to feed them?	1.0
2862887	bt_nllb_arabic	How to care for tracked dragons and what to feed them	1.0
2862887	bt_nllb_german	How to take care of a spiked dragon and what to feed them	1.0
2862887	bt_nllb_russian	How to care for a dragon and what to feed	1.0
2862887	bt_nllb_swahili	how to care for the dragon with a tip and what to feed	1.0
2862887	bt_nllb_french	How do you take care of a spiny dragon and what do you feed them	0.5
2862887	bt_nllb_malay	How to keep the leafy dragons and what to feed them	0.5
2862887	bt_nllb_korean	How do you take care of the rabbit and feed it	0.1667
2862887	bt_nllb_tamil	How do you look at a cone dragon and what food to feed them	0.1667
2862887	bt_nllb_chinese_yue	How do you raise a dragon with a sting	0.125
2862887	bt_nllb_persian	How do we take care of a dragon with our fingers and what do we give him	0.0
2864267	-1	what exemplifies effective customer service?	1.0
2864267	bt_nllb_arabic	What s an example of effective customer service	1.0
2864267	bt_nllb_chinese_yue	How can we prove effective customer service	1.0
2864267	bt_nllb_french	What shows effective customer service	1.0
2864267	bt_nllb_german	What is an example of effective customer service	1.0
2864267	bt_nllb_korean	What example shows that effective customer service is effective	1.0
2864267	bt_nllb_malay	What shows effective customer service	1.0
2864267	bt_nllb_persian	What does effective customer service show	1.0
2864267	bt_nllb_russian	What is an example of effective customer service	1.0
2864267	bt_nllb_tamil	What is an example of customer service	1.0
2864267	bt_nllb_swahili	what shows that customer service is superior	0.5
2892478	-1	what factors cause the Earth to heat unevenly?	1.0
2892478	bt_nllb_malay	What are the factors that cause the Earth to become unevenly warming	1.0
2892478	bt_nllb_german	What factors cause uneven warming of the earth	0.25
2892478	bt_nllb_korean	What is causing the planet to become so unevenly warming	0.2
2892478	bt_nllb_arabic	What are the factors that cause uneven global warming	0.0526
2892478	bt_nllb_french	What are the factors that cause unequal global warming	0.0526
2892478	bt_nllb_chinese_yue	Why is the planet warming so much	0.0
2892478	bt_nllb_persian	What factors contribute to global warming	0.0
2892478	bt_nllb_russian	What are the factors that lead to uneven global warming	0.0
2892478	bt_nllb_swahili	what are the factors that contribute to the uncompetitive global warming	0.0
2892478	bt_nllb_tamil	What are the reasons why the earth s temperature is irregular	0.0
2956570	-1	What are the words to write the sound of raindrops, moving train & scribbling w/ pencil on paper figuratively?	1.0
2956570	bt_nllb_arabic	What words write the sound of rain drops moving the train dancing w pen on paper figuratively	1.0
2956570	bt_nllb_chinese_yue	What is it that you see in the rain the train the pen on paper	1.0
2956570	bt_nllb_french	What words are used to write down the sound of rain drops the moving train and pencil writing on paper	1.0
2956570	bt_nllb_german	What are the words to write the sound of rain drops the train and the screaming with pencil on paper	1.0
2956570	bt_nllb_korean	Railroad movements the sound of writing on pencil and paper	1.0
2956570	bt_nllb_malay	What words to write the sound of rain the train moving scratching w pencil on paper symbolically	1.0
2956570	bt_nllb_persian	What are the words to write down the sound of rain drops the movement of trains and the cross dressing of a pen on paper	1.0
2956570	bt_nllb_swahili	What words can record the sound of raindrops as a train travels and type with a pen on paper	1.0
2956570	bt_nllb_tamil	What words are there to write down pen and ink on paper the sound of rain drops the movement of the train	0.3333
2956570	bt_nllb_russian	What words to write the sound of a rain drop a moving train and writing in writing	0.0106
2976644	-1	How amoeba catches its prey?	1.0
2976644	bt_nllb_chinese_yue	How do they catch prey	1.0
2976644	bt_nllb_french	How does the amoeba catch its prey	1.0
2976644	bt_nllb_german	How does the Ameba catch her prey	1.0
2976644	bt_nllb_korean	How does the amoeba catch its food	1.0
2976644	bt_nllb_malay	How do the amoeba catch prey	1.0
2976644	bt_nllb_persian	How does Amba catch his prey	1.0
2976644	bt_nllb_russian	How does the amoeba catch its prey	1.0
2976644	bt_nllb_arabic	How does Amba get to his prey	0.3333
2976644	bt_nllb_swahili	How does an ape take its prey	0.0588
2976644	bt_nllb_tamil	How does Amphibos catch its victims	0.0159
3040435	-1	USA have Snow, Hurricanes, Flood, Earthquakes and politicians, Brazil only have politicians, why?	1.0
3040435	bt_nllb_arabic	America has snow hurricanes floods earthquakes and politicians Brazil has only politicians why	1.0
3040435	bt_nllb_chinese_yue	There s snow wind floods earthquakes and politicians in the United States and Brazil has politicians so why	1.0
3040435	bt_nllb_german	The U S has snow hurricanes floods earthquakes and politicians Brazil has only politicians why	1.0
3040435	bt_nllb_korean	The United States has snow hurricanes floods earthquakes politicians and Brazil has politicians and why	1.0
3040435	bt_nllb_persian	America has snow storms floods earthquakes and politicians Brazil has politicians why	1.0
3040435	bt_nllb_russian	In the United States there s snow hurricanes floods earthquakes and politics in Brazil only politics why	1.0
3040435	bt_nllb_french	The United States has snow hurricanes floods earthquakes and politicians Brazil has only politicians why	0.5
3040435	bt_nllb_malay	The United States has snow hurricanes floods earthquakes and politicians Brazil only has politicians why	0.5
3040435	bt_nllb_swahili	The United States has snow hurricanes floods earthquakes and politicians Brazil has only politicians why	0.5
3040435	bt_nllb_tamil	There are ice hurricanes floods earthquakes and politicians in the United States and there are only politicians in Brazil and why	0.5
3074429	-1	How can we understand Islam and Muslims better?	1.0
3074429	bt_nllb_arabic	How can we better understand Islam and Muslims	1.0
3074429	bt_nllb_chinese_yue	How can we better understand Islam and Muslims	1.0
3074429	bt_nllb_french	How can we better understand Islam and Muslims	1.0
3074429	bt_nllb_german	How can we better understand Islam and the Muslims	1.0
3074429	bt_nllb_korean	How can we better understand Islam and Muslims	1.0
3074429	bt_nllb_malay	How can we better understand Islam and Muslims	1.0
3074429	bt_nllb_persian	How can we better understand Islam and Muslims	1.0
3074429	bt_nllb_russian	How can we better understand Islam and Muslims	1.0
3074429	bt_nllb_swahili	How can we better understand Islam and Muslims	1.0
3074429	bt_nllb_tamil	How can we better understand Muslims and Muslims	1.0
3078448	-1	How do you prevent chicken from drying out when you cook it?	1.0
3078448	bt_nllb_arabic	How do you avoid drying chicken when you re cooking it	1.0
3078448	bt_nllb_chinese_yue	How do you prevent chicken drying when you cook	1.0
3078448	bt_nllb_french	How do you keep chicken from drying up when you cook it	1.0
3078448	bt_nllb_german	How do you prevent chicken from getting dry when you cook it	1.0
3078448	bt_nllb_malay	How do you keep chicken from drying out when you cook it	1.0
3078448	bt_nllb_persian	How do you prevent chicken from drying up when you cook	1.0
3078448	bt_nllb_russian	How can you prevent chicken from drying up when it s cooked	1.0
3078448	bt_nllb_swahili	How can you prevent chicken from baking when you re cooking	1.0
3078448	bt_nllb_tamil	How can you prevent chicken from drying up when you cook	0.5
3078448	bt_nllb_korean	How can we prevent chicken from ripening	0.0169
312215	-1	how good is apple pie when it is cold?	1.0
312215	bt_nllb_arabic	How good is apple pie when it s cold	1.0
312215	bt_nllb_french	What s the quality of the apple pie when it s cold	1.0
312215	bt_nllb_german	How good is apple pie when it s cold	1.0
312215	bt_nllb_korean	How good is a cold apple pie	1.0
312215	bt_nllb_malay	How good is apple pie when it s cold	1.0
312215	bt_nllb_persian	How good is an apple pie when it s cold	1.0
312215	bt_nllb_russian	How good is an apple pie when it s cold	1.0
312215	bt_nllb_swahili	How good is apple pie in the cold	1.0
312215	bt_nllb_tamil	How good is the apple diet when it s cold	0.3333
312215	bt_nllb_chinese_yue	How good is the cake when it s cold	0.0
3155314	-1	we have pork chops, veal chops, lamb chops, why is there not any beef chops ?	1.0
3155314	bt_nllb_french	We have pig calf lamb cakes why aren t there beef cakes	1.0
3155314	bt_nllb_german	We have pork veal lamb why is there no beef	1.0
3155314	bt_nllb_malay	We have pork beef lamb why not beef	1.0
3155314	bt_nllb_persian	We have pork doll s meat lamb s meat why not beef	1.0
3155314	bt_nllb_russian	We have pigs calves lambs why is there no beef	1.0
3155314	bt_nllb_swahili	We have pork veal lamb why not beef	1.0
3155314	bt_nllb_tamil	Why don t we have pork beef lamb and goat	1.0
3155314	bt_nllb_chinese_yue	We have pork beef goat why not beef	0.3333
3155314	bt_nllb_korean	Why don t you have pork chicken beef	0.1
3155314	bt_nllb_arabic	We have a pig a pig a pig Why is there no pig	0.0
3206998	-1	how does disneyland make it snow?	1.0
3206998	bt_nllb_arabic	How does Disneyland make snow	1.0
3206998	bt_nllb_korean	How do you get snow on Disneyland	1.0
3206998	bt_nllb_malay	How does Disneyland make snow	1.0
3206998	bt_nllb_russian	How does Disneyland make snow	1.0
3206998	bt_nllb_swahili	How does Disneyland make snow	1.0
3206998	bt_nllb_tamil	How does Disneyland make it ice	1.0
3206998	bt_nllb_french	How does Disneyland snow	0.5
3206998	bt_nllb_german	How does Disneyland turn it into a snowfall	0.5
3206998	bt_nllb_persian	How does Disneyland snow	0.5
3206998	bt_nllb_chinese_yue	Where can Disney get snow	0.0303
3239329	-1	Why do we wee a lot in the cold weather especially at night?	1.0
3239329	bt_nllb_arabic	Why do we pee so much in cold weather especially at night	1.0
3239329	bt_nllb_chinese_yue	Why do we pee so much in cold weather	1.0
3239329	bt_nllb_french	Why do we pee a lot in cold weather especially at night	1.0
3239329	bt_nllb_malay	Why do we pee so much in cold weather especially at night	1.0
3239329	bt_nllb_russian	Why do we pee so much in cold weather especially at night	1.0
3239329	bt_nllb_korean	Why do you pee so much in cold weather especially at night	0.1429
3239329	bt_nllb_persian	Why do we get so cold especially at night	0.1
3239329	bt_nllb_german	Why do we pee so often especially at night	0.0385
3239329	bt_nllb_swahili	Why do we clean so much in the winter especially at night	0.0278
3239329	bt_nllb_tamil	Why do we urinate so much in the cold especially at night	0.0169
3269759	-1	what is artificial intelligence?	1.0
3269759	bt_nllb_french	What is artificial intelligence	1.0
3269759	bt_nllb_german	What is artificial intelligence	1.0
3269759	bt_nllb_malay	What is artificial intelligence	1.0
3269759	bt_nllb_russian	What is artificial intelligence	1.0
3269759	bt_nllb_tamil	What is artificial intelligence	1.0
3269759	bt_nllb_arabic	What is AI	0.2
3269759	bt_nllb_chinese_yue	What is AI	0.2
3269759	bt_nllb_korean	What is AI	0.2
3269759	bt_nllb_persian	What is AI	0.2
3269759	bt_nllb_swahili	What is a false mind	0.0
3278654	-1	Why do Kamikaze pilots wear helmets?	1.0
3278654	bt_nllb_arabic	Why do comic pilots wear helmets	1.0
3278654	bt_nllb_chinese_yue	Why are the Kamikaze pilots wearing armor	1.0
3278654	bt_nllb_german	Why do kamikaze pilots wear helmets	1.0
3278654	bt_nllb_korean	Why do comic book pilots wear helmets	1.0
3278654	bt_nllb_malay	Why is a Kamikaze pilot wearing a helmet	1.0
3278654	bt_nllb_russian	Why are the Kamikaze pilots wearing helmets	1.0
3278654	bt_nllb_swahili	Why do Kamikaze pilots wear helmets	1.0
3278654	bt_nllb_tamil	Why do comic book pilots wear helmets	1.0
3278654	bt_nllb_french	Why are suicide bombers wearing helmets	0.5
3278654	bt_nllb_persian	Why are comics pilots wearing hats	0.5
3280768	-1	why is islam so hated in america?	1.0
3280768	bt_nllb_arabic	Why does Islam hate it in America	1.0
3280768	bt_nllb_chinese_yue	Why do Americans hate Islam so much	1.0
3280768	bt_nllb_french	Why is Islam so hated in America	1.0
3280768	bt_nllb_german	Why is Islam so hated in America	1.0
3280768	bt_nllb_korean	Why is Islam so hated in the United States	1.0
3280768	bt_nllb_malay	Why is Islam so hated in America	1.0
3280768	bt_nllb_persian	Why is Islam so hated in America	1.0
3280768	bt_nllb_russian	Why is Islam so hated in America	1.0
3280768	bt_nllb_swahili	Why is Islam so hated in the United States	1.0
3280768	bt_nllb_tamil	Why Is Islam Hated in the United States	0.5
3295055	-1	What causes skin discoloration, specifically, whitening of the skin between fingers?	1.0
3295055	bt_nllb_arabic	What causes the skin to change color specifically whitening the skin between the fingers	1.0
3295055	bt_nllb_chinese_yue	What causes the skin to turn colored The skin between the fingers to become white	1.0
3295055	bt_nllb_french	What causes the skin to turn off especially the whitening of the skin between the fingers	1.0
3295055	bt_nllb_korean	What causes the skin to change color and why does the skin turn white especially between the fingers	1.0
3295055	bt_nllb_malay	What causes the skin to change color specifically the skin to become white between the fingers	1.0
3295055	bt_nllb_persian	What causes the skin to change color specifically the whitening of the skin between the fingers	1.0
3295055	bt_nllb_russian	What causes the skin to turn colored namely the whitening of the skin between the fingers	1.0
3295055	bt_nllb_swahili	What causes the skin to turn white especially between the fingers	1.0
3295055	bt_nllb_tamil	What causes the skin to turn white especially between the fingers	1.0
3295055	bt_nllb_german	What causes skin discoloration especially the skin between the fingers whiter	0.5
3301173	-1	how to design road crust for national highways?	1.0
3301173	bt_nllb_arabic	How do you design the road shell for the national highways	1.0
3301173	bt_nllb_chinese_yue	How do you design national highways	1.0
3301173	bt_nllb_french	How to design the road surface for national highways	1.0
3301173	bt_nllb_german	How will the road surface be designed for national highways	1.0
3301173	bt_nllb_korean	How to design a road surface on a national highway	1.0
3301173	bt_nllb_malay	How do you plan the road crest for the state highway	1.0
3301173	bt_nllb_persian	How do we design the road crest for national highways	1.0
3301173	bt_nllb_russian	How to design a road corridor for the national highways	1.0
3301173	bt_nllb_swahili	how to design highways for national highways	1.0
3301173	bt_nllb_tamil	How to design the road layout for National Highways	1.0
3313308	-1	how can I enjoy my time alone?	0.1429
3313308	bt_nllb_arabic	How can I enjoy my time alone	0.1429
3313308	bt_nllb_french	How can I enjoy my time alone	0.1429
3313308	bt_nllb_german	How can I enjoy my time alone	0.1429
3313308	bt_nllb_persian	How can I enjoy my time alone	0.1429
3313308	bt_nllb_russian	How can I enjoy my time alone	0.1429
3313308	bt_nllb_swahili	how can I enjoy my time alone	0.1429
3313308	bt_nllb_chinese_yue	How can I enjoy my free time	0.0667
3313308	bt_nllb_tamil	How can I enjoy solitude	0.0303
3313308	bt_nllb_korean	How can we enjoy our time alone	0.0147
3313308	bt_nllb_malay	How can I enjoy my own time	0.0105
3363149	-1	Why do Arabs and Mexicans look alike?	1.0
3363149	bt_nllb_arabic	Why do Arabs and Mexicans look alike	1.0
3363149	bt_nllb_chinese_yue	Why do Arabs and Mexicans look alike	1.0
3363149	bt_nllb_french	Why are Arabs and Mexicans alike	1.0
3363149	bt_nllb_german	Why do Arabs and Mexicans look alike	1.0
3363149	bt_nllb_korean	Why do Arabs and Mexicans look alike	1.0
3363149	bt_nllb_malay	Why do Arabs and Mexicans look alike	1.0
3363149	bt_nllb_persian	Why do Arabs and Mexicans look alike	1.0
3363149	bt_nllb_russian	Why are Arabs and Mexicans alike	1.0
3363149	bt_nllb_swahili	Why do Arabs and Mexicans have similarities	1.0
3363149	bt_nllb_tamil	Why are Arabs and Mexicans alike	1.0
3369088	-1	how can we stop the spread of islam?	1.0
3369088	bt_nllb_arabic	How can we stop the spread of Islam	1.0
3369088	bt_nllb_chinese_yue	How can we stop the spread of Islam	1.0
3369088	bt_nllb_french	How can we stop the spread of Islam	1.0
3369088	bt_nllb_german	How can we stop the spread of Islam	1.0
3369088	bt_nllb_korean	How can we stop the spread of Islam	1.0
3369088	bt_nllb_malay	How can we stop the spread of Islam	1.0
3369088	bt_nllb_persian	How can we stop the spread of Islam	1.0
3369088	bt_nllb_russian	How can we stop the spread of Islam	1.0
3369088	bt_nllb_swahili	How can we prevent the spread of Islam	1.0
3369088	bt_nllb_tamil	How can we prevent the spread of Islam	1.0
3382736	-1	what is minimalist cubisium?	1.0
3382736	bt_nllb_french	What is a minimalist cubisium	1.0
3382736	bt_nllb_german	What is a minimalist cubism	1.0
3382736	bt_nllb_malay	What is a minimalist bathroom	1.0
3382736	bt_nllb_russian	What is minimalist cubism	1.0
3382736	bt_nllb_swahili	What is a minimalist cubism	1.0
3382736	bt_nllb_arabic	What s the minimum copper	0.0
3382736	bt_nllb_chinese_yue	What is a simplified dimension	0.0
3382736	bt_nllb_korean	What is a minimalism qub	0.0
3382736	bt_nllb_persian	What is the least amount of cheminalism	0.0
3382736	bt_nllb_tamil	What is the minimum cube	0.0
3385681	-1	if red bull is soo bad for people ,then why is it soo popular?	1.0
3385681	bt_nllb_arabic	If Red Bull is so bad for people why is he so popular	1.0
3385681	bt_nllb_chinese_yue	If red bulls are bad for people why is it so popular	1.0
3385681	bt_nllb_french	If Red Bull is so bad for people why is it so popular	1.0
3385681	bt_nllb_german	If Red Bull is so bad for people why is he so popular	1.0
3385681	bt_nllb_korean	If red bulls are bad for people why are they so popular	1.0
3385681	bt_nllb_malay	If Red Bull is so bad for people why is it so popular	1.0
3385681	bt_nllb_persian	If Red Bull is so bad for people why is it so popular	1.0
3385681	bt_nllb_russian	If Red Bull is so bad for people why is it so popular	1.0
3385681	bt_nllb_swahili	If Red Bull is so bad for people then why is it so popular	1.0
3385681	bt_nllb_tamil	If Red Bull is so bad for humans why is it so popular	1.0
3389038	-1	why the media in US and Europe is always attacking the Arabs and Islam without finding the truth about them?	0.25
3389038	bt_nllb_arabic	Why are the media in the United States and Europe attacking Arabs and Islam without finding the truth about them	1.0
3389038	bt_nllb_chinese_yue	Why do the media in the United States and Europe always attack Arabs and Islam	1.0
3389038	bt_nllb_korean	Why is it that the media in the United States and Europe always attacks the Arabs and Islam	1.0
3389038	bt_nllb_malay	Why do the media in the United States and Europe always attack Arabs and Muslims without finding the truth about them	1.0
3389038	bt_nllb_french	Why do the American and European media still attack Arabs and Islam without finding the truth about them	0.5
3389038	bt_nllb_persian	Why do the American and European media always attack Arabs and Islam without finding the truth about them	0.5
3389038	bt_nllb_swahili	Why do the American and European media always attack Arabs and Islam without finding the truth about them	0.5
3389038	bt_nllb_german	Why do the media in the US and Europe always attack Arabs and Islam without finding the truth about them	0.3333
3389038	bt_nllb_russian	Why do the media in the US and Europe always attack Arabs and Islam without revealing the truth about them	0.3333
3389038	bt_nllb_tamil	Why do the media in the United States and Europe always attack without finding out the truth about Arabs and Islam	0.3333
3396066	-1	Why do airplanes fly so high?	1.0
3396066	bt_nllb_arabic	Why do planes fly so high	1.0
3396066	bt_nllb_chinese_yue	Why do planes fly so high	1.0
3396066	bt_nllb_french	Why are planes flying so high	1.0
3396066	bt_nllb_german	Why do planes fly so high	1.0
3396066	bt_nllb_korean	Why do planes fly so high	1.0
3396066	bt_nllb_persian	Why do planes fly so high	1.0
3396066	bt_nllb_russian	Why do planes fly so high	1.0
3396066	bt_nllb_tamil	Why do planes fly so high	1.0
3396066	bt_nllb_malay	Why is the plane so high	0.25
3396066	bt_nllb_swahili	Why do birds fly so high	0.0769
34041	-1	what are the symptoms of strep throat?	1.0
34041	bt_nllb_french	What are the symptoms of a throat drop	1.0
34041	bt_nllb_german	What are the symptoms of strep cancer	1.0
34041	bt_nllb_malay	What are the symptoms of strep throat	1.0
34041	bt_nllb_persian	What are the symptoms of strophic throat	1.0
34041	bt_nllb_russian	What are the symptoms of throat strep	1.0
34041	bt_nllb_arabic	What are the symptoms of a sore throat	0.5
34041	bt_nllb_chinese_yue	What are the symptoms of a sore throat	0.5
34041	bt_nllb_korean	What are the symptoms of throat inflammation	0.25
34041	bt_nllb_tamil	What are the symptoms of neck disease	0.0244
34041	bt_nllb_swahili	What are the symptoms of epilepsy	0.0106
3411123	-1	Why does'nt America regard foriegn credentials?	1.0
3411123	bt_nllb_russian	Why doesn t America count foreign credentials	0.1111
3411123	bt_nllb_french	Why isn t America considering qualifications	0.0175
3411123	bt_nllb_german	Why doesn t America respect deportations	0.0123
3411123	bt_nllb_arabic	Why don t America consider it a proof of trust	0.0
3411123	bt_nllb_chinese_yue	Why is the U S not paying attention to foreign identity cards	0.0
3411123	bt_nllb_korean	Why don t the United States consider identification	0.0
3411123	bt_nllb_malay	Why don t Americans take credit for their qualifications	0.0
3411123	bt_nllb_persian	Why doesn t America pay attention to credit cards	0.0
3411123	bt_nllb_swahili	Why does the United States disrespect the qualifications of employers	0.0
3411123	bt_nllb_tamil	Why are there no foreign certificates in the United States	0.0
3496147	-1	Why was I punished for being christlike?	1.0
3496147	bt_nllb_arabic	Why am I punished for being like Christ	1.0
3496147	bt_nllb_french	Why was I punished for being like Christ	1.0
3496147	bt_nllb_german	Why was I punished for being like Christ	1.0
3496147	bt_nllb_korean	Why was I punished for being like Christ	1.0
3496147	bt_nllb_malay	Why am I being punished for being like Christ	1.0
3496147	bt_nllb_persian	Why am I being punished like Christ	1.0
3496147	bt_nllb_russian	Why was I punished for being like Christ	1.0
3496147	bt_nllb_tamil	Why was I punished for imitating Christ	0.3333
3496147	bt_nllb_chinese_yue	Why am I being punished because I am like Christ	0.0
3496147	bt_nllb_swahili	Why was I judged for being like Christ	0.0
3499881	-1	Why is Gordon Ramsey so popular?	1.0
3499881	bt_nllb_arabic	Why is Gordon Ramsay so famous	1.0
3499881	bt_nllb_chinese_yue	Why is Gordon Ramsay so popular	1.0
3499881	bt_nllb_french	Why is Gordon Ramsey so popular	1.0
3499881	bt_nllb_german	Why is Gordon Ramsey so popular	1.0
3499881	bt_nllb_korean	Why is Gordon Ramsay so famous	1.0
3499881	bt_nllb_malay	Why is Gordon Ramsey so popular	1.0
3499881	bt_nllb_persian	Why is Gordon Ramsay so fond of you	1.0
3499881	bt_nllb_russian	Why is Gordon Ramsay so popular	1.0
3499881	bt_nllb_swahili	Why is Gordon Ramsey so popular	1.0
3499881	bt_nllb_tamil	Why is Gordon Ramsay so popular	1.0
3507491	-1	Why is religious freedom more important today?	1.0
3507491	bt_nllb_arabic	Why is religious freedom so important today	1.0
3507491	bt_nllb_chinese_yue	Why is religious freedom so important today	1.0
3507491	bt_nllb_french	Why is religious freedom more important today	1.0
3507491	bt_nllb_german	Why is religious freedom more important today	1.0
3507491	bt_nllb_korean	Why is religious freedom more important today	1.0
3507491	bt_nllb_malay	Why is religious freedom more important now	1.0
3507491	bt_nllb_persian	Why is religious freedom more important today	1.0
3507491	bt_nllb_russian	Why is religious freedom more important today	1.0
3507491	bt_nllb_swahili	Why is religious freedom more important today	1.0
3507491	bt_nllb_tamil	Why is religious freedom important today	1.0
354733	-1	What are the names of some famous photographers and why do their work stand up?	0.5
354733	bt_nllb_chinese_yue	What are the names of some famous photographers	1.0
354733	bt_nllb_arabic	What are the names of some famous photographers and why is their work so powerful	0.5
354733	bt_nllb_french	What are the names of some famous photographers and why is their work so important	0.5
354733	bt_nllb_german	What are the names of some famous photographers and why are their works noted	0.5
354733	bt_nllb_korean	What are the names of famous photographers and why is their work remarkable	0.5
354733	bt_nllb_malay	What are the names of some famous photographers and why do their works stand out	0.5
354733	bt_nllb_persian	What are some famous photographers names and why is their work remarkable	0.5
354733	bt_nllb_russian	What are the names of some famous photographers and why are their works so prominent	0.5
354733	bt_nllb_swahili	What are the names of some prominent photographers and why is their work unique	0.5
354733	bt_nllb_tamil	What are the names of famous photographers and why is their work so high	0.3333
3552010	-1	Why do parent put kids on restriction?	1.0
3552010	bt_nllb_german	Why do parents place limits on their children	1.0
3552010	bt_nllb_malay	Why do parents put their kids in the closet	1.0
3552010	bt_nllb_russian	Why do parents limit their children	1.0
3552010	bt_nllb_chinese_yue	Why do parents restrict their children	0.2
3552010	bt_nllb_korean	Why do parents restrict their children	0.2
3552010	bt_nllb_persian	Why do parents restrict their children	0.2
3552010	bt_nllb_arabic	Why do parents put restrictions on their children	0.1667
3552010	bt_nllb_french	Why do parents put children under restrictions	0.1429
3552010	bt_nllb_swahili	Why do parents place restrictions on their children	0.0833
