qid	order	query	qld.recip_rank
QALD2_te-48	tagmee.topn3.replace	United Kingdom City of London Headquarters Secret Intelligence Service	0.0714
QALD2_te-48	wiki.topn3.replace	british islands united kingdom great britain united kingdom cities london greater london city london city london military locations headquarters aspects organizations headquarters secret intelligence service british intelligence agencies mi secret intelligence service	0.0667
QALD2_te-48	word2vec.topn3.replace	england british town metropolis HQ mi gchq	0.0588
QALD2_te-48	conceptluster.topn5.3.bm25	uk city headquarters mi secret intelligence service headquarters city london united kingdom	0.0556
QALD2_te-48	conceptluster.topn5.3.qld	uk city headquarters mi city london secret intelligence service headquarters united kingdom	0.0556
QALD2_te-48	tagmee.topn3	uk city headquarters mi United Kingdom City of London Headquarters Secret Intelligence Service	0.0556
QALD2_te-48	wiki.topn3	uk city headquarters mi british islands united kingdom great britain united kingdom cities london greater london city london city london military locations headquarters aspects organizations headquarters secret intelligence service british intelligence agencies mi secret intelligence service	0.04
QALD2_te-48	conceptnet.topn3	uk city headquarters mi hat stand tyke capital town sbs secret intelligence service	0.0182
QALD2_te-48	conceptnet.topn3.replace	hat stand tyke capital town headquarters sbs secret intelligence service	0.0103
QALD2_te-49	-1	Which other weapons did the designer of the Uzi develop?	0.5
QALD2_te-49	anchor.topn3	weapons designer uzi develop gamilia ramirez pinki region mirror cdcl	1.0
QALD2_te-49	bt_nllb_russian	What other weapons did Uzi design	1.0
QALD2_te-49	sensedisambiguation.replace	Which other weapon did the interior designer of the uzi train	1.0
QALD2_te-49	termluster.topn5.3.bm25	weapons designer uzi develop	1.0
QALD2_te-49	termluster.topn5.3.qld	weapons designer uzi develop	1.0
QALD2_te-49	thesaurus.topn3	weapons designer uzi develop	1.0
QALD2_te-49	thesaurus.topn3.replace	weapons designer uzi develop	1.0
QALD2_te-49	wordnet.topn3.replace	artillery weapon system interior decorator fashion designer couturier uzi acquire arise train	1.0
QALD2_te-5	-1	What is the second highest mountain on Earth?	0.5
QALD2_te-51	-1	Give me all Frisian islands that belong to the Netherlands.	1.0
QALD2_te-53	-1	What is the ruling party in Lisbon?	0.0
QALD2_te-53	glove.topn3	ruling party lisbon decision democratic portugal prohertrib	0.1667
QALD2_te-53	glove.topn3.replace	decision democratic portugal prohertrib	0.0909
QALD2_te-53	bt_nllb_chinese_yue	What is the political party in Lisbon	0.0385
QALD2_te-53	bt_nllb_malay	What party is in power in Lisbon	0.0357
QALD2_te-53	bt_nllb_russian	What party in Lisbon	0.0196
QALD2_te-53	termluster.topn5.3.bm25	ruling party lisbon	0.0167
QALD2_te-53	termluster.topn5.3.qld	ruling party lisbon	0.0167
QALD2_te-53	thesaurus.topn3	ruling party lisbon	0.0167
QALD2_te-53	thesaurus.topn3.replace	ruling party lisbon	0.0167
QALD2_te-53	wiki.topn3	ruling party lisbon socialist parties south africa south africa politics sidebar templates parliament south africa african national congress marinas portugal populated coastal places portugal lisbon lisbon	0.0154
QALD2_te-53	stem.paicehusk	what is the rul party in lisbon	0.011
QALD2_te-53	bt_nllb_persian	Who is the ruling party in Lisbon	0.0108
QALD2_te-55	-1	Which Greek goddesses dwelt on Mount Olympus?	0.3333
QALD2_te-55	anchor.topn3.replace	greek cypriot τριδυμούλες υ goddesses collection al ep flower girl mt félix valentin olympus	1.0
QALD2_te-55	bt_nllb_arabic	Which Greek gods lived on Mount Olympus	1.0
QALD2_te-55	bt_nllb_chinese_yue	Who were the Greek goddesses who lived on Mount Olympus	1.0
QALD2_te-55	bt_nllb_french	What Greek goddesses lived on Mount Olympus	1.0
QALD2_te-55	bt_nllb_german	What Greek goddesses lived on Mount Olympus	1.0
QALD2_te-55	bt_nllb_persian	Which Greek gods lived on Mount Olympus	1.0
QALD2_te-55	bt_nllb_russian	What Greek goddesses lived on Mount Olympus	1.0
QALD2_te-55	bt_nllb_swahili	What Greek gods lived on Mount Olympus	1.0
QALD2_te-55	bt_nllb_tamil	What Greek gods lived on Mount Olympus	1.0
QALD2_te-55	conceptluster.topn5.3.bm25	greek goddesses dwelt mount olympus greek mythology	1.0
QALD2_te-55	conceptluster.topn5.3.qld	greek goddesses dwelt mount olympus greek mythology	1.0
QALD2_te-55	sensedisambiguation	Which Greek goddesses goddess dwelt populate on Mount saddle horse Olympus	1.0
QALD2_te-55	sensedisambiguation.replace	Which greek goddess populate on saddle horse olympus	1.0
QALD2_te-55	tagmee.topn3	greek goddesses dwelt mount olympus Greek mythology Greek mythology Mount Olympus	1.0
QALD2_te-55	tagmee.topn3.replace	Greek mythology Greek mythology Mount Olympus	1.0
QALD2_te-55	termluster.topn5.3.bm25	greek goddesses dwelt mount olympus	1.0
QALD2_te-55	termluster.topn5.3.qld	greek goddesses dwelt mount olympus	1.0
QALD2_te-55	thesaurus.topn3	greek goddesses dwelt mount olympus	1.0
QALD2_te-55	thesaurus.topn3.replace	greek goddesses dwelt mount olympus	1.0
QALD2_te-55	word2vec.topn3	greek goddesses dwelt mount olympus non greek deities gods dwelled dwells resided zeus nikon athena	1.0
QALD2_te-55	word2vec.topn3.replace	non greek deities gods dwelled dwells resided mount zeus nikon athena	1.0
QALD2_te-55	anchor.topn3	greek goddesses dwelt mount olympus greek cypriot τριδυμούλες υ collection al ep flower girl mt félix valentin	0.5
QALD2_te-55	bt_nllb_korean	Who were the Greek gods who lived on Mount Olympus	0.5
QALD2_te-55	bt_nllb_malay	Which Greek goddess lived on Mount Olympus	0.5
QALD2_te-55	conceptnet.topn3	greek goddesses dwelt mount olympus undwelt dwell t	0.5
QALD2_te-55	conceptnet.topn3.replace	greek goddesses undwelt dwell t mount olympus	0.5
QALD2_te-55	glove.topn3	greek goddesses dwelt mount olympus greece turkish gods deities dwelled em mt mountain bdb k	0.5
QALD2_te-55	relevancefeedback.topn10.bm25	which greek goddesses dwelt on mount olympus justic ida mytholog crete goddess hebe iri god	0.5
QALD2_te-55	relevancefeedback.topn10.qld	which greek goddesses dwelt on mount olympus ida crete god justic victori hebe iri goddess	0.5
QALD2_te-55	wiki.topn3	greek goddesses dwelt mount olympus european mythology ancient greek literature ancient greek religion greek mythology european mythology ancient greek literature ancient greek religion greek mythology biosphere reserves greece visitor attractions thessaly hera mount olympus	0.5
QALD2_te-55	wiki.topn3.replace	european mythology ancient greek literature ancient greek religion greek mythology european mythology ancient greek literature ancient greek religion greek mythology biosphere reserves greece visitor attractions thessaly hera mount olympus	0.5
QALD2_te-57	-1	Give me the Apollo 14 astronauts.	0.5
QALD2_te-57	conceptnet.topn3	give apollo astronauts offer provide pay Phoebus Apollo people the space shuttle journey to the moon	1.0
QALD2_te-57	relevancefeedback.topn10.bm25	give me the apollo astronauts lunar spacecraft cover space name state	1.0
QALD2_te-57	relevancefeedback.topn10.qld	give me the apollo astronauts lunar spacecraft state cover	1.0
QALD2_te-57	rm3.topn10.10.0.5.bm25	Give me the Apollo 14 astronauts.	1.0
QALD2_te-57	rm3.topn10.10.0.5.qld	Give me the Apollo 14 astronauts.	1.0
QALD2_te-57	wiki.topn3	give apollo astronauts video greatest hits history foolish beat lovnever felt good give apollo apollo apollo apollo astronauts spacshuttlatlantis destroyed spacecraft astronaut	1.0
QALD2_te-57	wiki.topn3.replace	video greatest hits history foolish beat lovnever felt good give apollo apollo apollo apollo astronauts spacshuttlatlantis destroyed spacecraft astronaut	1.0
QALD2_te-58	-1	What is the time zone of Salt Lake City?	0.3333
QALD2_te-58	conceptluster.topn5.3.bm25	time zone salt lake city time zone	1.0
QALD2_te-58	conceptluster.topn5.3.qld	time zone salt lake city time zone	1.0
QALD2_te-58	wordnet.topn3	time zone salt lake city clock time meter zona geographical zone table salt saltiness metropolis urban center	1.0
QALD2_te-58	bt_nllb_french	What s the time zone for Salt Lake City	0.5
QALD2_te-58	bt_nllb_german	What s the time zone of Salt Lake City	0.5
QALD2_te-58	bt_nllb_malay	What s the time zone of Salt Lake City	0.5
QALD2_te-58	bt_nllb_persian	What s the time zone in Salt Lake City	0.5
QALD2_te-58	tagmee.topn3	time zone salt lake city Time zone Salt Lake City	0.5
QALD2_te-58	tagmee.topn3.replace	Time zone Salt Lake City	0.5
QALD2_te-58	termluster.topn5.3.bm25	time zone salt lake city	0.5
QALD2_te-58	termluster.topn5.3.qld	time zone salt lake city	0.5
QALD2_te-58	thesaurus.topn3	time zone salt lake city	0.5
QALD2_te-58	thesaurus.topn3.replace	time zone salt lake city	0.5
QALD2_te-58	wiki.topn3.replace	list tz databastimzones time zones templates daylight saving time time zone salt lake city utah salt lake city metropolitan area county seats utah salt lake city	0.5
QALD2_te-58	wordnet.topn3.replace	meter clock prison term district geographical zone table salt Strategic Arms Limitation Talks lake metropolis urban center	0.5
QALD2_te-59	-1	Which U.S. states are in the same timezone as Utah?	0.0
QALD2_te-59	bt_nllb_malay	Which state in the United States is in the same time zone as Utah	0.2
QALD2_te-59	bt_nllb_french	Which US states are in the same time zone as Utah	0.1429
QALD2_te-59	bt_nllb_tamil	Which US states are in the same time zone as Utah	0.1429
QALD2_te-59	word2vec.topn3.replace	usa u s american sates states time zone UTC idaho arizona nevada	0.1429
QALD2_te-59	wordnet.topn3.replace	United States US Government USA nation land timezone UT Mormon State	0.0345
QALD2_te-59	word2vec.topn3	u s states timezone utah usa u s american sates states time zone UTC idaho arizona nevada	0.0286
QALD2_te-59	bt_nllb_arabic	Which U S states are in the same time zone as Utah	0.0263
QALD2_te-59	bt_nllb_german	Which U S states are in the same time zone as Utah	0.0263
QALD2_te-59	bt_nllb_korean	Which U S states are in the same time zone as Utah	0.0263
QALD2_te-59	bt_nllb_persian	Which U S states are in the same time zone as Utah	0.0263
QALD2_te-59	bt_nllb_russian	Which U S states are in the same time zone as Utah	0.0263
QALD2_te-59	bt_nllb_swahili	What U S states are in a time zone like Utah	0.0244
QALD2_te-59	bt_nllb_chinese_yue	Which state in the U S has the same time zone as Utah	0.0179
QALD2_te-6	-1	Give me all professional skateboarders from Sweden.	0.2
QALD2_te-6	bt_nllb_chinese_yue	To all the professional skateboarders from Sweden	1.0
QALD2_te-6	tagmee.topn3	give professional skateboarders sweden Give In to Me Skateboarding Sweden	1.0
QALD2_te-6	termluster.topn5.3.bm25	give professional skateboarders sweden	1.0
QALD2_te-6	termluster.topn5.3.qld	give professional skateboarders sweden	1.0
QALD2_te-6	thesaurus.topn3	give professional skateboarders sweden	1.0
QALD2_te-6	thesaurus.topn3.replace	give professional skateboarders sweden	1.0
QALD2_te-6	wiki.topn3	give professional skateboarders sweden video greatest hits history foolish beat lovnever felt good give skateboard bmx skateboarding equipment skateboarding year establishment unknown sweden swedish speaking countries territories sweden	1.0
QALD2_te-6	wiki.topn3.replace	video greatest hits history foolish beat lovnever felt good give skateboard bmx skateboarding equipment skateboarding year establishment unknown sweden swedish speaking countries territories sweden	1.0
QALD2_te-6	bt_nllb_korean	Give me all the Swedish professional skateboards	0.5
QALD2_te-6	bt_nllb_persian	Give me all the professional Swedish skateboards	0.5
QALD2_te-6	glove.topn3	give professional skateboarders sweden take amateur snowboarders denmark swedish	0.5
QALD2_te-6	sensedisambiguation.replace	yield me all professional skateboarder from sweden	0.5
QALD2_te-6	conceptluster.topn5.3.bm25	give professional skateboarders sweden give skateboarding	0.25
QALD2_te-6	conceptluster.topn5.3.qld	give professional skateboarders sweden give skateboarding	0.25
QALD2_te-6	sensedisambiguation	Give yield me all professional skateboarders skateboarder from Sweden	0.25
QALD2_te-6	stem.porter	give me all profession skateboard from sweden	0.25
QALD2_te-6	stem.porter2	give me all profession skateboard from sweden	0.25
QALD2_te-60	-1	Give me a list of all lakes in Denmark.	0.1429
QALD2_te-60	termluster.topn5.3.bm25	give list lakes denmark	1.0
QALD2_te-60	termluster.topn5.3.qld	give list lakes denmark	1.0
QALD2_te-60	thesaurus.topn3	give list lakes denmark	1.0
QALD2_te-60	thesaurus.topn3.replace	give list lakes denmark	1.0
QALD2_te-60	conceptluster.topn5.3.bm25	give list lakes denmark give denmark national cricket team	0.5
QALD2_te-60	conceptluster.topn5.3.qld	give list lakes denmark give denmark national cricket team	0.5
QALD2_te-60	sensedisambiguation	Give yield me a list tilt of all lakes lake in Denmark	0.5
QALD2_te-60	tagmee.topn3	give list lakes denmark Give In to Me Denmark national cricket team	0.25
QALD2_te-60	bt_nllb_tamil	Give me a list of lakes in Denmark	0.2
QALD2_te-63	-1	Give me all Argentine films.	0.125
QALD2_te-63	tagmee.topn3.replace	Give In to Me Cinema of Argentina Cinema of Argentina	1.0
QALD2_te-63	wiki.topn3	give argentine films video greatest hits history foolish beat lovnever felt good give cinema argentina cinenacional com fernando ayala cinema argentina cinema argentina cinenacional com fernando ayala cinema argentina	1.0
QALD2_te-63	wiki.topn3.replace	video greatest hits history foolish beat lovnever felt good give cinema argentina cinenacional com fernando ayala cinema argentina cinema argentina cinenacional com fernando ayala cinema argentina	1.0
QALD2_te-63	conceptluster.topn5.3.bm25	give argentine films give cinema argentina	0.5
QALD2_te-63	conceptluster.topn5.3.qld	give argentine films give cinema argentina	0.5
QALD2_te-63	glove.topn3	give argentine films take argentinian argentina movies	0.5
QALD2_te-63	tagmee.topn3	give argentine films Give In to Me Cinema of Argentina Cinema of Argentina	0.5
QALD2_te-63	termluster.topn5.3.bm25	give argentine films	0.5
QALD2_te-63	termluster.topn5.3.qld	give argentine films	0.5
QALD2_te-63	thesaurus.topn3	give argentine films	0.5
QALD2_te-63	thesaurus.topn3.replace	give argentine films	0.5
QALD2_te-63	stem.paicehusk	giv me al argentin film	0.3333
QALD2_te-63	glove.topn3.replace	take argentinian argentina movies	0.1429
QALD2_te-63	sensedisambiguation.replace	yield me all argentine movie	0.1429
QALD2_te-64	-1	Give me all launch pads operated by NASA.	1.0
QALD2_te-65	-1	Which instruments did John Lennon play?	1.0
QALD2_te-66	-1	Which ships were called after Benjamin Franklin?	0.3333
QALD2_te-66	bt_nllb_arabic	Which ship is named after Benjamin Franklin	1.0
QALD2_te-66	bt_nllb_chinese_yue	Which ship is named after Benjamin Franklin	1.0
QALD2_te-66	bt_nllb_french	Which ships were named after Benjamin Franklin	1.0
QALD2_te-66	bt_nllb_german	Which ships were named after Benjamin Franklin	1.0
QALD2_te-66	bt_nllb_korean	Which ships are named after Benjamin Franklin	1.0
QALD2_te-66	bt_nllb_malay	Which ship is named after Benjamin Franklin	1.0
QALD2_te-66	bt_nllb_persian	What ships are named after Benjamin Franklin	1.0
QALD2_te-66	bt_nllb_russian	What ships are named after Benjamin Franklin	1.0
QALD2_te-66	bt_nllb_swahili	What ships were named after Benjamin Franklin	1.0
QALD2_te-66	bt_nllb_tamil	What ships were named after Benjamin Franklin	1.0
QALD2_te-66	conceptluster.topn5.3.bm25	ships called benjamin franklin sailing ship	1.0
QALD2_te-66	conceptluster.topn5.3.qld	ships called benjamin franklin sailing ship	1.0
QALD2_te-66	conceptnet.topn3	ships called benjamin franklin captain weather storms Submarines benjaminite John Hope Franklin	1.0
QALD2_te-66	stem.lovins	which ship wer cal after benjamin franklin	1.0
QALD2_te-66	stem.paicehusk	which ship wer cal aft benjamin franklin	1.0
QALD2_te-66	tagmee.topn3	ships called benjamin franklin Sailing ship Benjamin Franklin	1.0
QALD2_te-66	tagmee.topn3.replace	Sailing ship Benjamin Franklin	1.0
QALD2_te-66	termluster.topn5.3.bm25	ships called benjamin franklin	1.0
QALD2_te-66	termluster.topn5.3.qld	ships called benjamin franklin	1.0
QALD2_te-66	thesaurus.topn3	ships called benjamin franklin	1.0
QALD2_te-66	thesaurus.topn3.replace	ships called benjamin franklin	1.0
QALD2_te-66	word2vec.topn3	ships called benjamin franklin warships vessels termed dubbed named seymour jeffrey eleanor ballard livingston patterson	1.0
QALD2_te-66	anchor.topn3	ships called benjamin franklin ducèn quédec krevé aps seducteur wanjika thooft wopamo eras	0.5
QALD2_te-67	-1	Who are the parents of the wife of Juan Carlos I?	0.0333
QALD2_te-67	stem.trunc5	who are the paren of the wife of juan carlo i	0.0476
QALD2_te-72	-1	In which U.S. state is Area 51 located?	0.0
QALD2_te-72	rm3.topn10.10.0.5.bm25	In which U.S. state is Area 51 located?	0.1667
QALD2_te-72	rm3.topn10.10.0.5.qld	In which U.S. state is Area 51 located?	0.1667
QALD2_te-72	conceptluster.topn5.3.bm25	u s state area located tonopah test range	0.125
QALD2_te-72	conceptluster.topn5.3.qld	u s state area located tonopah test range	0.125
QALD2_te-72	tagmee.topn3.replace	U S state Tonopah Test Range	0.0714
QALD2_te-72	tagmee.topn3	u s state area located U S state Tonopah Test Range	0.0588
QALD2_te-72	wiki.topn3	u s state area located country subdivisions americas west virginia west virginia u s state fallon rangtraining complex tonopah air forcstation miko callaghan federal hospital tonopah test range	0.0588
QALD2_te-72	wiki.topn3.replace	country subdivisions americas west virginia west virginia u s state fallon rangtraining complex tonopah air forcstation miko callaghan federal hospital tonopah test range	0.05
QALD2_te-75	-1	Which daughters of British earls died in the same place they were born in?	0.0217
QALD2_te-75	stem.porter2	which daughter of british earl die in the same place they were born in	0.0435
QALD2_te-75	glove.topn3	daughters british earls died place born sons britain canadian viscounts dukes death killed née married	0.0294
QALD2_te-76	-1	List the children of Margaret Thatcher.	1.0
QALD2_te-77	-1	Who was called Scarface?	0.1667
QALD2_te-77	bt_nllb_korean	Who called you Scarface	1.0
QALD2_te-77	conceptnet.topn3	called scarface Alphonse Capone	1.0
QALD2_te-77	conceptnet.topn3.replace	called Alphonse Capone	1.0
QALD2_te-77	relevancefeedback.topn10.bm25	who was called scarface film record album messier buffi paul cast d	1.0
QALD2_te-77	sensedisambiguation	Who was called visit Scarface capone	1.0
QALD2_te-77	wiki.topn3	called scarface throlling stones fleetwood mac led zeppelin rappers missouri geto boys willid scarface rapper	1.0
QALD2_te-77	wiki.topn3.replace	throlling stones fleetwood mac led zeppelin rappers missouri geto boys willid scarface rapper	1.0
QALD2_te-77	wordnet.topn3	called scarface telephone call in phone Alphonse Capone Capone	1.0
QALD2_te-77	wordnet.topn3.replace	bid forebode address Alphonse Capone Capone	1.0
QALD2_te-77	bt_nllb_chinese_yue	Who is Scarface	0.5
QALD2_te-77	bt_nllb_french	Who was Scarface	0.5
QALD2_te-77	bt_nllb_german	Who was Scarface	0.5
QALD2_te-77	bt_nllb_russian	Who was Scarface	0.5
QALD2_te-77	bt_nllb_swahili	Who was Scarface	0.5
QALD2_te-77	conceptluster.topn5.3.bm25	called scarface scarface rapper	0.5
QALD2_te-77	conceptluster.topn5.3.qld	called scarface scarface rapper	0.5
QALD2_te-77	tagmee.topn3	called scarface The Who Scarface rapper	0.5
QALD2_te-77	tagmee.topn3.replace	The Who Scarface rapper	0.5
QALD2_te-8	-1	To which countries does the Himalayan mountain system extend?	0.3333
QALD2_te-8	bt_nllb_chinese_yue	Which country is the Himalayas	1.0
QALD2_te-8	bt_nllb_korean	To what country does the Himalayas extend	1.0
QALD2_te-8	bt_nllb_russian	What countries are the Himalayan mountain range extending into	1.0
QALD2_te-8	conceptluster.topn5.3.bm25	countries himalayan mountain system extend himalayas mountain nation mountain range	1.0
QALD2_te-8	conceptluster.topn5.3.qld	countries himalayan mountain system extend mountain range himalayas mountain nation	1.0
QALD2_te-8	relevancefeedback.topn10.bm25	to which countries does the himalayan mountain system extend peak forest research basin bhutan rang famili	1.0
QALD2_te-8	relevancefeedback.topn10.qld	to which countries does the himalayan mountain system extend space himalaya object forest peak rang basin relat	1.0
QALD2_te-8	stem.trunc5	to which count does the himal mount syste exten	1.0
QALD2_te-8	tagmee.topn3	countries himalayan mountain system extend Nation Himalayas Himalayas Mountain Mountain range	1.0
QALD2_te-8	tagmee.topn3.replace	Nation Himalayas Himalayas Mountain Mountain range	1.0
QALD2_te-8	wiki.topn3	countries himalayan mountain system extend independence nationality society nation mountain ranges tibet mountain ranges nepal mountain ranges pakistan himalayas mountain ranges tibet mountain ranges nepal mountain ranges pakistan himalayas mountains geography terminology glacier mountain mountain ranges massif mountain templates mountain range	1.0
QALD2_te-8	wiki.topn3.replace	independence nationality society nation mountain ranges tibet mountain ranges nepal mountain ranges pakistan himalayas mountain ranges tibet mountain ranges nepal mountain ranges pakistan himalayas mountains geography terminology glacier mountain mountain ranges massif mountain templates mountain range	1.0
QALD2_te-8	word2vec.topn3	countries himalayan mountain system extend nations countires coutries himalayas himalaya hill sytem system expand	1.0
QALD2_te-8	bt_nllb_french	In what countries is the Himalayan mountain system extended	0.5
QALD2_te-8	bt_nllb_tamil	To which countries are the Himalayan mountains extending	0.5
QALD2_te-8	sensedisambiguation	To which countries state does the Himalayan mountain system extend carry	0.5
QALD2_te-8	sensedisambiguation.replace	To which state does the himalayan mountain system carry	0.5
QALD2_te-8	stem.krovetz	to which country do the himalayan mountain system extend	0.5
QALD2_te-8	stem.paicehusk	to which country doe the himalay mountain system extend	0.5
QALD2_te-8	termluster.topn5.3.bm25	countries himalayan mountain system extend	0.5
QALD2_te-8	termluster.topn5.3.qld	countries himalayan mountain system extend	0.5
QALD2_te-8	thesaurus.topn3	countries himalayan mountain system extend	0.5
QALD2_te-8	thesaurus.topn3.replace	countries himalayan mountain system extend	0.5
QALD2_te-8	word2vec.topn3.replace	nations countires coutries himalayas himalaya hill sytem system expand	0.5
QALD2_te-80	-1	Give me all books by William Goldman with more than 300 pages.	1.0
QALD2_te-81	-1	Which books by Kerouac were published by Viking Press?	0.5
QALD2_te-81	conceptluster.topn5.3.bm25	books kerouac published viking press book jack kerouac publishing	1.0
QALD2_te-81	conceptluster.topn5.3.qld	books kerouac published viking press jack kerouac publishing book	1.0
QALD2_te-81	conceptnet.topn3	books kerouac published viking press a shelf read words Jean Louis Lebris de Kerouac kerouacian push down iron	1.0
QALD2_te-81	conceptnet.topn3.replace	a shelf read words Jean Louis Lebris de Kerouac kerouacian published viking push down iron	1.0
QALD2_te-81	tagmee.topn3.replace	Book Jack Kerouac Publishing Viking Press	1.0
QALD2_te-81	wordnet.topn3	books kerouac published viking press Scripture Good Book Jean Louis Lebris de Kerouac Jack Kerouac bring out put out public press jam campaign	1.0
QALD2_te-81	wordnet.topn3.replace	account book record Quran Jack Kerouac Jean Louis Lebris de Kerouac write issue bring out viking bid conjure military press	1.0
QALD2_te-82	-1	Give me a list of all American inventions.	0.04
QALD2_te-82	glove.topn3	give list american inventions take u s innovations	1.0
QALD2_te-82	termluster.topn5.3.bm25	give list american inventions	1.0
QALD2_te-82	termluster.topn5.3.qld	give list american inventions	1.0
QALD2_te-82	thesaurus.topn3	give list american inventions	1.0
QALD2_te-82	thesaurus.topn3.replace	give list american inventions	1.0
QALD2_te-82	word2vec.topn3	give list american inventions provide list british america inventors	1.0
QALD2_te-82	sensedisambiguation	Give yield me a list tilt of all American inventions invention	0.5
QALD2_te-82	wordnet.topn3	give list american inventions grant pass ease up heel name American language American English innovation conception	0.5
QALD2_te-82	conceptluster.topn5.3.bm25	give list american inventions a list give all america	0.3333
QALD2_te-82	conceptluster.topn5.3.qld	give list american inventions give all america a list	0.3333
QALD2_te-82	word2vec.topn3.replace	provide list british america inventors	0.3333
QALD2_te-82	bt_nllb_chinese_yue	Give me a list of all the inventions in America	0.2
QALD2_te-82	bt_nllb_korean	Give me a list of American inventions	0.2
QALD2_te-82	bt_nllb_tamil	Give me a list of American inventions	0.2
QALD2_te-82	stem.krovetz	give me a list of all america invention	0.2
QALD2_te-84	-1	Who created the comic Captain America?	1.0
QALD2_te-86	-1	What is the largest city in Australia?	1.0
QALD2_te-87	-1	Who composed the music for Harold and Maude?	0.3333
QALD2_te-87	bt_nllb_arabic	Who made the music for Harold and Maud	0.5
QALD2_te-87	stem.paicehusk	who compos the mus for harold and maud	0.5
QALD2_te-88	-1	Which films starring Clint Eastwood did he direct himself?	1.0
QALD2_te-89	-1	In which city was the former Dutch queen Juliana buried?	1.0
QALD2_te-9	-1	Give me a list of all trumpet players that were bandleaders.	1.0
QALD2_te-90	-1	Where is the residence of the prime minister of Spain?	1.0
QALD2_te-91	-1	Which U.S. State has the abbreviation MN?	1.0
QALD2_te-92	-1	Show me all songs from Bruce Springsteen released between 1980 and 1990.	1.0
QALD2_te-93	-1	Which movies did Sam Raimi direct after Army of Darkness?	1.0
QALD2_te-95	-1	Who wrote the lyrics for the Polish national anthem?	0.05
QALD2_te-95	word2vec.topn3	wrote lyrics polish national anthem writes penned authored songs song regional international local song hymn	1.0
