1023,INEX_XER-126,wiki.topn3,toy train manufacturers still business high rail model steam engine z scale toy train industry supply chain products manufacturing business accounting finance business,0.2151
1024,INEX_XER-126,tagmee.topn3.replace,Toy train Manufacturing Business,0.1943
1025,INEX_XER-126,conceptluster.topn5.3.bm25,toy train manufacturers still business manufacturing business toy train,0.1703
1026,INEX_XER-126,conceptluster.topn5.3.qld,toy train manufacturers still business toy train business manufacturing,0.1703
1027,INEX_XER-126,tagmee.topn3,toy train manufacturers still business Toy train Manufacturing Business,0.1703
1028,INEX_XER-126,relevancefeedback.topn10.bm25,toy train manufacturers that are still in business gilbert scale railwai sonneberg parisi duplo compani toi triang caplan,0.1632
1029,INEX_XER-126,bt_nllb_french,manufacturers of toy trains still in operation,0.1588
1030,INEX_XER-126,bt_nllb_russian,manufacturers of toy trains that are still in operation,0.1588
1031,INEX_XER-126,bt_nllb_chinese_yue,Toy train manufacturers are still producing,0.1467
1032,INEX_XER-127,-1,german female politicians,0.2851
1033,INEX_XER-127,conceptluster.topn5.3.bm25,german female politicians germans,0.2968
1034,INEX_XER-127,conceptluster.topn5.3.qld,german female politicians germans,0.2968
1035,INEX_XER-127,tagmee.topn3,german female politicians Germans,0.2968
1036,INEX_XER-127,sensedisambiguation,german female politicians politician,0.2917
1037,INEX_XER-127,stem.krovetz,germany female politician,0.2852
1038,INEX_XER-128,-1,Bond girls,0.3435
1039,INEX_XER-129,-1,Science fiction book written in the 1980,0.0016
1040,INEX_XER-129,rm3.topn10.10.0.5.bm25,Science fiction book written in the 1980,0.1285
1041,INEX_XER-129,rm3.topn10.10.0.5.qld,Science fiction book written in the 1980,0.1285
1042,INEX_XER-129,wiki.topn3,science fiction book written science fiction genres science fiction speculative fiction science fiction books publishing documents book vocabulary symbol narrative writing,0.0089
1043,INEX_XER-129,wiki.topn3.replace,science fiction genres science fiction speculative fiction science fiction books publishing documents book vocabulary symbol narrative writing,0.0066
1044,INEX_XER-129,bertqe.topn10.bm25,categori professor shonku book,0.0041
1045,INEX_XER-129,tagmee.topn3,science fiction book written Science fiction Book Writing,0.0025
1046,INEX_XER-129,bt_bing_swahili,Science fiction novels published in,0.0021
1047,INEX_XER-130,-1,Star Trek Captains,0.3279
1048,INEX_XER-132,-1,living nordic classical composers,0.2602
1049,INEX_XER-132,bt_bing_german,Living Composers of Nordic Classical Music,0.2618
1050,INEX_XER-133,-1,EU countries,0.0942
1051,INEX_XER-133,sensedisambiguation,EU european union countries state,0.1546
1052,INEX_XER-133,conceptluster.topn5.3.bm25,eu countries european union nation,0.1128
1053,INEX_XER-133,conceptluster.topn5.3.qld,eu countries european union nation,0.1128
1054,INEX_XER-133,tagmee.topn3,eu countries European Union Nation,0.1128
1055,INEX_XER-134,-1,record-breaking sprinters in male 100-meter sprints,0.0533
1056,INEX_XER-134,rm3.topn10.10.0.5.bm25,record-breaking sprinters in male 100-meter sprints,0.0811
1057,INEX_XER-134,rm3.topn10.10.0.5.qld,record-breaking sprinters in male 100-meter sprints,0.0811
1058,INEX_XER-134,wordnet.topn3,record breaking sprinters male meter sprints male person virile manful dash,0.0544
1059,INEX_XER-135,-1,professional baseball team in Japan,0.3149
1060,INEX_XER-136,-1,Japanese players in Major League Baseball,0.6746
1061,INEX_XER-136,sensedisambiguation,Japanese players player in Major League Baseball,0.6764
1062,INEX_XER-138,-1,National Parks East Coast Canada US,0.0074
1063,INEX_XER-138,bt_nllb_russian,National parks of the Eastern coast of Canada,0.0595
1064,INEX_XER-138,bt_nllb_korean,National Park on the east coast of Canada,0.038
1065,INEX_XER-138,bt_nllb_swahili,National Parks on the East Coast of Canada,0.038
1066,INEX_XER-138,bt_nllb_malay,The U S Canadian East Coast National Park,0.0249
1067,INEX_XER-138,bt_bing_german,National Parks East Coast Canada USA,0.0217
1068,INEX_XER-138,bt_bing_korean,East Coast National Parks of Canada USA,0.0217
1069,INEX_XER-138,bt_bing_russian,National Parks East Coast of Canada USA,0.0217
1070,INEX_XER-138,bt_bing_tamil,National Parks East Coast Canada U S,0.0141
1071,INEX_XER-138,tagmee.topn3,national parks east coast canada us National Parks of Canada Canada United States,0.0107
1072,INEX_XER-139,-1,Films directed by Akira Kurosawa,0.8685
1073,INEX_XER-139,conceptnet.topn3,films directed akira kurosawa oriented Akira Kurosawa,0.9113
1074,INEX_XER-139,sensedisambiguation,Films movie directed direct by Akira Kurosawa,0.8799
1075,INEX_XER-139,bt_nllb_arabic,Movies directed by Akira Kurosawa,0.8711
1076,INEX_XER-139,bt_nllb_swahili,Movies directed by Akira Kurosawa,0.8711
1077,INEX_XER-139,sensedisambiguation.replace,movie direct by Akira kurosawa,0.8711
1078,INEX_XER-139,relevancefeedback.topn10.qld,films directed by akira kurosawa film,0.87
1079,INEX_XER-140,-1,Airports in Germany,0.3824
1080,INEX_XER-140,sensedisambiguation,Airports airport in Germany,0.4484
1081,INEX_XER-141,-1,Universities in Catalunya,0.0776
1082,INEX_XER-141,bt_bing_arabic,Universities in Catalonia,0.2781
1083,INEX_XER-141,bt_bing_chinese_simplified,University in Catalonia,0.2781
1084,INEX_XER-141,bt_bing_french,Universities in Catalonia,0.2781
1085,INEX_XER-141,bt_bing_german,Universities in Catalonia,0.2781
1086,INEX_XER-141,bt_bing_korean,Universities in Catalonia,0.2781
1087,INEX_XER-141,bt_bing_persian,Universities in Catalonia,0.2781
1088,INEX_XER-141,bt_bing_russian,Universities in Catalonia,0.2781
1089,INEX_XER-141,bt_nllb_arabic,Universities in Catalonia,0.2781
1090,INEX_XER-141,bt_nllb_chinese_yue,The University of Catalonia,0.2781
1091,INEX_XER-141,bt_nllb_french,Universities in Catalonia,0.2781
1092,INEX_XER-141,bt_nllb_korean,The University of Catalonia,0.2781
1093,INEX_XER-141,bt_nllb_malay,University of Catalonia,0.2781
1094,INEX_XER-141,bt_nllb_russian,Universities of Catalonia,0.2781
1095,INEX_XER-141,bt_nllb_swahili,Universities in Catalonia,0.2781
1096,INEX_XER-141,bt_nllb_german,Higher education in Catalonia,0.2434
1097,INEX_XER-141,glove.topn3,universities catalunya colleges campuses catalonia jerez,0.2383
1098,INEX_XER-141,relevancefeedback.topn10.bm25,universities in catalunya barcelona univers transvers research joe nroad catalonia star,0.1639
1099,INEX_XER-141,sensedisambiguation,Universities university in Catalunya,0.1107
1100,INEX_XER-141,wiki.topn3,universities catalunya studium generale robert kilwardby siger brabant medieval university catalonia andalusia asturias catalonia,0.0965
1101,INEX_XER-143,-1,Hanseatic league in Germany in the Netherlands Circle,0.0677
1102,INEX_XER-143,relevancefeedback.topn10.bm25,hanseatic league in germany in the netherlands circle netherland germani bocholt dortmund list hanseat bremen town kampen,0.1241
1103,INEX_XER-143,relevancefeedback.topn10.qld,hanseatic league in germany in the netherlands circle bremen netherland germani hanseat list c dortmund kampen,0.107
1104,INEX_XER-143,bt_nllb_tamil,The Hanseatic League in Germany in the Netherlands,0.0739
1105,INEX_XER-144,-1,chess world champions,0.3308
1106,INEX_XER-147,-1,Chemical elements that are named after people,0.0475
1107,INEX_XER-147,bt_bing_chinese_simplified,A chemical element named after a person,0.1921
1108,INEX_XER-147,tagmee.topn3.replace,Chemical element,0.1031
1109,INEX_XER-147,sensedisambiguation,Chemical elements element that are named name after people,0.0698
1110,INEX_XER-60,-1,olympic classes dinghy sailing,0.3111
1111,INEX_XER-62,-1,Neil Gaiman novels,0.7002
1112,INEX_XER-62,sensedisambiguation,Neil Gaiman novels novel,0.7049
1113,INEX_XER-63,-1,Hugo awarded best novels,0.3201
1114,INEX_XER-64,-1,Alan Moore graphic novels adapted to film,0.452
1115,INEX_XER-64,sensedisambiguation.replace,Alan moore graphic novel adjust to movie,0.6087
1116,INEX_XER-64,bt_bing_tamil,Alan Moore graphic novels turned into movies,0.6026
1117,INEX_XER-64,wordnet.topn3,alan moore graphic novels adapted film Douglas Moore G E Moore George Edward Moore lifelike in writing altered adjust cinema take plastic film,0.4963
1118,INEX_XER-64,bt_bing_german,Alan Moore Graphic Novels Adapted,0.4892
1119,INEX_XER-64,bt_nllb_swahili,Alan Moore graphic novels related to film,0.4573
1120,INEX_XER-64,sensedisambiguation,Alan Moore graphic novels novel adapted adjust to film movie,0.4538
1121,INEX_XER-65,-1,Pacific navigators Australia explorers,0.224
1122,INEX_XER-65,relevancefeedback.topn10.bm25,pacific navigators australia explorers de schouten tasman hm cook bayldon navig explor kotzebu torr,0.2587
1123,INEX_XER-65,bt_bing_chinese_simplified,Pacific navigator Australian explorer,0.2447
1124,INEX_XER-65,bt_bing_korean,Pacific Navigator Australian Explorer,0.2447
1125,INEX_XER-67,-1,Ferris and observation wheels,0.5761
1126,INEX_XER-67,bt_bing_korean,Ferris wheel and Ferris wheel,0.8051
1127,INEX_XER-67,stem.trunc5,ferri and obser wheel,0.8051
1128,INEX_XER-67,tagmee.topn3.replace,Ferris wheel,0.8051
1129,INEX_XER-67,bt_bing_german,Ferris and Ferris wheels,0.7716
1130,INEX_XER-67,bt_bing_russian,Ferris and Ferris wheels,0.7716
1131,INEX_XER-67,conceptluster.topn5.3.bm25,ferris observation wheels ferris wheel,0.7524
1132,INEX_XER-67,conceptluster.topn5.3.qld,ferris observation wheels ferris wheel,0.7524
1133,INEX_XER-67,tagmee.topn3,ferris observation wheels Ferris wheel,0.7524
1134,INEX_XER-67,wiki.topn3,ferris observation wheels buildings structures demolished former ferris wheels template ferris wheel ferris wheel,0.6863
1135,INEX_XER-67,bt_bing_chinese_simplified,Ferris wheel and observation wheel,0.6715
1136,INEX_XER-67,bt_bing_french,Ferris wheels and observation wheels,0.6715
1137,INEX_XER-67,sensedisambiguation,Ferris and observation wheels wheel,0.6715
1138,INEX_XER-67,bt_bing_swahili,Ferris and diagnostics wheels,0.6569
1139,INEX_XER-67,bt_nllb_swahili,Ferries and scouting wheels,0.6404
1140,INEX_XER-67,bt_bing_arabic,Ferris and surveillance wheels,0.6347
1141,INEX_XER-72,-1,films shot in Venice,0.2549
1142,INEX_XER-73,-1,magazines about indie-music,0.0339
1143,INEX_XER-73,glove.topn3,magazines indie music publications,0.1526
1144,INEX_XER-73,anchor.topn3,magazines indie music,0.1185
1145,INEX_XER-73,anchor.topn3.replace,magazines indie music,0.1185
1146,INEX_XER-73,bt_bing_french,Indie Music Magazines,0.1185
1147,INEX_XER-73,bt_bing_russian,Indie Music Magazines,0.1185
1148,INEX_XER-73,bt_bing_tamil,Indie music magazines,0.1185
1149,INEX_XER-73,bt_nllb_russian,The magazine on indie music,0.1185
1150,INEX_XER-73,conceptluster.topn5.3.bm25,magazines indie music,0.1185
1151,INEX_XER-73,conceptluster.topn5.3.qld,magazines indie music,0.1185
1152,INEX_XER-73,tagmee.topn3,magazines indie music,0.1185
1153,INEX_XER-73,termluster.topn5.3.bm25,magazines indie music,0.1185
1154,INEX_XER-73,termluster.topn5.3.qld,magazines indie music,0.1185
1155,INEX_XER-73,thesaurus.topn3,magazines indie music,0.1185
1156,INEX_XER-73,thesaurus.topn3.replace,magazines indie music,0.1185
1157,INEX_XER-73,wiki.topn3,magazines indie music,0.1185
1158,INEX_XER-73,wordnet.topn3,magazines indie music magazine publisher cartridge powder magazine,0.0762
1159,INEX_XER-73,bt_bing_arabic,Magazines on independent music,0.057
1160,INEX_XER-73,sensedisambiguation,magazines magazine about indie music,0.049
1161,INEX_XER-73,bt_nllb_french,magazines about independent music,0.0392
1162,INEX_XER-74,-1,circus mammals,0.0355
1163,INEX_XER-74,bertqe.topn10.bm25,rogu eleph african eleph eleph,0.0435
1164,INEX_XER-74,sensedisambiguation,circus mammals mammal,0.0358
1165,INEX_XER-79,-1,Works by Charles Rennie Mackintosh,0.5636
1166,INEX_XER-79,sensedisambiguation.replace,workplace by charles Rennie mackintosh,0.7635
1167,INEX_XER-79,tagmee.topn3,works charles rennie mackintosh Iannis Xenakis Charles Rennie Mackintosh,0.6652
1168,INEX_XER-79,bt_bing_korean,Works by Charles Rennie Mackintosh Carls Rennie Mackintosh,0.6544
1169,INEX_XER-79,bt_bing_persian,Written by Charles Rennie Mackintosh,0.6206
1170,INEX_XER-81,-1,Movies about English hooligans,0.2723
1171,INEX_XER-81,tagmee.topn3.replace,Film English language Hooliganism,0.5175
1172,INEX_XER-81,bt_bing_chinese_simplified,Films about British hooligans,0.4896
1173,INEX_XER-81,bt_bing_korean,Films about British hooligans,0.4896
1174,INEX_XER-81,bt_nllb_swahili,A film about British hooligans,0.4896
1175,INEX_XER-81,bt_bing_arabic,Films about English hooligans,0.4838
1176,INEX_XER-81,bt_bing_french,Films about English hooligans,0.4838
1177,INEX_XER-81,bt_bing_german,Films about English hooligans,0.4838
1178,INEX_XER-81,bt_bing_malay,Films about English hooligans,0.4838
1179,INEX_XER-81,bt_nllb_french,Films about English hooligans,0.4838
1180,INEX_XER-81,bt_nllb_german,Films about English hooligans,0.4838
1181,INEX_XER-81,conceptluster.topn5.3.bm25,movies english hooligans film english language hooliganism,0.419
1182,INEX_XER-81,conceptluster.topn5.3.qld,movies english hooligans film english language hooliganism,0.419
1183,INEX_XER-81,tagmee.topn3,movies english hooligans Film English language Hooliganism,0.419
1184,INEX_XER-81,relevancefeedback.topn10.qld,movies about english hooligans film british footbal game galaxi compound,0.4102
1185,INEX_XER-86,-1,List of countries in World War Two,0.0002
1186,INEX_XER-86,bertqe.topn10.qld,categori world war ii list,0.0597
1187,INEX_XER-86,bt_bing_arabic,List of countries in World War II,0.0418
1188,INEX_XER-86,bt_bing_french,List of countries of World War II,0.0418
1189,INEX_XER-86,bt_bing_german,List of countries in World War II,0.0418
1190,INEX_XER-86,bt_bing_korean,List of countries of World War II,0.0418
1191,INEX_XER-86,bt_bing_persian,List of countries in World War II,0.0418
1192,INEX_XER-86,bt_bing_swahili,List of countries in World War II,0.0418
1193,INEX_XER-86,bt_bing_tamil,List of countries in World War II,0.0418
1194,INEX_XER-86,bt_nllb_arabic,List of countries in World War II,0.0418
1195,INEX_XER-86,bt_nllb_chinese_yue,List of countries in World War II,0.0418
1196,INEX_XER-86,bt_nllb_french,List of countries of World War II,0.0418
1197,INEX_XER-86,bt_nllb_german,List of countries in World War II,0.0418
1198,INEX_XER-86,bt_nllb_malay,List of countries in World War II,0.0418
1199,INEX_XER-86,tagmee.topn3.replace,World War II,0.0414
1200,INEX_XER-86,bt_nllb_korean,List of countries that fought in World War II,0.0133
1201,INEX_XER-86,wiki.topn3,list countries world war two wars involving luxembourg wars involving poland wars involving netherlands world war ii,0.0067
1202,INEX_XER-86,conceptluster.topn5.3.bm25,list countries world war two world war ii,0.0026
1203,INEX_XER-86,conceptluster.topn5.3.qld,list countries world war two world war ii,0.0026
1204,INEX_XER-86,tagmee.topn3,list countries world war two World War II,0.0026
1205,INEX_XER-86,wiki.topn3.replace,wars involving luxembourg wars involving poland wars involving netherlands world war ii,0.0021
1206,INEX_XER-86,wordnet.topn3,list countries world war two number lean area nation human race humans existence warfare state of war II,0.0019
1207,INEX_XER-86,conceptnet.topn3,list countries world war two distribution list continent flag battle double a number number,0.0016
1208,INEX_XER-86,word2vec.topn3,list countries world war two list nations countires coutries globe country conflict three four five,0.0011
1209,INEX_XER-86,glove.topn3,list countries world war two nations governments time ever conflict three four,0.0008
1210,INEX_XER-86,bt_nllb_persian,List of countries involved in World War II,0.0006
1211,INEX_XER-86,bt_nllb_tamil,List of countries involved in World War II,0.0006
1212,INEX_XER-86,bt_bing_russian,List of countries that participated in World War II,0.0005
1213,INEX_XER-86,bt_nllb_swahili,List of countries that participated in World War II,0.0005
1214,INEX_XER-87,-1,Axis powers of World War II,0.1865
1215,INEX_XER-88,-1,Nordic authors who are known for children's literature,0.1899
1216,INEX_XER-88,bt_bing_french,Nordic authors known for children s literature,0.2142
1217,INEX_XER-88,bt_bing_german,Nordic authors known for children s literature,0.2142
1218,INEX_XER-88,bt_nllb_arabic,Nordic authors known for children s literature,0.2142
1219,INEX_XER-88,bt_nllb_french,Nordic authors known for their children s literature,0.2142
1220,INEX_XER-88,bt_nllb_german,Nordic authors known for children s literature,0.2142
1221,INEX_XER-88,termluster.topn5.3.bm25,nordic authors known children s literature,0.2142
1222,INEX_XER-88,termluster.topn5.3.qld,nordic authors known children s literature,0.2142
1223,INEX_XER-88,thesaurus.topn3,nordic authors known children s literature,0.2142
1224,INEX_XER-88,thesaurus.topn3.replace,nordic authors known children s literature,0.2142
1225,INEX_XER-88,rm3.topn10.10.0.5.bm25,Nordic authors who are known for childrens literature,0.2141
1226,INEX_XER-88,rm3.topn10.10.0.5.qld,Nordic authors who are known for childrens literature,0.2141
1227,INEX_XER-91,-1,Paul Auster novels,0.8305
1228,INEX_XER-94,-1,Hybrid cars sold in Europe,0.234
1229,INEX_XER-94,conceptluster.topn5.3.bm25,hybrid cars sold europe hybrid vehicle,0.3061
1230,INEX_XER-94,conceptluster.topn5.3.qld,hybrid cars sold europe hybrid vehicle,0.3061
1231,INEX_XER-94,tagmee.topn3,hybrid cars sold europe Hybrid vehicle Europe,0.2871
1232,INEX_XER-94,bt_bing_chinese_simplified,Hybrid vehicles sold in Europe,0.2603
1233,INEX_XER-94,bt_nllb_german,Hybrid vehicles sold in Europe,0.2603
1234,INEX_XER-94,bt_nllb_tamil,Hybrid vehicles sold in Europe,0.2603
1235,INEX_XER-94,word2vec.topn3,hybrid cars sold europe non hybrid automobiles vehicles bought purchased resold germany european europe,0.2417
1236,INEX_XER-95,-1,Tom Hanks movies where he plays a leading role.,0.1199
1237,INEX_XER-95,bt_bing_korean,A movie starring Tom Hanks,0.2529
1238,INEX_XER-95,wordnet.topn3.replace,gobbler Uncle Tom Tom Hanks Thomas J Hanks motion picture flick fiddle period of play playact star pass moderate purpose character part,0.2076
1239,INEX_XER-95,bt_bing_chinese_simplified,Tom Hanks plays the lead role in the movie,0.169
1240,INEX_XER-95,termluster.topn5.3.bm25,tom hanks movies plays leading role,0.169
1241,INEX_XER-95,termluster.topn5.3.qld,tom hanks movies plays leading role,0.169
1242,INEX_XER-95,thesaurus.topn3,tom hanks movies plays leading role,0.169
1243,INEX_XER-95,thesaurus.topn3.replace,tom hanks movies plays leading role,0.169
1244,INEX_XER-95,stem.paicehusk,tom hank movy wher he play a lead rol,0.1496
1245,INEX_XER-95,stem.trunc4,tom hank movi wher he play a lead role,0.1322
1246,INEX_XER-95,anchor.topn3,tom hanks movies plays leading role meldru knute mrv p mixins vehicle protect,0.1321
1247,INEX_XER-95,tagmee.topn3,tom hanks movies plays leading role Tom Hanks Film Theatre Leading actor,0.1291
1248,INEX_XER-95,sensedisambiguation,Tom turkey cock Hanks hank movies movie where he plays play a leading role function,0.1287
1249,INEX_XER-95,word2vec.topn3,tom hanks movies plays leading role clancy daley kersey slub films led rôle,0.1243
1250,INEX_XER-95,wordnet.topn3,tom hanks movies plays leading role tom turkey gobbler tomcat Thomas J Hanks moving picture picture show moving picture show bid free rein swordplay head chair precede purpose character office,0.1231
1251,INEX_XER-96,-1,Pure object-oriented programing languages,0.0455
1252,INEX_XER-96,glove.topn3,pure object oriented programing languages essence whereas smalltalk constructs simulcasts airs spoken,0.07
1253,INEX_XER-96,relevancefeedback.topn10.bm25,pure object oriented programing languages program design door type tcl languag,0.0645
1254,INEX_XER-97,-1,Compilers that can compile both C and C++,0.0524
1255,INEX_XER-97,bt_nllb_tamil,C and C compilers,0.3435
1256,INEX_XER-97,termluster.topn5.3.bm25,compilers compile c c,0.33
1257,INEX_XER-97,termluster.topn5.3.qld,compilers compile c c,0.33
1258,INEX_XER-97,thesaurus.topn3,compilers compile c c,0.33
1259,INEX_XER-97,thesaurus.topn3.replace,compilers compile c c,0.33
1260,INEX_XER-97,bt_bing_chinese_simplified,Compilers that can compile C and C,0.112
1261,INEX_XER-97,bt_bing_swahili,Compilers that can compile C and C,0.112
1262,INEX_XER-97,sensedisambiguation,Compilers compiler that can compile roll up both C vitamin c and C,0.0925
1263,INEX_XER-97,conceptluster.topn5.3.bm25,compilers compile c c bus,0.0733
1264,INEX_XER-97,conceptluster.topn5.3.qld,compilers compile c c bus,0.0733
1265,INEX_XER-97,wordnet.topn3,compilers compile c c compiling program compose hoard carbon one C speed of light,0.0714
1266,INEX_XER-97,tagmee.topn3,compilers compile c c Compiler CAN bus,0.0699
1267,INEX_XER-98,-1,Makers of lawn tennis rackets,0.0409
1268,INEX_XER-98,tagmee.topn3.replace,Tennis Tennis Racket sports equipment,0.2508
1269,INEX_XER-98,bt_bing_chinese_simplified,Lawn tennis racket manufacturer,0.2125
1270,INEX_XER-98,bt_bing_french,Lawn Tennis Racket Manufacturers,0.2125
1271,INEX_XER-98,bt_bing_german,Manufacturer of lawn tennis rackets,0.2125
1272,INEX_XER-98,bt_bing_korean,Lawn Tennis Racket Manufacturer,0.2125
1273,INEX_XER-98,bt_bing_russian,Lawn Tennis Racket Manufacturers,0.2125
1274,INEX_XER-98,bt_bing_swahili,Manufacturers of lawn tennis rackets,0.2125
1275,INEX_XER-98,bt_nllb_french,Manufacturers of lawn tennis rackets,0.2125
1276,INEX_XER-98,bt_nllb_german,Manufacturers of lawn tennis rackets,0.2125
1277,INEX_XER-98,bt_nllb_malay,Manufacturer of lawn tennis rackets,0.2125
1278,INEX_XER-98,bt_nllb_swahili,Manufacturers of lawn tennis rackets,0.2125
1279,INEX_XER-98,bt_nllb_tamil,The manufacturers of lawn tennis rackets,0.2125
1280,INEX_XER-98,sensedisambiguation.replace,manufacturer of lawn tennis racket,0.2125
1281,INEX_XER-98,sensedisambiguation,Makers manufacturer of lawn tennis rackets racket,0.2084
1282,INEX_XER-98,bt_nllb_korean,We re a manufacturer of lawn tennis rackets,0.2083
1283,INEX_XER-98,tagmee.topn3,makers lawn tennis rackets Tennis Tennis Racket sports equipment,0.1895
1284,INEX_XER-98,bt_nllb_arabic,The manufacturer of tennis racquets for the fatigued,0.1854
1285,INEX_XER-98,conceptluster.topn5.3.bm25,makers lawn tennis rackets tennis racket sports equipment,0.1851
1286,INEX_XER-98,conceptluster.topn5.3.qld,makers lawn tennis rackets tennis racket sports equipment,0.1851
1287,INEX_XER-98,word2vec.topn3,makers lawn tennis rackets manufacturers manufacturer mowing racquet badminton racquets,0.1589
1288,INEX_XER-98,glove.topn3,makers lawn tennis rackets manufacturers beside badminton tournament em,0.153
1289,INEX_XER-98,word2vec.topn3.replace,manufacturers manufacturer mowing racquet badminton racquets,0.1511
1290,INEX_XER-98,wiki.topn3,makers lawn tennis rackets tennis racquet sports sports rules regulations tennis tennis racquet sports sports rules regulations tennis badminton equipment boardsport shuttlecock racket sports equipment,0.0893
1291,INEX_XER-98,wiki.topn3.replace,tennis racquet sports sports rules regulations tennis tennis racquet sports sports rules regulations tennis badminton equipment boardsport shuttlecock racket sports equipment,0.0822
1292,INEX_XER-98,relevancefeedback.topn10.qld,makers of lawn tennis rackets tenni racket,0.0596
1293,INEX_XER-98,wordnet.topn3,makers lawn tennis rackets Divine Jehovah Lord lawn tennis jollify fraudulent scheme revel,0.058
1294,INEX_XER-99,-1,Computer systems that have a recursive acronym for the name,0.4401
1295,INEX_XER-99,conceptluster.topn5.3.bm25,computer systems recursive acronym name recursive acronym,0.4831
1296,INEX_XER-99,conceptluster.topn5.3.qld,computer systems recursive acronym name recursive acronym,0.4831
1297,INEX_XER-99,bt_bing_chinese_simplified,A computer system with a recursive acronym for a name,0.4778
1298,INEX_XER-99,bt_bing_french,Computer systems with a recursive acronym in their name,0.4778
1299,INEX_XER-99,bt_nllb_malay,Computer systems with recursive acronyms for names,0.4778
1300,INEX_XER-99,bt_nllb_russian,Computer systems with a recursive acronym for the name,0.4778
1301,INEX_XER-99,termluster.topn5.3.bm25,computer systems recursive acronym name,0.4778
1302,INEX_XER-99,termluster.topn5.3.qld,computer systems recursive acronym name,0.4778
1303,INEX_XER-99,thesaurus.topn3,computer systems recursive acronym name,0.4778
1304,INEX_XER-99,thesaurus.topn3.replace,computer systems recursive acronym name,0.4778
1305,QALD2_te-1,-1,Which German cities have more than 250000 inhabitants?,0.0049
1306,QALD2_te-1,bt_bing_korean,Which German city has a population of more than,0.0483
1307,QALD2_te-1,bt_nllb_chinese_yue,Which city in Germany has more than people,0.0371
1308,QALD2_te-1,bt_nllb_persian,Which German cities have a population of more than,0.023
1309,QALD2_te-1,wordnet.topn3,german cities inhabitants High German German language metropolis urban center habitant indweller dweller,0.0122
1310,QALD2_te-1,relevancefeedback.topn10.bm25,which german cities have more than inhabitants tangier softwar oper northcliff award deal citi fund lyari hall,0.0115
1311,QALD2_te-1,wiki.topn3,german cities inhabitants ethnigroups germany german people poles germans municipio communications latin america demographics panama demonym,0.0111
1312,QALD2_te-1,bt_nllb_malay,Which city in Germany has more than inhabitants,0.0086
1313,QALD2_te-1,bt_nllb_arabic,What German city has more than inhabitants,0.0069
1314,QALD2_te-1,wordnet.topn3.replace,High German German language metropolis urban center dweller indweller,0.0062
1315,QALD2_te-1,bt_bing_arabic,Which German cities have a population of more than inhabitants,0.0057
1316,QALD2_te-100,-1,Who produces Orangina?,0.4648
1317,QALD2_te-100,bt_nllb_tamil,Who is the maker of Orangina,0.6357
1318,QALD2_te-100,relevancefeedback.topn10.bm25,who produces orangina cocacola mott citi ting oasi villemot american song fanta orangina,0.5579
