2104,QALD2_te-89,relevancefeedback.topn10.qld,in which city was the former dutch queen juliana buried order princess netherland dai kidnap regalia hofman,0.5
2105,QALD2_te-89,wordnet.topn3.replace,metropolis urban center late previous Dutch people queen mole rat fagot fag juliana inter swallow up inhumed,0.5
2106,QALD2_te-89,bt_bing_arabic,What city was the former Dutch Queen Juliana buried in,0.4307
2107,QALD2_te-89,bt_bing_german,What city was former Dutch Queen Juliana buried in,0.4307
2108,QALD2_te-89,bt_bing_persian,What city was the former Dutch queen Juliana buried,0.4307
2109,QALD2_te-89,bt_nllb_french,In what city was the former Dutch Queen Juliana buried,0.4307
2110,QALD2_te-89,bt_nllb_malay,Where is the former Dutch queen Juliana buried,0.4307
2111,QALD2_te-89,termluster.topn5.3.bm25,city former dutch queen juliana buried,0.4307
2112,QALD2_te-89,termluster.topn5.3.qld,city former dutch queen juliana buried,0.4307
2113,QALD2_te-89,thesaurus.topn3,city former dutch queen juliana buried,0.4307
2114,QALD2_te-89,thesaurus.topn3.replace,city former dutch queen juliana buried,0.4307
2115,QALD2_te-89,conceptluster.topn5.3.bm25,city former dutch queen juliana buried juliana netherlands funeral monarchy netherlands dutch language,0.3562
2116,QALD2_te-89,conceptluster.topn5.3.qld,city former dutch queen juliana buried monarchy netherlands funeral juliana netherlands dutch language,0.3562
2117,QALD2_te-89,conceptnet.topn3,city former dutch queen juliana buried capital town king royal crown gillian julianus belowground,0.3562
2118,QALD2_te-89,tagmee.topn3,city former dutch queen juliana buried Dutch language Monarchy of the Netherlands Juliana of the Netherlands Funeral,0.3562
2119,QALD2_te-89,bt_bing_french,What city was the former Queen of the Netherlands Juliana buried in,0.3333
2120,QALD2_te-89,bt_nllb_swahili,In what city was the former Queen Juliana of the Netherlands buried,0.3333
2121,QALD2_te-9,-1,Give me a list of all trumpet players that were bandleaders.,0.3889
2122,QALD2_te-9,conceptluster.topn5.3.bm25,give list trumpet players bandleaders a list give trumpet bandleader,0.5085
2123,QALD2_te-9,conceptluster.topn5.3.qld,give list trumpet players bandleaders give bandleader trumpet a list,0.5085
2124,QALD2_te-9,tagmee.topn3,give list trumpet players bandleaders Give In to Me A list A list Trumpet Bandleader,0.4367
2125,QALD2_te-9,termluster.topn5.3.bm25,give list trumpet players bandleaders,0.4358
2126,QALD2_te-9,termluster.topn5.3.qld,give list trumpet players bandleaders,0.4358
2127,QALD2_te-9,thesaurus.topn3,give list trumpet players bandleaders,0.4358
2128,QALD2_te-9,thesaurus.topn3.replace,give list trumpet players bandleaders,0.4358
2129,QALD2_te-9,wiki.topn3,give list trumpet players bandleaders video greatest hits history foolish beat lovnever felt good give hollywood com central ohio film critics association inappropriatcomedy a list hollywood com central ohio film critics association inappropriatcomedy a list trombone b flat instruments brass instruments trumpet arbors records list jazz trumpeters session musician bandleader,0.4165
2130,QALD2_te-9,sensedisambiguation,Give yield me a list tilt of all trumpet cornet players player that were bandleaders bandleader,0.3925
2131,QALD2_te-90,-1,Where is the residence of the prime minister of Spain?,0.5
2132,QALD2_te-90,termluster.topn5.3.bm25,residence prime minister spain,0.9072
2133,QALD2_te-90,termluster.topn5.3.qld,residence prime minister spain,0.9072
2134,QALD2_te-90,thesaurus.topn3,residence prime minister spain,0.9072
2135,QALD2_te-90,thesaurus.topn3.replace,residence prime minister spain,0.9072
2136,QALD2_te-90,relevancefeedback.topn10.qld,where is the residence of the prime minister of spain spain moncloa barbado minist royal leader australia,0.6433
2137,QALD2_te-90,bt_nllb_french,Where is the residence of the Spanish Prime Minister,0.5995
2138,QALD2_te-90,bt_nllb_german,Where is the residence of the Spanish Prime Minister,0.5995
2139,QALD2_te-90,bt_nllb_malay,Where is the residence of the Spanish prime minister,0.5995
2140,QALD2_te-90,bt_bing_chinese_simplified,Where is the official residence of the Prime Minister of Spain,0.5769
2141,QALD2_te-90,relevancefeedback.topn10.bm25,where is the residence of the prime minister of spain leader eta hi chilean ambassador moncloa royal de unit madagascar,0.5438
2142,QALD2_te-90,sensedisambiguation,Where is the residence residency of the prime premier minister of Spain,0.5155
2143,QALD2_te-90,wordnet.topn3,residence prime minister spain hall mansion house abode undercoat select prime quantity diplomatic minister government minister curate Espana Kingdom of Spain,0.5063
2144,QALD2_te-91,-1,Which U.S. State has the abbreviation MN?,0.0538
2145,QALD2_te-91,stem.lovins,which u s st ha th abbrevi mn,0.2587
2146,QALD2_te-91,wordnet.topn3.replace,United States US Government USA nation land abbreviation North Star State Gopher State,0.1911
2147,QALD2_te-91,bt_bing_arabic,Which US state has the abbreviation MN,0.1814
2148,QALD2_te-91,bt_bing_french,Which US state has the abbreviation MN,0.1814
2149,QALD2_te-91,bt_bing_german,Which US state has the abbreviation MN,0.1814
2150,QALD2_te-91,bt_nllb_french,Which US state has the abbreviation MN,0.1814
2151,QALD2_te-91,bt_nllb_tamil,Which US state has the abbreviation MN,0.1814
2152,QALD2_te-91,anchor.topn3,u s state abbreviation mn us c alphabet daflepur hyperaggress hsiwan minnesota histori minnesota minnesota educ,0.1283
2153,QALD2_te-91,bt_bing_korean,What US state has the abbreviation MN,0.1266
2154,QALD2_te-91,stem.trunc5,which u s state has the abbre mn,0.0948
2155,QALD2_te-91,bt_bing_chinese_simplified,Which state in the United States has an abbreviation MN,0.0944
2156,QALD2_te-91,bt_nllb_malay,Which state in the United States has the abbreviation MN,0.0944
2157,QALD2_te-91,bt_bing_tamil,The abbreviation MN is not used in any U S The province contains,0.0916
2158,QALD2_te-91,relevancefeedback.topn10.qld,which u s state has the abbreviation mn minnesota mass road,0.0911
2159,QALD2_te-91,conceptnet.topn3,u s state abbreviation mn Minnesota manganese bn,0.089
2160,QALD2_te-91,bt_nllb_korean,In which state in the United States is MN abbreviated,0.082
2161,QALD2_te-91,bertqe.topn10.qld,us state abbrevi tradit us,0.0778
2162,QALD2_te-91,word2vec.topn3,u s state abbreviation mn usa u s american federal acronym abbrevation bn tn illion,0.0778
2163,QALD2_te-91,bt_bing_malay,Which US country has the abbreviation MN,0.0737
2164,QALD2_te-91,anchor.topn3.replace,us c alphabet daflepur hyperaggress hsiwan abbreviation minnesota histori minnesota minnesota educ,0.0736
2165,QALD2_te-91,bt_bing_russian,Which U S state uses the abbreviation MN,0.069
2166,QALD2_te-91,termluster.topn5.3.bm25,u s state abbreviation mn,0.0686
2167,QALD2_te-91,termluster.topn5.3.qld,u s state abbreviation mn,0.0686
2168,QALD2_te-91,thesaurus.topn3,u s state abbreviation mn,0.0686
2169,QALD2_te-91,thesaurus.topn3.replace,u s state abbreviation mn,0.0686
2170,QALD2_te-91,sensedisambiguation,Which U S united states government State state of matter has the abbreviation MN minnesota,0.0659
2171,QALD2_te-91,stem.trunc4,whic u s stat has the abbr mn,0.0644
2172,QALD2_te-91,rm3.topn10.10.0.5.bm25,Which U.S. State has the abbreviation MN?,0.0627
2173,QALD2_te-91,rm3.topn10.10.0.5.qld,Which U.S. State has the abbreviation MN?,0.0627
2174,QALD2_te-91,wordnet.topn3,u s state abbreviation mn the States US U S government submit DoS nation Minnesota manganese,0.0584
2175,QALD2_te-91,relevancefeedback.topn10.bm25,which u s state has the abbreviation mn minnesota fest mass parti dog esperanto constructor program,0.0579
2176,QALD2_te-91,bt_nllb_arabic,What U S state has an abbreviation MN,0.0555
2177,QALD2_te-92,-1,Show me all songs from Bruce Springsteen released between 1980 and 1990.,0.1839
2178,QALD2_te-92,bertqe.topn10.qld,singl bruce springsteen song,0.5126
2179,QALD2_te-92,anchor.topn3.replace,show nascar com anında songs sylverston lariwoo small hulk small guthro springsteen e street released,0.3496
2180,QALD2_te-92,anchor.topn3,show songs bruce springsteen released show nascar com anında sylverston lariwoo small hulk small guthro springsteen e street,0.3386
2181,QALD2_te-92,termluster.topn5.3.bm25,show songs bruce springsteen released,0.3194
2182,QALD2_te-92,termluster.topn5.3.qld,show songs bruce springsteen released,0.3194
2183,QALD2_te-92,thesaurus.topn3,show songs bruce springsteen released,0.3194
2184,QALD2_te-92,thesaurus.topn3.replace,show songs bruce springsteen released,0.3194
2185,QALD2_te-92,conceptnet.topn3,show songs bruce springsteen released music verse Robert the Bruce Sir David Bruce springsteenian out,0.2962
2186,QALD2_te-92,wiki.topn3,show songs bruce springsteen released sagthgemini paranoid ty dolla sign song textbook timbo show kid ink song songs musical form lyrics song e street band members paul simon billy joel bruce springsteen,0.2793
2187,QALD2_te-92,bt_bing_korean,Show all of Bruce Springsteen s songs released between and,0.2698
2188,QALD2_te-92,wordnet.topn3,show songs bruce springsteen released appearance register record call Sung dynasty David Bruce Sir David Bruce exhaust eject put out,0.2544
2189,QALD2_te-92,relevancefeedback.topn10.qld,show me all songs from bruce springsteen released between and song titl album,0.2325
2190,QALD2_te-92,rm3.topn10.10.0.5.bm25,Show me all songs from Bruce Springsteen released between 1980 and 1990.,0.216
2191,QALD2_te-92,rm3.topn10.10.0.5.qld,Show me all songs from Bruce Springsteen released between 1980 and 1990.,0.216
2192,QALD2_te-92,relevancefeedback.topn10.bm25,show me all songs from bruce springsteen released between and song album eddi titl,0.185
2193,QALD2_te-93,-1,Which movies did Sam Raimi direct after Army of Darkness?,0.6764
2194,QALD2_te-93,wordnet.topn3,movies sam raimi direct army darkness motion picture flick surface to air missile orchestrate directly verbatim US Army shadow swarthiness,0.8293
2195,QALD2_te-93,bt_bing_swahili,What film did Sam Raimi direct after Army of Darkness,0.8266
2196,QALD2_te-93,bt_bing_tamil,What films did Sam Raimi direct after Army of Darkness,0.8266
2197,QALD2_te-93,bt_nllb_swahili,What films did Sam Raimi direct after the Army of Darkness,0.8266
2198,QALD2_te-93,word2vec.topn3,movies sam raimi direct army darkness films jim alfie mr indirect directly troops light shadows,0.8067
2199,QALD2_te-93,bt_bing_malay,Which film was directed by Sam Raimi after the Army of Darkness,0.7952
2200,QALD2_te-93,bt_bing_korean,What movie did Sam Raimi direct after Armes of Darknes,0.7676
2201,QALD2_te-93,bt_bing_chinese_simplified,What movies did Sam Raimi direct after Army of Darkness,0.7673
2202,QALD2_te-93,bt_bing_french,What movies did Sam Raimi direct after Army of Darkness,0.7673
2203,QALD2_te-93,bt_bing_german,What movies did Sam Raimi direct after Army of Darkness,0.7673
2204,QALD2_te-93,bt_bing_persian,What movies did Sam Raimi direct after The Dark Army,0.7673
2205,QALD2_te-93,bt_nllb_arabic,What movies did Sam Raimi direct after Dark Army,0.7673
2206,QALD2_te-93,bt_nllb_french,What movies did Sam Raimi direct after Army of Darkness,0.7673
2207,QALD2_te-93,bt_nllb_russian,What movies did Sam Raimi direct after the Army of Darkness,0.7673
2208,QALD2_te-93,bt_nllb_tamil,What movies did Sam Raimi direct after the Army went dark,0.7596
2209,QALD2_te-93,glove.topn3,movies sam raimi direct army darkness films svahng zheed moodin pawf indirect directly forces military shadows twilight,0.7509
2210,QALD2_te-93,bt_nllb_korean,Are the films that Ram Raimi made about the army of darkness,0.7434
2211,QALD2_te-93,wiki.topn3,movies sam raimi direct army darkness films type film editing cinematography feature film bruccampbell keith a wester scott squires sam raimi film directors film crew screenwriter film director barb wire piter dvries batman forever army darkness,0.7381
2212,QALD2_te-93,bt_bing_russian,What movies did Sam Raimi make after Army of Darkness,0.736
2213,QALD2_te-93,bt_nllb_chinese_yue,What movies did Sam Raimi direct after the Dark Ages,0.7316
2214,QALD2_te-93,wiki.topn3.replace,films type film editing cinematography feature film bruccampbell keith a wester scott squires sam raimi film directors film crew screenwriter film director barb wire piter dvries batman forever army darkness,0.7228
2215,QALD2_te-93,conceptnet.topn3,movies sam raimi direct army darkness door to door undeviating military general shade,0.7172
2216,QALD2_te-93,bt_nllb_german,What movies did Sam Raimi direct to Army of Darkness,0.7165
2217,QALD2_te-93,termluster.topn5.3.bm25,movies sam raimi direct army darkness,0.715
2218,QALD2_te-93,termluster.topn5.3.qld,movies sam raimi direct army darkness,0.715
2219,QALD2_te-93,thesaurus.topn3,movies sam raimi direct army darkness,0.715
2220,QALD2_te-93,thesaurus.topn3.replace,movies sam raimi direct army darkness,0.715
2221,QALD2_te-93,anchor.topn3,movies sam raimi direct army darkness kantharat mosoeu njacko aofiyebi raimi nureni film cannon direc framework,0.6834
2222,QALD2_te-93,bt_nllb_malay,Which movie was directed by Sam Raimi after Army of Darkness,0.6771
2223,QALD2_te-95,-1,Who wrote the lyrics for the Polish national anthem?,0.0688
2224,QALD2_te-95,conceptluster.topn5.3.bm25,wrote lyrics polish national anthem lyrics poland yet lost,0.3053
2225,QALD2_te-95,conceptluster.topn5.3.qld,wrote lyrics polish national anthem lyrics poland yet lost,0.3053
2226,QALD2_te-95,tagmee.topn3,wrote lyrics polish national anthem Lyrics Poland Is Not Yet Lost,0.3053
2227,QALD2_te-95,tagmee.topn3.replace,Lyrics Poland Is Not Yet Lost,0.2453
2228,QALD2_te-95,sensedisambiguation.replace,Who write the lyric for the polish national hymn,0.2015
2229,QALD2_te-95,word2vec.topn3.replace,writes penned authored songs song polish regional international local song hymn,0.2015
2230,QALD2_te-95,bt_bing_persian,Who wrote the Polish national anthem,0.1884
2231,QALD2_te-95,word2vec.topn3,wrote lyrics polish national anthem writes penned authored songs song regional international local song hymn,0.1597
2232,QALD2_te-95,bt_nllb_arabic,Who wrote the words to the Polish national anthem,0.1538
2233,QALD2_te-95,bt_nllb_french,Who wrote the words to the Polish national anthem,0.1538
2234,QALD2_te-95,bt_nllb_persian,Who wrote the words to the Polish national anthem,0.1538
2235,QALD2_te-95,bt_nllb_swahili,Who wrote the words to the Polish national anthem,0.1538
2236,QALD2_te-95,wiki.topn3,wrote lyrics polish national anthem lyrics song songs lyrics compositions history poland maciej płażyński poland yet lost,0.1376
2237,QALD2_te-95,glove.topn3,wrote lyrics polish national anthem written writing songs song lithuanian hungarian public tune,0.1106
2238,QALD2_te-95,wordnet.topn3,wrote lyrics polish national anthem save publish write words lyric poem burnish finish smooth home subject hymn,0.1065
2239,QALD2_te-95,anchor.topn3,wrote lyrics polish national anthem purred wrote tv wants romanian polski lithuanian sozialisten national noodzaak paris span al hima gaumii community polish,0.1022
2240,QALD2_te-95,sensedisambiguation,Who wrote write the lyrics lyric for the Polish national anthem hymn,0.0961
2241,QALD2_te-95,wiki.topn3.replace,lyrics song songs lyrics compositions history poland maciej płażyński poland yet lost,0.0839
2242,QALD2_te-95,relevancefeedback.topn10.qld,who wrote the lyrics for the polish national anthem anthem nation lao thai cameroon music poland canada alexandrov,0.0781
2243,QALD2_te-97,-1,Who painted The Storm on the Sea of Galilee?,0.5894
2244,QALD2_te-97,conceptluster.topn5.3.bm25,painted storm sea galilee,0.5958
2245,QALD2_te-97,conceptluster.topn5.3.qld,painted storm sea galilee,0.5958
2246,QALD2_te-97,termluster.topn5.3.bm25,painted storm sea galilee,0.5958
2247,QALD2_te-97,termluster.topn5.3.qld,painted storm sea galilee,0.5958
2248,QALD2_te-97,thesaurus.topn3,painted storm sea galilee,0.5958
2249,QALD2_te-97,thesaurus.topn3.replace,painted storm sea galilee,0.5958
2250,QALD2_te-97,tagmee.topn3,painted storm sea galilee The Storm on the Sea of Galilee,0.5915
2251,QALD2_te-98,-1,Which country does the creator of Miffy come from?,0.6015
2252,QALD2_te-98,tagmee.topn3.replace,Miffy,0.6646
2253,QALD2_te-98,tagmee.topn3,country creator miffy come Miffy,0.6461
2254,QALD2_te-98,wiki.topn3,country creator miffy come garbagpicking loossocks gin tonic miffy,0.6461
2255,QALD2_te-98,bt_bing_chinese_simplified,What country is the creator of Miffy from,0.6263
2256,QALD2_te-98,bt_bing_french,What country is the creator of Miffy from,0.6263
2257,QALD2_te-98,bt_bing_german,What country is the creator of Miffy from,0.6263
2258,QALD2_te-98,bt_bing_korean,What country is the creator of Miffy from,0.6263
2259,QALD2_te-98,bt_nllb_german,What country is the creator of Miffy from,0.6263
2260,QALD2_te-98,stem.krovetz,which country do the creator of miffy come from,0.6263
2261,QALD2_te-98,conceptluster.topn5.3.bm25,country creator miffy come,0.6203
2262,QALD2_te-98,conceptluster.topn5.3.qld,country creator miffy come,0.6203
2263,QALD2_te-98,termluster.topn5.3.bm25,country creator miffy come,0.6203
2264,QALD2_te-98,termluster.topn5.3.qld,country creator miffy come,0.6203
2265,QALD2_te-98,thesaurus.topn3,country creator miffy come,0.6203
2266,QALD2_te-98,thesaurus.topn3.replace,country creator miffy come,0.6203
2267,QALD2_te-98,bt_bing_malay,Which country did the creator Miffy come from,0.6155
2268,QALD2_te-98,bt_nllb_french,What country is Miffy s creator from,0.6117
2269,QALD2_te-98,bt_nllb_russian,What country is Miffy s creator from,0.6117
2270,QALD2_te-99,-1,For which label did Elvis record his first album?,0.0337
2271,QALD2_te-99,wiki.topn3,label elvis record first album record labels independent record label independent record labels record label cardiovascular disease deaths tennessee sun records artists las vegas musicians elvis presley music introductions singl music gramophone record twelvalbum bcareful n t wish c cat trance first album twelve album albums media formats billboard album,0.3479
2272,QALD2_te-99,conceptluster.topn5.3.bm25,label elvis record first album elvis presley record label album first album twelve album gramophone record,0.3262
2273,QALD2_te-99,conceptluster.topn5.3.qld,label elvis record first album elvis presley album gramophone record record label first album twelve album,0.3262
2274,QALD2_te-99,tagmee.topn3,label elvis record first album Record label Elvis Presley Gramophone record First Album Twelve album Album,0.3262
2275,QALD2_te-99,tagmee.topn3.replace,Record label Elvis Presley Gramophone record First Album Twelve album Album,0.2633
2276,QALD2_te-99,termluster.topn5.3.bm25,label elvis record first album,0.2468
2277,QALD2_te-99,termluster.topn5.3.qld,label elvis record first album,0.2468
2278,QALD2_te-99,thesaurus.topn3,label elvis record first album,0.2468
2279,QALD2_te-99,thesaurus.topn3.replace,label elvis record first album,0.2468
2280,QALD2_te-99,wiki.topn3.replace,record labels independent record label independent record labels record label cardiovascular disease deaths tennessee sun records artists las vegas musicians elvis presley music introductions singl music gramophone record twelvalbum bcareful n t wish c cat trance first album twelve album albums media formats billboard album,0.232
2281,QALD2_te-99,relevancefeedback.topn10.bm25,for which label did elvis record his first album song album perkin elvi writer,0.1737
2282,QALD2_te-99,relevancefeedback.topn10.qld,for which label did elvis record his first album song perkin elvi album,0.1368
2283,QALD2_te-99,bertqe.topn10.bm25,rev scor link elvi perkin dearland,0.0985
2284,QALD2_te-99,wordnet.topn3,label elvis record first album judge tag pronounce dot window pane phonograph record book register inaugural kickoff firstly record album,0.0363
2285,QALD2_te-99,bt_bing_chinese_simplified,For which record label did Elvis record his first album,0.0349
2286,QALD2_tr-1,-1,Give me all female Russian astronauts.,0.5166
2287,QALD2_tr-1,termluster.topn5.3.bm25,give female russian astronauts,0.8515
2288,QALD2_tr-1,termluster.topn5.3.qld,give female russian astronauts,0.8515
2289,QALD2_tr-1,thesaurus.topn3,give female russian astronauts,0.8515
2290,QALD2_tr-1,thesaurus.topn3.replace,give female russian astronauts,0.8515
2291,QALD2_tr-1,sensedisambiguation.replace,impart me all female russian astronaut,0.7914
2292,QALD2_tr-1,wordnet.topn3,give female russian astronauts grant pass ease up distaff female person spaceman cosmonaut,0.7775
2293,QALD2_tr-1,sensedisambiguation,Give impart me all female Russian astronauts astronaut,0.6909
2294,QALD2_tr-1,bt_bing_chinese_simplified,Give me all Russian female cosmonauts,0.6315
2295,QALD2_tr-1,bt_bing_korean,Give me all the female Russian cosmonauts,0.6315
2296,QALD2_tr-1,bt_bing_malay,Give me all the female Russian cosmonauts,0.6315
2297,QALD2_tr-1,bt_bing_persian,Give me all the Russian female cosmonauts,0.6315
2298,QALD2_tr-1,bt_bing_tamil,Give me all the Russian female cosmonauts,0.6315
2299,QALD2_tr-1,wordnet.topn3.replace,sacrifice turn over open female person distaff russian spaceman cosmonaut,0.6103
2300,QALD2_tr-1,glove.topn3,give female russian astronauts take male woman russia moscow cosmonauts iss,0.6053
2301,QALD2_tr-1,conceptluster.topn5.3.bm25,give female russian astronauts give astronaut russians,0.6031
2302,QALD2_tr-1,conceptluster.topn5.3.qld,give female russian astronauts give astronaut russians,0.6031
2303,QALD2_tr-1,tagmee.topn3,give female russian astronauts Give In to Me Russians Astronaut,0.5902
2304,QALD2_tr-1,bt_nllb_korean,Call all the Russian women astronauts,0.5771
2305,QALD2_tr-10,-1,In which country does the Nile start?,0.0
2306,QALD2_tr-10,wiki.topn3,country nile start socialist state ethnic nationalism self governance nation state water transport egypt rivers egypt rivers south sudan nile,0.4353
2307,QALD2_tr-10,wiki.topn3.replace,socialist state ethnic nationalism self governance nation state water transport egypt rivers egypt rivers south sudan nile,0.4349
2308,QALD2_tr-10,bt_nllb_german,Which country is the source of the Nile,0.1423
2309,QALD2_tr-10,bt_nllb_swahili,From what country does the Nile River begin,0.1226
2310,QALD2_tr-10,bt_nllb_persian,In which country does the Nile River begin,0.092
2311,QALD2_tr-10,bt_bing_tamil,The Nile River starts in which country,0.075
2312,QALD2_tr-10,conceptnet.topn3,country nile start nation river beginning begin,0.0736
2313,QALD2_tr-10,bt_bing_swahili,What country does the Nile begin in,0.0706
2314,QALD2_tr-10,bt_nllb_malay,In what country does the Nile begin,0.0706
2315,QALD2_tr-10,bt_nllb_tamil,What country does the Nile begin in,0.0706
2316,QALD2_tr-10,relevancefeedback.topn10.bm25,in which country does the nile start frasier parti sudan beke dam,0.0682
2317,QALD2_tr-10,bt_nllb_chinese_yue,From which country does the Nile begin,0.0652
2318,QALD2_tr-10,tagmee.topn3,country nile start Nation state Nile,0.0642
2319,QALD2_tr-10,bt_nllb_arabic,In which country does the Nile River start,0.062
2320,QALD2_tr-10,bt_nllb_korean,Which country does the Nile River start in,0.062
2321,QALD2_tr-10,bt_bing_malay,In which country does the Nile begin,0.0618
2322,QALD2_tr-10,bt_bing_russian,In which country does the Nile begin,0.0618
2323,QALD2_tr-11,-1,Which countries have places with more than two caves?,0.086
2324,QALD2_tr-13,-1,Which classis does the Millepede belong to?,1.0
2325,QALD2_tr-15,-1,Who created Goofy?,0.2729
2326,QALD2_tr-15,tagmee.topn3,created goofy Goofy,0.5148
2327,QALD2_tr-15,tagmee.topn3.replace,Goofy,0.4465
2328,QALD2_tr-15,conceptluster.topn5.3.bm25,created goofy,0.4116
2329,QALD2_tr-15,conceptluster.topn5.3.qld,created goofy,0.4116
2330,QALD2_tr-15,termluster.topn5.3.bm25,created goofy,0.4116
2331,QALD2_tr-15,termluster.topn5.3.qld,created goofy,0.4116
2332,QALD2_tr-15,thesaurus.topn3,created goofy,0.4116
2333,QALD2_tr-15,thesaurus.topn3.replace,created goofy,0.4116
2334,QALD2_tr-15,sensedisambiguation,Who created produce Goofy,0.3651
2335,QALD2_tr-15,sensedisambiguation.replace,Who produce goofy,0.3613
2336,QALD2_tr-15,stem.lovins,wh creat goof,0.3609
2337,QALD2_tr-16,-1,Give me the capitals of all countries in Africa.,0.0
2338,QALD2_tr-16,word2vec.topn3,give capitals countries africa provide capitols cities nations countires coutries african africans africa,0.0379
2339,QALD2_tr-16,conceptnet.topn3,give capitals countries africa offer provide pay caps continent flag war a continent a village an elephant,0.0135
2340,QALD2_tr-16,conceptnet.topn3.replace,offer provide pay caps continent flag war a continent a village an elephant,0.0084
2341,QALD2_tr-17,-1,Give me all cities in New Jersey with more than 100000 inhabitants.,0.0
2342,QALD2_tr-17,termluster.topn5.3.bm25,give cities new jersey inhabitants,0.085
2343,QALD2_tr-17,termluster.topn5.3.qld,give cities new jersey inhabitants,0.085
2344,QALD2_tr-17,thesaurus.topn3,give cities new jersey inhabitants,0.085
2345,QALD2_tr-17,thesaurus.topn3.replace,give cities new jersey inhabitants,0.085
2346,QALD2_tr-17,sensedisambiguation,Give impart me all cities city in New raw Jersey new jersey with more than hundred thousand inhabitants inhabitant,0.0723
2347,QALD2_tr-17,relevancefeedback.topn10.qld,give me all cities in new jersey with more than inhabitants list citi jersei provinc ben,0.0551
2348,QALD2_tr-17,glove.topn3,give cities new jersey inhabitants take towns york same n j new mangxamba http www kasparovchess com population natives,0.0547
2349,QALD2_tr-17,rm3.topn10.10.0.5.bm25,Give me all cities in New Jersey with more than 100000 inhabitants.,0.0446
2350,QALD2_tr-17,rm3.topn10.10.0.5.qld,Give me all cities in New Jersey with more than 100000 inhabitants.,0.0446
2351,QALD2_tr-17,wordnet.topn3,give cities new jersey inhabitants grant pass ease up metropolis urban center freshly raw tee shirt NJ hundred thousand lakh dweller indweller,0.0289
2352,QALD2_tr-18,-1,Which museum exhibits The Scream by Munch?,0.0
