2098,QALD2_te-89,wordnet.topn3.replace,metropolis urban center late previous Dutch people queen mole rat fagot fag juliana inter swallow up inhumed,0.3333
2099,QALD2_te-89,bt_bing_arabic,What city was the former Dutch Queen Juliana buried in,0.25
2100,QALD2_te-89,bt_bing_german,What city was former Dutch Queen Juliana buried in,0.25
2101,QALD2_te-89,bt_bing_persian,What city was the former Dutch queen Juliana buried,0.25
2102,QALD2_te-89,bt_nllb_french,In what city was the former Dutch Queen Juliana buried,0.25
2103,QALD2_te-89,bt_nllb_malay,Where is the former Dutch queen Juliana buried,0.25
2104,QALD2_te-89,termluster.topn5.3.bm25,city former dutch queen juliana buried,0.25
2105,QALD2_te-89,termluster.topn5.3.qld,city former dutch queen juliana buried,0.25
2106,QALD2_te-89,thesaurus.topn3,city former dutch queen juliana buried,0.25
2107,QALD2_te-89,thesaurus.topn3.replace,city former dutch queen juliana buried,0.25
2108,QALD2_te-89,conceptluster.topn5.3.bm25,city former dutch queen juliana buried juliana netherlands funeral monarchy netherlands dutch language,0.1667
2109,QALD2_te-89,conceptluster.topn5.3.qld,city former dutch queen juliana buried monarchy netherlands funeral juliana netherlands dutch language,0.1667
2110,QALD2_te-89,conceptnet.topn3,city former dutch queen juliana buried capital town king royal crown gillian julianus belowground,0.1667
2111,QALD2_te-89,tagmee.topn3,city former dutch queen juliana buried Dutch language Monarchy of the Netherlands Juliana of the Netherlands Funeral,0.1667
2112,QALD2_te-89,bt_bing_french,What city was the former Queen of the Netherlands Juliana buried in,0.1429
2113,QALD2_te-89,bt_nllb_swahili,In what city was the former Queen Juliana of the Netherlands buried,0.1429
2114,QALD2_te-9,-1,Give me a list of all trumpet players that were bandleaders.,0.1744
2115,QALD2_te-9,conceptluster.topn5.3.bm25,give list trumpet players bandleaders a list give trumpet bandleader,0.3348
2116,QALD2_te-9,conceptluster.topn5.3.qld,give list trumpet players bandleaders give bandleader trumpet a list,0.3348
2117,QALD2_te-9,tagmee.topn3,give list trumpet players bandleaders Give In to Me A list A list Trumpet Bandleader,0.2859
2118,QALD2_te-9,termluster.topn5.3.bm25,give list trumpet players bandleaders,0.2764
2119,QALD2_te-9,termluster.topn5.3.qld,give list trumpet players bandleaders,0.2764
2120,QALD2_te-9,thesaurus.topn3,give list trumpet players bandleaders,0.2764
2121,QALD2_te-9,thesaurus.topn3.replace,give list trumpet players bandleaders,0.2764
2122,QALD2_te-9,bt_bing_malay,Give me a list of all the trumpet players who are bandleaders,0.196
2123,QALD2_te-9,wiki.topn3,give list trumpet players bandleaders video greatest hits history foolish beat lovnever felt good give hollywood com central ohio film critics association inappropriatcomedy a list hollywood com central ohio film critics association inappropriatcomedy a list trombone b flat instruments brass instruments trumpet arbors records list jazz trumpeters session musician bandleader,0.1928
2124,QALD2_te-9,sensedisambiguation,Give yield me a list tilt of all trumpet cornet players player that were bandleaders bandleader,0.1882
2125,QALD2_te-90,-1,Where is the residence of the prime minister of Spain?,0.2917
2126,QALD2_te-90,termluster.topn5.3.bm25,residence prime minister spain,0.7
2127,QALD2_te-90,termluster.topn5.3.qld,residence prime minister spain,0.7
2128,QALD2_te-90,thesaurus.topn3,residence prime minister spain,0.7
2129,QALD2_te-90,thesaurus.topn3.replace,residence prime minister spain,0.7
2130,QALD2_te-90,wordnet.topn3,residence prime minister spain hall mansion house abode undercoat select prime quantity diplomatic minister government minister curate Espana Kingdom of Spain,0.5156
2131,QALD2_te-90,relevancefeedback.topn10.qld,where is the residence of the prime minister of spain spain moncloa barbado minist royal leader australia,0.5
2132,QALD2_te-90,wordnet.topn3.replace,manse hall premier quality heyday rector pastor government minister Espana Kingdom of Spain,0.5
2133,QALD2_te-90,relevancefeedback.topn10.bm25,where is the residence of the prime minister of spain leader eta hi chilean ambassador moncloa royal de unit madagascar,0.4167
2134,QALD2_te-90,bt_nllb_french,Where is the residence of the Spanish Prime Minister,0.375
2135,QALD2_te-90,bt_nllb_german,Where is the residence of the Spanish Prime Minister,0.375
2136,QALD2_te-90,bt_nllb_malay,Where is the residence of the Spanish prime minister,0.375
2137,QALD2_te-90,sensedisambiguation,Where is the residence residency of the prime premier minister of Spain,0.3333
2138,QALD2_te-90,bt_bing_chinese_simplified,Where is the official residence of the Prime Minister of Spain,0.3214
2139,QALD2_te-91,-1,Which U.S. State has the abbreviation MN?,0.0102
2140,QALD2_te-91,stem.lovins,which u s st ha th abbrevi mn,0.0595
2141,QALD2_te-91,wordnet.topn3.replace,United States US Government USA nation land abbreviation North Star State Gopher State,0.0549
2142,QALD2_te-91,bt_bing_arabic,Which US state has the abbreviation MN,0.0325
2143,QALD2_te-91,bt_bing_french,Which US state has the abbreviation MN,0.0325
2144,QALD2_te-91,bt_bing_german,Which US state has the abbreviation MN,0.0325
2145,QALD2_te-91,bt_nllb_french,Which US state has the abbreviation MN,0.0325
2146,QALD2_te-91,bt_nllb_tamil,Which US state has the abbreviation MN,0.0325
2147,QALD2_te-91,stem.trunc5,which u s state has the abbre mn,0.0286
2148,QALD2_te-91,bt_bing_tamil,The abbreviation MN is not used in any U S The province contains,0.0274
2149,QALD2_te-91,bertqe.topn10.qld,us state abbrevi tradit us,0.0263
2150,QALD2_te-91,word2vec.topn3,u s state abbreviation mn usa u s american federal acronym abbrevation bn tn illion,0.0263
2151,QALD2_te-91,bt_bing_korean,What US state has the abbreviation MN,0.0211
2152,QALD2_te-91,bt_bing_russian,Which U S state uses the abbreviation MN,0.0169
2153,QALD2_te-91,termluster.topn5.3.bm25,u s state abbreviation mn,0.0167
2154,QALD2_te-91,termluster.topn5.3.qld,u s state abbreviation mn,0.0167
2155,QALD2_te-91,thesaurus.topn3,u s state abbreviation mn,0.0167
2156,QALD2_te-91,thesaurus.topn3.replace,u s state abbreviation mn,0.0167
2157,QALD2_te-91,conceptnet.topn3,u s state abbreviation mn Minnesota manganese bn,0.0156
2158,QALD2_te-91,anchor.topn3,u s state abbreviation mn us c alphabet daflepur hyperaggress hsiwan minnesota histori minnesota minnesota educ,0.0153
2159,QALD2_te-91,stem.trunc4,whic u s stat has the abbr mn,0.0148
2160,QALD2_te-91,relevancefeedback.topn10.qld,which u s state has the abbreviation mn minnesota mass road,0.0146
2161,QALD2_te-91,wordnet.topn3,u s state abbreviation mn the States US U S government submit DoS nation Minnesota manganese,0.0123
2162,QALD2_te-91,sensedisambiguation,Which U S united states government State state of matter has the abbreviation MN minnesota,0.0112
2163,QALD2_te-91,bt_nllb_arabic,What U S state has an abbreviation MN,0.0109
2164,QALD2_te-91,bt_nllb_korean,In which state in the United States is MN abbreviated,0.0108
2165,QALD2_te-91,bt_bing_chinese_simplified,Which state in the United States has an abbreviation MN,0.0103
2166,QALD2_te-91,bt_nllb_malay,Which state in the United States has the abbreviation MN,0.0103
2167,QALD2_te-92,-1,Show me all songs from Bruce Springsteen released between 1980 and 1990.,0.0655
2168,QALD2_te-92,bertqe.topn10.qld,singl bruce springsteen song,0.2932
2169,QALD2_te-92,anchor.topn3.replace,show nascar com anında songs sylverston lariwoo small hulk small guthro springsteen e street released,0.1316
2170,QALD2_te-92,wordnet.topn3,show songs bruce springsteen released appearance register record call Sung dynasty David Bruce Sir David Bruce exhaust eject put out,0.121
2171,QALD2_te-92,anchor.topn3,show songs bruce springsteen released show nascar com anında sylverston lariwoo small hulk small guthro springsteen e street,0.1184
2172,QALD2_te-92,conceptnet.topn3,show songs bruce springsteen released music verse Robert the Bruce Sir David Bruce springsteenian out,0.1026
2173,QALD2_te-92,termluster.topn5.3.bm25,show songs bruce springsteen released,0.1016
2174,QALD2_te-92,termluster.topn5.3.qld,show songs bruce springsteen released,0.1016
2175,QALD2_te-92,thesaurus.topn3,show songs bruce springsteen released,0.1016
2176,QALD2_te-92,thesaurus.topn3.replace,show songs bruce springsteen released,0.1016
2177,QALD2_te-92,wiki.topn3,show songs bruce springsteen released sagthgemini paranoid ty dolla sign song textbook timbo show kid ink song songs musical form lyrics song e street band members paul simon billy joel bruce springsteen,0.1006
2178,QALD2_te-92,relevancefeedback.topn10.qld,show me all songs from bruce springsteen released between and song titl album,0.0885
2179,QALD2_te-92,bt_bing_korean,Show all of Bruce Springsteen s songs released between and,0.0839
2180,QALD2_te-92,rm3.topn10.10.0.5.bm25,Show me all songs from Bruce Springsteen released between 1980 and 1990.,0.0728
2181,QALD2_te-92,rm3.topn10.10.0.5.qld,Show me all songs from Bruce Springsteen released between 1980 and 1990.,0.0728
2182,QALD2_te-92,sensedisambiguation,Show usher me all songs sung from Bruce Springsteen released unblock between and,0.0684
2183,QALD2_te-93,-1,Which movies did Sam Raimi direct after Army of Darkness?,0.4479
2184,QALD2_te-93,bt_bing_swahili,What film did Sam Raimi direct after Army of Darkness,0.5959
2185,QALD2_te-93,bt_bing_tamil,What films did Sam Raimi direct after Army of Darkness,0.5959
2186,QALD2_te-93,bt_nllb_swahili,What films did Sam Raimi direct after the Army of Darkness,0.5959
2187,QALD2_te-93,wordnet.topn3,movies sam raimi direct army darkness motion picture flick surface to air missile orchestrate directly verbatim US Army shadow swarthiness,0.5805
2188,QALD2_te-93,bt_bing_malay,Which film was directed by Sam Raimi after the Army of Darkness,0.5417
2189,QALD2_te-93,word2vec.topn3,movies sam raimi direct army darkness films jim alfie mr indirect directly troops light shadows,0.5347
2190,QALD2_te-93,bt_bing_chinese_simplified,What movies did Sam Raimi direct after Army of Darkness,0.5115
2191,QALD2_te-93,bt_bing_french,What movies did Sam Raimi direct after Army of Darkness,0.5115
2192,QALD2_te-93,bt_bing_german,What movies did Sam Raimi direct after Army of Darkness,0.5115
2193,QALD2_te-93,bt_bing_persian,What movies did Sam Raimi direct after The Dark Army,0.5115
2194,QALD2_te-93,bt_nllb_arabic,What movies did Sam Raimi direct after Dark Army,0.5115
2195,QALD2_te-93,bt_nllb_french,What movies did Sam Raimi direct after Army of Darkness,0.5115
2196,QALD2_te-93,bt_nllb_russian,What movies did Sam Raimi direct after the Army of Darkness,0.5115
2197,QALD2_te-93,bt_nllb_tamil,What movies did Sam Raimi direct after the Army went dark,0.4924
2198,QALD2_te-93,wiki.topn3,movies sam raimi direct army darkness films type film editing cinematography feature film bruccampbell keith a wester scott squires sam raimi film directors film crew screenwriter film director barb wire piter dvries batman forever army darkness,0.4853
2199,QALD2_te-93,bt_bing_korean,What movie did Sam Raimi direct after Armes of Darknes,0.473
2200,QALD2_te-93,glove.topn3,movies sam raimi direct army darkness films svahng zheed moodin pawf indirect directly forces military shadows twilight,0.4578
2201,QALD2_te-93,bt_nllb_malay,Which movie was directed by Sam Raimi after Army of Darkness,0.4498
2202,QALD2_te-93,bt_nllb_chinese_yue,What movies did Sam Raimi direct after the Dark Ages,0.448
2203,QALD2_te-95,-1,Who wrote the lyrics for the Polish national anthem?,0.0139
2204,QALD2_te-95,sensedisambiguation.replace,Who write the lyric for the polish national hymn,0.1667
2205,QALD2_te-95,word2vec.topn3.replace,writes penned authored songs song polish regional international local song hymn,0.1667
2206,QALD2_te-95,conceptluster.topn5.3.bm25,wrote lyrics polish national anthem lyrics poland yet lost,0.1346
2207,QALD2_te-95,conceptluster.topn5.3.qld,wrote lyrics polish national anthem lyrics poland yet lost,0.1346
2208,QALD2_te-95,tagmee.topn3,wrote lyrics polish national anthem Lyrics Poland Is Not Yet Lost,0.1346
2209,QALD2_te-95,word2vec.topn3,wrote lyrics polish national anthem writes penned authored songs song regional international local song hymn,0.1111
2210,QALD2_te-95,tagmee.topn3.replace,Lyrics Poland Is Not Yet Lost,0.0847
2211,QALD2_te-95,wiki.topn3,wrote lyrics polish national anthem lyrics song songs lyrics compositions history poland maciej płażyński poland yet lost,0.0833
2212,QALD2_te-95,wordnet.topn3,wrote lyrics polish national anthem save publish write words lyric poem burnish finish smooth home subject hymn,0.0476
2213,QALD2_te-95,sensedisambiguation,Who wrote write the lyrics lyric for the Polish national anthem hymn,0.037
2214,QALD2_te-95,bt_bing_persian,Who wrote the Polish national anthem,0.0321
2215,QALD2_te-95,wiki.topn3.replace,lyrics song songs lyrics compositions history poland maciej płażyński poland yet lost,0.0256
2216,QALD2_te-95,relevancefeedback.topn10.qld,who wrote the lyrics for the polish national anthem anthem nation lao thai cameroon music poland canada alexandrov,0.0208
2217,QALD2_te-95,glove.topn3,wrote lyrics polish national anthem written writing songs song lithuanian hungarian public tune,0.0182
2218,QALD2_te-97,-1,Who painted The Storm on the Sea of Galilee?,0.3174
2219,QALD2_te-97,tagmee.topn3.replace,The Storm on the Sea of Galilee,0.375
2220,QALD2_te-97,conceptluster.topn5.3.bm25,painted storm sea galilee,0.3301
2221,QALD2_te-97,conceptluster.topn5.3.qld,painted storm sea galilee,0.3301
2222,QALD2_te-97,termluster.topn5.3.bm25,painted storm sea galilee,0.3301
2223,QALD2_te-97,termluster.topn5.3.qld,painted storm sea galilee,0.3301
2224,QALD2_te-97,thesaurus.topn3,painted storm sea galilee,0.3301
2225,QALD2_te-97,thesaurus.topn3.replace,painted storm sea galilee,0.3301
2226,QALD2_te-97,tagmee.topn3,painted storm sea galilee The Storm on the Sea of Galilee,0.3237
2227,QALD2_te-98,-1,Which country does the creator of Miffy come from?,0.3846
2228,QALD2_te-98,relevancefeedback.topn10.bm25,which country does the creator of miffy come from remast hukam miffi school land pattern netherland amlash brown comic,0.6667
2229,QALD2_te-98,tagmee.topn3.replace,Miffy,0.5556
2230,QALD2_te-98,conceptnet.topn3,country creator miffy come nation creationism miff irritated return arrive,0.5
2231,QALD2_te-98,tagmee.topn3,country creator miffy come Miffy,0.5
2232,QALD2_te-98,wiki.topn3,country creator miffy come garbagpicking loossocks gin tonic miffy,0.5
2233,QALD2_te-98,bt_bing_chinese_simplified,What country is the creator of Miffy from,0.4444
2234,QALD2_te-98,bt_bing_french,What country is the creator of Miffy from,0.4444
2235,QALD2_te-98,bt_bing_german,What country is the creator of Miffy from,0.4444
2236,QALD2_te-98,bt_bing_korean,What country is the creator of Miffy from,0.4444
2237,QALD2_te-98,bt_nllb_german,What country is the creator of Miffy from,0.4444
2238,QALD2_te-98,stem.krovetz,which country do the creator of miffy come from,0.4444
2239,QALD2_te-98,conceptluster.topn5.3.bm25,country creator miffy come,0.4286
2240,QALD2_te-98,conceptluster.topn5.3.qld,country creator miffy come,0.4286
2241,QALD2_te-98,termluster.topn5.3.bm25,country creator miffy come,0.4286
2242,QALD2_te-98,termluster.topn5.3.qld,country creator miffy come,0.4286
2243,QALD2_te-98,thesaurus.topn3,country creator miffy come,0.4286
2244,QALD2_te-98,thesaurus.topn3.replace,country creator miffy come,0.4286
2245,QALD2_te-98,bt_bing_malay,Which country did the creator Miffy come from,0.4167
2246,QALD2_te-98,bt_nllb_french,What country is Miffy s creator from,0.4074
2247,QALD2_te-98,bt_nllb_russian,What country is Miffy s creator from,0.4074
2248,QALD2_te-99,-1,For which label did Elvis record his first album?,0.0037
2249,QALD2_te-99,wiki.topn3,label elvis record first album record labels independent record label independent record labels record label cardiovascular disease deaths tennessee sun records artists las vegas musicians elvis presley music introductions singl music gramophone record twelvalbum bcareful n t wish c cat trance first album twelve album albums media formats billboard album,0.1457
2250,QALD2_te-99,conceptluster.topn5.3.bm25,label elvis record first album elvis presley record label album first album twelve album gramophone record,0.1328
2251,QALD2_te-99,conceptluster.topn5.3.qld,label elvis record first album elvis presley album gramophone record record label first album twelve album,0.1328
2252,QALD2_te-99,tagmee.topn3,label elvis record first album Record label Elvis Presley Gramophone record First Album Twelve album Album,0.1328
2253,QALD2_te-99,tagmee.topn3.replace,Record label Elvis Presley Gramophone record First Album Twelve album Album,0.1161
2254,QALD2_te-99,termluster.topn5.3.bm25,label elvis record first album,0.088
2255,QALD2_te-99,termluster.topn5.3.qld,label elvis record first album,0.088
2256,QALD2_te-99,thesaurus.topn3,label elvis record first album,0.088
2257,QALD2_te-99,thesaurus.topn3.replace,label elvis record first album,0.088
2258,QALD2_te-99,wiki.topn3.replace,record labels independent record label independent record labels record label cardiovascular disease deaths tennessee sun records artists las vegas musicians elvis presley music introductions singl music gramophone record twelvalbum bcareful n t wish c cat trance first album twelve album albums media formats billboard album,0.0847
2259,QALD2_te-99,relevancefeedback.topn10.bm25,for which label did elvis record his first album song album perkin elvi writer,0.0445
2260,QALD2_te-99,relevancefeedback.topn10.qld,for which label did elvis record his first album song perkin elvi album,0.0213
2261,QALD2_te-99,bertqe.topn10.bm25,rev scor link elvi perkin dearland,0.0103
2262,QALD2_te-99,wordnet.topn3,label elvis record first album judge tag pronounce dot window pane phonograph record book register inaugural kickoff firstly record album,0.0048
2263,QALD2_te-99,bt_bing_chinese_simplified,For which record label did Elvis record his first album,0.0042
2264,QALD2_tr-1,-1,Give me all female Russian astronauts.,0.2546
2265,QALD2_tr-1,termluster.topn5.3.bm25,give female russian astronauts,0.6269
2266,QALD2_tr-1,termluster.topn5.3.qld,give female russian astronauts,0.6269
2267,QALD2_tr-1,thesaurus.topn3,give female russian astronauts,0.6269
2268,QALD2_tr-1,thesaurus.topn3.replace,give female russian astronauts,0.6269
2269,QALD2_tr-1,sensedisambiguation.replace,impart me all female russian astronaut,0.553
2270,QALD2_tr-1,wordnet.topn3,give female russian astronauts grant pass ease up distaff female person spaceman cosmonaut,0.5212
2271,QALD2_tr-1,sensedisambiguation,Give impart me all female Russian astronauts astronaut,0.4851
2272,QALD2_tr-1,bt_bing_chinese_simplified,Give me all Russian female cosmonauts,0.4061
2273,QALD2_tr-1,bt_bing_korean,Give me all the female Russian cosmonauts,0.4061
2274,QALD2_tr-1,bt_bing_malay,Give me all the female Russian cosmonauts,0.4061
2275,QALD2_tr-1,bt_bing_persian,Give me all the Russian female cosmonauts,0.4061
2276,QALD2_tr-1,bt_bing_tamil,Give me all the Russian female cosmonauts,0.4061
2277,QALD2_tr-1,conceptluster.topn5.3.bm25,give female russian astronauts give astronaut russians,0.3904
2278,QALD2_tr-1,conceptluster.topn5.3.qld,give female russian astronauts give astronaut russians,0.3904
2279,QALD2_tr-1,tagmee.topn3,give female russian astronauts Give In to Me Russians Astronaut,0.3631
2280,QALD2_tr-1,wordnet.topn3.replace,sacrifice turn over open female person distaff russian spaceman cosmonaut,0.3477
2281,QALD2_tr-1,bt_nllb_korean,Call all the Russian women astronauts,0.2941
2282,QALD2_tr-1,relevancefeedback.topn10.qld,give me all female russian astronauts card he rhoda space soyuz kondakova ben song theorem,0.2695
2283,QALD2_tr-1,glove.topn3,give female russian astronauts take male woman russia moscow cosmonauts iss,0.2636
2284,QALD2_tr-10,-1,In which country does the Nile start?,0.0
2285,QALD2_tr-10,wiki.topn3,country nile start socialist state ethnic nationalism self governance nation state water transport egypt rivers egypt rivers south sudan nile,0.1744
2286,QALD2_tr-10,wiki.topn3.replace,socialist state ethnic nationalism self governance nation state water transport egypt rivers egypt rivers south sudan nile,0.1742
2287,QALD2_tr-10,bt_nllb_german,Which country is the source of the Nile,0.0333
2288,QALD2_tr-10,bt_nllb_swahili,From what country does the Nile River begin,0.0238
2289,QALD2_tr-10,bt_nllb_persian,In which country does the Nile River begin,0.0111
2290,QALD2_tr-10,bt_bing_tamil,The Nile River starts in which country,0.0057
2291,QALD2_tr-10,conceptnet.topn3,country nile start nation river beginning begin,0.0054
2292,QALD2_tr-10,bt_bing_swahili,What country does the Nile begin in,0.0046
2293,QALD2_tr-10,bt_nllb_malay,In what country does the Nile begin,0.0046
2294,QALD2_tr-10,bt_nllb_tamil,What country does the Nile begin in,0.0046
2295,QALD2_tr-10,relevancefeedback.topn10.bm25,in which country does the nile start frasier parti sudan beke dam,0.0041
2296,QALD2_tr-10,bt_nllb_chinese_yue,From which country does the Nile begin,0.0034
2297,QALD2_tr-10,tagmee.topn3,country nile start Nation state Nile,0.0032
2298,QALD2_tr-10,bt_nllb_arabic,In which country does the Nile River start,0.0028
2299,QALD2_tr-10,bt_nllb_korean,Which country does the Nile River start in,0.0028
2300,QALD2_tr-10,bt_bing_malay,In which country does the Nile begin,0.0027
2301,QALD2_tr-10,bt_bing_russian,In which country does the Nile begin,0.0027
2302,QALD2_tr-11,-1,Which countries have places with more than two caves?,0.0228
2303,QALD2_tr-13,-1,Which classis does the Millepede belong to?,1.0
2304,QALD2_tr-15,-1,Who created Goofy?,0.0751
2305,QALD2_tr-15,tagmee.topn3,created goofy Goofy,0.2875
2306,QALD2_tr-15,stem.lovins,wh creat goof,0.2002
2307,QALD2_tr-15,tagmee.topn3.replace,Goofy,0.1917
2308,QALD2_tr-15,conceptluster.topn5.3.bm25,created goofy,0.1838
2309,QALD2_tr-15,conceptluster.topn5.3.qld,created goofy,0.1838
2310,QALD2_tr-15,termluster.topn5.3.bm25,created goofy,0.1838
2311,QALD2_tr-15,termluster.topn5.3.qld,created goofy,0.1838
2312,QALD2_tr-15,thesaurus.topn3,created goofy,0.1838
2313,QALD2_tr-15,thesaurus.topn3.replace,created goofy,0.1838
2314,QALD2_tr-15,sensedisambiguation.replace,Who produce goofy,0.1653
2315,QALD2_tr-15,sensedisambiguation,Who created produce Goofy,0.1367
2316,QALD2_tr-16,-1,Give me the capitals of all countries in Africa.,0.0
2317,QALD2_tr-16,word2vec.topn3,give capitals countries africa provide capitols cities nations countires coutries african africans africa,0.0029
2318,QALD2_tr-16,conceptnet.topn3,give capitals countries africa offer provide pay caps continent flag war a continent a village an elephant,0.0022
2319,QALD2_tr-16,conceptnet.topn3.replace,offer provide pay caps continent flag war a continent a village an elephant,0.0005
2320,QALD2_tr-17,-1,Give me all cities in New Jersey with more than 100000 inhabitants.,0.0
2321,QALD2_tr-17,rm3.topn10.10.0.5.bm25,Give me all cities in New Jersey with more than 100000 inhabitants.,0.0085
2322,QALD2_tr-17,rm3.topn10.10.0.5.qld,Give me all cities in New Jersey with more than 100000 inhabitants.,0.0085
2323,QALD2_tr-17,termluster.topn5.3.bm25,give cities new jersey inhabitants,0.0074
2324,QALD2_tr-17,termluster.topn5.3.qld,give cities new jersey inhabitants,0.0074
2325,QALD2_tr-17,thesaurus.topn3,give cities new jersey inhabitants,0.0074
2326,QALD2_tr-17,thesaurus.topn3.replace,give cities new jersey inhabitants,0.0074
2327,QALD2_tr-17,sensedisambiguation,Give impart me all cities city in New raw Jersey new jersey with more than hundred thousand inhabitants inhabitant,0.0044
2328,QALD2_tr-17,wordnet.topn3,give cities new jersey inhabitants grant pass ease up metropolis urban center freshly raw tee shirt NJ hundred thousand lakh dweller indweller,0.0019
2329,QALD2_tr-17,relevancefeedback.topn10.qld,give me all cities in new jersey with more than inhabitants list citi jersei provinc ben,0.0016
2330,QALD2_tr-17,glove.topn3,give cities new jersey inhabitants take towns york same n j new mangxamba http www kasparovchess com population natives,0.0015
2331,QALD2_tr-18,-1,Which museum exhibits The Scream by Munch?,0.0
2332,QALD2_tr-18,wiki.topn3.replace,museums tourist activities museology museum museums tourist activities museology museum expressionist paintings madonna edvard munch ben day dots scream kurt schwitters madonna edvard munch national museum art architecturand design edvard munch,0.0909
2333,QALD2_tr-18,wiki.topn3,museum exhibits scream munch museums tourist activities museology museum museums tourist activities museology museum expressionist paintings madonna edvard munch ben day dots scream kurt schwitters madonna edvard munch national museum art architecturand design edvard munch,0.0667
2334,QALD2_tr-18,tagmee.topn3.replace,Museum Museum The Scream Edvard Munch,0.0345
2335,QALD2_tr-18,sensedisambiguation.replace,Which museum expose The screech by munch,0.0286
2336,QALD2_tr-18,conceptluster.topn5.3.bm25,museum exhibits scream munch museum edvard munch,0.0204
2337,QALD2_tr-18,conceptluster.topn5.3.qld,museum exhibits scream munch edvard munch museum,0.0204
2338,QALD2_tr-18,bt_nllb_swahili,What museum is the Munch Declaration testimony to,0.0192
2339,QALD2_tr-18,tagmee.topn3,museum exhibits scream munch Museum Museum The Scream Edvard Munch,0.0189
2340,QALD2_tr-18,bt_nllb_french,What museum is showing Munch s Cry,0.0149
2341,QALD2_tr-18,bertqe.topn10.qld,paint edvard munch norwegian pronunci,0.0135
2342,QALD2_tr-18,conceptnet.topn3.replace,art glory days yell munch,0.0135
2343,QALD2_tr-18,bt_bing_swahili,What museums display Scream and Munch,0.0112
2344,QALD2_tr-18,bt_bing_arabic,Which museum displays The Scream of Munch,0.0103
2345,QALD2_tr-18,bt_bing_tamil,Which museum is The Scream by Munch on display,0.0103
2346,QALD2_tr-21,-1,Which states border Illinois?,0.1133
2347,QALD2_tr-21,termluster.topn5.3.bm25,states border illinois,0.1265
