1028,INEX_XER-125,bt_bing_german,Countries that have won the FIFA World Cup,0.2269
1029,INEX_XER-125,bt_bing_korean,Countries that have won the FIFA World Cup,0.2269
1030,INEX_XER-125,bt_bing_malay,countries that have won the FIFA World Cup,0.2269
1031,INEX_XER-125,bt_bing_russian,Countries that have won the FIFA World Cup,0.2269
1032,INEX_XER-125,bt_bing_swahili,Countries that have won the FIFA World Cup,0.2269
1033,INEX_XER-125,bt_nllb_arabic,Countries that have won the FIFA World Cup,0.2269
1034,INEX_XER-125,bt_nllb_french,countries that have won the FIFA World Cup,0.2269
1035,INEX_XER-125,bt_nllb_german,Countries that have won the FIFA World Cup,0.2269
1036,INEX_XER-125,bt_nllb_malay,countries that have won the FIFA World Cup,0.2269
1037,INEX_XER-125,bt_nllb_swahili,countries that have won the FIFA World Cup,0.2269
1038,INEX_XER-125,stem.trunc4,coun whic have won the fifa worl cup,0.1731
1039,INEX_XER-125,sensedisambiguation,countries state which have won win the FIFA world worldly concern cup,0.1591
1040,INEX_XER-125,stem.trunc5,count which have won the fifa world cup,0.1535
1041,INEX_XER-126,-1,toy train manufacturers that are still in business,0.4353
1042,INEX_XER-126,relevancefeedback.topn10.qld,toy train manufacturers that are still in business toi lionel gilbert triang scale compani steam,0.5225
1043,INEX_XER-126,tagmee.topn3.replace,Toy train Manufacturing Business,0.4899
1044,INEX_XER-126,conceptluster.topn5.3.bm25,toy train manufacturers still business manufacturing business toy train,0.4643
1045,INEX_XER-126,conceptluster.topn5.3.qld,toy train manufacturers still business toy train business manufacturing,0.4643
1046,INEX_XER-126,tagmee.topn3,toy train manufacturers still business Toy train Manufacturing Business,0.4643
1047,INEX_XER-127,-1,german female politicians,0.4639
1048,INEX_XER-127,conceptluster.topn5.3.bm25,german female politicians germans,0.4703
1049,INEX_XER-127,conceptluster.topn5.3.qld,german female politicians germans,0.4703
1050,INEX_XER-127,tagmee.topn3,german female politicians Germans,0.4703
1051,INEX_XER-127,sensedisambiguation,german female politicians politician,0.4657
1052,INEX_XER-128,-1,Bond girls,0.5922
1053,INEX_XER-129,-1,Science fiction book written in the 1980,0.043
1054,INEX_XER-129,rm3.topn10.10.0.5.bm25,Science fiction book written in the 1980,0.3581
1055,INEX_XER-129,rm3.topn10.10.0.5.qld,Science fiction book written in the 1980,0.3581
1056,INEX_XER-130,-1,Star Trek Captains,0.6955
1057,INEX_XER-132,-1,living nordic classical composers,0.4552
1058,INEX_XER-133,-1,EU countries,0.1792
1059,INEX_XER-133,sensedisambiguation,EU european union countries state,0.2349
1060,INEX_XER-133,conceptluster.topn5.3.bm25,eu countries european union nation,0.2001
1061,INEX_XER-133,conceptluster.topn5.3.qld,eu countries european union nation,0.2001
1062,INEX_XER-133,tagmee.topn3,eu countries European Union Nation,0.2001
1063,INEX_XER-134,-1,record-breaking sprinters in male 100-meter sprints,0.2089
1064,INEX_XER-134,rm3.topn10.10.0.5.bm25,record-breaking sprinters in male 100-meter sprints,0.2612
1065,INEX_XER-134,rm3.topn10.10.0.5.qld,record-breaking sprinters in male 100-meter sprints,0.2612
1066,INEX_XER-134,conceptluster.topn5.3.bm25,record breaking sprinters male meter sprints sprint running metres,0.219
1067,INEX_XER-134,conceptluster.topn5.3.qld,record breaking sprinters male meter sprints sprint running metres,0.219
1068,INEX_XER-134,tagmee.topn3,record breaking sprinters male meter sprints Sprint running metres Sprint running,0.2189
1069,INEX_XER-135,-1,professional baseball team in Japan,0.4777
1070,INEX_XER-136,-1,Japanese players in Major League Baseball,0.8356
1071,INEX_XER-138,-1,National Parks East Coast Canada US,0.0831
1072,INEX_XER-138,bt_nllb_russian,National parks of the Eastern coast of Canada,0.2271
1073,INEX_XER-138,bt_nllb_korean,National Park on the east coast of Canada,0.139
1074,INEX_XER-138,bt_nllb_swahili,National Parks on the East Coast of Canada,0.139
1075,INEX_XER-138,bt_nllb_malay,The U S Canadian East Coast National Park,0.1089
1076,INEX_XER-138,tagmee.topn3,national parks east coast canada us National Parks of Canada Canada United States,0.093
1077,INEX_XER-138,bt_bing_german,National Parks East Coast Canada USA,0.092
1078,INEX_XER-138,bt_bing_korean,East Coast National Parks of Canada USA,0.092
1079,INEX_XER-138,bt_bing_russian,National Parks East Coast of Canada USA,0.092
1080,INEX_XER-138,bt_bing_tamil,National Parks East Coast Canada U S,0.0905
1081,INEX_XER-139,-1,Films directed by Akira Kurosawa,0.8795
1082,INEX_XER-139,bt_nllb_arabic,Movies directed by Akira Kurosawa,0.9468
1083,INEX_XER-139,bt_nllb_swahili,Movies directed by Akira Kurosawa,0.9468
1084,INEX_XER-139,sensedisambiguation.replace,movie direct by Akira kurosawa,0.9468
1085,INEX_XER-139,sensedisambiguation,Films movie directed direct by Akira Kurosawa,0.9443
1086,INEX_XER-139,relevancefeedback.topn10.bm25,films directed by akira kurosawa film tsuchiya,0.9176
1087,INEX_XER-139,conceptnet.topn3,films directed akira kurosawa oriented Akira Kurosawa,0.9104
1088,INEX_XER-139,relevancefeedback.topn10.qld,films directed by akira kurosawa film,0.8814
1089,INEX_XER-140,-1,Airports in Germany,0.5903
1090,INEX_XER-140,sensedisambiguation,Airports airport in Germany,0.6377
1091,INEX_XER-141,-1,Universities in Catalunya,0.3161
1092,INEX_XER-141,bt_bing_arabic,Universities in Catalonia,0.5916
1093,INEX_XER-141,bt_bing_chinese_simplified,University in Catalonia,0.5916
1094,INEX_XER-141,bt_bing_french,Universities in Catalonia,0.5916
1095,INEX_XER-141,bt_bing_german,Universities in Catalonia,0.5916
1096,INEX_XER-141,bt_bing_korean,Universities in Catalonia,0.5916
1097,INEX_XER-141,bt_bing_persian,Universities in Catalonia,0.5916
1098,INEX_XER-141,bt_bing_russian,Universities in Catalonia,0.5916
1099,INEX_XER-141,bt_nllb_arabic,Universities in Catalonia,0.5916
1100,INEX_XER-141,bt_nllb_chinese_yue,The University of Catalonia,0.5916
1101,INEX_XER-141,bt_nllb_french,Universities in Catalonia,0.5916
1102,INEX_XER-141,bt_nllb_korean,The University of Catalonia,0.5916
1103,INEX_XER-141,bt_nllb_malay,University of Catalonia,0.5916
1104,INEX_XER-141,bt_nllb_russian,Universities of Catalonia,0.5916
1105,INEX_XER-141,bt_nllb_swahili,Universities in Catalonia,0.5916
1106,INEX_XER-141,glove.topn3,universities catalunya colleges campuses catalonia jerez,0.4591
1107,INEX_XER-141,bt_nllb_german,Higher education in Catalonia,0.4503
1108,INEX_XER-141,relevancefeedback.topn10.bm25,universities in catalunya barcelona univers transvers research joe nroad catalonia star,0.4081
1109,INEX_XER-141,sensedisambiguation,Universities university in Catalunya,0.3716
1110,INEX_XER-143,-1,Hanseatic league in Germany in the Netherlands Circle,0.2536
1111,INEX_XER-143,relevancefeedback.topn10.bm25,hanseatic league in germany in the netherlands circle netherland germani bocholt dortmund list hanseat bremen town kampen,0.3984
1112,INEX_XER-143,relevancefeedback.topn10.qld,hanseatic league in germany in the netherlands circle bremen netherland germani hanseat list c dortmund kampen,0.3352
1113,INEX_XER-143,bt_nllb_tamil,The Hanseatic League in Germany in the Netherlands,0.2742
1114,INEX_XER-144,-1,chess world champions,0.5237
1115,INEX_XER-147,-1,Chemical elements that are named after people,0.2347
1116,INEX_XER-147,bt_bing_chinese_simplified,A chemical element named after a person,0.4442
1117,INEX_XER-147,tagmee.topn3.replace,Chemical element,0.3149
1118,INEX_XER-147,sensedisambiguation,Chemical elements element that are named name after people,0.2876
1119,INEX_XER-60,-1,olympic classes dinghy sailing,0.5685
1120,INEX_XER-60,bt_bing_chinese_simplified,Olympic class dinghy sailboat,0.5884
1121,INEX_XER-62,-1,Neil Gaiman novels,0.8491
1122,INEX_XER-62,sensedisambiguation,Neil Gaiman novels novel,0.8737
1123,INEX_XER-63,-1,Hugo awarded best novels,0.5489
1124,INEX_XER-64,-1,Alan Moore graphic novels adapted to film,0.6559
1125,INEX_XER-64,sensedisambiguation.replace,Alan moore graphic novel adjust to movie,0.7701
1126,INEX_XER-64,bt_bing_tamil,Alan Moore graphic novels turned into movies,0.742
1127,INEX_XER-64,wordnet.topn3,alan moore graphic novels adapted film Douglas Moore G E Moore George Edward Moore lifelike in writing altered adjust cinema take plastic film,0.6879
1128,INEX_XER-64,anchor.topn3,alan moore graphic novels adapted film kaimali dunbarney mal alan sprites animation focused pro pro psychology environ economics journ svalbard fauna femba tokongsub film insul,0.667
1129,INEX_XER-64,sensedisambiguation,Alan Moore graphic novels novel adapted adjust to film movie,0.6665
1130,INEX_XER-64,bt_bing_german,Alan Moore Graphic Novels Adapted,0.6577
1131,INEX_XER-65,-1,Pacific navigators Australia explorers,0.4612
1132,INEX_XER-65,relevancefeedback.topn10.bm25,pacific navigators australia explorers de schouten tasman hm cook bayldon navig explor kotzebu torr,0.4993
1133,INEX_XER-65,sensedisambiguation,Pacific navigators navigator Australia explorers explorer,0.4923
1134,INEX_XER-65,bt_bing_chinese_simplified,Pacific navigator Australian explorer,0.4862
1135,INEX_XER-65,bt_bing_korean,Pacific Navigator Australian Explorer,0.4862
1136,INEX_XER-65,wiki.topn3,pacific navigators australia explorers pacifiocean oceans atlantic ocean pacific ocean circumnavigation lieutenant navy sortie navigator australia states territories australia australian capital cities australia list explorers continental drift javla grande exploration,0.4627
1137,INEX_XER-67,-1,Ferris and observation wheels,0.78
1138,INEX_XER-67,bt_bing_korean,Ferris wheel and Ferris wheel,0.8853
1139,INEX_XER-67,stem.trunc5,ferri and obser wheel,0.8853
1140,INEX_XER-67,tagmee.topn3.replace,Ferris wheel,0.8853
1141,INEX_XER-67,bt_bing_german,Ferris and Ferris wheels,0.861
1142,INEX_XER-67,bt_bing_russian,Ferris and Ferris wheels,0.861
1143,INEX_XER-67,conceptluster.topn5.3.bm25,ferris observation wheels ferris wheel,0.8299
1144,INEX_XER-67,conceptluster.topn5.3.qld,ferris observation wheels ferris wheel,0.8299
1145,INEX_XER-67,tagmee.topn3,ferris observation wheels Ferris wheel,0.8299
1146,INEX_XER-67,bt_bing_chinese_simplified,Ferris wheel and observation wheel,0.8048
1147,INEX_XER-67,bt_bing_french,Ferris wheels and observation wheels,0.8048
1148,INEX_XER-67,sensedisambiguation,Ferris and observation wheels wheel,0.8048
1149,INEX_XER-72,-1,films shot in Venice,0.4989
1150,INEX_XER-73,-1,magazines about indie-music,0.0753
1151,INEX_XER-73,glove.topn3,magazines indie music publications,0.3588
1152,INEX_XER-73,anchor.topn3,magazines indie music,0.3043
1153,INEX_XER-73,anchor.topn3.replace,magazines indie music,0.3043
1154,INEX_XER-73,bt_bing_french,Indie Music Magazines,0.3043
1155,INEX_XER-73,bt_bing_russian,Indie Music Magazines,0.3043
1156,INEX_XER-73,bt_bing_tamil,Indie music magazines,0.3043
1157,INEX_XER-73,bt_nllb_russian,The magazine on indie music,0.3043
1158,INEX_XER-73,conceptluster.topn5.3.bm25,magazines indie music,0.3043
1159,INEX_XER-73,conceptluster.topn5.3.qld,magazines indie music,0.3043
1160,INEX_XER-73,tagmee.topn3,magazines indie music,0.3043
1161,INEX_XER-73,termluster.topn5.3.bm25,magazines indie music,0.3043
1162,INEX_XER-73,termluster.topn5.3.qld,magazines indie music,0.3043
1163,INEX_XER-73,thesaurus.topn3,magazines indie music,0.3043
1164,INEX_XER-73,thesaurus.topn3.replace,magazines indie music,0.3043
1165,INEX_XER-73,wiki.topn3,magazines indie music,0.3043
1166,INEX_XER-73,wordnet.topn3,magazines indie music magazine publisher cartridge powder magazine,0.2899
1167,INEX_XER-73,bt_bing_arabic,Magazines on independent music,0.2291
1168,INEX_XER-73,conceptnet.topn3,magazines indie music the library the doctor printed on paper,0.1174
1169,INEX_XER-73,glove.topn3.replace,publications indie music,0.0919
1170,INEX_XER-73,sensedisambiguation,magazines magazine about indie music,0.0895
1171,INEX_XER-73,bt_nllb_french,magazines about independent music,0.0809
1172,INEX_XER-74,-1,circus mammals,0.1587
1173,INEX_XER-74,sensedisambiguation,circus mammals mammal,0.1593
1174,INEX_XER-79,-1,Works by Charles Rennie Mackintosh,0.7976
1175,INEX_XER-79,sensedisambiguation.replace,workplace by charles Rennie mackintosh,0.8947
1176,INEX_XER-79,tagmee.topn3,works charles rennie mackintosh Iannis Xenakis Charles Rennie Mackintosh,0.8364
1177,INEX_XER-79,bt_bing_korean,Works by Charles Rennie Mackintosh Carls Rennie Mackintosh,0.8303
1178,INEX_XER-81,-1,Movies about English hooligans,0.6572
1179,INEX_XER-81,bt_bing_chinese_simplified,Films about British hooligans,0.7976
1180,INEX_XER-81,bt_bing_korean,Films about British hooligans,0.7976
1181,INEX_XER-81,bt_nllb_swahili,A film about British hooligans,0.7976
1182,INEX_XER-81,bt_bing_arabic,Films about English hooligans,0.7847
1183,INEX_XER-81,bt_bing_french,Films about English hooligans,0.7847
1184,INEX_XER-81,bt_bing_german,Films about English hooligans,0.7847
1185,INEX_XER-81,bt_bing_malay,Films about English hooligans,0.7847
1186,INEX_XER-81,bt_nllb_french,Films about English hooligans,0.7847
1187,INEX_XER-81,bt_nllb_german,Films about English hooligans,0.7847
1188,INEX_XER-81,tagmee.topn3.replace,Film English language Hooliganism,0.7669
1189,INEX_XER-81,relevancefeedback.topn10.qld,movies about english hooligans film british footbal game galaxi compound,0.6998
1190,INEX_XER-81,conceptluster.topn5.3.bm25,movies english hooligans film english language hooliganism,0.6888
1191,INEX_XER-81,conceptluster.topn5.3.qld,movies english hooligans film english language hooliganism,0.6888
1192,INEX_XER-81,tagmee.topn3,movies english hooligans Film English language Hooliganism,0.6888
1193,INEX_XER-86,-1,List of countries in World War Two,0.0061
1194,INEX_XER-86,bertqe.topn10.qld,categori world war ii list,0.1323
1195,INEX_XER-86,bt_bing_arabic,List of countries in World War II,0.1219
1196,INEX_XER-86,bt_bing_french,List of countries of World War II,0.1219
1197,INEX_XER-86,bt_bing_german,List of countries in World War II,0.1219
1198,INEX_XER-86,bt_bing_korean,List of countries of World War II,0.1219
1199,INEX_XER-86,bt_bing_persian,List of countries in World War II,0.1219
1200,INEX_XER-86,bt_bing_swahili,List of countries in World War II,0.1219
1201,INEX_XER-86,bt_bing_tamil,List of countries in World War II,0.1219
1202,INEX_XER-86,bt_nllb_arabic,List of countries in World War II,0.1219
1203,INEX_XER-86,bt_nllb_chinese_yue,List of countries in World War II,0.1219
1204,INEX_XER-86,bt_nllb_french,List of countries of World War II,0.1219
1205,INEX_XER-86,bt_nllb_german,List of countries in World War II,0.1219
1206,INEX_XER-86,bt_nllb_malay,List of countries in World War II,0.1219
1207,INEX_XER-86,tagmee.topn3.replace,World War II,0.1137
1208,INEX_XER-86,conceptnet.topn3,list countries world war two distribution list continent flag battle double a number number,0.0448
1209,INEX_XER-86,bt_nllb_korean,List of countries that fought in World War II,0.0407
1210,INEX_XER-86,wordnet.topn3,list countries world war two number lean area nation human race humans existence warfare state of war II,0.0354
1211,INEX_XER-86,wiki.topn3,list countries world war two wars involving luxembourg wars involving poland wars involving netherlands world war ii,0.0323
1212,INEX_XER-86,wiki.topn3.replace,wars involving luxembourg wars involving poland wars involving netherlands world war ii,0.0171
1213,INEX_XER-86,bt_bing_russian,List of countries that participated in World War II,0.0145
1214,INEX_XER-86,bt_nllb_swahili,List of countries that participated in World War II,0.0145
1215,INEX_XER-86,word2vec.topn3,list countries world war two list nations countires coutries globe country conflict three four five,0.014
1216,INEX_XER-86,conceptluster.topn5.3.bm25,list countries world war two world war ii,0.0136
1217,INEX_XER-86,conceptluster.topn5.3.qld,list countries world war two world war ii,0.0136
1218,INEX_XER-86,tagmee.topn3,list countries world war two World War II,0.0136
1219,INEX_XER-86,glove.topn3,list countries world war two nations governments time ever conflict three four,0.0084
1220,INEX_XER-86,bt_nllb_persian,List of countries involved in World War II,0.0078
1221,INEX_XER-86,bt_nllb_tamil,List of countries involved in World War II,0.0078
1222,INEX_XER-87,-1,Axis powers of World War II,0.3533
1223,INEX_XER-88,-1,Nordic authors who are known for children's literature,0.4056
1224,INEX_XER-88,bt_bing_french,Nordic authors known for children s literature,0.4257
1225,INEX_XER-88,bt_bing_german,Nordic authors known for children s literature,0.4257
1226,INEX_XER-88,bt_nllb_arabic,Nordic authors known for children s literature,0.4257
1227,INEX_XER-88,bt_nllb_french,Nordic authors known for their children s literature,0.4257
1228,INEX_XER-88,bt_nllb_german,Nordic authors known for children s literature,0.4257
1229,INEX_XER-88,termluster.topn5.3.bm25,nordic authors known children s literature,0.4257
1230,INEX_XER-88,termluster.topn5.3.qld,nordic authors known children s literature,0.4257
1231,INEX_XER-88,thesaurus.topn3,nordic authors known children s literature,0.4257
1232,INEX_XER-88,thesaurus.topn3.replace,nordic authors known children s literature,0.4257
1233,INEX_XER-88,bt_bing_korean,Nordic writers known for their children s literature,0.4219
1234,INEX_XER-88,bt_bing_malay,Nordic writers known for children s literature,0.4219
1235,INEX_XER-88,bt_bing_persian,Nordic writers known for children s literature,0.4219
1236,INEX_XER-88,bt_bing_tamil,Nordic writers known for children s literature,0.4219
1237,INEX_XER-88,bt_nllb_malay,Nordic writer known for children s literature,0.4219
1238,INEX_XER-88,bt_nllb_persian,Nordic writers known for children s literature,0.4219
1239,INEX_XER-88,bt_nllb_tamil,Nordic writers known for children s literature,0.4219
1240,INEX_XER-88,bt_bing_swahili,Nordic writers who are known for children s literature,0.4198
1241,INEX_XER-91,-1,Paul Auster novels,0.9285
1242,INEX_XER-94,-1,Hybrid cars sold in Europe,0.5332
1243,INEX_XER-94,tagmee.topn3,hybrid cars sold europe Hybrid vehicle Europe,0.6167
1244,INEX_XER-94,conceptluster.topn5.3.bm25,hybrid cars sold europe hybrid vehicle,0.6134
1245,INEX_XER-94,conceptluster.topn5.3.qld,hybrid cars sold europe hybrid vehicle,0.6134
1246,INEX_XER-94,bt_bing_chinese_simplified,Hybrid vehicles sold in Europe,0.559
1247,INEX_XER-94,bt_nllb_german,Hybrid vehicles sold in Europe,0.559
1248,INEX_XER-94,bt_nllb_tamil,Hybrid vehicles sold in Europe,0.559
1249,INEX_XER-95,-1,Tom Hanks movies where he plays a leading role.,0.2544
1250,INEX_XER-95,bt_bing_korean,A movie starring Tom Hanks,0.5114
1251,INEX_XER-95,wordnet.topn3.replace,gobbler Uncle Tom Tom Hanks Thomas J Hanks motion picture flick fiddle period of play playact star pass moderate purpose character part,0.491
1252,INEX_XER-95,bt_bing_chinese_simplified,Tom Hanks plays the lead role in the movie,0.3608
1253,INEX_XER-95,termluster.topn5.3.bm25,tom hanks movies plays leading role,0.3608
1254,INEX_XER-95,termluster.topn5.3.qld,tom hanks movies plays leading role,0.3608
1255,INEX_XER-95,thesaurus.topn3,tom hanks movies plays leading role,0.3608
1256,INEX_XER-95,thesaurus.topn3.replace,tom hanks movies plays leading role,0.3608
1257,INEX_XER-95,wordnet.topn3,tom hanks movies plays leading role tom turkey gobbler tomcat Thomas J Hanks moving picture picture show moving picture show bid free rein swordplay head chair precede purpose character office,0.3283
1258,INEX_XER-95,bt_nllb_persian,Tom Hanks in the movies he plays,0.3006
1259,INEX_XER-95,anchor.topn3,tom hanks movies plays leading role meldru knute mrv p mixins vehicle protect,0.2997
1260,INEX_XER-95,stem.paicehusk,tom hank movy wher he play a lead rol,0.2972
1261,INEX_XER-95,stem.trunc4,tom hank movi wher he play a lead role,0.2908
1262,INEX_XER-95,word2vec.topn3,tom hanks movies plays leading role clancy daley kersey slub films led rôle,0.2893
1263,INEX_XER-95,sensedisambiguation,Tom turkey cock Hanks hank movies movie where he plays play a leading role function,0.2874
1264,INEX_XER-95,bt_nllb_chinese_yue,Tom Hanks is the main character in the movie,0.2807
1265,INEX_XER-95,tagmee.topn3,tom hanks movies plays leading role Tom Hanks Film Theatre Leading actor,0.2661
1266,INEX_XER-95,stem.trunc5,tom hanks movie where he plays a leadi role,0.257
1267,INEX_XER-95,bt_bing_german,Tom Hanks movies in which he plays a leading role,0.2559
1268,INEX_XER-96,-1,Pure object-oriented programing languages,0.1532
1269,INEX_XER-96,glove.topn3,pure object oriented programing languages essence whereas smalltalk constructs simulcasts airs spoken,0.2182
1270,INEX_XER-96,relevancefeedback.topn10.bm25,pure object oriented programing languages program design door type tcl languag,0.1688
1271,INEX_XER-97,-1,Compilers that can compile both C and C++,0.2588
1272,INEX_XER-97,termluster.topn5.3.bm25,compilers compile c c,0.5416
1273,INEX_XER-97,termluster.topn5.3.qld,compilers compile c c,0.5416
1274,INEX_XER-97,thesaurus.topn3,compilers compile c c,0.5416
1275,INEX_XER-97,thesaurus.topn3.replace,compilers compile c c,0.5416
1276,INEX_XER-97,bt_nllb_tamil,C and C compilers,0.54
1277,INEX_XER-97,sensedisambiguation,Compilers compiler that can compile roll up both C vitamin c and C,0.3156
1278,INEX_XER-97,bt_bing_chinese_simplified,Compilers that can compile C and C,0.3006
1279,INEX_XER-97,bt_bing_swahili,Compilers that can compile C and C,0.3006
1280,INEX_XER-98,-1,Makers of lawn tennis rackets,0.1941
1281,INEX_XER-98,bt_bing_chinese_simplified,Lawn tennis racket manufacturer,0.5337
1282,INEX_XER-98,bt_bing_french,Lawn Tennis Racket Manufacturers,0.5337
1283,INEX_XER-98,bt_bing_german,Manufacturer of lawn tennis rackets,0.5337
1284,INEX_XER-98,bt_bing_korean,Lawn Tennis Racket Manufacturer,0.5337
1285,INEX_XER-98,bt_bing_russian,Lawn Tennis Racket Manufacturers,0.5337
1286,INEX_XER-98,bt_bing_swahili,Manufacturers of lawn tennis rackets,0.5337
1287,INEX_XER-98,bt_nllb_french,Manufacturers of lawn tennis rackets,0.5337
1288,INEX_XER-98,bt_nllb_german,Manufacturers of lawn tennis rackets,0.5337
1289,INEX_XER-98,bt_nllb_malay,Manufacturer of lawn tennis rackets,0.5337
1290,INEX_XER-98,bt_nllb_swahili,Manufacturers of lawn tennis rackets,0.5337
1291,INEX_XER-98,bt_nllb_tamil,The manufacturers of lawn tennis rackets,0.5337
1292,INEX_XER-98,sensedisambiguation.replace,manufacturer of lawn tennis racket,0.5337
1293,INEX_XER-98,bt_nllb_korean,We re a manufacturer of lawn tennis rackets,0.5315
1294,INEX_XER-98,sensedisambiguation,Makers manufacturer of lawn tennis rackets racket,0.527
1295,INEX_XER-98,tagmee.topn3.replace,Tennis Tennis Racket sports equipment,0.4924
1296,INEX_XER-98,tagmee.topn3,makers lawn tennis rackets Tennis Tennis Racket sports equipment,0.4513
1297,INEX_XER-98,conceptluster.topn5.3.bm25,makers lawn tennis rackets tennis racket sports equipment,0.4215
1298,INEX_XER-98,conceptluster.topn5.3.qld,makers lawn tennis rackets tennis racket sports equipment,0.4215
1299,INEX_XER-98,word2vec.topn3,makers lawn tennis rackets manufacturers manufacturer mowing racquet badminton racquets,0.3891
1300,INEX_XER-98,glove.topn3,makers lawn tennis rackets manufacturers beside badminton tournament em,0.364
1301,INEX_XER-98,bt_nllb_arabic,The manufacturer of tennis racquets for the fatigued,0.338
1302,INEX_XER-98,wiki.topn3,makers lawn tennis rackets tennis racquet sports sports rules regulations tennis tennis racquet sports sports rules regulations tennis badminton equipment boardsport shuttlecock racket sports equipment,0.3294
1303,INEX_XER-98,word2vec.topn3.replace,manufacturers manufacturer mowing racquet badminton racquets,0.325
1304,INEX_XER-98,wiki.topn3.replace,tennis racquet sports sports rules regulations tennis tennis racquet sports sports rules regulations tennis badminton equipment boardsport shuttlecock racket sports equipment,0.3141
1305,INEX_XER-98,relevancefeedback.topn10.qld,makers of lawn tennis rackets tenni racket,0.2498
1306,INEX_XER-98,wordnet.topn3,makers lawn tennis rackets Divine Jehovah Lord lawn tennis jollify fraudulent scheme revel,0.2088
1307,INEX_XER-98,wordnet.topn3.replace,Godhead manufacturing business Creator lawn lawn tennis racquet make merry dissonance,0.1964
1308,INEX_XER-98,relevancefeedback.topn10.bm25,makers of lawn tennis rackets tenni racket olymp club,0.1957
1309,INEX_XER-99,-1,Computer systems that have a recursive acronym for the name,0.6179
1310,INEX_XER-99,conceptluster.topn5.3.bm25,computer systems recursive acronym name recursive acronym,0.668
1311,INEX_XER-99,conceptluster.topn5.3.qld,computer systems recursive acronym name recursive acronym,0.668
1312,INEX_XER-99,bt_bing_chinese_simplified,A computer system with a recursive acronym for a name,0.664
1313,INEX_XER-99,bt_bing_french,Computer systems with a recursive acronym in their name,0.664
1314,INEX_XER-99,bt_nllb_malay,Computer systems with recursive acronyms for names,0.664
1315,INEX_XER-99,bt_nllb_russian,Computer systems with a recursive acronym for the name,0.664
1316,INEX_XER-99,termluster.topn5.3.bm25,computer systems recursive acronym name,0.664
1317,INEX_XER-99,termluster.topn5.3.qld,computer systems recursive acronym name,0.664
1318,INEX_XER-99,thesaurus.topn3,computer systems recursive acronym name,0.664
1319,INEX_XER-99,thesaurus.topn3.replace,computer systems recursive acronym name,0.664
1320,QALD2_te-1,-1,Which German cities have more than 250000 inhabitants?,0.0411
1321,QALD2_te-1,bt_bing_korean,Which German city has a population of more than,0.1471
1322,QALD2_te-1,bt_nllb_chinese_yue,Which city in Germany has more than people,0.1362
1323,QALD2_te-1,wordnet.topn3,german cities inhabitants High German German language metropolis urban center habitant indweller dweller,0.1228
1324,QALD2_te-1,wordnet.topn3.replace,High German German language metropolis urban center dweller indweller,0.089
1325,QALD2_te-1,bt_nllb_persian,Which German cities have a population of more than,0.0747
