qid	order	query	qld.ndcg
354733	bt_bing_tamil	What are the names of some famous photographers and why does their work stand out	0.2412
354733	bt_nllb_arabic	What are the names of some famous photographers and why is their work so powerful	0.2272
354733	bt_nllb_tamil	What are the names of famous photographers and why is their work so high	0.2208
354733	bt_nllb_french	What are the names of some famous photographers and why is their work so important	0.2188
354733	bt_bing_korean	What are the names of famous photographers and why do their work get noticed	0.2113
354733	bt_bing_chinese_simplified	What are the names of some famous photographers and why do their work hold water	0.2014
354733	bt_nllb_chinese_yue	What are the names of some famous photographers	0.1981
354733	bt_bing_french	What are the names of some famous photographers and why does their work hold up	0.1935
354733	bt_bing_russian	What are some famous photographers names and why are their work worth considering	0.1879
354733	bt_nllb_german	What are the names of some famous photographers and why are their works noted	0.1843
354733	bt_nllb_korean	What are the names of famous photographers and why is their work remarkable	0.1812
354733	bt_nllb_persian	What are some famous photographers names and why is their work remarkable	0.1768
354733	bt_bing_german	What are the names of some famous photographers and why are their work so successful	0.1699
354733	bt_nllb_russian	What are the names of some famous photographers and why are their works so prominent	0.1346
354733	bt_nllb_swahili	What are the names of some prominent photographers and why is their work unique	0.0737
3552010	-1	Why do parent put kids on restriction?	0.2731
3552010	bt_bing_german	Why do parents put their children on restriction	0.1469
3552010	bt_bing_malay	Why do parents put children on restrictions	0.1469
3552010	bt_nllb_arabic	Why do parents put restrictions on their children	0.1469
3552010	bt_bing_french	Why do parents restrict their children	0.13
3552010	bt_nllb_chinese_yue	Why do parents restrict their children	0.13
3552010	bt_nllb_korean	Why do parents restrict their children	0.13
3552010	bt_nllb_persian	Why do parents restrict their children	0.13
3552010	bt_nllb_swahili	Why do parents place restrictions on their children	0.1224
3552010	bt_bing_arabic	Why does a parent put children on restrictions	0.1127
3552010	bt_bing_chinese_simplified	Why should parents restrict their children	0.095
3552010	bt_nllb_french	Why do parents put children under restrictions	0.0934
3552010	bt_bing_korean	Why do parents limit children	0.0743
3552010	bt_bing_persian	Why do parents limit their children	0.0743
3552010	bt_nllb_russian	Why do parents limit their children	0.0743
3552010	bt_nllb_german	Why do parents place limits on their children	0.0589
3552010	bt_bing_russian	Why Do Parents Impose Restrictions on Children	0.0474
3552010	bt_nllb_malay	Why do parents put their kids in the closet	0.0457
3552010	bt_bing_tamil	Why do parents control children	0.0191
3552010	bt_nllb_tamil	Why do parents control their children	0.0191
3552010	bt_bing_swahili	Why does a parent put children in custody	0.0
3554263	-1	why some people behave so rude without reason,is it due to their own problem?	0.2534
3554263	bt_nllb_chinese_yue	Why are some people so rude without any reason Is it because they have problems	0.1885
3554263	bt_bing_arabic	Why do some people act rudely for no reason is it due to their own problem	0.1875
3554263	bt_nllb_persian	Why do some people act so rude for no reason	0.1596
3554263	bt_nllb_russian	Why do some people act so rude for no reason it s because of their own problems	0.1252
3554263	bt_bing_swahili	Why are some people acting rudely for no reason is it because of their own trouble	0.0958
3554263	bt_nllb_arabic	Why do some people act inappropriately for no reason	0.0
3554263	bt_nllb_korean	Why do some people act disrespectfully	0.0
3554263	bt_nllb_malay	Why do some people act so cruel for no reason because of their own problems	0.0
3554263	bt_nllb_swahili	Why do some people act cruelly for no reason and is it because of their own problem	0.0
3554263	bt_nllb_tamil	Why do some people act so badly for no reason and is it their own fault	0.0
3559048	-1	How do you sell a junk car without a title?	0.7361
3559048	bt_bing_french	How do you sell a junk car without a title deed	0.6199
3559048	bt_nllb_french	How do you sell a regular car without a title	0.5648
3559048	bt_nllb_swahili	How to sell junk car without a name	0.5481
3559048	bt_nllb_persian	How about selling a trash car without a title	0.5414
3559048	bt_nllb_chinese_yue	How do you sell trash cars without a title	0.5321
3559048	bt_bing_arabic	How do you sell a junk car without an address	0.4843
3559048	bt_bing_korean	How do you sell an untitled junk car	0.4499
3559048	bt_bing_malay	How do you sell a garbage car without a title	0.4471
3559048	bt_nllb_tamil	How do you sell a garbage car without a title	0.4471
3559048	bt_bing_russian	How to sell junk cars without a registration certificate	0.4033
3559048	bt_bing_swahili	How to sell a junk car without a headlamp	0.3683
3559048	bt_nllb_malay	How do you sell trash cans without a title	0.3546
3559048	bt_nllb_korean	How can you sell a garbage truck without a title	0.2364
3559048	bt_nllb_russian	How do you sell a garbage machine without a title	0.2349
3559048	bt_bing_chinese_simplified	How do you sell a garbage truck without title	0.2076
3559048	bt_nllb_arabic	How do you sell a bad car without a address	0.0379
3577501	-1	what are some signs that puberty is beginning?	0.6393
3577501	bt_nllb_chinese_yue	What are the signs of puberty	0.6325
3577501	bt_nllb_persian	What are the signs of puberty	0.6325
3577501	bt_bing_french	What are the signs that puberty is starting	0.5783
3577501	bt_bing_persian	What are the signs that the start of puberty	0.5783
3577501	bt_nllb_german	What are some signs of puberty	0.559
3577501	bt_bing_german	What are some signs that puberty is starting	0.4865
3577501	bt_bing_russian	What are some signs that puberty is starting	0.4865
3577501	bt_bing_tamil	What are some signs that puberty is starting	0.4865
3577501	bt_bing_chinese_simplified	What are the signs of the onset of puberty	0.3129
3577501	bt_bing_korean	What are some signs that puberty is onset	0.308
3577501	bt_bing_arabic	What are some signs that puberty has begun	0.2183
3577501	bt_nllb_arabic	What are some signs that puberty has begun	0.2183
3577501	bt_nllb_russian	What are the signs that sexual maturation is beginning	0.207
3577501	bt_nllb_malay	What are some signs that adolescence is about to begin	0.1087
3577501	bt_nllb_korean	What are some signs that the coming of age is about to begin	0.0214
3577501	bt_nllb_swahili	what are the signs that a pregnancy is beginning	0.0
3577501	bt_nllb_tamil	What is the beginning of youth	0.0
3639660	-1	Why do most cigarettes have the yellow filter?	0.5928
3639660	bt_bing_swahili	Why do so many cigarettes have a yellow filter	0.5911
3640705	-1	what is the punishment for child molestors?	0.3012
3640705	bt_nllb_arabic	What is the punishment for child rapists	0.1
3640705	bt_bing_persian	What is the punishment for child abuse	0.0388
3640705	bt_nllb_chinese_yue	What is the punishment for child abuse	0.0388
3640705	bt_nllb_malay	What is the punishment for child abuse	0.0388
3640705	bt_nllb_russian	What is the punishment for child abuse	0.0388
3640705	bt_bing_swahili	What is the punishment for children	0.0355
3640705	bt_nllb_korean	What is the punishment for child sexual abuse	0.0197
3640705	bt_nllb_tamil	What is the punishment for child sexual abuse	0.0197
3640705	bt_nllb_german	What is the penalty for minors	0.0
3698636	-1	why do cats headbutt?	0.1313
3698636	bt_bing_malay	Why Headbutt Cats	0.1311
3698636	bt_bing_russian	Why do cats butt heads	0.0946
3698636	bt_nllb_korean	Why does a cat have a head	0.0491
3698636	bt_nllb_swahili	why the cat s head	0.0412
3698636	bt_nllb_persian	Why do cats keep their heads	0.0389
3698636	bt_bing_chinese_simplified	Why do cats hit their heads with their heads	0.0334
3698636	bt_bing_arabic	Why do cats butt	0.0282
3698636	bt_nllb_chinese_yue	Why is a cat so stupid	0.0273
3698636	bt_bing_persian	Why do cats look	0.015
3698636	bt_bing_swahili	Why do cats scratch the head	0.0147
3698636	bt_nllb_arabic	Why are cats moving	0.0123
3698636	bt_nllb_french	Why are cats shoveling	0.0092
3698636	bt_bing_tamil	Why do cats get dizzy	0.0
3698636	bt_nllb_german	Why are cats shaking	0.0
3698636	bt_nllb_malay	Why is the cat sweating	0.0
3698636	bt_nllb_russian	Why are the cats dizzy	0.0
3698636	bt_nllb_tamil	Why do cats have headaches	0.0
3714728	-1	Why is the world so shallow?	0.481
3714728	bt_bing_chinese_simplified	Why is the world so superficial	0.0
3714728	bt_bing_french	Why is the world so superficial	0.0
3714728	bt_bing_german	Why is the world so superficial	0.0
3714728	bt_bing_persian	Why is the world so superficial	0.0
3714728	bt_bing_russian	Why is the world so small	0.0
3714728	bt_bing_swahili	Why is the world so high	0.0
3714728	bt_nllb_arabic	Why is the world so tight	0.0
3714728	bt_nllb_french	Why is the world so superficial	0.0
3714728	bt_nllb_german	Why is the world so superficial	0.0
3714728	bt_nllb_korean	Why is the world like this	0.0
3714728	bt_nllb_persian	Why is the world so flat	0.0
3714728	bt_nllb_russian	Why is the world so superficial	0.0
3714728	bt_nllb_swahili	Why is the universe so low	0.0
3714728	bt_nllb_tamil	Why is the world so dim	0.0
3723508	-1	What is the difference between an ox and a bull?	0.7333
3723508	bt_bing_chinese_simplified	What is the difference between a cow and a bull	0.2332
3723508	bt_nllb_chinese_yue	What s the difference between cows and bulls	0.2283
3723508	bt_nllb_korean	What s the difference between cows and bulls	0.2283
3723508	bt_bing_korean	What is the difference between a bull and a bull	0.1448
3723508	bt_bing_malay	What is the difference between a bull and a bull	0.1448
3723508	bt_bing_persian	What is the difference between bull and bull	0.1448
3723508	bt_bing_russian	What is the difference between a bull and a bull	0.1448
3723508	bt_nllb_arabic	What s the difference between a bull and a bull	0.143
3723508	bt_nllb_french	What s the difference between a bull and a bull	0.143
3723508	bt_nllb_german	What s the difference between a bull and a bull	0.143
3723508	bt_nllb_malay	What s the difference between a bull and a bull	0.143
3723508	bt_nllb_russian	What s the difference between a bull and a bull	0.143
3723508	bt_nllb_swahili	What is the difference between a bull and a calf	0.0845
3723508	bt_bing_arabic	What is the difference between Taurus and Taurus	0.0253
3723508	bt_nllb_tamil	What is the difference between a cow and a cow	0.0166
3723508	bt_bing_swahili	What s the difference between a cow and a cow	0.0165
3723508	bt_nllb_persian	What s the difference between a cow and a cow	0.0165
3778229	-1	how were the witches tested in the salem witch trials?	0.731
3778229	bt_bing_korean	How were the witches tried at the Salem Witch Trials	0.7304
3778229	bt_nllb_swahili	How were witches tried in the Salem witch trials	0.7304
3778229	bt_bing_chinese_simplified	How were witches put to the test in the Salem Witch Trial	0.7268
3778229	bt_bing_german	How were the witches put to the test in the Salem Witch Trials	0.7268
3778229	bt_bing_persian	How were witches tested in healthy witch trials	0.7267
3778229	bt_nllb_russian	How were the witches in Salem	0.676
3778229	bt_bing_malay	How were witches tested in Salem s magic trials	0.6497
3778229	bt_nllb_persian	How were witches tested in the courts of the healthy witches	0.5606
3825386	-1	How can I develop leanbody and muscles?	0.1776
3825386	bt_bing_korean	How can I get leaner and have more muscles	0.1369
3825386	bt_bing_german	How can I develop leaner body and muscles	0.0823
3825386	bt_bing_russian	How to develop a muscular figure and muscles	0.0164
3825386	bt_bing_chinese_simplified	How can I develop lean and muscle	0.0157
3825386	bt_bing_swahili	How can I develop lean and muscle	0.0157
3825386	bt_nllb_chinese_yue	How can I develop muscle and lean	0.0157
3825386	bt_bing_arabic	How can I develop a lean body and muscles	0.0119
3825386	bt_nllb_arabic	How can I develop a lean body and muscles	0.0119
3825386	bt_nllb_french	How can I develop lean body and muscle	0.0119
3825386	bt_nllb_german	How can I develop a lean body and muscles	0.0119
3825386	bt_nllb_persian	How can I develop a lean body and muscle	0.0119
3825386	bt_nllb_russian	How can I develop a lean body and muscles	0.0119
3825386	bt_nllb_swahili	How can I develop a lean body and muscles	0.0119
3825386	bt_nllb_korean	How can I build my own body and muscles	0.0108
3825386	bt_bing_french	How can I build my lean body and muscles	0.0
3825386	bt_bing_tamil	How can I build a lean body and muscle	0.0
3825386	bt_nllb_malay	How can I build lean bodies and muscles	0.0
3825386	bt_nllb_tamil	How can I cultivate a lean body	0.0
3872395	-1	what are some easy ways to get a toddler to go to sleep without being mean?	0.1822
3872395	bt_bing_chinese_simplified	What are some easy ways to get a toddler to sleep without being mean	0.1814
3872395	bt_bing_german	What are some easy ways to get a toddler to sleep without being mean	0.1814
3872395	bt_bing_tamil	What are some simple ways to put toddler to sleep without average	0.1575
3872395	bt_bing_french	What are some easy ways to put a toddler to sleep without being naughty	0.1504
3872395	bt_bing_korean	What are some easy ways to get a toddler to sleep without being grumpy	0.135
3872395	bt_bing_malay	What are some easy ways to make a child sleep meaninglessly	0.012
3872395	bt_nllb_french	What are some easy ways to get a child to sleep without being mean	0.0116
3872395	bt_bing_arabic	What are some easy ways to make a baby fall asleep without being mean	0.0
3872395	bt_bing_russian	What are some simple ways to get your baby to fall asleep without getting angry	0.0
3872395	bt_bing_swahili	What are the easiest ways to get a newborn to go to bed without being useless	0.0
3872395	bt_nllb_arabic	What are some easy ways to get a little child to sleep without being violent	0.0
3872395	bt_nllb_chinese_yue	How can you keep a child from speaking badly in their sleep	0.0
3872395	bt_nllb_german	How can you let a little child sleep without being mean	0.0
3872395	bt_nllb_korean	What are some easy ways to get your kids to sleep without harm	0.0
3872395	bt_nllb_malay	What s the easiest way to get a child to sleep without being mean	0.0
3872395	bt_nllb_persian	What are some simple ways to get a child to sleep without abuse	0.0
3872395	bt_nllb_russian	What are the simple ways to get a baby to sleep without being angry	0.0
3872395	bt_nllb_swahili	what are some simple ways to get a baby to sleep without being dirty	0.0
3872395	bt_nllb_tamil	What are some simple ways to keep a boy asleep without being betrayed	0.0
3874326	-1	How come Compton is only designated for black people?	0.1426
387874	-1	Why does asparugus make your pee stink?	0.6164
387874	bt_bing_korean	Why does my asparugus smell like pee	0.3614
387874	bt_bing_malay	Why does asparugus make your pee smell	0.3448
387874	bt_nllb_arabic	Why does asparagus make you pee	0.313
387874	bt_bing_french	Why does asparagus make you smell pee	0.3126
387874	bt_nllb_french	Why does your pee smell like asparagus	0.307
387874	bt_nllb_german	Why does your pee smell like asparagus	0.307
387874	bt_bing_german	Why does asparagus make urine stink	0.2462
387874	bt_nllb_chinese_yue	Why does Asparagus make you smell like a piss	0.221
387874	bt_nllb_swahili	Why does asparagus make your candy smell	0.2175
387874	bt_nllb_malay	Why does asparagus make your urine smell	0.1994
387874	bt_nllb_korean	Why does the weather smell like asparagus	0.199
387874	bt_nllb_tamil	Why does Asparagus smell your urine	0.1885
387874	bt_nllb_russian	Why does asparagus make you drink so bad	0.1574
387874	bt_bing_russian	Why Does Aspararugus Make Urine Stink	0.1049
387874	bt_nllb_persian	Why does sprigos make your urine smell	0.0999
387874	bt_bing_tamil	Why does aspruce make your urine stink	0.0831
387874	bt_bing_persian	Why does Spartacus make you smell bad	0.0295
387874	bt_bing_arabic	Why does asparrogus make Polk smelly	0.0
3910925	-1	Why is yawning contagious?	0.8467
3910925	bt_nllb_chinese_yue	Why is it contagious	0.6155
3910925	bt_nllb_german	Why is it contagious	0.6155
3910925	bt_nllb_swahili	Why is bathing contagious	0.5574
3910925	bt_nllb_russian	Why is burning contagious	0.5315
3910925	bt_nllb_arabic	Why is vibration contagious	0.4997
3910925	bt_nllb_french	Why is it contagious to vomit	0.4721
3910925	bt_nllb_malay	Why is it that the spider can be contagious	0.3999
3910925	bt_nllb_korean	Why is sleep a contagious disease	0.3391
3910925	bt_nllb_persian	Why are the gnomes so boring	0.0
3910925	bt_nllb_tamil	Why the blindness	0.0
3960080	-1	Why don't commercial planes fly over the North Pole?	0.6694
3960080	bt_nllb_tamil	Why do commercial planes not fly over the North Pole	0.6367
3960080	bt_bing_malay	Why don t commercial planes fly at the North Pole	0.6359
3960080	bt_nllb_french	Why aren t commercial planes flying over the North Pole	0.6191
3960080	bt_nllb_german	Why aren t commercial planes flying over the North Pole	0.6191
3960080	bt_nllb_malay	Why aren t commercial planes flying over the North Pole	0.6191
3960080	bt_nllb_russian	Why aren t commercial planes flying over the North Pole	0.6191
3960080	bt_nllb_persian	Why aren t commercial planes flying from the North Pole	0.6073
3960080	bt_bing_swahili	Why don t commercial airliners fly over the North Pole	0.5344
3960080	bt_bing_german	Why don t airliners fly over the North Pole	0.4748
3960080	bt_nllb_swahili	Why do commercial aircraft not fly over the North Pole	0.4369
3960080	bt_nllb_chinese_yue	Why can t commercial planes fly over the Arctic	0.3991
3960080	bt_nllb_arabic	Why don t commercial planes fly over the Arctic	0.382
3960080	bt_bing_persian	Why aren t commercial planes flying over the Arctic	0.3051
3960080	bt_nllb_korean	Why don t commercial planes cross the Arctic	0.1664
3971195	-1	How do i get my pitbull more agressive?	0.4635
3971195	bt_bing_swahili	How can I get my pitbull to be more aggressive	0.4268
3971195	bt_bing_tamil	How do I get my pitbull aggressive	0.4265
3971195	bt_bing_malay	How can I make my pitbull more aggressive	0.424
3971195	bt_nllb_malay	How can I make my pitbull more aggressive	0.424
3971195	bt_nllb_tamil	How can I make my pitbull more aggressive	0.424
3971195	bt_bing_arabic	How do I make a pitbull more aggressive	0.4226
3971195	bt_bing_chinese_simplified	How do I make my Pitbull more aggressive	0.4214
3971195	bt_nllb_swahili	How can I make my pitbull sharper	0.3457
3971195	bt_bing_russian	How do you make a pit bull more aggressive	0.1787
3971195	bt_bing_french	How do I make my pit bull more aggressive	0.1781
3971195	bt_bing_korean	How do I make my pit bull more aggressive	0.1781
3971195	bt_bing_persian	How do I make my pit bull more aggressive	0.1781
3971195	bt_nllb_french	How can I make my pit bull more aggressive	0.178
3971195	bt_nllb_german	How can I make my pit bull more aggressive	0.178
3971195	bt_nllb_russian	How can I make my pit bull more aggressive	0.178
3971195	bt_bing_german	How do I get my pit bull more aggressive	0.1773
3971195	bt_nllb_arabic	How can I make him more aggressive	0.1397
3971195	bt_nllb_korean	How can we make Pittleburr more aggressive	0.0742
3971195	bt_nllb_chinese_yue	How can I make my son more positive	0.0
3971195	bt_nllb_persian	How can I scare my dick so bad	0.0
3990512	-1	how can we get concentration onsomething?	0.2176
3990512	bt_bing_arabic	How can we focus on something	0.0
3990512	bt_bing_chinese_simplified	How can we focus on something	0.0
3990512	bt_bing_french	How can we focus on something	0.0
3990512	bt_bing_german	How can we focus on something	0.0
3990512	bt_bing_korean	How can I focus on something	0.0
3990512	bt_bing_malay	How can we get onsomething focus	0.0
3990512	bt_bing_persian	How can we focus on something	0.0
3990512	bt_bing_russian	How can we focus on something	0.0
3990512	bt_bing_swahili	How can we get a convention on something	0.0
3990512	bt_bing_tamil	How can we focus on one thing	0.0
3990512	bt_nllb_arabic	How can we focus on something	0.0
3990512	bt_nllb_chinese_yue	How do we focus on work	0.0
3990512	bt_nllb_french	How can we focus our attention on something	0.0
3990512	bt_nllb_german	How can we focus on something	0.0
3990512	bt_nllb_korean	How can we focus	0.0
3990512	bt_nllb_malay	How can we focus on something	0.0
3990512	bt_nllb_persian	How do we get focused on something	0.0
3990512	bt_nllb_russian	How can we focus on something	0.0
3990512	bt_nllb_swahili	How can we focus on something	0.0
3990512	bt_nllb_tamil	How can we focus on something	0.0
4003223	-1	What are the marketing gimmicks that will attract males?	0.3083
4003223	bt_bing_tamil	Marketing gimmicks that attract men	0.2775
4003223	bt_bing_malay	What marketing gimmicks will interest men	0.2533
4003223	bt_bing_swahili	What marketing gimmicks will appeal to men	0.2526
4003223	bt_bing_chinese_simplified	What are the marketing gimmicks to attract men	0.2518
4003223	bt_bing_french	What are the marketing gimmicks that will attract men	0.2518
4003223	bt_bing_german	What are the marketing gimmicks that attract men	0.2518
4003223	bt_bing_arabic	What marketing tricks will attract males	0.1057
4003223	bt_nllb_arabic	What marketing scratches will attract males	0.0903
4003223	bt_bing_korean	What are the marketing tricks to attract men	0.013
4003223	bt_bing_persian	What are the marketing tricks that attract men	0.013
4003223	bt_bing_russian	What marketing tricks will attract men	0.013
4003223	bt_nllb_persian	What marketing tricks are attracting men	0.013
4003223	bt_nllb_russian	What marketing tricks will attract men	0.013
4003223	bt_nllb_tamil	What are the marketing tricks that attract men	0.013
4003223	bt_nllb_french	What kind of marketing tricks will attract men	0.0125
4003223	bt_nllb_korean	What marketing techniques attract men	0.0061
4003223	bt_nllb_chinese_yue	What are the marketing techniques that attract men s attention	0.0
4003223	bt_nllb_german	What are the marketing tricks men wear	0.0
4003223	bt_nllb_malay	What s the marketing trick that ll attract men	0.0
4003223	bt_nllb_swahili	What marketing techniques will appeal to men	0.0
4012558	-1	what is the term milky way?	0.7352
4012558	bt_nllb_malay	What s the term Milky Way	0.7229
4012558	bt_nllb_chinese_yue	What is the name of the galaxy	0.2984
4012558	bt_nllb_korean	What is the term for a galaxy	0.2727
4012558	bt_nllb_arabic	What s the term our trade route	0.0
4012558	bt_nllb_persian	What is the term Milk Road	0.0
4012558	bt_nllb_tamil	What is the word milk road	0.0
4018891	-1	How do I know if a particular term or phrase is copyrighted?	0.3462
4018891	bt_nllb_german	How do I know if a particular term or phrase is protected by copyright	0.3296
4018891	bt_bing_persian	How do I know if a particular term or phrase has been copyrighted	0.3154
4018891	bt_nllb_persian	How do I know if a particular term or phrase is occupied	0.057
402514	-1	why do my baked potatos never taste near as good as when I get them in a nice restaurant?	0.3992
402514	bt_bing_chinese_simplified	Why do my baked potatoes never taste as good as what I bought in a nice restaurant	0.3975
402514	bt_bing_tamil	Why do I never taste my baked potatoes when I buy them at a good restaurant	0.3958
402514	bt_bing_german	Why do my baked potatoes never taste nearly as good as when I get them at a nice restaurant	0.3942
402514	bt_bing_russian	Why are my baked potatoes never as tasty as when I buy them at a good restaurant	0.3108
402514	bt_bing_korean	Why don t baked potatoes taste as good as they do when you get them from a good restaurant	0.2982
402514	bt_bing_swahili	Why don t my baked potatoes taste nearly as good as when I get them at a good restaurant	0.2925
402514	bt_nllb_french	Why don t my baked potatoes taste as good as when I have them in a good restaurant	0.2904
402514	bt_bing_malay	Why don t my baked potatoes ever taste nearly as good when I get them in a nice restaurant	0.2878
402514	bt_nllb_chinese_yue	Why can t my potatoes be as good as the ones I bought in a good restaurant	0.2726
402514	bt_bing_arabic	Why doesn t baked potatoes taste as good as when I get them in a nice restaurant	0.2678
402514	bt_nllb_swahili	why aren t my boiled potatoes as good as I see them in a good restaurant	0.1485
402514	bt_nllb_korean	Why is my potato not as tasty as a delicious restaurant	0.1319
402514	bt_nllb_tamil	Why isn t my bag of potatoes almost as tasty as when I get to a good restaurant	0.1137
402514	bt_nllb_malay	Why didn t my fries ever taste like when I got them at a good restaurant	0.026
402514	bt_nllb_arabic	Why don t breadcrumbs taste like when I get them at a nice restaurant	0.0246
402514	bt_nllb_german	Why don t my fries taste as good as they do in a nice restaurant	0.0
402514	bt_nllb_persian	Why don t I like my cooked guards as much as I do when I eat them in a good restaurant	0.0
402514	bt_nllb_russian	Why don t my fries ever taste as good as when I get them at a good restaurant	0.0
4126337	-1	Why does my friend buy...?	0.0939
4126337	bt_bing_chinese_simplified	Why would my friend buy	0.0866
4126337	bt_nllb_arabic	Why would my friend buy	0.0866
4126337	bt_nllb_tamil	Why would my friend buy	0.0866
4126337	bt_bing_malay	Why did my friend buy	0.0564
4126337	bt_nllb_chinese_yue	Why did my friend buy	0.0564
4126337	bt_nllb_malay	Why did my friend buy	0.0564
4126337	bt_nllb_korean	Why is my friend staying	0.0
4126337	bt_nllb_persian	Why does my friend eat	0.0
4153592	-1	what can make someones ear's stink?	0.0849
4153592	bt_nllb_malay	What makes a person s ears smell	0.0681
4153592	bt_nllb_arabic	What makes him smell like someone s ears	0.0678
4153592	bt_nllb_russian	What could make someone smell	0.0282
4153592	bt_bing_arabic	What can make someone s ear smelly	0.0
4153592	bt_nllb_chinese_yue	Why does anyone smell bad	0.0
