,qid,order,query,qld.ndcg
4056,774,docluster.topn10.3.qld,causes of homelessness homeless,0.1846
4057,774,relevancefeedback.topn10.qld,causes of homelessness homeless,0.1846
4058,774,tagmee.topn3,causes homelessness Paralysis Homelessness,0.1676
4059,774,bt_nllb_tamil,Why are homeless people so vulnerable,0.1555
4060,774,word2vec.topn3,causes homelessness poverty,0.1544
4061,774,wordnet.topn3,causes homelessness have make induce,0.138
4062,774,glove.topn3,causes homelessness alcoholism,0.1347
4063,774,rm3.topn10.10.0.5.qld,causes of homelessness homeless student,0.1263
4064,774,bt_bing_persian,Reasons for homelessness,0.1234
4065,774,bt_nllb_persian,The reasons for homelessness,0.1234
4066,774,bt_nllb_swahili,Reasons for Homelessness,0.1234
4067,774,rm3.topn10.10.0.5.bm25,causes of homelessness homeless student district,0.0927
4068,774,wordnet.topn3.replace,suit grounds case homelessness,0.0719
4069,774,sensedisambiguation,Causes lawsuit of Homelessness,0.0704
4070,774,sensedisambiguation.replace,lawsuit of homelessness,0.025
4071,774,conceptluster.topn5.3.qld,causes homelessness paralysis,0.0153
4072,774,tagmee.topn3.replace,Paralysis Homelessness,0.0133
4073,774,bt_nllb_chinese_yue,Why they re homeless,0.0122
4074,774,stem.trunc5,cause of homel,0.0087
4075,774,bt_nllb_french,The Causes of Poverty,0.0056
4076,774,word2vec.topn3.replace,causes poverty,0.0056
4077,774,bt_nllb_malay,Causes of Housing Emptiness,0.0024
4078,774,bertqe.topn10.bm25,est end wed nov,0.0
4079,774,bertqe.topn10.qld,date subject other mail archiv,0.0
4080,774,bt_nllb_korean,Why I Have No Home,0.0
4081,774,glove.topn3.replace,causes alcoholism,0.0
4082,774,stem.lovins,caus of home,0.0
4083,774,stem.paicehusk,caus of homeless,0.0
4084,774,stem.porter,caus of homeless,0.0
4085,774,stem.porter2,caus of homeless,0.0
4086,774,stem.trunc4,caus of home,0.0
4087,774,termluster.topn5.3.qld,causes homelessness nifl messag literaci,0.0
4088,775,-1,Commercial candy makers,0.144
4089,775,conceptnet.topn3,commercial candy makers commercialised chocolate sugar the movies,0.1591
4090,775,conceptluster.topn5.3.qld,commercial candy makers candy,0.1583
4091,775,docluster.topn10.3.qld,commercial candy makers candi,0.1583
4092,775,tagmee.topn3,commercial candy makers Candy,0.1583
4093,775,rm3.topn10.10.0.5.qld,commercial candy makers candi all shall industri chocol,0.158
4094,775,wiki.topn3,commercial candy makers marshmallow caramel snack food candy,0.1495
4095,775,rm3.topn10.10.0.5.bm25,commercial candy makers candi shall chocol u industri,0.1491
4096,775,bt_bing_arabic,Commercial Candy Makers,0.144
4097,775,bt_bing_malay,Commercial candy maker,0.144
4098,775,bt_bing_persian,Commercial Candy Makers,0.144
4099,775,original,Commercial candy makers,0.144
4100,775,stem.krovetz,commercial candy maker,0.144
4101,775,stem.porter,commerci candi maker,0.144
4102,775,stem.porter2,commerci candi maker,0.144
4103,775,stem.sstemmer,commercial candy maker,0.144
4104,775,thesaurus.topn3,commercial candy makers,0.144
4105,775,thesaurus.topn3.replace,commercial candy makers,0.144
4106,775,tagmee.topn3.replace,Candy,0.1419
4107,775,wiki.topn3.replace,marshmallow caramel snack food candy,0.1378
4108,775,termluster.topn5.3.qld,commercial candy makers maker candi,0.1353
4109,775,relevancefeedback.topn10.qld,commercial candy makers candi u all,0.1183
4110,775,glove.topn3,commercial candy makers addition business chocolate manufacturers,0.0921
4111,775,wordnet.topn3,commercial candy makers commercial grade commercial message sugarcoat confect glaze shaper Godhead Divine,0.0699
4112,775,word2vec.topn3,commercial candy makers commerical non commercial commericial sweets chocolate manufacturers manufacturer,0.0696
4113,775,sensedisambiguation,Commercial candy makers manufacturer,0.0588
4114,775,bt_nllb_arabic,The commercial confectioners,0.052
4115,775,bt_bing_tamil,Commercial confectionery makers,0.0491
4116,775,conceptnet.topn3.replace,commercialised chocolate sugar the movies makers,0.0443
4117,775,stem.trunc5,comme candy maker,0.0412
4118,775,bt_nllb_tamil,Commercial sweets makers,0.0398
4119,775,bt_bing_french,Commercial Candy Manufacturers,0.0258
4120,775,bt_bing_korean,Commercial Candy Manufacturers,0.0258
4121,775,bt_bing_russian,Commercial Candy Manufacturers,0.0258
4122,775,bt_bing_swahili,Commercial candy manufacturers,0.0258
4123,775,bt_nllb_chinese_yue,Commercial candy manufacturers,0.0258
4124,775,bt_nllb_korean,Commercial candy manufacturers,0.0258
4125,775,bt_nllb_malay,Commercial candy manufacturers,0.0258
4126,775,bt_nllb_russian,Commercial candy manufacturers,0.0258
4127,775,sensedisambiguation.replace,commercial candy manufacturer,0.0258
4128,775,glove.topn3.replace,addition business chocolate manufacturers,0.0165
4129,775,stem.paicehusk,commerc candy mak,0.0161
4130,775,word2vec.topn3.replace,commerical non commercial commericial sweets chocolate manufacturers manufacturer,0.0069
4131,775,bt_nllb_swahili,Commercial sugar producers,0.0017
4132,775,anchor.topn3,commercial candy makers d africa penninsulair d esplorazion hekili keezo tologanak,0.0
4133,775,anchor.topn3.replace,d africa penninsulair d esplorazion hekili keezo tologanak makers,0.0
4134,775,bertqe.topn10.bm25,usda nutrient databas standard refer,0.0
4135,775,bertqe.topn10.qld,usda nutrient databas standard refer,0.0
4136,775,bt_bing_chinese_simplified,Commercial confectionery manufacturer,0.0
4137,775,bt_bing_german,Commercial Confectionery Manufacturers,0.0
4138,775,bt_nllb_french,Manufacturers of commercial sweets,0.0
4139,775,bt_nllb_german,Manufacturers of commercial sweets,0.0
4140,775,bt_nllb_persian,Commercial sweets manufacturers,0.0
4141,775,stem.lovins,commerc cand maker,0.0
4142,775,stem.trunc4,comm cand make,0.0
4143,775,wordnet.topn3.replace,commercial message commercial grade glaze sugarcoat Jehovah shaper God Almighty,0.0
4144,776,-1,Magnet schools success,0.261
4145,776,bt_bing_arabic,The success of Magnet Schools,0.261
4146,776,bt_bing_chinese_simplified,Magnet school success,0.261
4147,776,bt_bing_french,Magnet Schools Success,0.261
4148,776,bt_bing_german,Success of Magnet Schools,0.261
4149,776,bt_bing_korean,Magnet School Success,0.261
4150,776,bt_bing_malay,The success of the magnetic school,0.261
4151,776,bt_bing_persian,Success Magnetic Schools,0.261
4152,776,bt_bing_russian,The Success of Magnet Schools,0.261
4153,776,bt_bing_swahili,Success of Magnet Schools,0.261
4154,776,bt_bing_tamil,Magnet Schools Success,0.261
4155,776,bt_nllb_arabic,The success of magnet schools,0.261
4156,776,bt_nllb_chinese_yue,The success of the magnet school,0.261
4157,776,bt_nllb_french,The Success of Magnetic Schools,0.261
4158,776,bt_nllb_german,Success of magnet schools,0.261
4159,776,bt_nllb_malay,Success of magnet school,0.261
4160,776,bt_nllb_persian,The Success of Magnetic Schools,0.261
4161,776,bt_nllb_russian,The success of magnet schools,0.261
4162,776,bt_nllb_swahili,The success of magnetic schools,0.261
4163,776,bt_nllb_tamil,The success of the magnetic schools,0.261
4164,776,conceptluster.topn5.3.qld,magnet schools success,0.261
4165,776,original,Magnet schools success,0.261
4166,776,sensedisambiguation.replace,magnet school success,0.261
4167,776,stem.krovetz,magnet school success,0.261
4168,776,stem.paicehusk,magnet school success,0.261
4169,776,stem.porter,magnet school success,0.261
4170,776,stem.porter2,magnet school success,0.261
4171,776,stem.sstemmer,magnet school success,0.261
4172,776,thesaurus.topn3,magnet schools success,0.261
4173,776,thesaurus.topn3.replace,magnet schools success,0.261
4174,776,relevancefeedback.topn10.qld,magnet schools success school student,0.2442
4175,776,rm3.topn10.10.0.5.bm25,magnet schools success school msap,0.2402
4176,776,wiki.topn3,magnet schools success magnet schools national honor society alternativschool magnet school magnet schools national honor society alternativschool magnet school,0.2354
4177,776,tagmee.topn3,magnet schools success Magnet school Magnet school,0.2051
4178,776,wiki.topn3.replace,magnet schools national honor society alternativschool magnet school magnet schools national honor society alternativschool magnet school,0.1898
4179,776,tagmee.topn3.replace,Magnet school Magnet school,0.1803
4180,776,termluster.topn5.3.qld,magnet schools success art children design support success student art children design,0.1637
4181,776,bertqe.topn10.qld,million support magnet school program,0.1343
4182,776,docluster.topn10.3.qld,magnet schools success school,0.1317
4183,776,rm3.topn10.10.0.5.qld,magnet schools success school,0.1317
4184,776,sensedisambiguation,Magnet schools school success,0.1317
4185,776,glove.topn3,magnet schools success http www mediabynumbers com colleges achieved,0.1259
4186,776,wordnet.topn3,magnet schools success attracter attractive feature attractor schooltime educate winner achiever succeeder,0.1
4187,776,bertqe.topn10.bm25,new haven bloomfield receiv nearli,0.0551
4188,776,conceptnet.topn3,magnet schools success an eraser places to learn things classrooms taking finals,0.0456
4189,776,stem.lovins,magnet school succes,0.0346
4190,776,bt_nllb_korean,Success at Your School,0.005
4191,776,word2vec.topn3,magnet schools success colleges universities sucess,0.0049
4192,776,conceptnet.topn3.replace,magnet an eraser places to learn things classrooms taking finals,0.0043
4193,776,anchor.topn3,magnet schools success anomaly n ge ndfeb war br of austr rd b,0.0
4194,776,anchor.topn3.replace,anomaly n ge ndfeb schools war br of austr rd b,0.0
4195,776,glove.topn3.replace,http www mediabynumbers com colleges achieved,0.0
4196,776,stem.trunc4,magn scho succ,0.0
4197,776,stem.trunc5,magne schoo succe,0.0
4198,776,word2vec.topn3.replace,magnet colleges universities sucess,0.0
4199,776,wordnet.topn3.replace,attractor attractive feature attracter civilize shoal succeeder achiever winner,0.0
4200,777,-1,hybrid alternative fuel cars,0.2391
4201,777,wiki.topn3,hybrid alternative fuel cars powertrain ac propulsion automotivaerodynamics hybrid vehicle alternative fuels miles per gallon gasolinequivalent hybrid vehicldrivetrain alternative fuel vehicle,0.2692
4202,777,rm3.topn10.10.0.5.qld,hybrid alternative fuel cars hydrogen vehicl,0.2561
4203,777,glove.topn3,hybrid alternative fuel cars concept preferable gasoline vehicles,0.2526
4204,777,bt_bing_french,Alternative Fuel Hybrid Cars,0.2391
4205,777,bt_bing_german,Hybrid cars with alternative fuels,0.2391
4206,777,bt_bing_malay,Hybrid alternative fuel cars,0.2391
4207,777,bt_bing_tamil,Hybrid Alternative Fuel Cars,0.2391
4208,777,bt_nllb_arabic,Hybrid alternative fuel cars,0.2391
4209,777,bt_nllb_korean,Hybrid alternative fuel cars,0.2391
4210,777,docluster.topn10.3.qld,hybrid alternative fuel cars,0.2391
4211,777,original,hybrid alternative fuel cars,0.2391
4212,777,sensedisambiguation.replace,hybrid alternative fuel car,0.2391
4213,777,stem.krovetz,hybrid alternative fuel car,0.2391
4214,777,stem.lovins,hybrid altern fuel car,0.2391
4215,777,stem.paicehusk,hybrid altern fuel car,0.2391
4216,777,stem.porter,hybrid altern fuel car,0.2391
4217,777,stem.porter2,hybrid altern fuel car,0.2391
4218,777,stem.sstemmer,hybrid alternative fuel car,0.2391
4219,777,thesaurus.topn3,hybrid alternative fuel cars,0.2391
4220,777,thesaurus.topn3.replace,hybrid alternative fuel cars,0.2391
4221,777,word2vec.topn3,hybrid alternative fuel cars non hybrid gasoline automobiles vehicles,0.2344
4222,777,sensedisambiguation,hybrid alternative fuel cars car,0.2288
4223,777,relevancefeedback.topn10.qld,hybrid alternative fuel cars electr hydrogen transport,0.2236
4224,777,rm3.topn10.10.0.5.bm25,hybrid alternative fuel cars hydrogen transport ga vehicl,0.2223
4225,777,anchor.topn3,hybrid alternative fuel cars reassoci arbutu hybrids goos fuel inject mixed oxid gas motor geilli idlicot schiedt,0.2212
4226,777,wiki.topn3.replace,powertrain ac propulsion automotivaerodynamics hybrid vehicle alternative fuels miles per gallon gasolinequivalent hybrid vehicldrivetrain alternative fuel vehicle,0.2202
4227,777,bt_nllb_persian,Hybrid fuel cars are replacing them,0.1929
4228,777,wordnet.topn3,hybrid alternative fuel cars loan blend intercrossed crossbreed substitute fire railroad car cable car,0.183
4229,777,conceptluster.topn5.3.qld,hybrid alternative fuel cars hybrid vehicle alternative fuel vehicle,0.1664
4230,777,tagmee.topn3,hybrid alternative fuel cars Hybrid vehicle Alternative fuel vehicle,0.1664
4231,777,bt_nllb_malay,hybrid alternative fuels,0.147
4232,777,word2vec.topn3.replace,non hybrid alternative gasoline automobiles vehicles,0.1344
4233,777,bt_bing_arabic,Hybrid Alternative Fuel Vehicles,0.1179
4234,777,bt_bing_chinese_simplified,Hybrid alternative fuel vehicles,0.1179
4235,777,bt_bing_korean,Hybrid Alternative Fuel Vehicles,0.1179
4236,777,bt_bing_persian,Hybrid Vehicles with Alternative Fuel,0.1179
4237,777,bt_bing_russian,Hybrid Vehicles on Alternative Fuels,0.1179
4238,777,bt_bing_swahili,Alternative hybrid fuel vehicles,0.1179
4239,777,bt_nllb_chinese_yue,Hybrid alternative fuel vehicles,0.1179
4240,777,bt_nllb_french,hybrid alternative fuel vehicles,0.1179
4241,777,bt_nllb_german,Hybrid alternative fuel vehicles,0.1179
4242,777,bt_nllb_russian,hybrid vehicles with alternative fuel,0.1179
4243,777,bt_nllb_tamil,Hybrid alternative fuel vehicles,0.1179
4244,777,termluster.topn5.3.qld,hybrid alternative fuel cars addit advantag air vehicl standard speed addit advantag air vehicl standard speed,0.1049
4245,777,bt_nllb_swahili,hybrid fuel vehicles,0.0973
4246,777,anchor.topn3.replace,reassoci arbutu hybrids goos alternative fuel inject mixed oxid gas motor geilli idlicot schiedt,0.0918
4247,777,tagmee.topn3.replace,Hybrid vehicle Alternative fuel vehicle,0.0816
4248,777,glove.topn3.replace,concept preferable gasoline vehicles,0.0609
4249,777,conceptnet.topn3,hybrid alternative fuel cars organism unconventional oil coal gas go fast driven,0.0535
4250,777,stem.trunc4,hybr alte fuel cars,0.0294
4251,777,stem.trunc5,hybri alter fuel cars,0.0082
4252,777,bertqe.topn10.bm25,role inform tool success stori,0.0
4253,777,bertqe.topn10.qld,smart commun network transport maxim,0.0
4254,777,conceptnet.topn3.replace,organism unconventional oil coal gas go fast driven,0.0
4255,777,wordnet.topn3.replace,cross crossbreed intercrossed choice fire auto cable car elevator car,0.0
4256,778,-1,golden ratio,0.3346
4257,778,rm3.topn10.10.0.5.bm25,golden ratio mathemat face similar dr,0.3995
4258,778,termluster.topn5.3.qld,golden ratio number ratio golden number,0.3575
4259,778,bertqe.topn10.bm25,titl divin ratio studi fibonacci,0.3353
4260,778,bertqe.topn10.qld,titl divin ratio studi fibonacci,0.3353
4261,778,bt_bing_arabic,Golden ratio,0.3346
4262,778,bt_bing_chinese_simplified,The golden ratio,0.3346
4263,778,bt_bing_french,Golden Ratio,0.3346
4264,778,bt_bing_korean,The Golden Ratio,0.3346
4265,778,bt_bing_persian,Golden Ratio,0.3346
4266,778,bt_bing_swahili,Golden ratio,0.3346
4267,778,bt_bing_tamil,Golden Ratio,0.3346
4268,778,bt_nllb_arabic,The golden ratio,0.3346
4269,778,bt_nllb_russian,The golden ratio,0.3346
4270,778,conceptluster.topn5.3.qld,golden ratio golden ratio,0.3346
4271,778,original,golden ratio,0.3346
4272,778,sensedisambiguation,golden ratio,0.3346
4273,778,sensedisambiguation.replace,golden ratio,0.3346
4274,778,stem.krovetz,golden ratio,0.3346
4275,778,stem.porter,golden ratio,0.3346
4276,778,stem.porter2,golden ratio,0.3346
4277,778,stem.sstemmer,golden ratio,0.3346
4278,778,tagmee.topn3,golden ratio Golden ratio,0.3346
4279,778,tagmee.topn3.replace,Golden ratio,0.3346
4280,778,thesaurus.topn3,golden ratio,0.3346
4281,778,thesaurus.topn3.replace,golden ratio,0.3346
4282,778,glove.topn3,golden ratio http www nwguild org k proportion,0.2111
4283,778,anchor.topn3,golden ratio reneta small golden saxifrag golden weav gravissimum dtis,0.1685
4284,778,rm3.topn10.10.0.5.qld,golden ratio town citi mathemat face,0.1513
4285,778,wiki.topn3,golden ratio kepler poinsot polyhedron dodecahedron nonconvex polyhedra golden ratio,0.1127
4286,778,wordnet.topn3,golden ratio fortunate favourable lucky proportion,0.1114
4287,778,conceptnet.topn3,golden ratio bridge rule prosperous,0.0941
4288,778,bt_bing_malay,Gold Ratio,0.0245
4289,778,bt_nllb_chinese_yue,The gold ratio,0.0245
4290,778,bt_nllb_french,gold ratio,0.0245
4291,778,bt_nllb_german,Gold ratio,0.0245
4292,778,bt_nllb_korean,Gold ratio,0.0245
4293,778,bt_nllb_malay,gold ratio,0.0245
4294,778,bt_nllb_persian,The gold ratio,0.0245
4295,778,bt_nllb_swahili,gold ratio,0.0245
4296,778,stem.paicehusk,gold ratio,0.0245
4297,778,stem.trunc5,golde ratio,0.0245
4298,778,relevancefeedback.topn10.qld,golden ratio town citi face rule fish,0.015
4299,778,anchor.topn3.replace,reneta small golden saxifrag golden weav gravissimum dtis,0.0
4300,778,bt_bing_german,Golden section,0.0
4301,778,bt_bing_russian,Golden section,0.0
4302,778,bt_nllb_tamil,Gold Rate,0.0
4303,778,conceptnet.topn3.replace,bridge rule prosperous ratio,0.0
4304,778,docluster.topn10.3.qld,golden ratio citi town,0.0
4305,778,glove.topn3.replace,http www nwguild org k proportion,0.0
4306,778,stem.lovins,gold rati,0.0
4307,778,stem.trunc4,gold rati,0.0
4308,778,wiki.topn3.replace,kepler poinsot polyhedron dodecahedron nonconvex polyhedra golden ratio,0.0
4309,778,word2vec.topn3,golden ratio gilded silver Signal to noise decidendi,0.0
4310,778,word2vec.topn3.replace,gilded silver Signal to noise decidendi,0.0
4311,778,wordnet.topn3.replace,aureate gilt halcyon proportion,0.0
4312,779,-1,Javelinas range and description,0.4432
4313,779,stem.paicehusk,javelina rang and describ,0.446
4314,779,bt_bing_french,Javelinas Range and Description,0.4432
4315,779,bt_bing_korean,Javelinas range and description,0.4432
4316,779,bt_bing_malay,Range and description of Javelinas,0.4432
4317,779,bt_bing_persian,Javelinas Range and Description,0.4432
4318,779,bt_bing_russian,Javelinas range and description,0.4432
4319,779,bt_nllb_malay,Range and description of Javelinas,0.4432
4320,779,original,Javelinas range and description,0.4432
4321,779,stem.krovetz,javelina range and description,0.4432
4322,779,stem.porter,javelina rang and descript,0.4432
4323,779,stem.porter2,javelina rang and descript,0.4432
4324,779,stem.sstemmer,javelina range and description,0.4432
4325,779,thesaurus.topn3,javelinas range description,0.4432
4326,779,thesaurus.topn3.replace,javelinas range description,0.4432
4327,779,docluster.topn10.3.qld,javelinas range and description road rang area,0.4042
4328,779,relevancefeedback.topn10.qld,javelinas range and description javelina road area bear jaguar rang confidenti,0.3996
4329,779,termluster.topn5.3.qld,javelinas range description speci south rang speci south mountain,0.3944
4330,779,bt_bing_swahili,Javelinas species and description,0.3918
4331,779,conceptluster.topn5.3.qld,javelinas range description peccary species description range biology,0.3808
4332,779,tagmee.topn3,javelinas range description Peccary Range biology Species description,0.3808
4333,779,sensedisambiguation,Javelinas collared peccary range stove and description,0.3687
4334,779,anchor.topn3,javelinas range description barsana hindola fliml schoenbrunnensi guianæ paenitentia,0.3483
4335,779,bt_nllb_tamil,The description and classification of Javelina,0.3479
4336,779,rm3.topn10.10.0.5.bm25,javelinas range and description hunt area road,0.3477
4337,779,bt_bing_german,Javelina s range and description,0.3448
4338,779,rm3.topn10.10.0.5.qld,javelinas range and description hunt area javelina road bear,0.3417
4339,779,bt_nllb_german,Selection and description of Javelinas,0.322
4340,779,wiki.topn3,javelinas range description peccaries quetzal coati peccary species complex biological journal thlinnean society monotypitaxonomigroups range biology russulales basidiospore hymenium species description,0.3073
4341,779,anchor.topn3.replace,javelinas barsana hindola fliml schoenbrunnensi guianæ paenitentia,0.3013
4342,779,bt_nllb_swahili,Types and descriptions of javelinas,0.2925
4343,779,word2vec.topn3,javelinas range description whitetails pronghorns range decription discription,0.2749
4344,779,wordnet.topn3,javelinas range description Tayassu tajacu Peccari angulatus swan place lay out verbal description,0.2573
4345,779,glove.topn3,javelinas range description mangxamba kd describing,0.2551
4346,779,sensedisambiguation.replace,collared peccary stove and description,0.2425
4347,779,tagmee.topn3.replace,Peccary Range biology Species description,0.2159
4348,779,wordnet.topn3.replace,collared peccary Tayassu angulatus Tayassu tajacu roll kitchen stove stray verbal description,0.1875
4349,779,wiki.topn3.replace,peccaries quetzal coati peccary species complex biological journal thlinnean society monotypitaxonomigroups range biology russulales basidiospore hymenium species description,0.1811
4350,779,conceptnet.topn3,javelinas range description home stove word picture,0.1265
4351,779,conceptnet.topn3.replace,javelinas home stove word picture,0.0683
4352,779,word2vec.topn3.replace,whitetails pronghorns range decription discription,0.0637
4353,779,bertqe.topn10.bm25,nativ western hemisp here character,0.0247
4354,779,stem.trunc4,jave rang and desc,0.0114
4355,779,bertqe.topn10.qld,speci card game speci food,0.0058
4356,779,bt_nllb_russian,Assortment and description of hawks,0.0053
4357,779,bt_bing_arabic,Spear set and description,0.0
4358,779,bt_bing_chinese_simplified,Javelin series and description,0.0
4359,779,bt_bing_tamil,Javelin throw throw and description,0.0
4360,779,bt_nllb_arabic,The collection and description of the javelins,0.0
4361,779,bt_nllb_chinese_yue,The knife series and description,0.0
4362,779,bt_nllb_french,Region and description of the javelins,0.0
4363,779,bt_nllb_korean,The range and description of the javelin,0.0
4364,779,bt_nllb_persian,The range and description of Javins,0.0
4365,779,glove.topn3.replace,mangxamba kd range describing,0.0
4366,779,stem.lovins,javelin rang and descript,0.0
4367,779,stem.trunc5,javel range and descr,0.0
4368,780,-1,Arable land,0.1301
4369,780,docluster.topn10.3.qld,arable land perman or claim,0.198
4370,780,relevancefeedback.topn10.qld,arable land perman or claim,0.198
4371,780,rm3.topn10.10.0.5.qld,arable land perman or claim,0.198
4372,780,termluster.topn5.3.qld,arable land world unit south arabl south forest,0.1494
4373,780,anchor.topn3.replace,arable technohub marinefährprahm,0.1469
4374,780,anchor.topn3,arable land technohub marinefährprahm,0.1301
4375,780,bt_bing_arabic,Arable land,0.1301
4376,780,bt_bing_french,Arable land,0.1301
4377,780,bt_bing_german,Arable land,0.1301
4378,780,bt_bing_russian,Arable land,0.1301
4379,780,bt_bing_swahili,Arable Land,0.1301
4380,780,bt_bing_tamil,Arable land,0.1301
4381,780,conceptluster.topn5.3.qld,arable land,0.1301
4382,780,original,Arable land,0.1301
4383,780,stem.krovetz,arable land,0.1301
4384,780,stem.porter,arabl land,0.1301
4385,780,stem.porter2,arabl land,0.1301
4386,780,stem.sstemmer,arable land,0.1301
4387,780,stem.trunc5,arabl land,0.1301
4388,780,tagmee.topn3,arable land Arable land,0.1301
4389,780,tagmee.topn3.replace,Arable land,0.1301
4390,780,thesaurus.topn3,arable land,0.1301
4391,780,thesaurus.topn3.replace,arable land,0.1301
4392,780,sensedisambiguation,Arable land state,0.128
4393,780,rm3.topn10.10.0.5.bm25,arable land perman china would or water,0.1196
4394,780,sensedisambiguation.replace,arable state,0.1162
4395,780,conceptnet.topn3,arable land cultivatable property continent An island,0.1142
4396,780,wiki.topn3,arable land agricultural land grassland plains arable land,0.108
4397,780,word2vec.topn3,arable land cultivatable farmable non arable farmland,0.0961
4398,780,wiki.topn3.replace,agricultural land grassland plains arable land,0.0926
4399,780,glove.topn3,arable land farmland irrigated property,0.0737
4400,780,wordnet.topn3,arable land tillable cultivable cultivatable set ashore ground landed estate,0.0587
4401,780,word2vec.topn3.replace,cultivatable farmable non arable farmland,0.0265
4402,780,bertqe.topn10.bm25,summari preliminari evalu claim klamath,0.0082
4403,780,bt_nllb_chinese_yue,The land,0.0082
4404,780,conceptnet.topn3.replace,cultivatable property continent An island,0.0055
4405,780,stem.trunc4,arab land,0.0053
4406,780,bt_nllb_korean,Farming land,0.0041
4407,780,wordnet.topn3.replace,cultivable tillable country farming set down,0.0038
4408,780,bt_bing_malay,Agricultural land,0.0012
4409,780,bt_bing_persian,Agricultural land,0.0012
4410,780,bt_nllb_french,Agricultural land,0.0012
4411,780,bt_nllb_german,Agricultural land,0.0012
4412,780,bt_nllb_tamil,agricultural land,0.0012
4413,780,bertqe.topn10.qld,po box beatti,0.0
4414,780,bt_bing_chinese_simplified,cultivated land,0.0
4415,780,bt_bing_korean,Farmland,0.0
4416,780,bt_nllb_arabic,The cultivated land,0.0
4417,780,bt_nllb_malay,Farmland,0.0
4418,780,bt_nllb_persian,The slaughterhouses,0.0
4419,780,bt_nllb_russian,Soil,0.0
4420,780,bt_nllb_swahili,The Harvest,0.0
4421,780,glove.topn3.replace,farmland irrigated property,0.0
4422,780,stem.lovins,ar land,0.0
4423,780,stem.paicehusk,ar land,0.0
4424,781,-1,Squirrel control and protections,0.2328
4425,781,rm3.topn10.10.0.5.bm25,squirrel control and protections ground,0.2381
4426,781,bt_bing_arabic,Squirrel control and protection,0.2328
4427,781,bt_bing_chinese_simplified,Squirrel control and protection,0.2328
4428,781,bt_bing_french,Squirrel control and protection,0.2328
4429,781,bt_bing_german,Squirrel control and protection,0.2328
4430,781,bt_bing_korean,Squirrel Control Protection,0.2328
4431,781,bt_bing_malay,Squirrel control and protection,0.2328
4432,781,bt_bing_persian,Squirrel Control and Protection,0.2328
4433,781,bt_bing_swahili,Squirrel control and protection,0.2328
4434,781,bt_nllb_french,Control and protection of squirrels,0.2328
4435,781,bt_nllb_german,Control and protection of squirrels,0.2328
4436,781,bt_nllb_malay,Squirrel control and protection,0.2328
