,qid,order,query,qld.map
0,701,-1,U.S. oil industry history,0.008
1,701,sensedisambiguation,U S united states government oil vegetable oil industry history,0.0039
2,701,rm3.topn10.10.0.5.qld,u s oil industry history fuel ga energi price,0.0036
3,701,bertqe.topn10.bm25,f ossil nergi e nvir,0.0033
4,701,wiki.topn3,u s oil industry history glassforming liquids melts oil natural gas petroleum,0.0024
5,701,word2vec.topn3,u s oil industry history usa u s american petroleum industy history,0.0021
6,701,bertqe.topn10.qld,e nvir onment al dv,0.0018
7,701,sensedisambiguation.replace,united states government vegetable oil industry history,0.0013
8,701,glove.topn3,u s oil industry history us u s crude petroleum business historical ever,0.0008
9,701,rm3.topn10.10.0.5.bm25,u s oil industry history energi opec,0.0007
10,701,conceptnet.topn3,u s oil industry history liquid black fuel commercial enterprise past subject school,0.0005
11,701,wordnet.topn3,u s oil industry history USA United States United States government rock oil petroleum oil color manufacture diligence account chronicle,0.0004
12,701,word2vec.topn3.replace,usa u s american petroleum industy history,0.0001
13,701,anchor.topn3,u s oil industry history us c alphabet elektrivõrgud sooju recuyel seeg théodrat,0.0
14,701,anchor.topn3.replace,us c alphabet elektrivõrgud sooju industry recuyel seeg théodrat,0.0
15,701,conceptnet.topn3.replace,u s liquid black fuel commercial enterprise past subject school,0.0
16,701,glove.topn3.replace,us u s crude petroleum business historical ever,0.0
17,701,stem.lovins,u s oil industr histor,0.0
18,701,stem.paicehusk,u s oil industry hist,0.0
19,701,stem.trunc4,u s oil indu hist,0.0
20,701,stem.trunc5,u s oil indus histo,0.0
21,701,tagmee.topn3.replace,Petroleum,0.0
22,701,wiki.topn3.replace,glassforming liquids melts oil natural gas petroleum,0.0
23,701,wordnet.topn3.replace,United States government USA US anoint vegetable oil crude manufacture story chronicle,0.0
24,702,-1,Pearl farming,0.0264
25,702,docluster.topn10.3.qld,pearl farming farm,0.0184
26,702,rm3.topn10.10.0.5.bm25,pearl farming coliform cumberland option japan our jerri ocean,0.018
27,702,word2vec.topn3,pearl farming necklace agriculture agricultural,0.0174
28,702,wordnet.topn3,pearl farming drop ivory off white agricultural land raise,0.0138
29,702,anchor.topn3,pearl farming nanyou namro madlen,0.0088
30,702,relevancefeedback.topn10.qld,pearl farming japan farm jerri option irrig,0.0043
31,702,bt_nllb_arabic,The pearl planting,0.0035
32,702,bt_bing_persian,Pearl Agriculture,0.0007
33,702,conceptnet.topn3,pearl farming land crop,0.0006
34,702,conceptnet.topn3.replace,pearl land crop,0.0002
35,702,glove.topn3,pearl farming harbor http www oklahomacitynationalmemorial org agricultural farmers,0.0002
36,702,anchor.topn3.replace,nanyou namro madlen farming,0.0
37,702,bertqe.topn10.bm25,potato program regulatori test servic,0.0
38,702,bertqe.topn10.qld,seed farm,0.0
39,702,bt_nllb_persian,The Pearl of the Caribbean,0.0
40,702,glove.topn3.replace,harbor http www oklahomacitynationalmemorial org agricultural farmers,0.0
41,702,stem.trunc4,pear farm,0.0
42,702,stem.trunc5,pearl farmi,0.0
43,702,word2vec.topn3.replace,necklace agriculture agricultural,0.0
44,702,wordnet.topn3.replace,off white bead agricultural agrarian,0.0
45,704,-1,Green party political views,0.0489
46,704,docluster.topn10.3.qld,green party political views parti,0.0372
47,704,relevancefeedback.topn10.qld,green party political views parti,0.0372
48,704,rm3.topn10.10.0.5.qld,green party political views parti,0.0372
49,704,bt_bing_persian,The Green Party s Political Views,0.0277
50,704,bt_nllb_chinese_yue,The Green Party s political views,0.0277
51,704,conceptluster.topn5.3.qld,green party political views ideology politics political party green party united states,0.0223
52,704,tagmee.topn3,green party political views Green Party of the United States Political party Politics Ideology,0.0223
53,704,tagmee.topn3.replace,Green Party of the United States Political party Politics Ideology,0.0133
54,704,wiki.topn3,green party political views natural law party united states green national committee maria elizabeth muñoz green party united states political parties portal politics dieter nohlen political party society politics political science politics schools thought social equality egalitarianism ideology,0.0113
55,704,rm3.topn10.10.0.5.bm25,green party political views indonesia parti polit,0.0111
56,704,anchor.topn3,green party political views green windi treekrem k cup,0.0092
57,704,wiki.topn3.replace,natural law party united states green national committee maria elizabeth muñoz green party united states political parties portal politics dieter nohlen political party society politics political science politics schools thought social equality egalitarianism ideology,0.0083
58,704,word2vec.topn3,green party political views yellow blue red party economic social socio political viewpoints viewpoint,0.0079
59,704,glove.topn3,green party political views red purple democratic politicians opinions,0.0075
60,704,anchor.topn3.replace,green windi treekrem k cup party political views,0.0067
61,704,bt_bing_chinese_simplified,The Greens political views,0.0048
62,704,bt_bing_german,Political views of the Greens,0.0048
63,704,bt_nllb_german,Political views of the Greens,0.0048
64,704,wordnet.topn3,green party political views immature super C honey oil political party company regard take in reckon,0.0039
65,704,sensedisambiguation,Green party political views view,0.0036
66,704,stem.lovins,green part polit view,0.0027
67,704,wordnet.topn3.replace,commons unripened viridity company political party political perspective sentiment panorama,0.0011
68,704,glove.topn3.replace,red purple democratic politicians opinions,0.0002
69,704,word2vec.topn3.replace,yellow blue red party economic social socio political viewpoints viewpoint,0.0002
70,704,bertqe.topn10.bm25,n warren lisa chac n,0.0
71,704,bertqe.topn10.qld,n warren lisa chac n,0.0
72,704,conceptnet.topn3,green party political views apple plant a color celebration gathering birthday,0.0
73,704,conceptnet.topn3.replace,apple plant a color celebration gathering birthday political views,0.0
74,704,stem.trunc4,gree part poli view,0.0
75,705,-1,Iraq foreign debt reduction,0.1034
76,705,glove.topn3,iraq foreign debt reduction iraqi baghdad overseas ministry repay reducing,0.0929
77,705,bt_bing_swahili,Reducing Iraq s foreign debt,0.0924
78,705,bt_nllb_persian,Reducing Iraq s foreign debt,0.0924
79,705,bt_nllb_swahili,Reducing Iraq s foreign debt,0.0924
80,705,bt_bing_chinese_simplified,Iraq s external debt relief,0.0921
81,705,bt_bing_korean,Reduction of Iraq s foreign debt,0.0683
82,705,bt_bing_malay,Reduction of Iraq s foreign debt,0.0683
83,705,bt_nllb_korean,Iraq s foreign debt reduction,0.0683
84,705,bt_nllb_tamil,Iraq s foreign debt reduction,0.0683
85,705,termluster.topn5.3.qld,iraq foreign debt reduction debt depart state depart iraq state unit state servic,0.0633
86,705,relevancefeedback.topn10.qld,iraq foreign debt reduction develop,0.0588
87,705,rm3.topn10.10.0.5.qld,iraq foreign debt reduction develop,0.0588
88,705,glove.topn3.replace,iraqi baghdad overseas ministry repay reducing,0.0471
89,705,word2vec.topn3,iraq foreign debt reduction iraq afghanistan iraqi domestic international indebtedness reducing,0.0393
90,705,bt_nllb_arabic,Cut the foreign debt in Iraq,0.0352
91,705,stem.trunc5,iraq forei debt reduc,0.0336
92,705,conceptluster.topn5.3.qld,iraq foreign debt reduction debt external debt,0.0172
93,705,wiki.topn3,iraq foreign debt reduction iraq mesopotamia syria iraq internal debt portfolio investment fixed investment external debt credit finance collateral finance interest debt,0.0172
94,705,conceptnet.topn3,iraq foreign debt reduction a country a country in the middle east war other money spending money paying by credit card,0.0045
95,705,word2vec.topn3.replace,iraq afghanistan iraqi domestic international indebtedness reducing,0.0042
96,705,wordnet.topn3,iraq foreign debt reduction Irak Al Iraq extraneous alien simplification step down,0.0041
97,705,wordnet.topn3.replace,Republic of Iraq Irak extraneous strange alien debt simplification step down diminution,0.0008
98,705,anchor.topn3,iraq foreign debt reduction iraq histori syria fortress syria transport s education s tawheed obligation subprim inclosure delan nonreduct frege church organisation fundament,0.0003
99,705,anchor.topn3.replace,iraq histori syria fortress syria transport s education s tawheed obligation subprim inclosure delan nonreduct frege church organisation fundament,0.0
100,705,bertqe.topn10.bm25,dc mai,0.0
101,705,bertqe.topn10.qld,unit state gener account offic,0.0
102,705,conceptnet.topn3.replace,a country a country in the middle east war other money spending money paying by credit card reduction,0.0
103,705,stem.trunc4,iraq fore debt redu,0.0
104,705,wiki.topn3.replace,iraq mesopotamia syria iraq internal debt portfolio investment fixed investment external debt credit finance collateral finance interest debt,0.0
105,706,-1,Controlling type II diabetes,0.0321
106,706,docluster.topn10.3.qld,controlling type ii diabetes diabet,0.0316
107,706,rm3.topn10.10.0.5.bm25,controlling type ii diabetes diabet,0.0316
108,706,sensedisambiguation,Controlling see type II two diabetes,0.0295
109,706,relevancefeedback.topn10.qld,controlling type ii diabetes diabet word,0.0262
110,706,bt_nllb_malay,Managing type diabetes,0.0259
111,706,bt_bing_korean,Type Diabetes Control,0.0252
112,706,bt_nllb_arabic,Control of type diabetes,0.0252
113,706,bt_nllb_chinese_yue,Control of type diabetes,0.0252
114,706,bt_nllb_korean,Control of type diabetes,0.0252
115,706,bt_nllb_persian,Control of type diabetes,0.0252
116,706,stem.paicehusk,control type iy diabet,0.0246
117,706,rm3.topn10.10.0.5.qld,controlling type ii diabetes diabet cost,0.0225
118,706,conceptluster.topn5.3.qld,controlling type ii diabetes diabetes mellitus,0.0218
119,706,tagmee.topn3,controlling type ii diabetes Diabetes mellitus,0.0218
120,706,bt_bing_swahili,Managing Type II Diabetes,0.021
121,706,glove.topn3,controlling type ii diabetes example iii iv hypertension obesity,0.0095
122,706,termluster.topn5.3.qld,controlling type ii diabetes type trial studi control diabet diseas type trial studi,0.004
123,706,wordnet.topn3,controlling type ii diabetes assure contain typewrite eccentric deuce,0.001
124,706,conceptnet.topn3,controlling type ii diabetes dominant have a keyboard use a computer use a keyboard two iii polydipsia,0.0005
125,706,tagmee.topn3.replace,Diabetes mellitus,0.0004
126,706,stem.trunc4,cont type ii diab,0.0003
127,706,stem.lovins,control typ ii diabes,0.0002
128,706,stem.trunc5,contr type ii diabe,0.0002
129,706,wordnet.topn3.replace,ensure moderate manipulate typewrite character case deuce two diabetes,0.0001
130,706,anchor.topn3,controlling type ii diabetes umbauwagon percent encoding th ii kara ḫardaš nazi bugaš and the events at end of his reign iii,0.0
131,706,anchor.topn3.replace,controlling umbauwagon percent encoding th ii kara ḫardaš nazi bugaš and the events at end of his reign iii diabetes,0.0
132,706,bertqe.topn10.bm25,assess number us glycat,0.0
133,706,bertqe.topn10.qld,evid report technolog assess number,0.0
134,706,conceptnet.topn3.replace,dominant have a keyboard use a computer use a keyboard two iii polydipsia,0.0
135,706,glove.topn3.replace,controlling example iii iv hypertension obesity,0.0
136,706,wiki.topn3,controlling type ii diabetes lymphoma noninfective enteritis colitis cirrhosis diabetes mellitus,0.0
137,706,wiki.topn3.replace,lymphoma noninfective enteritis colitis cirrhosis diabetes mellitus,0.0
138,706,word2vec.topn3,controlling type ii diabetes regulating kind iii iv vii,0.0
139,706,word2vec.topn3.replace,regulating kind iii iv vii diabetes,0.0
140,707,-1,Aspirin cancer prevention,0.2795
141,707,bt_nllb_chinese_yue,The anti cancer aspirin,0.2726
142,707,termluster.topn5.3.qld,aspirin cancer prevention cancer colon effect aspirin colon effect studi screen risk,0.2687
143,707,conceptluster.topn5.3.qld,aspirin cancer prevention cancer cancer prevention,0.2655
144,707,bt_nllb_tamil,Aspirin is used to prevent cancer,0.2568
145,707,rm3.topn10.10.0.5.bm25,aspirin cancer prevention i,0.2351
146,707,relevancefeedback.topn10.qld,aspirin cancer prevention claim,0.2327
147,707,bt_nllb_korean,Aspirin is a cancer prevention drug,0.1996
148,707,bt_nllb_swahili,How to fight cancer with aspirin,0.1237
149,707,stem.lovins,aspirin cancer prevens,0.0869
150,707,wiki.topn3,aspirin cancer prevention antiplatelet drugs salicylates nausea aspirin types neoplasia types cancer oncology cancer cancer prevention,0.0743
151,707,wordnet.topn3,aspirin cancer prevention Bayer St Joseph malignant neoplastic disease bar,0.0551
152,707,glove.topn3,aspirin cancer prevention ibuprofen medications prostate breast combating cdc,0.0399
153,707,wiki.topn3.replace,antiplatelet drugs salicylates nausea aspirin types neoplasia types cancer oncology cancer cancer prevention,0.0262
154,707,bertqe.topn10.qld,known risk factor colorect cancer,0.0252
155,707,word2vec.topn3,aspirin cancer prevention ibuprofen paracetamol leukemia lymphoma,0.011
156,707,wordnet.topn3.replace,acetylsalicylic acid St Joseph genus Cancer Cancer the Crab bar,0.0102
157,707,conceptnet.topn3,aspirin cancer prevention a medicine cabinet smoking a disease cigarette smoking suppression,0.0057
158,707,glove.topn3.replace,ibuprofen medications prostate breast combating cdc,0.0046
159,707,bt_nllb_arabic,Prevention of cancer,0.0039
160,707,bt_nllb_persian,Spraying for cancer prevention,0.0022
161,707,anchor.topn3,aspirin cancer prevention extrusion hydrostat filter modif multi antimicrobi institute upmc insulinoma cancercent,0.002
162,707,word2vec.topn3.replace,ibuprofen paracetamol leukemia lymphoma prevention,0.0007
163,707,anchor.topn3.replace,extrusion hydrostat filter modif multi antimicrobi institute upmc insulinoma cancercent prevention,0.0
164,707,bertqe.topn10.bm25,health care financ wisconsin depart,0.0
165,707,conceptnet.topn3.replace,a medicine cabinet smoking a disease cigarette smoking suppression,0.0
166,707,stem.paicehusk,aspirin cant prev,0.0
167,707,stem.trunc4,aspi canc prev,0.0
168,707,stem.trunc5,aspir cance preve,0.0
169,708,-1,Decorative slate sources,0.1784
170,708,bt_bing_french,Decorative slate springs,0.1528
171,708,bt_bing_german,Decorative slate springs,0.1528
172,708,anchor.topn3,decorative slate sources wirren nusstort,0.102
173,708,rm3.topn10.10.0.5.bm25,decorative slate sources roof,0.0767
174,708,rm3.topn10.10.0.5.qld,decorative slate sources roof,0.0767
175,708,termluster.topn5.3.qld,decorative slate sources centuri color due,0.0762
176,708,word2vec.topn3,decorative slate sources ornamental limestone souces references,0.0658
177,708,bt_nllb_swahili,The origins of the decorative slate,0.0606
178,708,conceptluster.topn5.3.qld,decorative slate sources ornament art slate,0.059
179,708,tagmee.topn3,decorative slate sources Ornament art Slate,0.059
180,708,conceptnet.topn3,decorative slate sources spatial unmasking,0.0524
181,708,conceptnet.topn3.replace,decorative slate spatial unmasking,0.0365
182,708,bt_bing_russian,Sources of Ornamental Slate,0.0343
183,708,sensedisambiguation,Decorative cosmetic slate sources source,0.0312
184,708,bertqe.topn10.qld,research replac histor roof materi,0.0167
185,708,tagmee.topn3.replace,Ornament art Slate,0.0098
186,708,bt_nllb_chinese_yue,Sources of the decoration of the stone tablets,0.0055
187,708,wordnet.topn3,decorative slate sources cosmetic ornamental ticket reference generator,0.0052
188,708,sensedisambiguation.replace,cosmetic slate source,0.0037
189,708,wiki.topn3,decorative slate sources proportion architecture history decorativarts template history architecture ornament art bay architecture politics san francisco bay area defunct american political movements slate,0.0031
190,708,glove.topn3,decorative slate sources ornamental ornament http www nwguild org according,0.0023
191,708,bt_nllb_french,Sources of decorative clay,0.0001
192,708,stem.lovins,decor sl sourc,0.0001
193,708,anchor.topn3.replace,decorative wirren nusstort sources,0.0
194,708,bertqe.topn10.bm25,repair replac histor research replac,0.0
195,708,bt_bing_korean,Slate sauce for garnish,0.0
196,708,bt_bing_persian,Decorative Boulder Sources,0.0
197,708,bt_bing_swahili,Sources of jewelry,0.0
198,708,bt_nllb_arabic,Sources for the decorative pages,0.0
199,708,bt_nllb_german,Other articles of heading,0.0
200,708,bt_nllb_malay,Sources of decorative plates,0.0
201,708,bt_nllb_persian,Sources of fertility,0.0
202,708,bt_nllb_russian,The sources of decorative leaves,0.0
203,708,bt_nllb_tamil,The decorative silk pieces,0.0
204,708,glove.topn3.replace,ornamental ornament http www nwguild org according,0.0
205,708,stem.paicehusk,dec slat sourc,0.0
206,708,stem.trunc4,deco slat sour,0.0
207,708,wiki.topn3.replace,proportion architecture history decorativarts template history architecture ornament art bay architecture politics san francisco bay area defunct american political movements slate,0.0
208,708,word2vec.topn3.replace,ornamental limestone souces references,0.0
209,708,wordnet.topn3.replace,ornamental cosmetic ticket informant reservoir seed,0.0
210,709,-1,Horse racing jockey weight,0.6158
211,709,bt_bing_german,Horse racing jockey s weight,0.6096
212,709,anchor.topn3,horse racing jockey weight samaraa general virginia al diwaniya morabilla eroticid lungitz kheawcha oum sa nanwai jockey weight maximum ccir high molecular,0.6005
213,709,conceptluster.topn5.3.qld,horse racing jockey weight jockey,0.5658
214,709,docluster.topn10.3.qld,horse racing jockey weight shall race,0.5475
215,709,tagmee.topn3,horse racing jockey weight Horse racing Jockey,0.5381
216,709,bt_bing_persian,Weight Horse Racing,0.5337
217,709,bt_nllb_german,Weight of horse racing,0.5337
218,709,bt_nllb_russian,Weight of the horse race,0.5337
219,709,stem.porter,hors race jockei weight,0.5119
220,709,stem.porter2,hors race jockey weight,0.5119
221,709,relevancefeedback.topn10.qld,horse racing jockey weight race hors shall,0.5087
222,709,rm3.topn10.10.0.5.bm25,horse racing jockey weight race hors shall,0.5087
223,709,rm3.topn10.10.0.5.qld,horse racing jockey weight hors race shall,0.5087
224,709,conceptnet.topn3,horse racing jockey weight animal riding a bicycle rider measurement mass scale,0.4851
225,709,bt_nllb_tamil,The weight of the horse racing team,0.4846
226,709,bt_nllb_persian,A joke weight in a horse race,0.4674
227,709,bt_bing_arabic,Weight Knight Horse Racing,0.4459
228,709,tagmee.topn3.replace,Horse racing Jockey,0.4407
229,709,bt_nllb_malay,Heavy jockey horse racing,0.4399
230,709,wiki.topn3,horse racing jockey weight sports betting horse racing jockey horse racing jockeys horstrainer horse trainers jockey,0.4292
231,709,termluster.topn5.3.qld,horse racing jockey weight without win whip without win whip ani anoth assign,0.4137
232,709,wordnet.topn3,horse racing jockey weight gymnastic horse sawbuck buck hotfoot rush along belt along chicane screw shaft angle burden system of weights,0.3804
233,709,wiki.topn3.replace,sports betting horse racing jockey horse racing jockeys horstrainer horse trainers jockey,0.3745
234,709,word2vec.topn3,horse racing jockey weight pony racers racer weight,0.2772
235,709,stem.paicehusk,hors rac jockey weight,0.1946
236,709,bt_nllb_arabic,Weight of the front runners in horse racing,0.1882
237,709,sensedisambiguation.replace,sawhorse rush jockey weight unit,0.091
238,709,glove.topn3,horse racing jockey weight rode racers racer rode load,0.0796
239,709,stem.trunc5,horse racin jocke weigh,0.0571
240,709,conceptnet.topn3.replace,animal riding horse a bicycle rider measurement mass scale,0.0056
241,709,anchor.topn3.replace,samaraa general virginia al diwaniya morabilla eroticid lungitz kheawcha oum sa nanwai jockey weight maximum ccir high molecular,0.0013
242,709,word2vec.topn3.replace,pony racers racer jockey weight,0.0013
243,709,bt_nllb_chinese_yue,The weight of the race car,0.0003
244,709,bertqe.topn10.bm25,word term when us regul,0.0
245,709,bertqe.topn10.qld,have follow mean unless context,0.0
246,709,glove.topn3.replace,rode racers racer rode load,0.0
247,709,stem.lovins,hors rac jocke weight,0.0
248,709,stem.trunc4,hors raci jock weig,0.0
249,709,wordnet.topn3.replace,buck Equus caballus hie belt along pelt along chouse cheat screw weight unit system of weights slant,0.0
250,710,-1,Prostate cancer treatments,0.2001
251,710,sensedisambiguation,Prostate prostate gland cancer treatments treatment,0.1859
252,710,docluster.topn10.3.qld,prostate cancer treatments prostat,0.1791
253,710,relevancefeedback.topn10.qld,prostate cancer treatments prostat,0.1791
254,710,rm3.topn10.10.0.5.bm25,prostate cancer treatments prostat,0.1791
255,710,rm3.topn10.10.0.5.qld,prostate cancer treatments prostat,0.1791
256,710,conceptluster.topn5.3.qld,prostate cancer treatments management cancer,0.1777
257,710,sensedisambiguation.replace,prostate gland cancer treatment,0.1707
258,710,tagmee.topn3,prostate cancer treatments Prostate cancer Management of cancer,0.1559
259,710,wordnet.topn3.replace,prostate gland genus Cancer Cancer the Crab discourse handling intervention,0.0962
260,710,tagmee.topn3.replace,Prostate cancer Management of cancer,0.0776
261,710,wordnet.topn3,prostate cancer treatments prostate gland malignant neoplastic disease handling discussion discourse,0.0578
262,710,termluster.topn5.3.qld,prostate cancer treatments usual urin urethra also area back usual urin urethra,0.0408
263,710,anchor.topn3,prostate cancer treatments institute upmc insulinoma cancercent,0.0373
264,710,glove.topn3,prostate cancer treatments cancer pancreatic prostate breast therapies therapy,0.0243
265,710,conceptnet.topn3,prostate cancer treatments prostate gland smoking a disease cigarette smoking medicaid,0.0143
266,710,wiki.topn3,prostate cancer treatments male genital neoplasia histopathology lymphoma prostate cancer lymphomatoid granulomatosis brentuximab vedotin treatment lung cancer management cancer,0.0133
267,710,word2vec.topn3,prostate cancer treatments testicular leukemia lymphoma therapies,0.0099
268,710,stem.lovins,prost cancer treatment,0.0093
269,710,anchor.topn3.replace,prostate institute upmc insulinoma cancercent treatments,0.0047
270,710,glove.topn3.replace,cancer pancreatic prostate breast therapies therapy,0.003
271,710,stem.trunc5,prost cance treat,0.003
272,710,wiki.topn3.replace,male genital neoplasia histopathology lymphoma prostate cancer lymphomatoid granulomatosis brentuximab vedotin treatment lung cancer management cancer,0.0017
273,710,word2vec.topn3.replace,testicular leukemia lymphoma therapies,0.0007
274,710,conceptnet.topn3.replace,prostate gland smoking a disease cigarette smoking medicaid,0.0003
275,710,stem.paicehusk,prost cant tre,0.0001
276,710,bertqe.topn10.bm25,skip navig other health topic,0.0
277,710,bertqe.topn10.qld,health topic b c d,0.0
278,710,stem.trunc4,pros canc trea,0.0
279,711,-1,Train station security measures,0.0419
280,711,tagmee.topn3,train station security measures Train station Airport security,0.0312
281,711,bt_bing_french,Security measures at stations,0.0304
282,711,bt_bing_german,Security measures at the station,0.0304
283,711,docluster.topn10.3.qld,train station security measures secur,0.0287
284,711,word2vec.topn3,train station security measures railway secuirty safety initiatives,0.0248
285,711,conceptluster.topn5.3.qld,train station security measures airport security,0.0155
286,711,sensedisambiguation,Train station security measures standard,0.0147
287,711,wiki.topn3,train station security measures railway stations east japan railway company west japan railway company train station computer assisted passenger prescreening system shobomb plot richard reid airport security,0.0082
288,711,bt_nllb_french,Safety measures at railway stations,0.0072
289,711,bt_nllb_german,Safety measures for railway stations,0.0072
290,711,bt_nllb_russian,Safety measures at railway stations,0.0072
291,711,wordnet.topn3,train station security measures civilize geartrain cultivate place post security department certificate security measure standard evaluate bill,0.0042
292,711,tagmee.topn3.replace,Train station Airport security,0.0041
293,711,stem.lovins,train stat secur measur,0.0033
294,711,termluster.topn5.3.qld,train station security measures identifi personnel respons establish oper provid work train servic safeti review relat,0.002
295,711,wiki.topn3.replace,railway stations east japan railway company west japan railway company train station computer assisted passenger prescreening system shobomb plot richard reid airport security,0.0011
296,711,sensedisambiguation.replace,train station security standard,0.001
297,711,anchor.topn3,train station security measures mats cs atc doctors shimoyashiki station bird negeori,0.0
298,711,anchor.topn3.replace,mats cs atc doctors shimoyashiki station bird negeori security measures,0.0
299,711,bertqe.topn10.bm25,tnite stai gener account offic,0.0
300,711,bertqe.topn10.qld,train need secur foreign standard,0.0
301,711,bt_bing_malay,Train station safety measures,0.0
302,711,bt_bing_swahili,Train station safety measures,0.0
303,711,bt_nllb_swahili,Safety measures at the train station,0.0
304,711,conceptnet.topn3,train station security measures compete become a scuba diver guard a door with a lock time,0.0
305,711,conceptnet.topn3.replace,compete become a scuba diver station guard a door with a lock time,0.0
306,711,glove.topn3.replace,bus operated adding ensure steps,0.0
307,711,stem.paicehusk,train stat sec meas,0.0
308,711,stem.trunc4,trai stat secu meas,0.0
309,711,stem.trunc5,train stati secur measu,0.0
310,711,word2vec.topn3.replace,train railway secuirty safety initiatives,0.0
