,qid,order,query,qld.ndcg
2206,741,stem.porter,artifici intellig,0.1405
2207,741,stem.porter2,artifici intellig,0.1405
2208,741,stem.sstemmer,artificial intelligence,0.1405
2209,741,tagmee.topn3,artificial intelligence Artificial intelligence,0.1405
2210,741,tagmee.topn3.replace,Artificial intelligence,0.1405
2211,741,thesaurus.topn3,artificial intelligence,0.1405
2212,741,thesaurus.topn3.replace,artificial intelligence,0.1405
2213,741,sensedisambiguation,Artificial Intelligence news,0.1366
2214,741,docluster.topn10.3.qld,artificial intelligence artifici,0.1095
2215,741,termluster.topn5.3.qld,artificial intelligence non intellig non artifici,0.083
2216,741,wiki.topn3,artificial intelligence unsolved problems computer science computational neuroscience simulation artificial intelligence,0.0814
2217,741,word2vec.topn3,artificial intelligence artifical synthetic intellegence intelligence,0.0696
2218,741,relevancefeedback.topn10.qld,artificial intelligence class artifici intellig s http,0.0568
2219,741,wordnet.topn3,artificial intelligence unreal hokey intelligence service tidings intelligence agency,0.0528
2220,741,wiki.topn3.replace,unsolved problems computer science computational neuroscience simulation artificial intelligence,0.0422
2221,741,anchor.topn3,artificial intelligence percettiva intelligenza condenan,0.0309
2222,741,stem.lovins,artific intellig,0.0213
2223,741,glove.topn3,artificial intelligence furthermore hence cia operatives,0.0199
2224,741,word2vec.topn3.replace,artifical synthetic intellegence intelligence,0.0189
2225,741,stem.paicehusk,art intellig,0.0147
2226,741,bt_nllb_chinese_yue,AI is the answer,0.0139
2227,741,bt_nllb_korean,AI,0.0138
2228,741,bt_nllb_persian,The AI,0.0138
2229,741,rm3.topn10.10.0.5.bm25,artificial intelligence class i,0.0069
2230,741,rm3.topn10.10.0.5.qld,artificial intelligence class artifici i,0.0069
2231,741,anchor.topn3.replace,percettiva intelligenza condenan intelligence,0.0
2232,741,bertqe.topn10.bm25,number isbn issn publish number,0.0
2233,741,bertqe.topn10.qld,publish number oclc number lccn,0.0
2234,741,bt_nllb_swahili,A Craftsman s Mind,0.0
2235,741,glove.topn3.replace,furthermore hence cia operatives,0.0
2236,741,sensedisambiguation.replace,artificial news,0.0
2237,741,stem.trunc4,arti inte,0.0
2238,741,stem.trunc5,artif intel,0.0
2239,741,wordnet.topn3.replace,stilted unreal hokey intelligence service intelligence agency intelligence activity,0.0
2240,742,-1,hedge funds fraud protection,0.4497
2241,742,bt_bing_german,Protection against hedge fund fraud,0.5252
2242,742,bt_nllb_german,Protection against hedge fund fraud,0.5252
2243,742,bt_nllb_malay,protection against hedge fund fraud,0.5252
2244,742,bt_nllb_persian,Protecting against hedge fund fraud,0.5252
2245,742,bt_nllb_russian,protection against hedge funds fraud,0.5252
2246,742,bt_nllb_swahili,protection against hedge funds fraud,0.5252
2247,742,stem.trunc5,hedge funds fraud prote,0.5158
2248,742,bt_bing_korean,Hedge Fund Fraud Prevention,0.51
2249,742,conceptluster.topn5.3.qld,hedge funds fraud protection security finance hedge fund fraud,0.4864
2250,742,tagmee.topn3,hedge funds fraud protection Hedge fund Fraud Security finance,0.4864
2251,742,docluster.topn10.3.qld,hedge funds fraud protection fund,0.4604
2252,742,rm3.topn10.10.0.5.qld,hedge funds fraud protection fund,0.4604
2253,742,tagmee.topn3.replace,Hedge fund Fraud Security finance,0.4514
2254,742,relevancefeedback.topn10.qld,hedge funds fraud protection fund invest,0.4504
2255,742,bt_bing_arabic,Hedge Fund Fraud Protection,0.4497
2256,742,bt_bing_chinese_simplified,Hedge Fund Fraud Protection,0.4497
2257,742,bt_bing_french,Hedge Fund Fraud Protection,0.4497
2258,742,bt_bing_malay,hedge fund fraud protection,0.4497
2259,742,bt_bing_persian,Hedge funds fraud protection,0.4497
2260,742,bt_bing_russian,Hedge Fund Fraud Protection,0.4497
2261,742,bt_bing_swahili,hedge funds fraud protection,0.4497
2262,742,bt_bing_tamil,Hedge Fund Fraud Protection,0.4497
2263,742,bt_nllb_korean,Hedge fund fraud protection,0.4497
2264,742,bt_nllb_tamil,Hedge fund fraud protection,0.4497
2265,742,original,hedge funds fraud protection,0.4497
2266,742,stem.krovetz,hedge funds fraud protection,0.4497
2267,742,stem.lovins,hedg fund fraud protect,0.4497
2268,742,stem.paicehusk,hedg fund fraud protect,0.4497
2269,742,stem.porter,hedg fund fraud protect,0.4497
2270,742,stem.porter2,hedg fund fraud protect,0.4497
2271,742,stem.sstemmer,hedge fund fraud protection,0.4497
2272,742,thesaurus.topn3,hedge funds fraud protection,0.4497
2273,742,thesaurus.topn3.replace,hedge funds fraud protection,0.4497
2274,742,word2vec.topn3,hedge funds fraud protection monies fraudulent,0.3896
2275,742,glove.topn3,hedge funds fraud protection investments fund money fraudulent embezzlement,0.3741
2276,742,anchor.topn3,hedge funds fraud protection fraud fixing match states disney use ahea,0.3167
2277,742,wordnet.topn3,hedge funds fraud protection elude hedge in put off monetary resource investment firm pecuniary resource role player pseud protective covering auspices shelter,0.2658
2278,742,word2vec.topn3.replace,hedge monies fraudulent protection,0.2524
2279,742,anchor.topn3.replace,hedge funds fraud fixing match states disney use ahea,0.2493
2280,742,termluster.topn5.3.qld,hedge funds fraud protection valu typic share valu typic share addit also ani valu typic share,0.2243
2281,742,bertqe.topn10.qld,todai report hedg fund implic,0.2157
2282,742,sensedisambiguation,hedge funds store fraud imposter protection security,0.2033
2283,742,stem.trunc4,hedg fund frau prot,0.1934
2284,742,rm3.topn10.10.0.5.bm25,hedge funds fraud protection fund cpo,0.1496
2285,742,wiki.topn3,hedge funds fraud protection trader finance leveraged buyout arthur andersen hedge fund embezzlement extortion indictment fraud financial institution deposit account equity finance security finance,0.147
2286,742,conceptnet.topn3,hedge funds fraud protection skirt pocket crime shade cover a condom,0.1314
2287,742,bt_nllb_french,protection against fraud of investment funds,0.1057
2288,742,wiki.topn3.replace,trader finance leveraged buyout arthur andersen hedge fund embezzlement extortion indictment fraud financial institution deposit account equity finance security finance,0.0723
2289,742,sensedisambiguation.replace,hedge store imposter security,0.0706
2290,742,wordnet.topn3.replace,put off hedge in skirt investment company investment trust hoax put on imposter protective covering protective cover,0.045
2291,742,glove.topn3.replace,investments fund money fraudulent embezzlement protection,0.0079
2292,742,bertqe.topn10.bm25,report fact sheet home previou,0.0
2293,742,bt_nllb_arabic,Securities fraud protection,0.0
2294,742,bt_nllb_chinese_yue,The protection of pension funds,0.0
2295,742,conceptnet.topn3.replace,skirt pocket crime shade cover a condom,0.0
2296,743,-1,Freighter ship registration,0.1065
2297,743,conceptluster.topn5.3.qld,freighter ship registration ship registration cargo ship,0.2457
2298,743,tagmee.topn3,freighter ship registration Cargo ship Cargo ship Ship registration,0.2242
2299,743,termluster.topn5.3.qld,freighter ship registration vessel,0.2132
2300,743,glove.topn3,freighter ship registration ship vessel voter identification,0.1927
2301,743,word2vec.topn3,freighter ship registration cargo tanker vessel warship registering,0.1733
2302,743,bertqe.topn10.bm25,under flag conveni nation secur,0.167
2303,743,bt_nllb_french,Register of freight vessels,0.1529
2304,743,wordnet.topn3,freighter ship registration merchantman bottom merchant ship transport embark enrolment adjustment readjustment,0.1482
2305,743,stem.lovins,freighter ship register,0.1284
2306,743,anchor.topn3,freighter ship registration d cl a improv kommuna cunnari communa,0.1235
2307,743,docluster.topn10.3.qld,freighter ship registration,0.1065
2308,743,original,Freighter ship registration,0.1065
2309,743,stem.krovetz,freighter ship registration,0.1065
2310,743,stem.porter,freighter ship registr,0.1065
2311,743,stem.porter2,freighter ship registr,0.1065
2312,743,stem.sstemmer,freighter ship registration,0.1065
2313,743,thesaurus.topn3,freighter ship registration,0.1065
2314,743,thesaurus.topn3.replace,freighter ship registration,0.1065
2315,743,conceptnet.topn3,freighter ship registration cargo ship captain boat enrollment,0.0913
2316,743,bt_bing_arabic,Cargo Ship Registration,0.0818
2317,743,bt_bing_chinese_simplified,Cargo ship registration,0.0818
2318,743,bt_bing_french,Registration of a cargo ship,0.0818
2319,743,bt_bing_german,Registration of cargo ships,0.0818
2320,743,bt_bing_korean,Cargo Ship Registration,0.0818
2321,743,bt_bing_persian,Registration of cargo ships,0.0818
2322,743,bt_bing_russian,Cargo Ship Registration,0.0818
2323,743,bt_bing_swahili,Registration of cargo ship,0.0818
2324,743,bt_bing_tamil,Cargo Ship Registration,0.0818
2325,743,tagmee.topn3.replace,Cargo ship Cargo ship Ship registration,0.0798
2326,743,bt_nllb_persian,Register of ships,0.0714
2327,743,bt_nllb_chinese_yue,The cargo ship is registered,0.0709
2328,743,bt_nllb_russian,Registration of cargo vessels,0.0671
2329,743,bertqe.topn10.qld,oversight panel merchant marin vessel,0.057
2330,743,bt_nllb_malay,Registering of cargo vessels,0.054
2331,743,rm3.topn10.10.0.5.qld,freighter ship registration ferri yacht http harbor whale,0.0404
2332,743,relevancefeedback.topn10.qld,freighter ship registration ferri harbor flag yacht lake,0.0403
2333,743,wiki.topn3,freighter ship registration deadweight tonnage length perpendiculars length overall cargo ship deadweight tonnage length perpendiculars length overall cargo ship net tonnage template admiralty law ship collision ship registration,0.0369
2334,743,word2vec.topn3.replace,cargo tanker vessel warship registering,0.0369
2335,743,sensedisambiguation,Freighter bottom ship registration,0.033
2336,743,wiki.topn3.replace,deadweight tonnage length perpendiculars length overall cargo ship deadweight tonnage length perpendiculars length overall cargo ship net tonnage template admiralty law ship collision ship registration,0.0312
2337,743,bt_nllb_tamil,Freight shipping registration,0.02
2338,743,stem.paicehusk,freight ship reg,0.0162
2339,743,bt_nllb_korean,Registering the freighter,0.0161
2340,743,wordnet.topn3.replace,merchant ship bottom send embark enrollment adjustment enrolment,0.0154
2341,743,conceptnet.topn3.replace,cargo ship captain boat enrollment,0.0075
2342,743,rm3.topn10.10.0.5.bm25,freighter ship registration yacht jackson william,0.0073
2343,743,anchor.topn3.replace,d cl a improv kommuna cunnari communa registration,0.0
2344,743,bt_bing_malay,Registration of carriers,0.0
2345,743,bt_nllb_arabic,Record of shipping,0.0
2346,743,bt_nllb_german,Registration of freight vehicles,0.0
2347,743,bt_nllb_swahili,Register of freight ships,0.0
2348,743,glove.topn3.replace,ship vessel voter identification,0.0
2349,743,sensedisambiguation.replace,bottom ship registration,0.0
2350,743,stem.trunc4,frei ship regi,0.0
2351,743,stem.trunc5,freig ship regis,0.0
2352,744,-1,Counterfeit ID punishments,0.0
2353,744,glove.topn3,counterfeit id punishments fake identification meted,0.1486
2354,744,bt_nllb_russian,Penalties for counterfeiting identity card,0.0975
2355,744,bt_nllb_arabic,The penalties for a fake identity,0.068
2356,744,glove.topn3.replace,fake identification meted,0.0602
2357,744,bt_bing_chinese_simplified,Penalties for forging identity documents,0.0474
2358,744,bt_bing_russian,Penalties for Identity Card Forgery,0.0264
2359,744,bt_bing_arabic,Penalties for identity fraud,0.0239
2360,744,bt_nllb_chinese_yue,The punishment for fake ID,0.0234
2361,744,bt_nllb_korean,The punishment for fake ID,0.0234
2362,744,bt_bing_korean,Penalties for fake IDs,0.0231
2363,744,bt_bing_tamil,Fake ID penalties,0.0231
2364,744,bt_bing_persian,Fraudulent punishments,0.0205
2365,744,bt_nllb_german,Penalties for counterfeit identification,0.0189
2366,744,bt_nllb_swahili,False identity judgments,0.0183
2367,744,bt_bing_french,Penalties for identity forgery,0.0146
2368,744,stem.paicehusk,counterfeit id pun,0.0128
2369,744,conceptnet.topn3,counterfeit id punishments Idaho buying a beer Sentences,0.0115
2370,744,sensedisambiguation.replace,counterfeit idaho punishment,0.0114
2371,744,wiki.topn3,counterfeit id punishments counterfeiters forgery theft counterfeit transactional analysis brief reactivpsychosis neurosis id ego super ego necessity retributivjustice mobbing punishment,0.0114
2372,744,bt_bing_swahili,Counter identification penalty,0.0113
2373,744,wiki.topn3.replace,counterfeiters forgery theft counterfeit transactional analysis brief reactivpsychosis neurosis id ego super ego necessity retributivjustice mobbing punishment,0.0113
2374,744,bt_nllb_persian,The penalties for false identity,0.0067
2375,744,conceptnet.topn3.replace,counterfeit Idaho buying a beer Sentences,0.0059
2376,744,anchor.topn3,counterfeit id punishments goods food miniassegni br id osobisty style color teal coeur,0.0
2377,744,anchor.topn3.replace,goods food miniassegni br id osobisty style color teal coeur punishments,0.0
2378,744,bertqe.topn10.bm25,arriv new california faq site,0.0
2379,744,bertqe.topn10.qld,arriv new california faq site,0.0
2380,744,bt_bing_german,Penalties for forged IDs,0.0
2381,744,bt_bing_malay,False ID punishment,0.0
2382,744,bt_nllb_french,Sanctions against counterfeiting,0.0
2383,744,bt_nllb_malay,The punishment for false ID,0.0
2384,744,bt_nllb_tamil,The punishment for counterfeiting identifiers,0.0
2385,744,conceptluster.topn5.3.qld,counterfeit id punishments id ego super ego punishment,0.0
2386,744,docluster.topn10.3.qld,counterfeit id punishments your,0.0
2387,744,original,Counterfeit ID punishments,0.0
2388,744,relevancefeedback.topn10.qld,counterfeit id punishments ani petition your,0.0
2389,744,rm3.topn10.10.0.5.bm25,counterfeit id punishments your,0.0
2390,744,rm3.topn10.10.0.5.qld,counterfeit id punishments your,0.0
2391,744,sensedisambiguation,Counterfeit ID idaho punishments punishment,0.0
2392,744,stem.krovetz,counterfeit id punishment,0.0
2393,744,stem.lovins,counterfeit id punishment,0.0
2394,744,stem.porter,counterfeit id punish,0.0
2395,744,stem.porter2,counterfeit id punish,0.0
2396,744,stem.sstemmer,counterfeit id punishment,0.0
2397,744,stem.trunc4,coun id puni,0.0
2398,744,stem.trunc5,count id punis,0.0
2399,744,tagmee.topn3,counterfeit id punishments Counterfeit Id ego and super ego Punishment,0.0
2400,744,tagmee.topn3.replace,Counterfeit Id ego and super ego Punishment,0.0
2401,744,termluster.topn5.3.qld,counterfeit id punishments ani fine guilti provid person licens,0.0
2402,744,thesaurus.topn3,counterfeit id punishments,0.0
2403,744,thesaurus.topn3.replace,counterfeit id punishments,0.0
2404,744,word2vec.topn3,counterfeit id punishments iots penalties,0.0
2405,744,word2vec.topn3.replace,counterfeit iots penalties,0.0
2406,744,wordnet.topn3,counterfeit id punishments forgery forge Idaho I D penalisation penalization,0.0
2407,744,wordnet.topn3.replace,forge forgery imitative Idaho penalization penalisation penalty,0.0
2408,745,-1,Doomsday cults,0.7025
2409,745,rm3.topn10.10.0.5.qld,doomsday cults cult religion biolog,0.729
2410,745,bt_bing_chinese_simplified,Doomsday cult,0.7025
2411,745,bt_bing_german,Doomsday Cults,0.7025
2412,745,bt_bing_malay,The cult of doomsday,0.7025
2413,745,bt_bing_russian,Doomsday Cults,0.7025
2414,745,bt_bing_swahili,Doomsday cult,0.7025
2415,745,conceptluster.topn5.3.qld,doomsday cults,0.7025
2416,745,original,Doomsday cults,0.7025
2417,745,stem.krovetz,doomsday cult,0.7025
2418,745,stem.paicehusk,doomsday cult,0.7025
2419,745,stem.porter,doomsdai cult,0.7025
2420,745,stem.porter2,doomsday cult,0.7025
2421,745,stem.sstemmer,doomsday cult,0.7025
2422,745,tagmee.topn3,doomsday cults Doomsday cult,0.7025
2423,745,tagmee.topn3.replace,Doomsday cult,0.7025
2424,745,thesaurus.topn3,doomsday cults,0.7025
2425,745,thesaurus.topn3.replace,doomsday cults,0.7025
2426,745,anchor.topn3,doomsday cults rustavelian decasyllab sharky,0.7005
2427,745,wiki.topn3,doomsday cults unification church neologisms mind control messiah complex doomsday cult,0.6831
2428,745,termluster.topn5.3.qld,doomsday cults number new,0.6801
2429,745,sensedisambiguation,Doomsday judgment day cults fad,0.6508
2430,745,docluster.topn10.3.qld,doomsday cults cult,0.6398
2431,745,glove.topn3,doomsday cults cult aum sects,0.626
2432,745,conceptnet.topn3,doomsday cults Judgment Day doom synchromysticism,0.518
2433,745,relevancefeedback.topn10.qld,doomsday cults cult religion religi,0.5048
2434,745,rm3.topn10.10.0.5.bm25,doomsday cults cult religion religi,0.5048
2435,745,word2vec.topn3,doomsday cults apocalypse apocalyptic end of the world sects,0.4825
2436,745,bt_bing_korean,Doomsday Worship,0.3863
2437,745,glove.topn3.replace,cult aum sects,0.3764
2438,745,wiki.topn3.replace,unification church neologisms mind control messiah complex doomsday cult,0.3715
2439,745,bt_bing_french,Apocalyptic Cults,0.3702
2440,745,wordnet.topn3,doomsday cults end of the world Last Judgement furor furore,0.2546
2441,745,bt_bing_arabic,Doomsday sects,0.2449
2442,745,word2vec.topn3.replace,apocalypse apocalyptic end of the world sects,0.1168
2443,745,bt_nllb_arabic,The Day of Judgment cult,0.1104
2444,745,bt_nllb_russian,The Day of Judgment cult,0.1104
2445,745,bt_nllb_chinese_yue,The cult of the last days,0.0977
2446,745,bt_nllb_french,The cults of the Last Judgment Day,0.0971
2447,745,stem.lovins,doomsda cult,0.0519
2448,745,stem.trunc4,doom cult,0.035
2449,745,stem.trunc5,dooms cults,0.035
2450,745,anchor.topn3.replace,rustavelian decasyllab sharky cults,0.022
2451,745,bertqe.topn10.bm25,seri titl call number isbn,0.0
2452,745,bertqe.topn10.qld,entir collect spanish video vh,0.0
2453,745,bt_bing_persian,Sects of the Day of Judgment,0.0
2454,745,bt_bing_tamil,Doomsday Liturgy,0.0
2455,745,bt_nllb_german,The Meaning of the Hereafter,0.0
2456,745,bt_nllb_korean,The Day of Judgment,0.0
2457,745,bt_nllb_malay,Religions of the Last Days,0.0
2458,745,bt_nllb_persian,The worship of the Day of Resurrection,0.0
2459,745,bt_nllb_swahili,Religions of Judgment Day,0.0
2460,745,bt_nllb_tamil,The final day of worship,0.0
2461,745,conceptnet.topn3.replace,Judgment Day doom synchromysticism,0.0
2462,745,sensedisambiguation.replace,judgment day fad,0.0
2463,745,wordnet.topn3.replace,Last Judgment Last Judgement eschaton craze cultus,0.0
2464,746,-1,Outsource job India,0.5215
2465,746,bt_bing_arabic,Outsourcing India Job,0.5215
2466,746,bt_bing_chinese_simplified,Outsourcing jobs in India,0.5215
2467,746,bt_bing_german,Jobs Outsourcing in India,0.5215
2468,746,bt_bing_korean,Outsourcing Jobs India,0.5215
2469,746,bt_bing_russian,Outsourced Jobs in India,0.5215
2470,746,bt_nllb_korean,Outsourcing jobs in India,0.5215
2471,746,original,Outsource job India,0.5215
2472,746,stem.krovetz,outsource job india,0.5215
2473,746,stem.porter,outsourc job india,0.5215
2474,746,stem.porter2,outsourc job india,0.5215
2475,746,stem.sstemmer,outsource job india,0.5215
2476,746,tagmee.topn3,outsource job india Outsourcing Job India,0.5215
2477,746,tagmee.topn3.replace,Outsourcing Job India,0.5215
2478,746,thesaurus.topn3,outsource job india,0.5215
2479,746,thesaurus.topn3.replace,outsource job india,0.5215
2480,746,sensedisambiguation,Outsource job problem India,0.4967
2481,746,anchor.topn3,outsource job india yustino ndugai nilgri india histori olatpur,0.4954
2482,746,sensedisambiguation.replace,outsource problem india,0.4892
2483,746,bt_bing_persian,Outsourcing India Work,0.4861
2484,746,bt_bing_tamil,Outsourced Work in India,0.4861
2485,746,bt_nllb_tamil,Outsourced work India,0.4861
2486,746,bt_nllb_chinese_yue,Get outsourced work in India,0.4848
2487,746,wiki.topn3,outsource job india market share takeover restructuring outsourcing psychopathy thworkplace gold collar worker job description job states territories established india hindustani speaking countries territories india,0.4763
2488,746,bt_bing_french,Outsourced Employment India,0.4489
2489,746,anchor.topn3.replace,outsource yustino ndugai nilgri india histori olatpur,0.4272
2490,746,docluster.topn10.3.qld,outsource job india we evan,0.4233
2491,746,rm3.topn10.10.0.5.bm25,outsource job india evan ocwen engin we data,0.4016
2492,746,relevancefeedback.topn10.qld,outsource job india engin my evan we ocwen,0.3868
2493,746,rm3.topn10.10.0.5.qld,outsource job india evan engin ocwen we my,0.3868
2494,746,termluster.topn5.3.qld,outsource job india work well unit american busi compani american busi compani,0.3765
2495,746,wordnet.topn3,outsource job india Book of Job task Republic of India Bharat,0.3452
2496,746,conceptluster.topn5.3.qld,outsource job india outsourcing job,0.3414
2497,746,glove.topn3,outsource job india working indian pakistan,0.2774
2498,746,bt_bing_malay,Indian outsourcing jobs,0.2679
2499,746,wiki.topn3.replace,market share takeover restructuring outsourcing psychopathy thworkplace gold collar worker job description job states territories established india hindustani speaking countries territories india,0.2545
2500,746,glove.topn3.replace,outsource working indian pakistan,0.1958
2501,746,conceptnet.topn3,outsource job india work interview servant a temple a country in Asia a very populous country,0.1887
2502,746,wordnet.topn3.replace,outsource caper business Bharat Republic of India,0.1885
2503,746,stem.trunc5,outso job india,0.145
2504,746,stem.lovins,outsourc job ind,0.1133
2505,746,stem.paicehusk,outsourc job ind,0.1133
2506,746,bt_nllb_arabic,Foreign work of India,0.0999
2507,746,bt_nllb_swahili,Foreign work in India,0.0999
2508,746,bt_nllb_persian,Jobs outside India,0.087
2509,746,bt_nllb_russian,Work in India,0.0802
2510,746,bt_bing_swahili,Overseas work in India,0.0613
2511,746,conceptnet.topn3.replace,outsource work interview servant a temple a country in Asia a very populous country,0.0393
2512,746,word2vec.topn3,outsource job india out source job work pakistan indian nepal,0.0247
2513,746,stem.trunc4,outs job indi,0.0188
2514,746,bt_nllb_french,Employment outside India,0.0135
2515,746,bt_nllb_malay,Employment outside India,0.0135
2516,746,bt_nllb_german,Exploitation of labour in India,0.0083
2517,746,bertqe.topn10.bm25,india chennai mumbai calcutta contact,0.0
2518,746,bertqe.topn10.qld,charg d affair u embassi asia,0.0
2519,746,word2vec.topn3.replace,out source job work pakistan indian nepal,0.0
2520,747,-1,Library computer oversight,0.1652
2521,747,tagmee.topn3,library computer oversight Library Computer Regulation,0.1908
2522,747,docluster.topn10.3.qld,library computer oversight librari comput cost,0.1743
2523,747,rm3.topn10.10.0.5.qld,library computer oversight librari cost comput,0.1743
2524,747,bt_nllb_russian,Computer oversight of the library,0.1652
2525,747,bt_nllb_tamil,Library computer oversight,0.1652
2526,747,conceptnet.topn3,library computer oversight,0.1652
2527,747,conceptnet.topn3.replace,library computer oversight,0.1652
2528,747,original,Library computer oversight,0.1652
2529,747,stem.krovetz,library computer oversight,0.1652
2530,747,stem.porter,librari comput oversight,0.1652
2531,747,stem.porter2,librari comput oversight,0.1652
2532,747,stem.sstemmer,library computer oversight,0.1652
2533,747,thesaurus.topn3,library computer oversight,0.1652
2534,747,thesaurus.topn3.replace,library computer oversight,0.1652
2535,747,relevancefeedback.topn10.qld,library computer oversight librari comput cost h,0.1594
2536,747,rm3.topn10.10.0.5.bm25,library computer oversight cost comput exce,0.1589
2537,747,conceptluster.topn5.3.qld,library computer oversight regulation computer,0.1576
2538,747,glove.topn3,library computer oversight archive software supervision accountability,0.1489
2539,747,wiki.topn3,library computer oversight libraries book promotion public library library computers computer hardware software computer policy consumer protection income regulation,0.1417
2540,747,wiki.topn3.replace,libraries book promotion public library library computers computer hardware software computer policy consumer protection income regulation,0.1289
2541,747,bt_bing_french,Computer monitoring of the library,0.1132
2542,747,bt_bing_persian,Computer Monitoring Library,0.1132
2543,747,bt_nllb_french,Monitoring of the library computer,0.1132
2544,747,bt_nllb_german,Computer monitoring of libraries,0.1132
2545,747,bt_nllb_malay,Computer monitoring of the library,0.1132
2546,747,bt_nllb_persian,Monitoring the library computer,0.1132
2547,747,sensedisambiguation,Library computer oversight supervision,0.1052
2548,747,tagmee.topn3.replace,Library Computer Regulation,0.1032
2549,747,wordnet.topn3,library computer oversight program library subroutine library calculator figurer estimator supervising superintendence inadvertence,0.069
2550,747,bt_bing_swahili,Library computer management,0.0537
2551,747,bt_nllb_swahili,The management of library computers,0.0537
2552,747,bt_bing_arabic,Computer supervision in the library,0.0517
2553,747,bt_bing_chinese_simplified,Library computer supervision,0.0517
2554,747,bt_bing_german,Supervision of the library computer,0.0517
2555,747,bt_bing_korean,Library Computer Supervision,0.0517
2556,747,bt_bing_russian,Computer Supervision of the Library,0.0517
2557,747,bt_nllb_arabic,Supervise the library on the computer,0.0517
2558,747,sensedisambiguation.replace,library computer supervision,0.0517
2559,747,word2vec.topn3,library computer oversight librarian software oversite accountability supervision,0.0478
2560,747,bt_bing_tamil,Library Computer Overview,0.0388
2561,747,bt_nllb_chinese_yue,Library computer control,0.0295
2562,747,bt_nllb_korean,Director of the library computer,0.0268
2563,747,wordnet.topn3.replace,depository library program library subroutine library estimator reckoner electronic computer supervising superintendence,0.0217
2564,747,termluster.topn5.3.qld,library computer oversight school region public school region public,0.0119
2565,747,bt_bing_malay,Library computer surveillance,0.0098
