,qid,order,query,qld.map
983,734,stem.paicehusk,recyc success,0.0007
984,734,word2vec.topn3.replace,recyling triumphs achievements failures,0.0002
985,734,wordnet.topn3.replace,reprocess succeeder achiever winner,0.0002
986,734,bertqe.topn10.bm25,tn,0.0
987,734,bertqe.topn10.qld,www tdec net dca,0.0
988,734,bt_nllb_german,Recycling sequence,0.0
989,734,bt_nllb_malay,Successful Cycles,0.0
990,734,bt_nllb_russian,Success in Utilization,0.0
991,734,bt_nllb_swahili,The Success of Order,0.0
992,734,conceptnet.topn3.replace,garbage hot bottom out quickly,0.0
993,734,glove.topn3.replace,waste accomplishments,0.0
994,734,stem.trunc4,recy succ,0.0
995,734,stem.trunc5,recyc succe,0.0
996,734,tagmee.topn3.replace,,0.0
997,734,wiki.topn3.replace,,0.0
998,735,-1,Afghan women condition,0.0927
999,735,glove.topn3,afghan women condition afghanistan men girls although anonymity,0.0823
1000,735,bt_nllb_german,Afghan women,0.07
1001,735,conceptluster.topn5.3.qld,afghan women condition women s rights afghanistan afghanistan,0.067
1002,735,tagmee.topn3,afghan women condition Afghanistan Women s rights in Afghanistan,0.067
1003,735,word2vec.topn3,afghan women condition afghanistan men woman situation,0.0573
1004,735,bt_bing_korean,Conditions of women in Afghanistan,0.0557
1005,735,stem.krovetz,afghanistan women condition,0.0557
1006,735,bt_nllb_russian,The state of Afghan women,0.0516
1007,735,bertqe.topn10.bm25,issu afghan reconstruct basic principl,0.0504
1008,735,bt_bing_french,Status of Afghan women,0.0498
1009,735,bt_bing_swahili,Status of Afghan women,0.0498
1010,735,bt_bing_tamil,Status of Afghan Women,0.0498
1011,735,tagmee.topn3.replace,Afghanistan Women s rights in Afghanistan,0.0454
1012,735,word2vec.topn3.replace,afghanistan men woman situation,0.0441
1013,735,bt_nllb_korean,The state of women in Afghanistan,0.0417
1014,735,glove.topn3.replace,afghanistan men girls although anonymity,0.0403
1015,735,termluster.topn5.3.qld,afghan women condition afghanistan american bring afghan afghanistan american,0.0264
1016,735,conceptnet.topn3,afghan women condition blanket Pashto dress state weather,0.0205
1017,735,stem.lovins,afghan wom condit,0.0123
1018,735,wordnet.topn3.replace,Afghan hound Pashtu Paxto char charwoman cleaning woman consideration discipline stipulate,0.0019
1019,735,wordnet.topn3,afghan women condition Pashtu Paxto fair sex womanhood charwoman experimental condition stipulation circumstance,0.0016
1020,735,bertqe.topn10.qld,women children refuge report submit,0.0013
1021,735,anchor.topn3,afghan women condition iraqi rachjaibun sorud mo mo south mezzo mini split uninsul minisplit,0.0003
1022,735,sensedisambiguation,Afghan sheepskin coat women womanhood condition,0.0002
1023,735,anchor.topn3.replace,iraqi rachjaibun sorud mo mo south mezzo mini split uninsul minisplit,0.0
1024,735,conceptnet.topn3.replace,blanket Pashto dress state weather,0.0
1025,735,sensedisambiguation.replace,sheepskin coat womanhood condition,0.0
1026,735,stem.paicehusk,afgh wom condit,0.0
1027,735,stem.trunc4,afgh wome cond,0.0
1028,735,stem.trunc5,afgha women condi,0.0
1029,736,-1,location BSE infections,0.1919
1030,736,bt_bing_russian,localization of BSE infections,0.1839
1031,736,relevancefeedback.topn10.qld,location bse infections anim infect cattl risk,0.1835
1032,736,stem.paicehusk,loc bse infect,0.1815
1033,736,docluster.topn10.3.qld,location bse infections cattl,0.1811
1034,736,bt_nllb_swahili,The environment of BSE transmission,0.1774
1035,736,termluster.topn5.3.qld,location bse infections anim infect unit usda unit total,0.1743
1036,736,rm3.topn10.10.0.5.qld,location bse infections cattl risk anim,0.1699
1037,736,conceptluster.topn5.3.qld,location bse infections infection heart bovine spongiform encephalopathy,0.166
1038,736,tagmee.topn3,location bse infections Heart Bovine spongiform encephalopathy Infection,0.166
1039,736,conceptnet.topn3,location bse infections place address a disease,0.1658
1040,736,rm3.topn10.10.0.5.bm25,location bse infections sheep,0.1656
1041,736,bt_bing_persian,Place of infection BSE,0.1624
1042,736,bt_bing_swahili,Local BSE transmission,0.1528
1043,736,wordnet.topn3,location bse infections positioning placement position bovine spongiform encephalitis mad cow disease transmission contagion,0.1215
1044,736,glove.topn3,location bse infections vicinity bovine spongiform pneumonia,0.1188
1045,736,tagmee.topn3.replace,Heart Bovine spongiform encephalopathy Infection,0.1184
1046,736,wiki.topn3,location bse infections cardiaanatomy heart kidney heart transmissible spongiform encephalopathies genetically modified food genetically modified organism bovine spongiform encephalopathy antibiotics urinary bladder pancreas infection,0.0979
1047,736,sensedisambiguation,location placement BSE bovine spongiform encephalitis infections infection,0.0717
1048,736,word2vec.topn3,location bse infections locale orl whr rsd diseases illnesses,0.0646
1049,736,wordnet.topn3.replace,fix placement mad cow disease bovine spongiform encephalitis contagion transmission,0.0531
1050,736,wiki.topn3.replace,cardiaanatomy heart kidney heart transmissible spongiform encephalopathies genetically modified food genetically modified organism bovine spongiform encephalopathy antibiotics urinary bladder pancreas infection,0.0509
1051,736,bertqe.topn10.qld,slaughter nearli risk cow,0.018
1052,736,sensedisambiguation.replace,placement bovine spongiform encephalitis infection,0.01
1053,736,anchor.topn3,location bse infections celien nbsp cm turret cupola pro bs sensex,0.009
1054,736,glove.topn3.replace,vicinity bovine spongiform pneumonia,0.0071
1055,736,stem.trunc5,locat bse infec,0.005
1056,736,stem.trunc4,loca bse infe,0.001
1057,736,anchor.topn3.replace,celien nbsp cm turret cupola pro bs sensex infections,0.0
1058,736,bertqe.topn10.bm25,consul osaka nagoya fukuoka sapporo,0.0
1059,736,bt_nllb_arabic,Location Beez infection,0.0
1060,736,bt_nllb_french,localisation of infections at the ESB,0.0
1061,736,conceptnet.topn3.replace,place address a disease infections,0.0
1062,736,stem.lovins,loc bs infect,0.0
1063,736,word2vec.topn3.replace,locale orl whr rsd diseases illnesses,0.0
1064,737,-1,Enron California energy crisis,0.2743
1065,737,tagmee.topn3,enron california energy crisis Enron California electricity crisis,0.2661
1066,737,tagmee.topn3.replace,Enron California electricity crisis,0.2522
1067,737,bt_bing_arabic,Enron s Energy Crisis California,0.252
1068,737,bt_bing_chinese_simplified,Enron California s energy crisis,0.252
1069,737,bt_bing_french,Enron s Energy Crisis in California,0.252
1070,737,rm3.topn10.10.0.5.qld,enron california energy crisis energi market,0.2508
1071,737,relevancefeedback.topn10.qld,enron california energy crisis energi iso,0.247
1072,737,docluster.topn10.3.qld,enron california energy crisis energi,0.2166
1073,737,wiki.topn3,enron california energy crisis arthur andersen corporattitle defunct energy companies enron economihistory california electripower united states calstrs california electricity crisis,0.2047
1074,737,conceptluster.topn5.3.qld,enron california energy crisis california electricity crisis,0.2044
1075,737,termluster.topn5.3.qld,enron california energy crisis california commiss crisi commiss crisi energi state regulatori market state regulatori market,0.1952
1076,737,rm3.topn10.10.0.5.bm25,enron california energy crisis ferc market pge iso,0.1823
1077,737,anchor.topn3,enron california energy crisis mensalão amvac gintech california economi california histori california educ,0.1542
1078,737,conceptnet.topn3,enron california energy crisis bankruptcy evil a state a lizard a state in the USA Exercising power heat depression,0.1343
1079,737,wiki.topn3.replace,arthur andersen corporattitle defunct energy companies enron economihistory california electripower united states calstrs california electricity crisis,0.1016
1080,737,stem.trunc5,enron calif energ crisi,0.0989
1081,737,wordnet.topn3,enron california energy crisis Golden State Calif CA push vigor vitality,0.0562
1082,737,glove.topn3,enron california energy crisis worldcom skilling calif oregon electricity renewable turmoil crises,0.0402
1083,737,wordnet.topn3.replace,enron Calif CA vigour get up and go crisis,0.04
1084,737,word2vec.topn3,enron california energy crisis madoff halliburton greenspan florida texas arizona enery crises catastrophe,0.0349
1085,737,stem.paicehusk,enron californ energy cris,0.023
1086,737,bt_nllb_arabic,The energy crisis in California,0.017
1087,737,bt_nllb_chinese_yue,The energy crisis in California,0.017
1088,737,bt_nllb_russian,The energy crisis in California,0.017
1089,737,bt_nllb_persian,The California Inron Energy Crisis,0.0119
1090,737,stem.lovins,enron californ energ cris,0.0057
1091,737,anchor.topn3.replace,mensalão amvac gintech california economi california histori california educ energy crisis,0.0043
1092,737,glove.topn3.replace,worldcom skilling calif oregon electricity renewable turmoil crises,0.0014
1093,737,stem.trunc4,enro cali ener cris,0.0009
1094,737,bertqe.topn10.bm25,anna legisl work agricultur anim,0.0001
1095,737,bertqe.topn10.qld,district student page anna legisl,0.0
1096,737,conceptnet.topn3.replace,bankruptcy evil a state a lizard a state in the USA Exercising power heat depression,0.0
1097,737,word2vec.topn3.replace,madoff halliburton greenspan florida texas arizona enery crises catastrophe,0.0
1098,738,-1,Anthrax hoaxes,0.3146
1099,738,anchor.topn3,anthrax hoaxes barybela attacker kelsorum,0.2339
1100,738,sensedisambiguation,Anthrax hoaxes fraud,0.2196
1101,738,bt_bing_chinese_simplified,Anthrax prank,0.1875
1102,738,anchor.topn3.replace,barybela attacker kelsorum hoaxes,0.1269
1103,738,wiki.topn3,anthrax hoaxes ames strain health new york officof laboratory animal welfare anthrax hoaxes,0.1265
1104,738,wiki.topn3.replace,ames strain health new york officof laboratory animal welfare anthrax hoaxes,0.0779
1105,738,word2vec.topn3,anthrax hoaxes bioterror bioterrorism,0.0586
1106,738,wordnet.topn3,anthrax hoaxes splenic fever put on dupery,0.0551
1107,738,conceptnet.topn3,anthrax hoaxes a disease zoonosis,0.0395
1108,738,word2vec.topn3.replace,bioterror bioterrorism hoaxes,0.0338
1109,738,bt_nllb_tamil,The Anthrax Lies,0.0254
1110,738,glove.topn3,anthrax hoaxes spores smallpox js,0.0195
1111,738,stem.trunc4,anth hoax,0.0119
1112,738,bt_bing_malay,Anthrax fraud,0.0065
1113,738,sensedisambiguation.replace,anthrax fraud,0.0065
1114,738,bt_nllb_french,The Lies Against Anthrax,0.0031
1115,738,bt_nllb_german,Counterfeit anthrax,0.0006
1116,738,bt_bing_korean,Anthrax scam,0.0002
1117,738,bt_nllb_korean,The Antrax Trick,0.0002
1118,738,bt_nllb_malay,Antrax is a fraud,0.0002
1119,738,stem.trunc5,anthr hoaxe,0.0002
1120,738,bertqe.topn10.bm25,educ coalit against terror program,0.0
1121,738,bertqe.topn10.qld,home page middl east peac,0.0
1122,738,bt_bing_arabic,Anthrax tricks,0.0
1123,738,bt_nllb_arabic,Tricks about the Andrax,0.0
1124,738,bt_nllb_chinese_yue,The charcoal fraud,0.0
1125,738,bt_nllb_persian,The tricks of the Anterx,0.0
1126,738,bt_nllb_russian,The Anthrax Deception,0.0
1127,738,bt_nllb_swahili,The Tricks of Anthrax,0.0
1128,738,conceptnet.topn3.replace,a disease zoonosis hoaxes,0.0
1129,738,glove.topn3.replace,spores smallpox js,0.0
1130,738,stem.lovins,anthrac hoac,0.0
1131,738,wordnet.topn3.replace,splenic fever fraud humbug dupery,0.0
1132,739,-1,Habitat for Humanity,0.0382
1133,739,rm3.topn10.10.0.5.qld,habitat for humanity faith hous,0.0263
1134,739,termluster.topn5.3.qld,habitat humanity human servic servic habitat,0.0252
1135,739,wiki.topn3,habitat humanity sumter county georgia united way america homeless shelter habitat humanity,0.0179
1136,739,rm3.topn10.10.0.5.bm25,habitat for humanity hous faith indiana,0.0171
1137,739,sensedisambiguation.replace,habitat for world,0.0143
1138,739,relevancefeedback.topn10.qld,habitat for humanity assess faith diseas,0.0048
1139,739,wiki.topn3.replace,sumter county georgia united way america homeless shelter habitat humanity,0.0043
1140,739,bt_nllb_chinese_yue,The human home,0.003
1141,739,wordnet.topn3,habitat humanity home ground human beings mankind,0.0001
1142,739,anchor.topn3,habitat humanity hydrocotyla baldellion seasonally inund park storybook,0.0
1143,739,anchor.topn3.replace,hydrocotyla baldellion seasonally inund park storybook humanity,0.0
1144,739,bertqe.topn10.bm25,yosemit vallei plan sei volum,0.0
1145,739,bertqe.topn10.qld,part wildlif analysi,0.0
1146,739,bt_bing_tamil,The habitat of mankind,0.0
1147,739,bt_nllb_arabic,The home of mankind,0.0
1148,739,bt_nllb_french,A Home for Mankind,0.0
1149,739,bt_nllb_german,A Home for Mankind,0.0
1150,739,bt_nllb_korean,The Residence for Mankind,0.0
1151,739,bt_nllb_russian,A Dwelling Place for Mankind,0.0
1152,739,bt_nllb_swahili,The Place of Human Dwelling,0.0
1153,739,bt_nllb_tamil,The Bible says that the earth is the home of the living God,0.0
1154,739,conceptnet.topn3,habitat humanity live commit genocide,0.0
1155,739,conceptnet.topn3.replace,habitat live commit genocide,0.0
1156,739,glove.topn3,habitat humanity forests humankind mankind,0.0
1157,739,glove.topn3.replace,forests humankind mankind,0.0
1158,739,stem.paicehusk,habit for hum,0.0
1159,739,stem.trunc4,habi for huma,0.0
1160,739,stem.trunc5,habit for human,0.0
1161,739,word2vec.topn3,habitat humanity species wildlife humankind mankind,0.0
1162,739,word2vec.topn3.replace,species wildlife humankind mankind,0.0
1163,739,wordnet.topn3.replace,home ground world manhood,0.0
1164,740,-1,regulate assisted living Maryland,0.1694
1165,740,bt_bing_malay,Regulating Maryland s assisted living,0.132
1166,740,wiki.topn3,regulate assisted living maryland policy consumer protection income regulation continuing care american hospital association homcare assisted living maryland virginia virginia maryland,0.1078
1167,740,sensedisambiguation,regulate assisted serve living support Maryland,0.0943
1168,740,word2vec.topn3,regulate assisted living maryland restrict aided facilitated non living kentucky virginia baltimore,0.0788
1169,740,docluster.topn10.3.qld,regulate assisted living maryland nurs assist,0.0779
1170,740,glove.topn3,regulate assisted living maryland virginia md,0.0655
1171,740,conceptluster.topn5.3.qld,regulate assisted living maryland assisted living regulation,0.0638
1172,740,conceptnet.topn3,regulate assisted living maryland power assisted motor assisted home room house MD a state,0.0628
1173,740,rm3.topn10.10.0.5.qld,regulate assisted living maryland x assist care live nurs provid http,0.0598
1174,740,relevancefeedback.topn10.qld,regulate assisted living maryland assist x nurs provid care resid you,0.0511
1175,740,rm3.topn10.10.0.5.bm25,regulate assisted living maryland nurs home assist servic state resid hospit,0.048
1176,740,anchor.topn3,regulate assisted living maryland gingerpig seareal caballero maryland histori maryland educ arksansa,0.0442
1177,740,termluster.topn5.3.qld,regulate assisted living maryland two time special state servic room state servic room assist care health,0.0356
1178,740,bt_bing_tamil,Help Discipline Living Maryland,0.0328
1179,740,bt_nllb_russian,regulate aid to residents of Maryland,0.0327
1180,740,wiki.topn3.replace,policy consumer protection income regulation continuing care american hospital association homcare assisted living maryland virginia virginia maryland,0.0315
1181,740,bt_nllb_swahili,control support live in maryland,0.0254
1182,740,bt_nllb_arabic,Living aid in Maryland,0.0246
1183,740,glove.topn3.replace,regulate assisted living virginia md,0.0096
1184,740,sensedisambiguation.replace,regulate serve support maryland,0.0069
1185,740,conceptnet.topn3.replace,regulate power assisted motor assisted home room house MD a state,0.0014
1186,740,wordnet.topn3,regulate assisted living maryland order modulate govern attend help livelihood dwell survive Old Line State Free State,0.0008
1187,740,bt_bing_persian,Maryland Life Assistance Adjustment,0.0006
1188,740,anchor.topn3.replace,regulate assisted gingerpig seareal caballero maryland histori maryland educ arksansa,0.0002
1189,740,bertqe.topn10.bm25,summari robert l mollica ed d,0.0
1190,740,bertqe.topn10.qld,academi state health polici june,0.0
1191,740,bt_nllb_chinese_yue,I m a life coach in Maryland,0.0
1192,740,bt_nllb_malay,Organizing life support in Maryland,0.0
1193,740,bt_nllb_persian,Set up a helping life in Maryland,0.0
1194,740,bt_nllb_tamil,The following is a list of some of the most common types of cancer in the United States,0.0
1195,740,stem.lovins,regl assist liv maryland,0.0
1196,740,stem.paicehusk,reg assist liv maryland,0.0
1197,740,stem.trunc4,regu assi livi mary,0.0
1198,740,stem.trunc5,regul assis livin maryl,0.0
1199,740,word2vec.topn3.replace,restrict aided facilitated non living kentucky virginia baltimore,0.0
1200,740,wordnet.topn3.replace,baffle regularize regularise attend wait on help support endure survive Old Line State MD,0.0
1201,741,-1,Artificial Intelligence,0.025
1202,741,docluster.topn10.3.qld,artificial intelligence artifici,0.0159
1203,741,wiki.topn3,artificial intelligence unsolved problems computer science computational neuroscience simulation artificial intelligence,0.0108
1204,741,word2vec.topn3,artificial intelligence artifical synthetic intellegence intelligence,0.0104
1205,741,termluster.topn5.3.qld,artificial intelligence non intellig non artifici,0.0097
1206,741,wordnet.topn3,artificial intelligence unreal hokey intelligence service tidings intelligence agency,0.0064
1207,741,relevancefeedback.topn10.qld,artificial intelligence class artifici intellig s http,0.0059
1208,741,wiki.topn3.replace,unsolved problems computer science computational neuroscience simulation artificial intelligence,0.0032
1209,741,anchor.topn3,artificial intelligence percettiva intelligenza condenan,0.0016
1210,741,stem.lovins,artific intellig,0.0016
1211,741,glove.topn3,artificial intelligence furthermore hence cia operatives,0.0013
1212,741,word2vec.topn3.replace,artifical synthetic intellegence intelligence,0.0011
1213,741,stem.paicehusk,art intellig,0.0005
1214,741,bt_nllb_chinese_yue,AI is the answer,0.0001
1215,741,bt_nllb_korean,AI,0.0001
1216,741,bt_nllb_persian,The AI,0.0001
1217,741,rm3.topn10.10.0.5.bm25,artificial intelligence class i,0.0001
1218,741,rm3.topn10.10.0.5.qld,artificial intelligence class artifici i,0.0001
1219,741,anchor.topn3.replace,percettiva intelligenza condenan intelligence,0.0
1220,741,bertqe.topn10.bm25,number isbn issn publish number,0.0
1221,741,bertqe.topn10.qld,publish number oclc number lccn,0.0
1222,741,bt_nllb_swahili,A Craftsman s Mind,0.0
1223,741,glove.topn3.replace,furthermore hence cia operatives,0.0
1224,741,sensedisambiguation.replace,artificial news,0.0
1225,741,stem.trunc4,arti inte,0.0
1226,741,stem.trunc5,artif intel,0.0
1227,741,wordnet.topn3.replace,stilted unreal hokey intelligence service intelligence agency intelligence activity,0.0
1228,742,-1,hedge funds fraud protection,0.2041
1229,742,relevancefeedback.topn10.qld,hedge funds fraud protection fund invest,0.204
1230,742,word2vec.topn3,hedge funds fraud protection monies fraudulent,0.1801
1231,742,glove.topn3,hedge funds fraud protection investments fund money fraudulent embezzlement,0.1751
1232,742,anchor.topn3,hedge funds fraud protection fraud fixing match states disney use ahea,0.1344
1233,742,wordnet.topn3,hedge funds fraud protection elude hedge in put off monetary resource investment firm pecuniary resource role player pseud protective covering auspices shelter,0.1078
1234,742,anchor.topn3.replace,hedge funds fraud fixing match states disney use ahea,0.0969
1235,742,word2vec.topn3.replace,hedge monies fraudulent protection,0.0939
1236,742,termluster.topn5.3.qld,hedge funds fraud protection valu typic share valu typic share addit also ani valu typic share,0.0672
1237,742,sensedisambiguation,hedge funds store fraud imposter protection security,0.0622
1238,742,bertqe.topn10.qld,todai report hedg fund implic,0.0611
1239,742,stem.trunc4,hedg fund frau prot,0.0576
1240,742,wiki.topn3,hedge funds fraud protection trader finance leveraged buyout arthur andersen hedge fund embezzlement extortion indictment fraud financial institution deposit account equity finance security finance,0.0385
1241,742,rm3.topn10.10.0.5.bm25,hedge funds fraud protection fund cpo,0.0308
1242,742,conceptnet.topn3,hedge funds fraud protection skirt pocket crime shade cover a condom,0.0294
1243,742,bt_nllb_french,protection against fraud of investment funds,0.0133
1244,742,wiki.topn3.replace,trader finance leveraged buyout arthur andersen hedge fund embezzlement extortion indictment fraud financial institution deposit account equity finance security finance,0.0111
1245,742,sensedisambiguation.replace,hedge store imposter security,0.0068
1246,742,wordnet.topn3.replace,put off hedge in skirt investment company investment trust hoax put on imposter protective covering protective cover,0.0033
1247,742,glove.topn3.replace,investments fund money fraudulent embezzlement protection,0.0002
1248,742,bertqe.topn10.bm25,report fact sheet home previou,0.0
1249,742,bt_nllb_arabic,Securities fraud protection,0.0
1250,742,bt_nllb_chinese_yue,The protection of pension funds,0.0
1251,742,conceptnet.topn3.replace,skirt pocket crime shade cover a condom,0.0
1252,743,-1,Freighter ship registration,0.0147
1253,743,anchor.topn3,freighter ship registration d cl a improv kommuna cunnari communa,0.0141
1254,743,conceptnet.topn3,freighter ship registration cargo ship captain boat enrollment,0.0123
1255,743,bt_nllb_russian,Registration of cargo vessels,0.0076
1256,743,rm3.topn10.10.0.5.qld,freighter ship registration ferri yacht http harbor whale,0.0045
1257,743,bt_nllb_malay,Registering of cargo vessels,0.0035
1258,743,word2vec.topn3.replace,cargo tanker vessel warship registering,0.003
1259,743,sensedisambiguation,Freighter bottom ship registration,0.0028
1260,743,bertqe.topn10.qld,oversight panel merchant marin vessel,0.0027
1261,743,stem.paicehusk,freight ship reg,0.0026
1262,743,wiki.topn3,freighter ship registration deadweight tonnage length perpendiculars length overall cargo ship deadweight tonnage length perpendiculars length overall cargo ship net tonnage template admiralty law ship collision ship registration,0.0026
1263,743,relevancefeedback.topn10.qld,freighter ship registration ferri harbor flag yacht lake,0.0025
1264,743,wiki.topn3.replace,deadweight tonnage length perpendiculars length overall cargo ship deadweight tonnage length perpendiculars length overall cargo ship net tonnage template admiralty law ship collision ship registration,0.0015
1265,743,bt_nllb_korean,Registering the freighter,0.0009
1266,743,bt_nllb_tamil,Freight shipping registration,0.0007
1267,743,conceptnet.topn3.replace,cargo ship captain boat enrollment,0.0002
1268,743,rm3.topn10.10.0.5.bm25,freighter ship registration yacht jackson william,0.0002
1269,743,wordnet.topn3.replace,merchant ship bottom send embark enrollment adjustment enrolment,0.0002
1270,743,anchor.topn3.replace,d cl a improv kommuna cunnari communa registration,0.0
1271,743,bt_bing_malay,Registration of carriers,0.0
1272,743,bt_nllb_arabic,Record of shipping,0.0
1273,743,bt_nllb_german,Registration of freight vehicles,0.0
1274,743,bt_nllb_swahili,Register of freight ships,0.0
1275,743,glove.topn3.replace,ship vessel voter identification,0.0
1276,743,sensedisambiguation.replace,bottom ship registration,0.0
1277,743,stem.trunc4,frei ship regi,0.0
1278,743,stem.trunc5,freig ship regis,0.0
1279,744,-1,Counterfeit ID punishments,0.0
1280,745,-1,Doomsday cults,0.4984
1281,745,wiki.topn3,doomsday cults unification church neologisms mind control messiah complex doomsday cult,0.4982
1282,745,anchor.topn3,doomsday cults rustavelian decasyllab sharky,0.4908
1283,745,rm3.topn10.10.0.5.qld,doomsday cults cult religion biolog,0.49
1284,745,sensedisambiguation,Doomsday judgment day cults fad,0.4554
1285,745,glove.topn3,doomsday cults cult aum sects,0.4436
1286,745,docluster.topn10.3.qld,doomsday cults cult,0.4365
1287,745,conceptnet.topn3,doomsday cults Judgment Day doom synchromysticism,0.3242
1288,745,relevancefeedback.topn10.qld,doomsday cults cult religion religi,0.3107
1289,745,rm3.topn10.10.0.5.bm25,doomsday cults cult religion religi,0.3107
1290,745,word2vec.topn3,doomsday cults apocalypse apocalyptic end of the world sects,0.249
1291,745,bt_bing_french,Apocalyptic Cults,0.189
1292,745,bt_bing_korean,Doomsday Worship,0.1785
1293,745,wiki.topn3.replace,unification church neologisms mind control messiah complex doomsday cult,0.153
1294,745,glove.topn3.replace,cult aum sects,0.1492
1295,745,wordnet.topn3,doomsday cults end of the world Last Judgement furor furore,0.0995
1296,745,bt_bing_arabic,Doomsday sects,0.0833
1297,745,bt_nllb_arabic,The Day of Judgment cult,0.0261
1298,745,bt_nllb_russian,The Day of Judgment cult,0.0261
1299,745,bt_nllb_chinese_yue,The cult of the last days,0.0207
1300,745,bt_nllb_french,The cults of the Last Judgment Day,0.0202
1301,745,word2vec.topn3.replace,apocalypse apocalyptic end of the world sects,0.0162
1302,745,stem.lovins,doomsda cult,0.0116
1303,745,stem.trunc4,doom cult,0.002
1304,745,stem.trunc5,dooms cults,0.002
1305,745,anchor.topn3.replace,rustavelian decasyllab sharky cults,0.0008
1306,745,bertqe.topn10.bm25,seri titl call number isbn,0.0
1307,745,bertqe.topn10.qld,entir collect spanish video vh,0.0
1308,745,bt_bing_persian,Sects of the Day of Judgment,0.0
1309,745,bt_bing_tamil,Doomsday Liturgy,0.0
1310,745,bt_nllb_german,The Meaning of the Hereafter,0.0
1311,745,bt_nllb_korean,The Day of Judgment,0.0
1312,745,bt_nllb_malay,Religions of the Last Days,0.0
1313,745,bt_nllb_persian,The worship of the Day of Resurrection,0.0
1314,745,bt_nllb_swahili,Religions of Judgment Day,0.0
1315,745,bt_nllb_tamil,The final day of worship,0.0
1316,745,conceptnet.topn3.replace,Judgment Day doom synchromysticism,0.0
1317,745,sensedisambiguation.replace,judgment day fad,0.0
