,qid,order,query,qld.map
2000,767,sensedisambiguation,Pharmacist License requirements requirement,0.1102
2001,767,bt_bing_korean,Pharmacist Licensure Requirements,0.0979
2002,767,relevancefeedback.topn10.qld,pharmacist license requirements board licens drug pharmaci shall,0.0964
2003,767,rm3.topn10.10.0.5.qld,pharmacist license requirements drug pharmaci shall licens board,0.0964
2004,767,bt_nllb_tamil,Pharmacy license requirements,0.0963
2005,767,wiki.topn3,pharmacist license requirements pharmacy dentist obstetrics pharmacist inventory vendor tradsecret license,0.0907
2006,767,docluster.topn10.3.qld,pharmacist license requirements licens pharmaci board,0.0664
2007,767,bt_nllb_arabic,The requirements for pharmacy licensure,0.0606
2008,767,word2vec.topn3,pharmacist license requirements pharmacy licence criteria,0.0569
2009,767,termluster.topn5.3.qld,pharmacist license requirements activ applic board activ applic board standard site review,0.0521
2010,767,conceptnet.topn3,pharmacist license requirements pill roller permit unfit,0.0501
2011,767,wordnet.topn3,pharmacist license requirements pill pusher apothecary chemist certify permission demand requisite prerequisite,0.0492
2012,767,wiki.topn3.replace,pharmacy dentist obstetrics pharmacist inventory vendor tradsecret license,0.041
2013,767,bt_nllb_malay,Licensing requirements for pharmaceuticals,0.0181
2014,767,glove.topn3,pharmacist license requirements dentist physician licence,0.0132
2015,767,anchor.topn3,pharmacist license requirements laparoscopist megerdumian aacrao extreme charact ghostbusters apress,0.0091
2016,767,bt_nllb_persian,The conditions of the pharmaceutical license,0.0042
2017,767,bt_nllb_french,Requirements for a pharmacist s licence,0.0007
2018,767,stem.lovins,pharmac licens requirement,0.0004
2019,767,stem.paicehusk,pharmac licens requir,0.0004
2020,767,wordnet.topn3.replace,chemist pill pusher druggist certify permit requisite necessity demand,0.0002
2021,767,bt_nllb_german,Requirements for the licence of a pharmacist,0.0001
2022,767,bt_nllb_korean,Licensing requirements,0.0001
2023,767,stem.porter,pharmacist licens requir,0.0001
2024,767,stem.porter2,pharmacist licens requir,0.0001
2025,767,anchor.topn3.replace,laparoscopist megerdumian aacrao extreme charact ghostbusters apress requirements,0.0
2026,767,bertqe.topn10.bm25,board includ ani site where,0.0
2027,767,bertqe.topn10.qld,regul protect public rule regul,0.0
2028,767,bt_nllb_swahili,License Requirements for Medicinal Products,0.0
2029,767,conceptnet.topn3.replace,pill roller permit unfit,0.0
2030,767,glove.topn3.replace,dentist physician licence requirements,0.0
2031,767,stem.trunc4,phar lice requ,0.0
2032,767,stem.trunc5,pharm licen requi,0.0
2033,767,word2vec.topn3.replace,pharmacy licence criteria,0.0
2034,768,-1,Women in state legislatures,0.0908
2035,768,rm3.topn10.10.0.5.bm25,women in state legislatures b minnesota,0.0678
2036,768,word2vec.topn3,women state legislatures men woman federal legislators,0.0638
2037,768,docluster.topn10.3.qld,women in state legislatures new,0.0162
2038,768,bt_nllb_korean,A woman in the State House of Representatives,0.014
2039,768,bt_nllb_french,Women in state legislation,0.0101
2040,768,bt_nllb_tamil,Women in state assemblies,0.0084
2041,768,word2vec.topn3.replace,men woman federal legislators,0.0062
2042,768,relevancefeedback.topn10.qld,women in state legislatures new athlet,0.0053
2043,768,stem.trunc5,women in state legis,0.0048
2044,768,sensedisambiguation,Women womanhood in state state of matter legislatures legislature,0.0038
2045,768,conceptluster.topn5.3.qld,women state legislatures women s suffrage state legislature united states,0.0031
2046,768,tagmee.topn3,women state legislatures Women s suffrage State legislature United States,0.0031
2047,768,bt_nllb_russian,Women in the legislative bodies of the States,0.0025
2048,768,termluster.topn5.3.qld,women state legislatures attornei board commiss attornei board commiss women statewid state,0.0022
2049,768,wiki.topn3,women state legislatures timelinof women s suffrage suffrage women s suffrage women s suffrage state senators united states statsupremcourt statsenator state legislature united states,0.0022
2050,768,tagmee.topn3.replace,Women s suffrage State legislature United States,0.0016
2051,768,bt_nllb_malay,Women in state law,0.0015
2052,768,glove.topn3,women state legislatures men girls federal parliaments,0.0014
2053,768,wiki.topn3.replace,timelinof women s suffrage suffrage women s suffrage women s suffrage state senators united states statsupremcourt statsenator state legislature united states,0.001
2054,768,sensedisambiguation.replace,womanhood in state of matter legislature,0.0005
2055,768,conceptnet.topn3,women state legislatures dress,0.0003
2056,768,stem.lovins,wom in st legislatur,0.0003
2057,768,bertqe.topn10.bm25,pro tempor california state assembl,0.0001
2058,768,bertqe.topn10.qld,fate dai which led first,0.0001
2059,768,stem.paicehusk,wom in stat legisl,0.0001
2060,768,anchor.topn3,women state legislatures mo mo south mezzo daflepur hyperaggress hsiwan,0.0
2061,768,anchor.topn3.replace,mo mo south mezzo daflepur hyperaggress hsiwan legislatures,0.0
2062,768,bt_nllb_arabic,Women in the legislative provinces,0.0
2063,768,bt_nllb_swahili,Women in the state parliament,0.0
2064,768,conceptnet.topn3.replace,dress state legislatures,0.0
2065,768,glove.topn3.replace,men girls federal parliaments,0.0
2066,768,stem.trunc4,wome in stat legi,0.0
2067,768,wordnet.topn3,women state legislatures fair sex womanhood charwoman country express province legislative assembly general assembly,0.0
2068,768,wordnet.topn3.replace,char charwoman cleaning woman DoS say posit law makers general assembly legislative assembly,0.0
2069,769,-1,Kroll Associates Employees,0.0046
2070,769,conceptluster.topn5.3.qld,kroll associates employees kroll inc,0.0043
2071,769,tagmee.topn3,kroll associates employees Kroll Inc,0.0043
2072,769,conceptnet.topn3,kroll associates employees a company the office company,0.0039
2073,769,bt_bing_korean,Kroll Associates Staff,0.0037
2074,769,bt_bing_persian,Kroll Staff Associates,0.0037
2075,769,bt_bing_tamil,Kroll Associates Staff,0.0037
2076,769,bt_nllb_tamil,The staff of Kroll Associates,0.0037
2077,769,stem.trunc5,kroll assoc emplo,0.0033
2078,769,rm3.topn10.10.0.5.bm25,kroll associates employees order thaw mr i facil program train we,0.0031
2079,769,stem.porter2,kroll associ employe,0.0024
2080,769,tagmee.topn3.replace,Kroll Inc,0.0022
2081,769,wordnet.topn3,kroll associates employees comrade familiar,0.0017
2082,769,wordnet.topn3.replace,kroll familiar consort associate degree employees,0.0017
2083,769,glove.topn3,kroll associates employees http www statoil com bb consulting workers,0.0012
2084,769,bt_bing_chinese_simplified,Kroll Athosiate employees,0.0011
2085,769,sensedisambiguation.replace,Kroll companion employee,0.0007
2086,769,docluster.topn10.3.qld,kroll associates employees wage,0.0005
2087,769,word2vec.topn3,kroll associates employees friends acquaintances colleagues workers,0.0004
2088,769,word2vec.topn3.replace,kroll friends acquaintances colleagues workers,0.0004
2089,769,anchor.topn3,kroll associates employees raulf kleiming bether,0.0002
2090,769,rm3.topn10.10.0.5.qld,kroll associates employees train wage mr new,0.0002
2091,769,sensedisambiguation,Kroll Associates companion Employees employee,0.0002
2092,769,anchor.topn3.replace,raulf kleiming bether associates employees,0.0
2093,769,bertqe.topn10.bm25,april state continu,0.0
2094,769,bertqe.topn10.qld,state dramat increas enforc wage,0.0
2095,769,bt_nllb_arabic,The staff associates,0.0
2096,769,bt_nllb_chinese_yue,I work for Crowl,0.0
2097,769,bt_nllb_korean,Crowl Co op staff,0.0
2098,769,bt_nllb_persian,Crowley s staff,0.0
2099,769,glove.topn3.replace,http www statoil com bb consulting workers,0.0
2100,769,stem.lovins,krol associ employee,0.0
2101,769,stem.paicehusk,krol assocy employ,0.0
2102,769,stem.trunc4,krol asso empl,0.0
2103,769,termluster.topn5.3.qld,kroll associates employees employe worker worker kroll,0.0
2104,770,-1,Kyrgyzstan-United States relations,0.1142
2105,770,relevancefeedback.topn10.qld,kyrgyzstan united states relations trade state central kyrgyzstan aestivum,0.1078
2106,770,bt_bing_chinese_simplified,Kyrgyzstan s relations with the United States,0.1047
2107,770,bt_nllb_chinese_yue,Kyrgyzstan s relations with the United States,0.1047
2108,770,rm3.topn10.10.0.5.qld,kyrgyzstan united states relations state central russian uighur,0.0943
2109,770,glove.topn3,kyrgyzstan united states relations united u s ties relationship,0.0812
2110,770,rm3.topn10.10.0.5.bm25,kyrgyzstan united states relations state central narcot u,0.0745
2111,770,glove.topn3.replace,kyrgyzstan united united u s ties relationship,0.0669
2112,770,conceptnet.topn3,kyrgyzstan united states relations country,0.0662
2113,770,conceptnet.topn3.replace,kyrgyzstan united country relations,0.061
2114,770,stem.paicehusk,kyrgyzstan unit stat rel,0.0559
2115,770,wiki.topn3,kyrgyzstan united states relations erkin rakishev erlan idrissov viktor verzhbitsky kyrgyzstan united states relations,0.0518
2116,770,word2vec.topn3.replace,kyrgyzstan united sates states relationships,0.0463
2117,770,word2vec.topn3,kyrgyzstan united states relations sates states relationships,0.0409
2118,770,stem.lovins,kyrgyzstan unit st rel,0.0328
2119,770,bt_bing_persian,Kyrgyzstan U S relations,0.0184
2120,770,bt_nllb_arabic,Kyrgyzstan U S relations,0.0184
2121,770,bt_nllb_malay,Kyrgyzstan U S relations,0.0184
2122,770,wordnet.topn3.replace,kyrgyzstan united DoS say posit intercourse recounting relative,0.0164
2123,770,bt_bing_arabic,Kyrgyz American Relations,0.0123
2124,770,bt_nllb_tamil,The Kyrgyz American relations,0.0123
2125,770,wiki.topn3.replace,erkin rakishev erlan idrissov viktor verzhbitsky kyrgyzstan united states relations,0.0104
2126,770,bt_bing_russian,Kyrgyz U S relations,0.0092
2127,770,bertqe.topn10.qld,state america proclam albania ha,0.0032
2128,770,stem.trunc5,kyrgy unite state relat,0.0016
2129,770,bertqe.topn10.bm25,secretari immedi releas june,0.0
2130,770,sensedisambiguation,Kyrgyzstan United States state of matter relations sexual intercourse,0.0
2131,770,sensedisambiguation.replace,Kyrgyzstan United state of matter sexual intercourse,0.0
2132,770,stem.trunc4,kyrg unit stat rela,0.0
2133,770,wordnet.topn3,kyrgyzstan united states relations country express province intercourse sexual intercourse recounting,0.0
2134,771,-1,deformed leopard frogs,0.3091
2135,771,termluster.topn5.3.qld,deformed leopard frogs minnesota leopard frog deform frog minnesota minnesota leopard deform,0.2971
2136,771,sensedisambiguation,deformed flex leopard frogs frog,0.2925
2137,771,anchor.topn3,deformed leopard frogs v g leopard nimrs,0.2752
2138,771,docluster.topn10.3.qld,deformed leopard frogs frog,0.2679
2139,771,relevancefeedback.topn10.qld,deformed leopard frogs frog,0.2679
2140,771,rm3.topn10.10.0.5.qld,deformed leopard frogs frog,0.2679
2141,771,glove.topn3,deformed leopard frogs malformed misshapen cheetah lion toads lizards,0.2009
2142,771,conceptnet.topn3,deformed leopard frogs animals amphibians swim,0.1743
2143,771,conceptnet.topn3.replace,deformed leopard animals amphibians swim,0.1584
2144,771,conceptluster.topn5.3.qld,deformed leopard frogs leopard frog leopard,0.145
2145,771,tagmee.topn3,deformed leopard frogs Leopard Leopard frog,0.145
2146,771,wordnet.topn3,deformed leopard frogs change shape misshapen flex Panthera pardus Gaul toad frog,0.131
2147,771,bt_bing_french,misshapen leopard frogs,0.1219
2148,771,word2vec.topn3,deformed leopard frogs misshapen disfigured tiger cheetah amphibians tadpoles,0.1189
2149,771,sensedisambiguation.replace,flex leopard frog,0.0707
2150,771,tagmee.topn3.replace,Leopard Leopard frog,0.0533
2151,771,bt_nllb_swahili,Defective leopards,0.0439
2152,771,bt_bing_malay,Disabled leopard frog,0.042
2153,771,bt_bing_arabic,Deformed tiger frogs,0.0409
2154,771,bt_nllb_persian,Leopard frogs are perverse,0.0402
2155,771,bt_bing_swahili,Spoiled leopard frog,0.0368
2156,771,stem.trunc4,defo leop frog,0.0344
2157,771,glove.topn3.replace,malformed misshapen cheetah lion toads lizards,0.0232
2158,771,word2vec.topn3.replace,misshapen disfigured tiger cheetah amphibians tadpoles,0.0164
2159,771,wiki.topn3,deformed leopard frogs national symbols democratirepubliof congo national symbols somalia giraffe leopard tiger salamander lithobates red back salamander leopard frog,0.0109
2160,771,bt_nllb_malay,A defective lion frog,0.0041
2161,771,stem.trunc5,defor leopa frogs,0.0021
2162,771,bt_nllb_korean,A modified tiger frog,0.0011
2163,771,wordnet.topn3.replace,flex distort change shape Panthera pardus toad toad frog,0.001
2164,771,bertqe.topn10.qld,vtdec water qualiti divis biomonitor,0.0007
2165,771,bt_nllb_arabic,The turning tiger frogs,0.0007
2166,771,wiki.topn3.replace,national symbols democratirepubliof congo national symbols somalia giraffe leopard tiger salamander lithobates red back salamander leopard frog,0.0006
2167,771,bertqe.topn10.bm25,divis biomonitor aquat studi section,0.0
2168,771,bt_nllb_chinese_yue,It s deformed,0.0
2169,771,bt_nllb_tamil,The red colored lion frog,0.0
2170,772,-1,flag display rules,0.2408
2171,772,stem.paicehusk,flag display rul,0.1462
2172,772,conceptluster.topn5.3.qld,flag display rules display rules,0.1374
2173,772,tagmee.topn3,flag display rules Display rules,0.1374
2174,772,sensedisambiguation,flag pin display rules rule,0.1352
2175,772,glove.topn3,flag display rules banner regulations laws,0.1343
2176,772,conceptnet.topn3,flag display rules symbol banner array showing law laws playing a game,0.066
2177,772,bertqe.topn10.qld,state flag us law state,0.0658
2178,772,bt_bing_korean,Flagging rules,0.0441
2179,772,bt_nllb_arabic,The rules of flagging,0.0441
2180,772,bt_nllb_swahili,rules for flags,0.0441
2181,772,bt_nllb_chinese_yue,The flag shows the rules,0.0228
2182,772,bt_nllb_malay,the rules of appearance of the flag,0.0204
2183,772,bt_nllb_korean,Flag sign rules,0.0117
2184,772,wiki.topn3,flag display rules social sharing emotions first impression psychology group emotion display rules,0.0085
2185,772,glove.topn3.replace,banner display regulations laws,0.006
2186,772,bertqe.topn10.bm25,washington secretari state state flag,0.005
2187,772,wordnet.topn3,flag display rules masthead fleur de lis showing presentation harness govern formula,0.0033
2188,772,stem.trunc5,flag displ rules,0.0019
2189,772,anchor.topn3,flag display rules rammersmen foic officer in command pinball resolution qhd p,0.0016
2190,772,sensedisambiguation.replace,pin display rule,0.0015
2191,772,tagmee.topn3.replace,Display rules,0.0006
2192,772,stem.lovins,flag displa rl,0.0003
2193,772,anchor.topn3.replace,rammersmen foic officer in command pinball resolution qhd p rules,0.0
2194,772,bt_bing_chinese_simplified,Tag display rules,0.0
2195,772,conceptnet.topn3.replace,symbol banner array showing law laws playing a game,0.0
2196,772,stem.trunc4,flag disp rule,0.0
2197,772,wiki.topn3.replace,social sharing emotions first impression psychology group emotion display rules,0.0
2198,772,wordnet.topn3.replace,slacken off ease off sword lily exhibit presentation video display pattern ruler rein,0.0
2199,773,-1,Pennsylvania slot machine gambling,0.4615
2200,773,sensedisambiguation.replace,university of pennsylvania slot machine gamble,0.4614
2201,773,conceptnet.topn3,pennsylvania slot machine gambling PA an apple tree slot machine,0.4385
2202,773,relevancefeedback.topn10.qld,pennsylvania slot machine gambling court machin license licens,0.4313
2203,773,rm3.topn10.10.0.5.bm25,pennsylvania slot machine gambling court machin licens license,0.4313
2204,773,rm3.topn10.10.0.5.qld,pennsylvania slot machine gambling machin court license licens,0.4313
2205,773,bt_nllb_persian,Playing in the Pennsylvania slot machine,0.4077
2206,773,wiki.topn3,pennsylvania slot machine gambling pennsylvania new jersey cities pennsylvania pennsylvania slot machines blackjack video poker slot machine gambling lottery slot machine gambling,0.3908
2207,773,bt_nllb_chinese_yue,Gambling in Pennsylvania,0.3689
2208,773,wiki.topn3.replace,pennsylvania new jersey cities pennsylvania pennsylvania slot machines blackjack video poker slot machine gambling lottery slot machine gambling,0.3425
2209,773,conceptluster.topn5.3.qld,pennsylvania slot machine gambling gambling slot machine,0.3118
2210,773,bt_nllb_french,Pennsylvania slot machines,0.2862
2211,773,conceptnet.topn3.replace,PA an apple tree slot machine machine gambling,0.2706
2212,773,wordnet.topn3.replace,PA University of Pennsylvania Keystone State expansion slot time slot auto political machine car adventure play,0.2273
2213,773,bt_nllb_swahili,Pennsylvania gaming machine,0.2234
2214,773,wordnet.topn3,pennsylvania slot machine gambling Penn University of Pennsylvania time slot expansion slot one armed bandit car political machine automobile risk gaming,0.1255
2215,773,stem.paicehusk,pennsylvan slot machin gambl,0.0707
2216,773,bt_bing_persian,Gambling Slot Machine Penguin,0.0657
2217,773,stem.trunc5,penns slot machi gambl,0.016
2218,773,bt_bing_french,Slot Games in Pennsylvania,0.0128
2219,773,stem.lovins,pennsylvan slot mach gambl,0.0047
2220,773,bertqe.topn10.bm25,liquor control board pennsylvania state,0.0006
2221,773,glove.topn3,pennsylvania slot machine gambling pa illinois spot hand casinos casino,0.0006
2222,773,bertqe.topn10.qld,bureau liquor control enforc citat,0.0001
2223,773,bt_nllb_arabic,The gambling projects in the Forex gaming projects,0.0
2224,773,glove.topn3.replace,pa illinois spot hand casinos casino,0.0
2225,773,stem.trunc4,penn slot mach gamb,0.0
2226,773,word2vec.topn3,pennsylvania slot machine gambling nebraska wisconsin massachusetts timeslot machinery gamblers casino,0.0
2227,773,word2vec.topn3.replace,nebraska wisconsin massachusetts timeslot machinery gamblers casino,0.0
2228,774,-1,Causes of Homelessness,0.0786
2229,774,docluster.topn10.3.qld,causes of homelessness homeless,0.0782
2230,774,relevancefeedback.topn10.qld,causes of homelessness homeless,0.0782
2231,774,tagmee.topn3,causes homelessness Paralysis Homelessness,0.0712
2232,774,word2vec.topn3,causes homelessness poverty,0.0601
2233,774,bt_nllb_tamil,Why are homeless people so vulnerable,0.0534
2234,774,rm3.topn10.10.0.5.qld,causes of homelessness homeless student,0.0484
2235,774,wordnet.topn3,causes homelessness have make induce,0.0443
2236,774,bt_bing_persian,Reasons for homelessness,0.0442
2237,774,bt_nllb_persian,The reasons for homelessness,0.0442
2238,774,bt_nllb_swahili,Reasons for Homelessness,0.0442
2239,774,glove.topn3,causes homelessness alcoholism,0.0424
2240,774,rm3.topn10.10.0.5.bm25,causes of homelessness homeless student district,0.0283
2241,774,wordnet.topn3.replace,suit grounds case homelessness,0.0197
2242,774,sensedisambiguation,Causes lawsuit of Homelessness,0.0149
2243,774,sensedisambiguation.replace,lawsuit of homelessness,0.0032
2244,774,conceptluster.topn5.3.qld,causes homelessness paralysis,0.0019
2245,774,tagmee.topn3.replace,Paralysis Homelessness,0.0012
2246,774,bt_nllb_chinese_yue,Why they re homeless,0.0005
2247,774,bt_nllb_french,The Causes of Poverty,0.0005
2248,774,word2vec.topn3.replace,causes poverty,0.0005
2249,774,stem.trunc5,cause of homel,0.0004
2250,774,bertqe.topn10.bm25,est end wed nov,0.0
2251,774,bertqe.topn10.qld,date subject other mail archiv,0.0
2252,774,bt_nllb_korean,Why I Have No Home,0.0
2253,774,bt_nllb_malay,Causes of Housing Emptiness,0.0
2254,774,glove.topn3.replace,causes alcoholism,0.0
2255,774,stem.lovins,caus of home,0.0
2256,774,stem.paicehusk,caus of homeless,0.0
2257,774,stem.porter,caus of homeless,0.0
2258,774,stem.porter2,caus of homeless,0.0
2259,774,stem.trunc4,caus of home,0.0
2260,774,termluster.topn5.3.qld,causes homelessness nifl messag literaci,0.0
2261,775,-1,Commercial candy makers,0.0419
2262,775,rm3.topn10.10.0.5.bm25,commercial candy makers candi shall chocol u industri,0.0403
2263,775,tagmee.topn3.replace,Candy,0.0375
2264,775,conceptluster.topn5.3.qld,commercial candy makers candy,0.0352
2265,775,docluster.topn10.3.qld,commercial candy makers candi,0.0352
2266,775,tagmee.topn3,commercial candy makers Candy,0.0352
2267,775,termluster.topn5.3.qld,commercial candy makers maker candi,0.0256
2268,775,relevancefeedback.topn10.qld,commercial candy makers candi u all,0.0196
2269,775,wordnet.topn3,commercial candy makers commercial grade commercial message sugarcoat confect glaze shaper Godhead Divine,0.0138
2270,775,glove.topn3,commercial candy makers addition business chocolate manufacturers,0.0134
2271,775,word2vec.topn3,commercial candy makers commerical non commercial commericial sweets chocolate manufacturers manufacturer,0.0119
2272,775,bt_nllb_arabic,The commercial confectioners,0.0085
2273,775,sensedisambiguation,Commercial candy makers manufacturer,0.0053
2274,775,bt_bing_tamil,Commercial confectionery makers,0.0045
2275,775,conceptnet.topn3.replace,commercialised chocolate sugar the movies makers,0.0045
2276,775,stem.trunc5,comme candy maker,0.0039
2277,775,bt_nllb_tamil,Commercial sweets makers,0.0037
2278,775,bt_bing_french,Commercial Candy Manufacturers,0.001
2279,775,bt_bing_korean,Commercial Candy Manufacturers,0.001
2280,775,bt_bing_russian,Commercial Candy Manufacturers,0.001
2281,775,bt_bing_swahili,Commercial candy manufacturers,0.001
2282,775,bt_nllb_chinese_yue,Commercial candy manufacturers,0.001
2283,775,bt_nllb_korean,Commercial candy manufacturers,0.001
2284,775,bt_nllb_malay,Commercial candy manufacturers,0.001
2285,775,bt_nllb_russian,Commercial candy manufacturers,0.001
2286,775,sensedisambiguation.replace,commercial candy manufacturer,0.001
2287,775,glove.topn3.replace,addition business chocolate manufacturers,0.0009
2288,775,stem.paicehusk,commerc candy mak,0.0005
2289,775,word2vec.topn3.replace,commerical non commercial commericial sweets chocolate manufacturers manufacturer,0.0002
2290,775,anchor.topn3,commercial candy makers d africa penninsulair d esplorazion hekili keezo tologanak,0.0
2291,775,anchor.topn3.replace,d africa penninsulair d esplorazion hekili keezo tologanak makers,0.0
2292,775,bertqe.topn10.bm25,usda nutrient databas standard refer,0.0
2293,775,bertqe.topn10.qld,usda nutrient databas standard refer,0.0
2294,775,bt_bing_chinese_simplified,Commercial confectionery manufacturer,0.0
2295,775,bt_bing_german,Commercial Confectionery Manufacturers,0.0
2296,775,bt_nllb_french,Manufacturers of commercial sweets,0.0
2297,775,bt_nllb_german,Manufacturers of commercial sweets,0.0
2298,775,bt_nllb_persian,Commercial sweets manufacturers,0.0
2299,775,bt_nllb_swahili,Commercial sugar producers,0.0
2300,775,stem.lovins,commerc cand maker,0.0
2301,775,stem.trunc4,comm cand make,0.0
2302,775,wordnet.topn3.replace,commercial message commercial grade glaze sugarcoat Jehovah shaper God Almighty,0.0
2303,776,-1,Magnet schools success,0.0721
2304,776,termluster.topn5.3.qld,magnet schools success art children design support success student art children design,0.0545
2305,776,wiki.topn3,magnet schools success magnet schools national honor society alternativschool magnet school magnet schools national honor society alternativschool magnet school,0.0535
2306,776,tagmee.topn3,magnet schools success Magnet school Magnet school,0.0397
2307,776,wiki.topn3.replace,magnet schools national honor society alternativschool magnet school magnet schools national honor society alternativschool magnet school,0.0368
2308,776,glove.topn3,magnet schools success http www mediabynumbers com colleges achieved,0.0277
2309,776,tagmee.topn3.replace,Magnet school Magnet school,0.0273
2310,776,wordnet.topn3,magnet schools success attracter attractive feature attractor schooltime educate winner achiever succeeder,0.0249
2311,776,bertqe.topn10.qld,million support magnet school program,0.0194
2312,776,docluster.topn10.3.qld,magnet schools success school,0.0193
2313,776,rm3.topn10.10.0.5.qld,magnet schools success school,0.0193
2314,776,sensedisambiguation,Magnet schools school success,0.0193
2315,776,bertqe.topn10.bm25,new haven bloomfield receiv nearli,0.0081
2316,776,conceptnet.topn3,magnet schools success an eraser places to learn things classrooms taking finals,0.0072
2317,776,stem.lovins,magnet school succes,0.0009
2318,776,bt_nllb_korean,Success at Your School,0.0002
2319,776,word2vec.topn3,magnet schools success colleges universities sucess,0.0002
2320,776,conceptnet.topn3.replace,magnet an eraser places to learn things classrooms taking finals,0.0001
2321,776,anchor.topn3,magnet schools success anomaly n ge ndfeb war br of austr rd b,0.0
2322,776,anchor.topn3.replace,anomaly n ge ndfeb schools war br of austr rd b,0.0
2323,776,glove.topn3.replace,http www mediabynumbers com colleges achieved,0.0
2324,776,stem.trunc4,magn scho succ,0.0
2325,776,stem.trunc5,magne schoo succe,0.0
2326,776,word2vec.topn3.replace,magnet colleges universities sucess,0.0
2327,776,wordnet.topn3.replace,attractor attractive feature attracter civilize shoal succeeder achiever winner,0.0
2328,777,-1,hybrid alternative fuel cars,0.0925
2329,777,word2vec.topn3,hybrid alternative fuel cars non hybrid gasoline automobiles vehicles,0.0911
2330,777,wiki.topn3.replace,powertrain ac propulsion automotivaerodynamics hybrid vehicle alternative fuels miles per gallon gasolinequivalent hybrid vehicldrivetrain alternative fuel vehicle,0.0854
2331,777,relevancefeedback.topn10.qld,hybrid alternative fuel cars electr hydrogen transport,0.0806
2332,777,rm3.topn10.10.0.5.bm25,hybrid alternative fuel cars hydrogen transport ga vehicl,0.0723
2333,777,bt_nllb_persian,Hybrid fuel cars are replacing them,0.0701
2334,777,anchor.topn3,hybrid alternative fuel cars reassoci arbutu hybrids goos fuel inject mixed oxid gas motor geilli idlicot schiedt,0.069
2335,777,wordnet.topn3,hybrid alternative fuel cars loan blend intercrossed crossbreed substitute fire railroad car cable car,0.0608
