,qid,order,query,qld.map
3358,812,anchor.topn3,total knee replacement surgery xposé tot poliglumex protein bound note miles massacre cit unicompartment,0.3115
3359,812,bt_bing_persian,Knee replacement surgery,0.2989
3360,812,bt_nllb_persian,Knee replacement surgery,0.2989
3361,812,bt_nllb_arabic,Full knee replacement surgery,0.2951
3362,812,bt_nllb_korean,Full knee replacement surgery,0.2951
3363,812,bt_nllb_german,Total knee replacement operation,0.2931
3364,812,bt_bing_swahili,general knee replacement surgery,0.2879
3365,812,sensedisambiguation,total full knee stifle replacement surrogate surgery,0.2714
3366,812,relevancefeedback.topn10.qld,total knee replacement surgery claimant you hi,0.235
3367,812,bt_nllb_russian,General operation for knee replacement,0.234
3368,812,tagmee.topn3.replace,Knee replacement Knee replacement Knee replacement,0.2205
3369,812,rm3.topn10.10.0.5.bm25,total knee replacement surgery claimant hi you he,0.1994
3370,812,bt_nllb_chinese_yue,A complete knee replacement,0.1688
3371,812,bt_nllb_tamil,A complete knee replacement,0.1688
3372,812,bt_nllb_swahili,knee surgery,0.1509
3373,812,bt_bing_korean,Total knee arthroplasty,0.1292
3374,812,bt_bing_russian,Total knee arthroplasty,0.1292
3375,812,wordnet.topn3,total knee replacement surgery summate add up entire articulatio genus human knee surrogate substitute operating theatre surgical operation operating room,0.1138
3376,812,conceptnet.topn3,total knee replacement surgery amount leg joint operation,0.102
3377,812,termluster.topn5.3.qld,total knee replacement surgery care function includ need physic physician year total surgic time therapi reason,0.101
3378,812,wiki.topn3,total knee replacement surgery radiculopathy tooth loss prolotherapy knee replacement radiculopathy tooth loss prolotherapy knee replacement radiculopathy tooth loss prolotherapy knee replacement,0.0181
3379,812,stem.paicehusk,tot kne replac surgery,0.0143
3380,812,conceptnet.topn3.replace,amount leg joint replacement operation,0.0138
3381,812,bertqe.topn10.bm25,visn patient guid total knee,0.013
3382,812,glove.topn3,total knee replacement surgery combined nearly ankle elbow underwent,0.0119
3383,812,stem.trunc5,total knee repla surge,0.0094
3384,812,stem.trunc4,tota knee repl surg,0.0088
3385,812,stem.lovins,tot kne replac surg,0.0028
3386,812,word2vec.topn3,total knee replacement surgery cumulative overall ankle elbow knee replacement,0.0025
3387,812,wiki.topn3.replace,radiculopathy tooth loss prolotherapy knee replacement radiculopathy tooth loss prolotherapy knee replacement radiculopathy tooth loss prolotherapy knee replacement,0.0019
3388,812,glove.topn3.replace,combined nearly ankle elbow replacement underwent,0.0009
3389,812,wordnet.topn3.replace,tot up add genu human knee transposition substitution renewal OR operation surgical operation,0.0008
3390,812,sensedisambiguation.replace,full stifle surrogate surgery,0.0001
3391,812,anchor.topn3.replace,xposé tot poliglumex protein bound note miles massacre cit unicompartment replacement surgery,0.0
3392,812,bertqe.topn10.qld,employ va insight show site,0.0
3393,812,word2vec.topn3.replace,cumulative overall ankle elbow replacement knee replacement,0.0
3394,813,-1,Atlantic Intracoastal Waterway,0.2324
3395,813,tagmee.topn3,atlantic intracoastal waterway Intracoastal Waterway Intracoastal Waterway,0.2114
3396,813,termluster.topn5.3.qld,atlantic intracoastal waterway waterwai water total waterwai water total,0.2063
3397,813,glove.topn3,atlantic intracoastal waterway ocean pacific waterway skaht intracoastal,0.1973
3398,813,anchor.topn3,atlantic intracoastal waterway spa hydromash kinderscoutian waterway divide cut tschipey waterway hadeln,0.1945
3399,813,docluster.topn10.3.qld,atlantic intracoastal waterway river waterwai florida,0.1843
3400,813,relevancefeedback.topn10.qld,atlantic intracoastal waterway florida river waterwai associ mile barg port,0.1621
3401,813,rm3.topn10.10.0.5.bm25,atlantic intracoastal waterway florida waterwai river port barg mile,0.1621
3402,813,rm3.topn10.10.0.5.qld,atlantic intracoastal waterway florida waterwai river barg port mile,0.1621
3403,813,tagmee.topn3.replace,Intracoastal Waterway Intracoastal Waterway,0.1416
3404,813,wordnet.topn3,atlantic intracoastal waterway Atlantic Ocean watercourse,0.1309
3405,813,bt_nllb_swahili,The Atlantic Waterway,0.1299
3406,813,conceptnet.topn3,atlantic intracoastal waterway ocean canal river,0.1114
3407,813,anchor.topn3.replace,spa hydromash kinderscoutian intracoastal waterway divide cut tschipey waterway hadeln,0.1032
3408,813,bt_bing_german,Inland Atlantic Waterway,0.0804
3409,813,bt_nllb_malay,Inland waterway of the Atlantic,0.0804
3410,813,bt_nllb_russian,Inland waterways of the Atlantic,0.0804
3411,813,glove.topn3.replace,ocean pacific waterway skaht intracoastal,0.0798
3412,813,bt_nllb_persian,The waterway into the Atlantic coast,0.0717
3413,813,bt_nllb_tamil,The Atlantic coast waterway,0.0717
3414,813,bt_bing_arabic,Atlantic waterway within the coasts,0.0589
3415,813,wordnet.topn3.replace,Atlantic Ocean intracoastal watercourse,0.0585
3416,813,stem.lovins,atlant intracoast waterwa,0.0564
3417,813,bt_nllb_arabic,The inland waterway in the Atlantic Ocean,0.0518
3418,813,bt_nllb_chinese_yue,Inland waterways in the Atlantic Ocean,0.0518
3419,813,bt_bing_russian,Atlantic Coastal Waterway,0.0376
3420,813,bt_bing_tamil,Atlantic Coastal Waterway,0.0376
3421,813,word2vec.topn3,atlantic intracoastal waterway Altantic Alantic intercoastal Volga Baltic deep draft canal river,0.035
3422,813,conceptnet.topn3.replace,ocean intracoastal canal river,0.0249
3423,813,wiki.topn3,atlantic intracoastal waterway buckman bridge shands bridge memorial bridg palatka florida intracoastal waterway buckman bridge shands bridge memorial bridg palatka florida intracoastal waterway,0.0191
3424,813,wiki.topn3.replace,buckman bridge shands bridge memorial bridg palatka florida intracoastal waterway buckman bridge shands bridge memorial bridg palatka florida intracoastal waterway,0.004
3425,813,stem.paicehusk,atl coast waterway,0.0021
3426,813,bt_bing_korean,Atlantic Canal,0.0004
3427,813,bertqe.topn10.bm25,jackson th post stephen,0.0
3428,813,bertqe.topn10.qld,hr html lc,0.0
3429,813,bt_bing_chinese_simplified,Nearshore shipping lanes in the Atlantic,0.0
3430,813,bt_nllb_korean,I m on my way to the Atlantic coast,0.0
3431,813,stem.trunc4,atla intr wate,0.0
3432,813,stem.trunc5,atlan intra water,0.0
3433,813,word2vec.topn3.replace,Altantic Alantic intercoastal Volga Baltic deep draft canal river,0.0
3434,814,-1,Johnstown flood,0.3748
3435,814,relevancefeedback.topn10.qld,johnstown flood tour you,0.3184
3436,814,bertqe.topn10.bm25,johnstown flood supplementari resourc inquiri,0.2625
3437,814,rm3.topn10.10.0.5.qld,johnstown flood park tour you,0.2458
3438,814,docluster.topn10.3.qld,johnstown flood tour,0.1894
3439,814,sensedisambiguation.replace,Johnstown flood tide,0.1763
3440,814,anchor.topn3,johnstown flood clontyduffi kingsboro flood th sint elisabethsvlo california decemb flood,0.168
3441,814,sensedisambiguation,Johnstown flood flood tide,0.1448
3442,814,rm3.topn10.10.0.5.bm25,johnstown flood park tour you nation,0.0862
3443,814,word2vec.topn3,johnstown flood deluge,0.0415
3444,814,conceptnet.topn3,johnstown flood fulton county flood tide,0.0384
3445,814,word2vec.topn3.replace,johnstown deluge,0.0163
3446,814,wordnet.topn3.replace,johnstown oversupply inundation floodlight,0.0043
3447,814,glove.topn3,johnstown flood harrisburg allentown,0.0018
3448,814,wordnet.topn3,johnstown flood photoflood inundation flood tide,0.0017
3449,814,stem.trunc5,johns flood,0.0003
3450,814,anchor.topn3.replace,clontyduffi kingsboro flood th sint elisabethsvlo california decemb flood,0.0002
3451,814,bertqe.topn10.qld,flood supplementari resourc look,0.0001
3452,814,bt_bing_russian,Flooding in Jonestown,0.0
3453,814,conceptnet.topn3.replace,fulton county flood tide,0.0
3454,814,glove.topn3.replace,harrisburg allentown flood,0.0
3455,814,stem.trunc4,john floo,0.0
3456,815,-1,Coast Guard rescues,0.0546
3457,815,bt_bing_arabic,Coast Guard Rescue Operations,0.051
3458,815,bt_bing_russian,Coast Guard Rescue Operations,0.051
3459,815,rm3.topn10.10.0.5.bm25,coast guard rescues i boat oper,0.0403
3460,815,conceptnet.topn3,coast guard rescues beach ocean edge security person,0.0368
3461,815,wordnet.topn3,coast guard rescues seacoast slide hold precaution guard duty deliverance deliver delivery,0.0348
3462,815,glove.topn3.replace,coastal guard rescues,0.0315
3463,815,glove.topn3,coast guard rescues coastal,0.0276
3464,815,word2vec.topn3,coast guard rescues coastline coastal gaurd,0.0158
3465,815,bt_nllb_arabic,Saving the Coast Guard,0.0142
3466,815,bt_nllb_russian,Coast Guard is saving,0.0142
3467,815,wordnet.topn3.replace,seacoast glide sea coast hold safeguard guard duty deliverance deliver,0.0099
3468,815,bt_nllb_french,The Coast Guard Rescuers,0.009
3469,815,stem.trunc4,coas guar resc,0.0075
3470,815,termluster.topn5.3.qld,coast guard rescues guard maritim nation coast maritim nation work unit state,0.0018
3471,815,word2vec.topn3.replace,coastline coastal gaurd rescues,0.0006
3472,815,anchor.topn3,coast guard rescues ambino poyll soldiers whec icebreak mackinaw,0.0003
3473,815,conceptnet.topn3.replace,beach ocean edge security person rescues,0.0003
3474,815,anchor.topn3.replace,ambino poyll soldiers whec icebreak mackinaw rescues,0.0002
3475,815,bertqe.topn10.bm25,search rescu depart transport u,0.0
3476,815,bertqe.topn10.qld,search rescu depart transport u,0.0
3477,815,bt_nllb_swahili,Coastguards Cleaning,0.0
3478,815,sensedisambiguation.replace,slide precaution rescue,0.0
3479,815,tagmee.topn3.replace,,0.0
3480,815,wiki.topn3.replace,,0.0
3481,816,-1,USAID assistance to Galapagos,0.7736
3482,816,bt_nllb_french,Aid from USAID to the Galapagos,0.7491
3483,816,wordnet.topn3.replace,usaid aid help Galapagos Islands,0.7456
3484,816,bt_bing_chinese_simplified,USAID assistance to the Galapagos Islands,0.7381
3485,816,bt_bing_russian,USAID Assistance to the Galapagos Islands,0.7381
3486,816,relevancefeedback.topn10.qld,usaid assistance to galapagos doi conserv fy,0.7164
3487,816,rm3.topn10.10.0.5.qld,usaid assistance to galapagos fy conserv doi,0.7164
3488,816,bt_bing_german,USAID aid for Galapagos,0.7122
3489,816,bt_nllb_german,USAID aid to the Galapagos,0.7122
3490,816,bt_nllb_malay,USAID aid to the Galapagos,0.7122
3491,816,bt_nllb_persian,USAID aid to the Galapagos,0.7122
3492,816,bt_nllb_swahili,USAID aid to the Galapagos,0.7122
3493,816,rm3.topn10.10.0.5.bm25,usaid assistance to galapagos doi conserv fy activ ecuador,0.7064
3494,816,wordnet.topn3,usaid assistance galapagos help Galapagos Islands,0.66
3495,816,anchor.topn3,usaid assistance galapagos development research awards busi gisma,0.6396
3496,816,sensedisambiguation.replace,USAID aid to galapagos islands,0.604
3497,816,bt_bing_korean,U S Agency for International Development USAID support for the Galapagos,0.5692
3498,816,sensedisambiguation,USAID assistance aid to Galapagos galapagos islands,0.5645
3499,816,termluster.topn5.3.qld,usaid assistance galapagos activ area assist year work water year work water,0.5107
3500,816,conceptluster.topn5.3.qld,usaid assistance galapagos galápagos islands united states agency international development,0.4483
3501,816,tagmee.topn3,usaid assistance galapagos United States Agency for International Development Galápagos Islands,0.4483
3502,816,bt_nllb_arabic,Assistance provided by the U S Agency for International Development to the Galapagos Islands,0.3948
3503,816,conceptnet.topn3,usaid assistance galapagos help aid Galapagos Islands galápagos galapagos tortoise,0.3077
3504,816,wiki.topn3,usaid assistance galapagos united states agency international development international fund agricultural development international fund agricultural development united states agency international development islands ecuador biosphere reserves ecuador surfing locations ecuador galápagos islands,0.3061
3505,816,word2vec.topn3,usaid assistance galapagos aid help assitance cayman alcatraz tortuga,0.3046
3506,816,conceptnet.topn3.replace,usaid help aid Galapagos Islands galápagos galapagos tortoise,0.2366
3507,816,glove.topn3,usaid assistance galapagos undp unicef aid providing galápagos kd,0.1739
3508,816,bertqe.topn10.bm25,usaid assist ecuador u agenc,0.1597
3509,816,anchor.topn3.replace,development research awards busi gisma assistance galapagos,0.0782
3510,816,wiki.topn3.replace,united states agency international development international fund agricultural development international fund agricultural development united states agency international development islands ecuador biosphere reserves ecuador surfing locations ecuador galápagos islands,0.0299
3511,816,tagmee.topn3.replace,United States Agency for International Development Galápagos Islands,0.0087
3512,816,glove.topn3.replace,undp unicef aid providing galápagos kd,0.0015
3513,816,bertqe.topn10.qld,www usaid gov,0.0
3514,816,stem.trunc4,usai assi to gala,0.0
3515,816,stem.trunc5,usaid assis to galap,0.0
3516,816,word2vec.topn3.replace,usaid aid help assitance cayman alcatraz tortuga,0.0
3517,817,-1,sports stadium naming rights,0.2248
3518,817,rm3.topn10.10.0.5.bm25,sports stadium naming rights state million sport,0.1952
3519,817,bt_bing_tamil,Stadium naming rights,0.1895
3520,817,bt_nllb_chinese_yue,The naming rights of the stadium,0.1895
3521,817,bt_nllb_swahili,right to the name of the stadium,0.1895
3522,817,bt_nllb_tamil,Naming rights of the stadium,0.1895
3523,817,tagmee.topn3.replace,Stadium Naming rights,0.1895
3524,817,bt_nllb_german,Sports stadium rights,0.1811
3525,817,bt_bing_arabic,Sports Stadium Nomenclature Rights,0.1783
3526,817,sensedisambiguation.replace,sport stadium name right field,0.1777
3527,817,sensedisambiguation,sports sport stadium naming name rights right field,0.1576
3528,817,docluster.topn10.3.qld,sports stadium naming rights sport contract franchis tax,0.1521
3529,817,bt_nllb_korean,Sports stadium names,0.1499
3530,817,bt_bing_malay,Sports Stadium Nomination Rights,0.1415
3531,817,rm3.topn10.10.0.5.qld,sports stadium naming rights sport franchis broadcast state tax,0.1318
3532,817,relevancefeedback.topn10.qld,sports stadium naming rights sport franchis contract broadcast state tax,0.1243
3533,817,termluster.topn5.3.qld,sports stadium naming rights versu unit ticket account acquir acquisit versu unit ticket,0.122
3534,817,word2vec.topn3,sports stadium naming rights athletics ballpark renaming rights rights rights,0.1123
3535,817,anchor.topn3,sports stadium naming rights sho rtan pitambarhat marzadasht,0.0999
3536,817,wiki.topn3,sports stadium naming rights stadiums multi purposstadium sports venues stadium list sports venues thnamtoyota geiger engineers rossetti architects naming rights,0.0809
3537,817,wordnet.topn3,sports stadium naming rights boast frolic sports stadium bowl bring up call appointment compensate,0.0755
3538,817,glove.topn3,sports stadium naming rights ballpark arena mo k human freedom,0.0716
3539,817,wordnet.topn3.replace,skylark sportswoman sports stadium arena bowl distinguish make mention redress compensate,0.0532
3540,817,wiki.topn3.replace,stadiums multi purposstadium sports venues stadium list sports venues thnamtoyota geiger engineers rossetti architects naming rights,0.0413
3541,817,word2vec.topn3.replace,athletics ballpark renaming rights rights rights,0.0157
3542,817,glove.topn3.replace,sports ballpark arena mo k human freedom,0.0085
3543,817,conceptnet.topn3,sports stadium naming rights fun ball Basketball and football numeration recklessly,0.0074
3544,817,bt_nllb_arabic,Sports fields naming rights,0.0029
3545,817,bt_bing_chinese_simplified,Naming rights for sports venues,0.0027
3546,817,bertqe.topn10.qld,preliminari analysi depart revenu analysi,0.0008
3547,817,stem.lovins,sport stad nam right,0.0008
3548,817,stem.paicehusk,sport stad nam right,0.0008
3549,817,bertqe.topn10.bm25,save ye x preliminari analysi,0.0006
3550,817,anchor.topn3.replace,sports sho rtan pitambarhat marzadasht naming rights,0.0001
3551,817,conceptnet.topn3.replace,fun ball Basketball and football stadium numeration recklessly,0.0001
3552,817,stem.trunc4,spor stad nami righ,0.0
3553,817,stem.trunc5,sport stadi namin right,0.0
3554,818,-1,Chaco Culture National Park,0.1261
3555,818,docluster.topn10.3.qld,chaco culture national park mr cultur nation,0.1183
3556,818,relevancefeedback.topn10.qld,chaco culture national park cultur nation mr,0.1183
3557,818,rm3.topn10.10.0.5.qld,chaco culture national park mr cultur nation,0.1183
3558,818,termluster.topn5.3.qld,chaco culture national park american canyon cultur site park nativ site park nativ american canyon chaco,0.1162
3559,818,anchor.topn3,chaco culture national park chilensis large lip semiárido sozialisten national noodzaak paris span magee 박찬욱 phokasomboun,0.0907
3560,818,sensedisambiguation.replace,Chaco polish national parking lot,0.0564
3561,818,glove.topn3,chaco culture national park patagonia lapland public adjacent,0.0546
3562,818,sensedisambiguation,Chaco Culture polish National Park parking lot,0.0482
3563,818,stem.trunc5,chaco cultu natio park,0.0433
3564,818,wordnet.topn3.replace,chaco cultivation finish subject home commons green,0.0406
3565,818,stem.paicehusk,chaco cult nat park,0.0367
3566,818,tagmee.topn3,chaco culture national park Chaco Culture National Historical Park Chaco Culture National Historical Park National park,0.0272
3567,818,bt_nllb_swahili,The Chaco National Park,0.026
3568,818,conceptluster.topn5.3.qld,chaco culture national park chaco culture national historical park national park,0.0247
3569,818,tagmee.topn3.replace,Chaco Culture National Historical Park Chaco Culture National Historical Park National park,0.0215
3570,818,word2vec.topn3,chaco culture national park yungas pantanal sabana traditions regional international local parkland,0.0156
3571,818,wiki.topn3,chaco culture national park parks mckinley county new mexico museums san juan county new mexico parks san juan county new mexico chaco culture national historical park parks mckinley county new mexico museums san juan county new mexico parks san juan county new mexico chaco culture national historical park national parks conservation areas naturreserve national park,0.0099
3572,818,wordnet.topn3,chaco culture national park cultivation civilisation finish subject internal car park parking area Mungo Park,0.0068
3573,818,wiki.topn3.replace,parks mckinley county new mexico museums san juan county new mexico parks san juan county new mexico chaco culture national historical park parks mckinley county new mexico museums san juan county new mexico parks san juan county new mexico chaco culture national historical park national parks conservation areas naturreserve national park,0.0059
3574,818,bertqe.topn10.qld,repatri act nagpra review committe,0.0056
3575,818,bertqe.topn10.bm25,review committe seventeenth meet mai,0.0009
3576,818,anchor.topn3.replace,chilensis large lip semiárido culture sozialisten national noodzaak paris span magee 박찬욱 phokasomboun,0.0005
3577,818,bt_bing_tamil,Chacko Culture National Park,0.0
3578,818,bt_nllb_chinese_yue,The Chako Culture National Park,0.0
3579,818,bt_nllb_korean,The Chako Cultural National Park,0.0
3580,818,bt_nllb_tamil,Sago Cultural National Park,0.0
3581,818,conceptnet.topn3.replace,shako Kalashnikov culture flag park,0.0
3582,818,glove.topn3.replace,patagonia lapland culture public adjacent,0.0
3583,818,stem.lovins,chac cultur nat park,0.0
3584,818,stem.trunc4,chac cult nati park,0.0
3585,818,word2vec.topn3.replace,yungas pantanal sabana traditions regional international local parkland,0.0
3586,819,-1,1890 Census,0.0005
3587,819,anchor.topn3,census census voluntari under insur un,0.0
3588,819,anchor.topn3.replace,census voluntari under insur un,0.0
3589,819,bertqe.topn10.bm25,censu tract,0.0
3590,819,bertqe.topn10.qld,censu tract,0.0
3591,819,bt_nllb_arabic,population,0.0
3592,819,bt_nllb_swahili,Population in,0.0
3593,819,conceptnet.topn3.replace,population,0.0
3594,819,glove.topn3.replace,population inhabitants,0.0
3595,819,stem.paicehusk,cens,0.0
3596,819,stem.trunc4,cens,0.0
3597,819,wordnet.topn3,census nosecount nose count,0.0
3598,819,wordnet.topn3.replace,nosecount nose count,0.0
3599,820,-1,imported fire ants,0.2831
3600,820,conceptluster.topn5.3.qld,imported fire ants fire ant introduced species,0.2797
3601,820,tagmee.topn3,imported fire ants Introduced species Fire ant,0.2797
3602,820,sensedisambiguation,imported spell fire ants ant,0.276
3603,820,docluster.topn10.3.qld,imported fire ants ant,0.2753
3604,820,relevancefeedback.topn10.qld,imported fire ants ant,0.2753
3605,820,rm3.topn10.10.0.5.qld,imported fire ants ant,0.2753
3606,820,termluster.topn5.3.qld,imported fire ants unit state red ant import red unit state red,0.2683
3607,820,wiki.topn3,imported fire ants invasivspecies introduced species cyperaceae introduced species leafcutter ant red imported firant queen ant fire ant,0.2614
3608,820,bt_bing_persian,Fire ants are in,0.2482
3609,820,bt_nllb_persian,Fire ants are in,0.2482
3610,820,rm3.topn10.10.0.5.bm25,imported fire ants ant bait infect,0.2424
3611,820,wiki.topn3.replace,invasivspecies introduced species cyperaceae introduced species leafcutter ant red imported firant queen ant fire ant,0.2154
3612,820,sensedisambiguation.replace,spell fire ant,0.1873
3613,820,anchor.topn3,imported fire ants illyrio championship ba ad,0.1764
3614,820,tagmee.topn3.replace,Introduced species Fire ant,0.1708
3615,820,conceptnet.topn3,imported fire ants lighting a match smoke burn things insects colony social insects,0.1493
3616,820,bt_bing_swahili,inverted fire ants,0.148
3617,820,word2vec.topn3,imported fire ants exported flames wasps insects,0.052
3618,820,stem.trunc5,impor fire ants,0.0506
3619,820,stem.lovins,import fir ant,0.0313
3620,820,stem.paicehusk,import fir ant,0.0313
3621,820,bt_nllb_chinese_yue,Importing fire,0.0263
3622,820,glove.topn3,imported fire ants exported termites,0.0236
3623,820,wordnet.topn3,imported fire ants spell dismiss flaming fervor emmet pismire,0.0215
3624,820,conceptnet.topn3.replace,imported lighting a match smoke burn things insects colony social insects,0.0046
3625,820,anchor.topn3.replace,imported illyrio championship ba ad ants,0.0044
3626,820,stem.trunc4,impo fire ants,0.0041
3627,820,bertqe.topn10.bm25,california alreadi tini d estruct,0.0038
3628,820,glove.topn3.replace,exported fire termites,0.0025
3629,820,bertqe.topn10.qld,have been found number southern,0.0002
3630,820,bt_nllb_korean,Imported fireworks,0.0
3631,820,bt_nllb_swahili,outdoor fireflies,0.0
3632,820,word2vec.topn3.replace,exported flames wasps insects,0.0
3633,820,wordnet.topn3.replace,spell ardour give the sack evoke emmet pismire,0.0
3634,821,-1,Internet work-at-home scams,0.1822
3635,821,bt_bing_chinese_simplified,Internet work from home scams,0.1586
3636,821,bt_bing_french,Work from home scams on the internet,0.1586
3637,821,bt_bing_korean,Internet Work From Home Scam,0.1586
3638,821,bt_nllb_french,Internet scams at work from home,0.1586
3639,821,docluster.topn10.3.qld,internet work at home scams you work consum credit,0.1321
3640,821,bt_bing_russian,Online Work from Home Scams,0.1085
3641,821,bt_bing_arabic,Online work at home scams,0.1071
3642,821,sensedisambiguation,Internet work at home scams scam,0.1058
3643,821,bt_nllb_persian,Internet scams at work,0.1011
3644,821,termluster.topn5.3.qld,internet work at home scams purchas inform home,0.0933
3645,821,glove.topn3,internet work at home scams web online frauds,0.0713
3646,821,relevancefeedback.topn10.qld,internet work at home scams work you home consum credit text s,0.0713
3647,821,stem.lovins,internet work at hom scam,0.0688
3648,821,stem.paicehusk,internet work at hom scam,0.0688
3649,821,rm3.topn10.10.0.5.bm25,internet work at home scams consum fraud credit s,0.0655
3650,821,stem.trunc4,inte work at home scam,0.0642
3651,821,rm3.topn10.10.0.5.qld,internet work at home scams consum fraud credit s home,0.0612
3652,821,stem.trunc5,inter work at home scams,0.0551
3653,821,word2vec.topn3,internet work at home scams online intenet work from home telecommuting telecommuter scammers frauds,0.048
3654,821,glove.topn3.replace,web online work at home frauds,0.047
3655,821,bt_nllb_german,Internet work to home fraud,0.0264
3656,821,bt_nllb_malay,Internet fraud works at home,0.0264
3657,821,anchor.topn3,internet work at home scams installshield theory censorship,0.0186
3658,821,bt_bing_german,Internet Fraud in Work from Home,0.0184
3659,821,bt_bing_malay,Internet homework scams,0.016
3660,821,tagmee.topn3,internet work at home scams Internet Telecommuting Confidence trick,0.0132
3661,821,conceptluster.topn5.3.qld,internet work at home scams telecommuting confidence trick,0.0097
3662,821,anchor.topn3.replace,installshield theory censorship work at home scams,0.0091
3663,821,wordnet.topn3,internet work at home scams net cyberspace gyp mulct,0.0067
3664,821,bt_nllb_russian,Internet fraud at work,0.0065
3665,821,bertqe.topn10.qld,web li how protect yourself,0.0055
3666,821,wiki.topn3,internet work at home scams internet introductions virtual reality internet intellectual capital federal grants thunited states virtual management telecommuting blackmail alibi bank robbery confidence trick,0.0009
3667,821,bt_nllb_tamil,The Internet is a home for online work,0.0008
3668,821,wordnet.topn3.replace,net cyberspace work at home nobble defraud victimize,0.0008
3669,821,bertqe.topn10.bm25,internet becom big part our,0.0
3670,821,bt_nllb_chinese_yue,The Internet is the kitchen,0.0
3671,821,bt_nllb_korean,You re cheating on the Internet,0.0
3672,821,bt_nllb_swahili,Cheating on homework on the Internet,0.0
3673,821,tagmee.topn3.replace,Internet Telecommuting Confidence trick,0.0
