2634143	-1	what is direct borrowing, phonological borrowing, linguistic borrowing, cultural borrowing,intimate borrowing?	0.4792
2634143	relevancefeedback.topn10.qld	what is direct borrowing phonological borrowing linguistic borrowing cultural borrowing intimate borrowing cognat you countri borrow mean want you r	0.5039
2634143	relevancefeedback.topn10.bm25	what is direct borrowing phonological borrowing linguistic borrowing cultural borrowing intimate borrowing countri borrow	0.4923
2643507	-1	why does milk cost more than gas per gallon?	0.7346
2643507	stem.porter2	whi doe milk cost more than gas per gallon	0.7366
2713171	-1	What does the sentence's mean?	0.2019
2713171	termluster.topn5.3.bm25	sentence s mean	0.3341
2713171	termluster.topn5.3.qld	sentence s mean	0.3341
2713171	thesaurus.topn3	sentence s mean	0.3341
2713171	thesaurus.topn3.replace	sentence s mean	0.3341
2713171	relevancefeedback.topn10.bm25	what does the sentence s mean about mean ha you direct can brais accent	0.275
2713171	stem.krovetz	what do the sentence s mean	0.2477
2713171	glove.topn3	sentence s mean jail s whose necessarily	0.2205
2713171	conceptluster.topn5.3.bm25	sentence s mean sentence linguistics expected value	0.2131
2713171	conceptluster.topn5.3.qld	sentence s mean sentence linguistics expected value	0.2131
2713171	tagmee.topn3	sentence s mean Sentence linguistics Expected value	0.2131
2722241	-1	why do some animals hide in a dark place b4 they die?	0.258
2722241	termluster.topn5.3.bm25	animals hide dark place b die	0.4178
2722241	termluster.topn5.3.qld	animals hide dark place b die	0.4178
2722241	thesaurus.topn3	animals hide dark place b die	0.4178
2722241	thesaurus.topn3.replace	animals hide dark place b die	0.4178
2722241	conceptluster.topn5.3.bm25	animals hide dark place b die hide musician animals	0.3881
2722241	conceptluster.topn5.3.qld	animals hide dark place b die hide musician animals	0.3881
2722241	tagmee.topn3	animals hide dark place b die The Animals Hide musician	0.3881
2722241	stem.porter2	whi do some anim hide in a dark place b they die	0.3416
2722241	rm3.topn10.10.0.5.bm25	why do some animals hide in a dark place b4 they die?	0.305
2722241	rm3.topn10.10.0.5.qld	why do some animals hide in a dark place b4 they die?	0.305
2722241	wiki.topn3	animals hide dark place b die barry jenkins marblarch records danny mcculloch animals pata musician say anything x japan song template hideto matsumoto hide musician	0.2914
2783398	-1	What is a nucleus?	0.6988
2783398	wordnet.topn3	nucleus karyon cell nucleus core	0.7203
2783398	anchor.topn3	nucleus	0.713
2783398	anchor.topn3.replace	nucleus	0.713
2783398	conceptluster.topn5.3.bm25	nucleus	0.713
2783398	conceptluster.topn5.3.qld	nucleus	0.713
2783398	tagmee.topn3	nucleus	0.713
2783398	termluster.topn5.3.bm25	nucleus	0.713
2783398	termluster.topn5.3.qld	nucleus	0.713
2783398	thesaurus.topn3	nucleus	0.713
2783398	thesaurus.topn3.replace	nucleus	0.713
2783398	wiki.topn3	nucleus	0.713
2785579	-1	If you could be an element of weather, which would you choose, and why?	0.0771
2785579	stem.porter	if you could be an element of weather which would you choos and why	0.1034
2785579	relevancefeedback.topn10.bm25	if you could be an element of weather which would you choose and why why blood have answer light energi	0.0806
2795030	-1	Why do people drink Cuervo when it tastes the same going down as coming up?	0.4704
2795030	termluster.topn5.3.bm25	people drink cuervo tastes going coming	0.6269
2795030	termluster.topn5.3.qld	people drink cuervo tastes going coming	0.6269
2795030	thesaurus.topn3	people drink cuervo tastes going coming	0.6269
2795030	thesaurus.topn3.replace	people drink cuervo tastes going coming	0.6269
2795030	stem.paicehusk	why do peopl drink cuervo when it tast the sam going down as com up	0.4974
2797224	-1	Muslims Are The Happiest People Ever, Why?	0.5493
2799913	-1	What's the proper way to express sorrow at a funeral?	0.5011
2814599	-1	what does the word remission mean when referring to cancer patients?	0.6613
2814599	stem.porter	what doe the word remiss mean when referr to cancer patient	0.7636
2814599	termluster.topn5.3.bm25	word remission mean referring cancer patients	0.7147
2814599	termluster.topn5.3.qld	word remission mean referring cancer patients	0.7147
2814599	thesaurus.topn3	word remission mean referring cancer patients	0.7147
2814599	thesaurus.topn3.replace	word remission mean referring cancer patients	0.7147
2814599	anchor.topn3	word remission mean referring cancer patients irán powertool dir ltr er span sega statnyj c institute upmc insulinoma cancercent	0.6712
2814599	stem.krovetz	what do the word remission mean when refer to cancer patient	0.6674
2814722	-1	why is the new jersey smoking ban not considered unconstitutional?	0.5672
2814722	relevancefeedback.topn10.bm25	why is the new jersey smoking ban not considered unconstitutional smoke bodi jersei am constitut	0.5702
2814722	relevancefeedback.topn10.qld	why is the new jersey smoking ban not considered unconstitutional caus labor oil peopl law smoke we you	0.5702
2814722	termluster.topn5.3.bm25	new jersey smoking ban considered unconstitutional	0.5692
2814722	termluster.topn5.3.qld	new jersey smoking ban considered unconstitutional	0.5692
2814722	thesaurus.topn3	new jersey smoking ban considered unconstitutional	0.5692
2814722	thesaurus.topn3.replace	new jersey smoking ban considered unconstitutional	0.5692
2815090	-1	how cloning will affects our community?	0.3742
2815090	anchor.topn3	cloning affects community devenyi preckwinkl forster larrinaga	0.693
2815090	conceptnet.topn3	cloning affects community	0.693
2815090	conceptnet.topn3.replace	cloning affects community	0.693
2815090	termluster.topn5.3.bm25	cloning affects community	0.693
2815090	termluster.topn5.3.qld	cloning affects community	0.693
2815090	thesaurus.topn3	cloning affects community	0.693
2815090	thesaurus.topn3.replace	cloning affects community	0.693
2815090	word2vec.topn3	cloning affects community communty	0.6929
2815090	relevancefeedback.topn10.qld	how cloning will affects our community life clone you dont u curv i heart	0.6537
2815090	conceptluster.topn5.3.bm25	cloning affects community affect philosophy free cloning	0.651
2815090	conceptluster.topn5.3.qld	cloning affects community affect philosophy free cloning	0.651
2815090	tagmee.topn3	cloning affects community Cloning Free will Affect philosophy	0.651
2815090	word2vec.topn3.replace	cloning affects communty	0.6382
2815090	glove.topn3	cloning affects community well	0.5129
2815090	glove.topn3.replace	cloning affects well	0.4522
2815090	tagmee.topn3.replace	Cloning Free will Affect philosophy	0.4186
2838988	-1	How can I get a cork out of, not into, a wine bottle without a corkscrew?	0.8234
2847807	-1	How can I get rid of the hicups?	0.302
2847807	termluster.topn5.3.bm25	get rid hicups	0.5472
2847807	termluster.topn5.3.qld	get rid hicups	0.5472
2847807	thesaurus.topn3	get rid hicups	0.5472
2847807	thesaurus.topn3.replace	get rid hicups	0.5472
2847807	anchor.topn3	get rid hicups drive differences chak chak stojkovićevo okruglica stojkovićeva	0.4976
2847807	anchor.topn3.replace	drive differences chak chak stojkovićevo okruglica stojkovićeva hicups	0.4641
2847807	conceptluster.topn5.3.bm25	get rid hicups get	0.4067
2847807	conceptluster.topn5.3.qld	get rid hicups get	0.4067
2847807	word2vec.topn3.replace	obtain give go eradicate banish eliminate hicups	0.4014
2847807	conceptnet.topn3	get rid hicups receive eating quickly	0.3816
2847807	glove.topn3.replace	got eliminate unfortunately hicups	0.3706
2847807	glove.topn3	get rid hicups got eliminate unfortunately	0.3353
2847807	stem.lovins	how can i ges rid of th hicup	0.3153
2847807	sensedisambiguation.replace	How can I suffer rid of the hicups	0.3066
2862887	-1	how to care for a spiked dragon and what to feed them?	0.3726
2862887	conceptluster.topn5.3.bm25	care spiked dragon feed suplex	0.5086
2862887	conceptluster.topn5.3.qld	care spiked dragon feed suplex	0.5086
2862887	tagmee.topn3	care spiked dragon feed Suplex	0.5086
2862887	termluster.topn5.3.bm25	care spiked dragon feed	0.5086
2862887	termluster.topn5.3.qld	care spiked dragon feed	0.5086
2862887	thesaurus.topn3	care spiked dragon feed	0.5086
2862887	thesaurus.topn3.replace	care spiked dragon feed	0.5086
2862887	wiki.topn3	care spiked dragon feed powerbomb boston crab dropkick suplex	0.4393
2864267	-1	what exemplifies effective customer service?	0.7867
2864267	anchor.topn3	exemplifies effective customer service	0.8033
2864267	anchor.topn3.replace	exemplifies effective customer service	0.8033
2864267	termluster.topn5.3.bm25	exemplifies effective customer service	0.8033
2864267	termluster.topn5.3.qld	exemplifies effective customer service	0.8033
2864267	thesaurus.topn3	exemplifies effective customer service	0.8033
2864267	thesaurus.topn3.replace	exemplifies effective customer service	0.8033
2864267	relevancefeedback.topn10.qld	what exemplifies effective customer service grant busi you nebula custom vitamin i	0.8006
2892478	-1	what factors cause the Earth to heat unevenly?	0.7192
2892478	termluster.topn5.3.bm25	factors cause earth heat unevenly	0.7552
2892478	termluster.topn5.3.qld	factors cause earth heat unevenly	0.7552
2892478	thesaurus.topn3	factors cause earth heat unevenly	0.7552
2892478	thesaurus.topn3.replace	factors cause earth heat unevenly	0.7552
2956570	-1	What are the words to write the sound of raindrops, moving train & scribbling w/ pencil on paper figuratively?	0.7395
2956570	termluster.topn5.3.bm25	words write sound raindrops moving train scribbling w pencil paper figuratively	0.7597
2956570	termluster.topn5.3.qld	words write sound raindrops moving train scribbling w pencil paper figuratively	0.7597
2956570	thesaurus.topn3	words write sound raindrops moving train scribbling w pencil paper figuratively	0.7597
2956570	thesaurus.topn3.replace	words write sound raindrops moving train scribbling w pencil paper figuratively	0.7597
2976644	-1	How amoeba catches its prey?	0.6519
2976644	anchor.topn3	amoeba catches prey carneago hecphora rufilinea visinu thiounn puthearim	0.7501
2976644	termluster.topn5.3.bm25	amoeba catches prey	0.7501
2976644	termluster.topn5.3.qld	amoeba catches prey	0.7501
2976644	thesaurus.topn3	amoeba catches prey	0.7501
2976644	thesaurus.topn3.replace	amoeba catches prey	0.7501
2976644	conceptnet.topn3	amoeba catches prey glommer keeper	0.7328
2976644	stem.porter	how amoeba catch it prei	0.7191
2976644	stem.porter2	how amoeba catch it prey	0.7191
2976644	conceptluster.topn5.3.bm25	amoeba catches prey predation amoeba	0.6542
2976644	conceptluster.topn5.3.qld	amoeba catches prey predation amoeba	0.6542
2976644	tagmee.topn3	amoeba catches prey Amoeba Predation	0.6542
3040435	-1	USA have Snow, Hurricanes, Flood, Earthquakes and politicians, Brazil only have politicians, why?	0.6235
3040435	termluster.topn5.3.bm25	usa snow hurricanes flood earthquakes politicians brazil politicians	0.6585
3040435	termluster.topn5.3.qld	usa snow hurricanes flood earthquakes politicians brazil politicians	0.6585
3040435	thesaurus.topn3	usa snow hurricanes flood earthquakes politicians brazil politicians	0.6585
3040435	thesaurus.topn3.replace	usa snow hurricanes flood earthquakes politicians brazil politicians	0.6585
3040435	tagmee.topn3	usa snow hurricanes flood earthquakes politicians brazil politicians United States Snow Tropical cyclone Flood Earthquake Brazil	0.6303
3074429	-1	How can we understand Islam and Muslims better?	0.5646
3074429	conceptluster.topn5.3.bm25	understand islam muslims better	0.6383
3074429	conceptluster.topn5.3.qld	understand islam muslims better	0.6383
3074429	termluster.topn5.3.bm25	understand islam muslims better	0.6383
3074429	termluster.topn5.3.qld	understand islam muslims better	0.6383
3074429	thesaurus.topn3	understand islam muslims better	0.6383
3074429	thesaurus.topn3.replace	understand islam muslims better	0.6383
3074429	sensedisambiguation	How can we understand Islam and Muslims muslim better good	0.6365
3078448	-1	How do you prevent chicken from drying out when you cook it?	0.4487
3078448	conceptluster.topn5.3.bm25	prevent chicken drying cook food drying chicken cooking desiccation	0.6482
3078448	conceptluster.topn5.3.qld	prevent chicken drying cook food drying chicken cooking desiccation	0.6482
3078448	tagmee.topn3	prevent chicken drying cook Chicken Food drying Desiccation Cooking	0.6482
3078448	termluster.topn5.3.bm25	prevent chicken drying cook	0.6294
3078448	termluster.topn5.3.qld	prevent chicken drying cook	0.6294
3078448	thesaurus.topn3	prevent chicken drying cook	0.6294
3078448	thesaurus.topn3.replace	prevent chicken drying cook	0.6294
3078448	wiki.topn3	prevent chicken drying cook junglefowls poultry pig chicken food drying desiccation dunaliella salina heterotroph desiccation recipe cooking baking cooking	0.6072
3078448	wordnet.topn3	prevent chicken drying cook foreclose forestall crybaby wimp dry out make manipulate Captain Cook	0.5605
3078448	tagmee.topn3.replace	Chicken Food drying Desiccation Cooking	0.535
3078448	relevancefeedback.topn10.qld	how do you prevent chicken from drying out when you cook it bake thaw yucca foil	0.4796
3078448	stem.porter2	how do you prevent chicken from dri out when you cook it	0.4596
3078448	relevancefeedback.topn10.bm25	how do you prevent chicken from drying out when you cook it foil bake add us	0.4576
312215	-1	how good is apple pie when it is cold?	0.694
3155314	-1	we have pork chops, veal chops, lamb chops, why is there not any beef chops ?	0.4707
3155314	glove.topn3	pork chops veal chops lamb chops beef chops beef meat loin lamb chops loin mutton veal loin meat pork loin	0.5719
3155314	anchor.topn3	pork chops veal chops lamb chops beef chops rafute okinawan siu sreey parmigiana eggpl sronoss lambo gerganiya play along kurog corned beef kipper	0.5624
3155314	word2vec.topn3	pork chops veal chops lamb chops beef chops beef meat steaks prowess beef scaloppine sweetbreads steaks prowess mutton hogget steaks prowess meat pork steaks prowess	0.514
3155314	conceptnet.topn3	pork chops veal chops lamb chops beef chops pig area talk jaw sheep wool cow a plate	0.491
3155314	stem.lovins	we hav pork chop veal chop lamb chop why is ther not any beef chop	0.4721
3155314	stem.paicehusk	we hav pork chop veal chop lamb chop why is ther not any beef chop	0.4721
3206998	-1	how does disneyland make it snow?	0.4011
3206998	termluster.topn5.3.bm25	disneyland make snow	0.5639
3206998	termluster.topn5.3.qld	disneyland make snow	0.5639
3206998	thesaurus.topn3	disneyland make snow	0.5639
3206998	thesaurus.topn3.replace	disneyland make snow	0.5639
3206998	conceptluster.topn5.3.bm25	disneyland make snow disneyland snow	0.563
3206998	conceptluster.topn5.3.qld	disneyland make snow disneyland snow	0.563
3206998	tagmee.topn3	disneyland make snow Disneyland Snow	0.563
3206998	tagmee.topn3.replace	Disneyland Snow	0.5144
3206998	stem.krovetz	how do disneyland make it snow	0.4428
3239329	-1	Why do we wee a lot in the cold weather especially at night?	0.4553
3239329	termluster.topn5.3.bm25	wee lot cold weather especially night	0.5159
3239329	termluster.topn5.3.qld	wee lot cold weather especially night	0.5159
3239329	thesaurus.topn3	wee lot cold weather especially night	0.5159
3239329	thesaurus.topn3.replace	wee lot cold weather especially night	0.5159
3239329	stem.porter2	whi do we wee a lot in the cold weather especi at night	0.4908
3269759	-1	what is artificial intelligence?	0.5092
3269759	word2vec.topn3	artificial intelligence artifical synthetic intellegence intelligence	0.7528
3269759	wordnet.topn3	artificial intelligence contrived unreal intelligence activity word	0.7424
3269759	anchor.topn3	artificial intelligence percettiva intelligenza condenan	0.6008
3269759	conceptluster.topn5.3.bm25	artificial intelligence artificial intelligence	0.6008
3269759	conceptluster.topn5.3.qld	artificial intelligence artificial intelligence	0.6008
3269759	tagmee.topn3	artificial intelligence Artificial intelligence	0.6008
3269759	tagmee.topn3.replace	Artificial intelligence	0.6008
3269759	termluster.topn5.3.bm25	artificial intelligence	0.6008
3269759	termluster.topn5.3.qld	artificial intelligence	0.6008
3269759	thesaurus.topn3	artificial intelligence	0.6008
3269759	thesaurus.topn3.replace	artificial intelligence	0.6008
3269759	relevancefeedback.topn10.bm25	what is artificial intelligence artifici ai intellig do satellit we air satelit	0.5917
3269759	anchor.topn3.replace	percettiva intelligenza condenan intelligence	0.5771
3269759	conceptnet.topn3	artificial intelligence learning United States intelligence agency	0.5481
3269759	wiki.topn3	artificial intelligence unsolved problems computer science computational neuroscience simulation artificial intelligence	0.5329
3278654	-1	Why do Kamikaze pilots wear helmets?	0.6668
3278654	word2vec.topn3	kamikaze pilots wear helmets aviators wore visors	0.707
3278654	sensedisambiguation	Why do Kamikaze pilots pilot wear helmets helmet	0.6848
3278654	termluster.topn5.3.bm25	kamikaze pilots wear helmets	0.6736
3278654	termluster.topn5.3.qld	kamikaze pilots wear helmets	0.6736
3278654	thesaurus.topn3	kamikaze pilots wear helmets	0.6736
3278654	thesaurus.topn3.replace	kamikaze pilots wear helmets	0.6736
3278654	anchor.topn3	kamikaze pilots wear helmets fvk malacoda cockersdal garments prohibit chochma	0.6717
3278654	stem.porter2	whi do kamikaz pilot wear helmet	0.6674
3280768	-1	why is islam so hated in america?	0.4089
3280768	termluster.topn5.3.bm25	islam hated america	0.49
3280768	termluster.topn5.3.qld	islam hated america	0.49
3280768	thesaurus.topn3	islam hated america	0.49
3280768	thesaurus.topn3.replace	islam hated america	0.49
3280768	conceptluster.topn5.3.bm25	islam hated america islam	0.4699
3280768	conceptluster.topn5.3.qld	islam hated america islam	0.4699
3280768	tagmee.topn3	islam hated america Islam	0.4699
3280768	anchor.topn3	islam hated america khazbulat azraqi fakhriddinov schurlau firetip mimic whit	0.4661
3280768	stem.porter2	whi is islam so hate in america	0.4462
3295055	-1	What causes skin discoloration, specifically, whitening of the skin between fingers?	0.6084
3295055	termluster.topn5.3.bm25	causes skin discoloration specifically whitening skin fingers	0.6359
3295055	termluster.topn5.3.qld	causes skin discoloration specifically whitening skin fingers	0.6359
3295055	thesaurus.topn3	causes skin discoloration specifically whitening skin fingers	0.6359
3295055	thesaurus.topn3.replace	causes skin discoloration specifically whitening skin fingers	0.6359
3295055	anchor.topn3	causes skin discoloration specifically whitening skin fingers sofamo commandeering ablepharon sofamo commandeering ablepharon	0.6133
3301173	-1	how to design road crust for national highways?	0.7498
3301173	conceptluster.topn5.3.bm25	design road crust national highways continental crust road national highway india	0.8004
3301173	conceptluster.topn5.3.qld	design road crust national highways continental crust road national highway india	0.8004
3301173	tagmee.topn3	design road crust national highways Road Continental crust National Highway India	0.8004
3301173	termluster.topn5.3.bm25	design road crust national highways	0.7928
3301173	termluster.topn5.3.qld	design road crust national highways	0.7928
3301173	thesaurus.topn3	design road crust national highways	0.7928
3301173	thesaurus.topn3.replace	design road crust national highways	0.7928
3313308	-1	how can I enjoy my time alone?	0.1872
3313308	termluster.topn5.3.bm25	enjoy time alone	0.5108
3313308	termluster.topn5.3.qld	enjoy time alone	0.5108
3313308	thesaurus.topn3	enjoy time alone	0.5108
3313308	thesaurus.topn3.replace	enjoy time alone	0.5108
3313308	conceptluster.topn5.3.bm25	enjoy time alone time alone	0.4568
3313308	conceptluster.topn5.3.qld	enjoy time alone time alone	0.4568
3313308	tagmee.topn3	enjoy time alone By Time Alone	0.4568
3313308	wiki.topn3	enjoy time alone oblivion orphanagalbum driven orphanagalbum bart smits time alone	0.4341
3313308	word2vec.topn3	enjoy time alone moment time period alone alone	0.4183
3313308	word2vec.topn3.replace	enjoy moment time period alone alone	0.3893
3313308	anchor.topn3	enjoy time alone first and oxime longshot byo yomi дрене netherwar	0.3705
3313308	tagmee.topn3.replace	By Time Alone	0.3656
3313308	glove.topn3	enjoy time alone when actually else	0.2941
3363149	-1	Why do Arabs and Mexicans look alike?	0.6927
3363149	termluster.topn5.3.bm25	arabs mexicans look alike	0.7847
3363149	termluster.topn5.3.qld	arabs mexicans look alike	0.7847
3363149	thesaurus.topn3	arabs mexicans look alike	0.7847
3363149	thesaurus.topn3.replace	arabs mexicans look alike	0.7847
3363149	anchor.topn3	arabs mexicans look alike backward	0.7498
3363149	stem.porter2	whi do arab and mexican look alik	0.7109
3369088	-1	how can we stop the spread of islam?	0.5213
3369088	termluster.topn5.3.bm25	stop spread islam	0.5578
3369088	termluster.topn5.3.qld	stop spread islam	0.5578
3369088	thesaurus.topn3	stop spread islam	0.5578
3369088	thesaurus.topn3.replace	stop spread islam	0.5578
3369088	wordnet.topn3	stop spread islam give up contain turn back spread out outspread feast Muslimism	0.5491
3382736	-1	what is minimalist cubisium?	0.6193
3385681	-1	if red bull is soo bad for people ,then why is it soo popular?	0.2225
3385681	tagmee.topn3	red bull soo bad people soo popular Red Bull People magazine Why T song Pop music	0.4203
3385681	conceptluster.topn5.3.bm25	red bull soo bad people soo popular pop music t song people magazine red bull	0.4128
3385681	conceptluster.topn5.3.qld	red bull soo bad people soo popular pop music t song people magazine red bull	0.4128
3385681	wordnet.topn3	red bull soo bad people soo popular cherry red faced reddened dogshit Irish bull bull through forged unfit tough hoi polloi multitude democratic pop	0.3255
3385681	wiki.topn3	red bull soo bad people soo popular austrian brands red bull gmbh diet coke red bull people magazine us weekly vanity fair magazine people magazine need t song t song lovely one t song pop music pop musigenres western culture pop music	0.2257
3389038	-1	why the media in US and Europe is always attacking the Arabs and Islam without finding the truth about them?	0.5282
3389038	termluster.topn5.3.bm25	media us europe always attacking arabs islam without finding truth	0.5693
3389038	termluster.topn5.3.qld	media us europe always attacking arabs islam without finding truth	0.5693
3389038	thesaurus.topn3	media us europe always attacking arabs islam without finding truth	0.5693
3389038	thesaurus.topn3.replace	media us europe always attacking arabs islam without finding truth	0.5693
3396066	-1	Why do airplanes fly so high?	0.5268
3396066	termluster.topn5.3.bm25	airplanes fly high	0.5521
3396066	termluster.topn5.3.qld	airplanes fly high	0.5521
3396066	thesaurus.topn3	airplanes fly high	0.5521
3396066	thesaurus.topn3.replace	airplanes fly high	0.5521
34041	-1	what are the symptoms of strep throat?	0.8702
34041	termluster.topn5.3.bm25	symptoms strep throat	0.8704
34041	termluster.topn5.3.qld	symptoms strep throat	0.8704
34041	thesaurus.topn3	symptoms strep throat	0.8704
34041	thesaurus.topn3.replace	symptoms strep throat	0.8704
3411123	-1	Why does'nt America regard foriegn credentials?	0.3537
3411123	stem.krovetz	why do nt america regard foriegn credentials	0.3773
3411123	termluster.topn5.3.bm25	does nt america regard foriegn credentials	0.3551
3411123	termluster.topn5.3.qld	does nt america regard foriegn credentials	0.3551
3411123	thesaurus.topn3	does nt america regard foriegn credentials	0.3551
3411123	thesaurus.topn3.replace	does nt america regard foriegn credentials	0.3551
3496147	-1	Why was I punished for being christlike?	0.3591
3496147	sensedisambiguation	Why was I punished punish for being christlike	0.506
3496147	relevancefeedback.topn10.bm25	why was i punished for being christlike punish allow he you move	0.4425
3496147	anchor.topn3	punished christlike	0.3903
3496147	anchor.topn3.replace	punished christlike	0.3903
3496147	conceptluster.topn5.3.bm25	punished christlike	0.3903
3496147	conceptluster.topn5.3.qld	punished christlike	0.3903
3496147	tagmee.topn3	punished christlike	0.3903
3496147	termluster.topn5.3.bm25	punished christlike	0.3903
3496147	termluster.topn5.3.qld	punished christlike	0.3903
3496147	thesaurus.topn3	punished christlike	0.3903
3496147	thesaurus.topn3.replace	punished christlike	0.3903
3496147	wiki.topn3	punished christlike	0.3903
3496147	stem.porter2	whi was i punish for be christlik	0.3781
3499881	-1	Why is Gordon Ramsey so popular?	0.3433
3499881	conceptluster.topn5.3.bm25	gordon ramsey popular	0.4218
3499881	conceptluster.topn5.3.qld	gordon ramsey popular	0.4218
3499881	termluster.topn5.3.bm25	gordon ramsey popular	0.4218
3499881	termluster.topn5.3.qld	gordon ramsey popular	0.4218
3499881	thesaurus.topn3	gordon ramsey popular	0.4218
3499881	thesaurus.topn3.replace	gordon ramsey popular	0.4218
3499881	tagmee.topn3	gordon ramsey popular Gordon Ramsey	0.421
3499881	tagmee.topn3.replace	Gordon Ramsey	0.3786
3499881	wiki.topn3	gordon ramsey popular bob weiskopf paul alter bill persky gordon ramsey	0.3778
3499881	wordnet.topn3.replace	gordon ramsey pop democratic	0.377
3499881	stem.porter2	whi is gordon ramsey so popular	0.3542
3499881	stem.paicehusk	why is gordon ramsey so popul	0.3498
3507491	-1	Why is religious freedom more important today?	0.7043
3507491	termluster.topn5.3.bm25	religious freedom important today	0.751
3507491	termluster.topn5.3.qld	religious freedom important today	0.751
3507491	thesaurus.topn3	religious freedom important today	0.751
3507491	thesaurus.topn3.replace	religious freedom important today	0.751
3507491	stem.porter2	whi is religi freedom more import today	0.7451
354733	-1	What are the names of some famous photographers and why do their work stand up?	0.3598
354733	termluster.topn5.3.bm25	names famous photographers work stand	0.4804
354733	termluster.topn5.3.qld	names famous photographers work stand	0.4804
